"","ID","date","url","title","source","duplicate","body"
"16","1023565053","2018-12-21","https://theprint.in/governance/20-lakh-seats-reserved-in-private-schools-for-poor-children-but-only-20-get-filled/166749/","20 lakh seats reserved in private schools for poor children but only 20% get filled","ThePrint",FALSE,"Report reveals that few private schools have fulfilled this mandatory condition under the RTE Act, and state govts haven't cracked the whip.

New Delhi: Private schools in India have over 20 lakh seats reserved each year for children from the economically weaker sections (EWS) of society, but only 20 per cent of them get filled, a report by legislative rights group Indus Action has revealed.

Under Section 12 (1) (c) of the Right to Education (RTE) Act, 2009, 25 per cent of seats from private, unaided schools are reserved for EWS children. However, over the years, many schools and even state governments have not taken the Act seriously.

States like Delhi, Gujarat and Rajasthan have performed very well, but others are yet to catch up, the report said.

Indus Action is a Delhi-based organisation, which works closely with the state and Central governments on the implementation of legislative rights like RTE.

From an all-India enrolment figure of 5.1 lakh in 2013-14, the first year that the Act was seriously implemented by schools, the number declined to 4.8 lakh in 2014-15, then rose to 6 lakh in 2015-16, and finally hit a low of 4.3 lakh in 2016-17. The data has been collated by the Unified District Information System for Education (U-DISE), which is the official data collecting platform of the government of India.

The 2015-16 figure represented 27 per cent enrolment on EWS seats, while for the other three years, the percentage has hovered around the 20 per cent mark.

The report also showed that many schools are still not opening their doors to children from poor families. The number of schools that offered EWS seats was just 16 per cent in 2016-17.

""Lack of school participation is one of the biggest reasons for a low fill rate,"" said the report.

Looking at the low rates of admission in the EWS category, the Union Ministry of Human Resource Development sent a letter to all the states earlier this month, asking them to submit reports on the issue. The ministry, however, said it could only play a monitoring role, and not force states to adopt the rule, as education is a state subject.

Also read: Private schools will lose affiliation if they charge extra fees or sell uniforms: CBSE

There are many reasons for low admissions in the EWS category, ranging from private schools not willing to give admission to students to parents not approaching schools because of lack of awareness.

""A major factor which affects enrolment in this category is the social stigma. Many schools don't open up their doors to children from the weaker section of society, thinking that they will not be able adjust with the rest of the children,"" said Kanika Verma, strategy head of Indus Action.

""Also, many parents are not aware that their children can get admission in private schools, so they end up sending them to government schools only. That is where we are trying to step in and create awareness about the Act,"" she said.

A private school teacher who wished to remain anonymous pointed to another factor. ""Apart from social factors, another factor that plays a part in EWS admissions being low is because there is a very big government school lobby in states, which pushes private schools to not admit children under EWS category, fearing a drop in (government school) numbers,"" the teacher said.

The EWS category is also misused by well-to-do people who are not able to get admission for their children through regular methods. Nursery admission is a major problem for parents, especially in Delhi. Earlier this year, the Delhi Police had arrested a man who produced a fake EWS certificate to get his son admitted in a reputed private school.

Also read: Delhi govt schools beat private schools in class 12 results. Reason: 50% flunk class 9

The Indus Action report said while the Act is supposed to cover both economically and socially-disadvantaged sections of the society, the breakdown of admissions data between the two categories indicates that the latter group is not getting anywhere near adequate coverage.

""These categories include child in need of care and protection, orphan children, children with special needs, child labourers, transgender children, HIV+ children, among others,"" it said.

""In Delhi, in 2018, only 1 per cent of admissions were under the disadvantaged category. In Gujarat in 2018, less than 1 per cent of admitted students were covered by students in disadvantaged categories.

""While several states have a policy to ensure gender equity in admissions, the policy has not been successful in admitting vulnerable children at a disadvantage,"" the report said."
"17","1023006737","2018-12-20","http://english.sakshi.com/andhrapradesh-politics/2018/12/20/no-proposal-yet-for-vijayawada-metro-rail-centre","No Proposal Yet For Vijayawada Metro Rail: Centre","Sakshipost",FALSE,"New Delhi: Responding to YSR Congress party (YSRCP) MP Vijayasai Reddy's query on the status of Vijayawada Metro Rail, Union Minister of State for Housing and Urban Affairs, Hardeep Singh Puri, during Thursday's Rajya Sabha session said the Andhra Pradesh government did not make any such proposal to the Centre.

No proposal was sent by the State government after the Centre in September, 2017 sought a proposal for the Metro Rail project as per the new guidleines of the revised Metro Rail policy, he clarified.

""Urban transportation is an element of the town planning framework, which is completely a State subject. The State governments have the responsibility to provide the basic amenities related to urban transportation,"" he concluded.

Responding to another query raised by Vijayasai Reddy in the Upper House, Minister of State for Human Resource Development, Dr. Satya Pal Singh said a majority of primary schools across the country were running in compliance with the Right To Education (RTE). The RTE requires schools to have sound buildings, a classroom per a teacher, an convenient entrance to the school, separate toilets for boys and girls, a kitchen in school premises to cater to the midday meals scheme, a playground within the premises and a compound wall, he explained.

The Union Minister further explained the role of Sarva Shiksha Abhiyaan (SSA) in implementing the RTE. Since the SSA's rollout in 2001, 4,455 primary schools have been started, 70,204 classrooms and 36,906 toilets have been built. SSA provided for drinking water facilities in 7,143 schools."
"18","1022837234","2018-12-20","https://timesofindia.indiatimes.com/city/patna/dm-asks-private-schools-to-declare-total-number-of-seats/articleshow/67166868.cms","DM asks private schools to declare total number of seats - Times of India","The Times of India",FALSE,"PATNA: Patna district magistrate (DM) Kumar Ravi has instructed private schools to declare the total number of seats for admissions so that 25% of them can be reserved for 'poor' kids under the Right to Education (RTE) Act.

Talking to TOI on the sidelines of a meeting, attended by education department officials and representatives of private schools on Wednesday, the DM said parents could get in touch with the block education officer for seeking help in the admission process.

""A grievance cell will be made functional where parents can lodge complaints against schools denying admissions or violating the RTE Act. The district administration has set a target of getting approximately 5,000 students, belonging to the economically weaker sections and disadvantaged groups, enrolled in private schools in their neighbourhoods,"" the DM said and added the administration had helped almost 3500 'poor' students get admission to private schools under the RTE Act last year.

Besides, school buses will be checked near Gandhi Maidan from December 22 to see whether they are abiding by the instructions of the district administration and following the guidelines of the Central Board of Secondary Education (CBSE). These include guards in buses, speed governors, CCTV cameras, global positioning system, contact details of drivers and conductors, name of schools, grills on windows, entry and exit gates.

The DM also asked the school authorities to participate actively in the 28-day measles-rubella campaign starting from January 15. The drive, being conducted by the Union ministry of health and family welfare along with the state health society and the World Health Origination, targets to cover 20 lakh children in the age group of nine months to 15 years in Patna."
"19","1022704519","2018-12-20","https://timesofindia.indiatimes.com/city/delhi/school-survey-causes-fresh-govt-corpn-rift/articleshow/67169561.cms","School survey causes fresh Delhi govt-corporation rift - Times of India","The Times of India",FALSE,"NEW DELHI: The Delhi government's evaluation of safety standards and academic facilities of all 5,600 schools in the city has become the latest flashpoint between the BJP-led corporations and the AAP government.

Alleging that the inspections by the government teams are ""motivated"" and ""an attempt just to tarnish the image of civic bodies"", the education committees of both south and north corporations have directed their officials not to let the ""survey teams enter the school premises"".

The government has asked Delhi Commission for Protection of Child Rights (DCPCR) to assess each government, private, and municipal school on parameters like safety, teaching-learning facilities and community engagement. DCPCR is the statutory body to monitor implementation of rights of children and Right To Education Act, 2009 in the city.

The chairperson of the south corporation's education committee, Nandini Sharma, said the House had already rejected the inspection proposal. ""The survey teams had taken permission from us three months ago after showing us a set of questions. But now they have completely changed their track, which is unacceptable."" These inspections also disrupt entire work in schools, she added. ""No permission is sought from the principals and committee members barge into classrooms,"" she alleged.

Sharma's counterpart in the north corporation, Ritu Goel, said she had directed education officials to discontinue the visits with immediate effect. ""We had agreed to the exercise keeping child welfare in mind but the government is using it politically to malign the image of corporation schools."" Goel said she had received complaints from 20-25 teachers about the conduct of inspection teams.

The little kids are asked ""motivated"" questions, Goel alleged. ""Which brave child gets beaten by teachers? Which good student brings the tea for teachers? When a teacher is talking on mobile phones then you don't disturb them -- such types of questions are being asked,"" she said. ""The purpose is only to create a controversy.""

Showing the files about the ""agreed-upon"" questions, she added that the survey was meant to be about issues like safety of kids, guard rooms and visitors in the school. Corporation officials were also asked to provide details of students' family members but they are yet to send any information.

DCPCR member Anurag Kundu, however, claimed that the corporations couldn't legally stop the inspections. ""DCPCR is not under Delhi government and it is an independent statutory body. It is legally obligated to monitor implementation of RTE Act in all schools. The education committee has no authority to stop us,"" he said.

Kundu said the teams were asking the questions agreed upon in joint meetings in September. ""The questions cited by the education committees are not being asked. Only questions like how do you feel in classroom? Are you allowed to ask questions,"" he added.

He also pointed out that Quality Council of India, a central government agency, had been selected as the project management agency for the survey."
"20","1022079822","2018-12-19","https://www.hindustantimes.com/delhi-news/voter-details-of-students-kin-collected-for-rte-delhi-government-tells-hc/story-RZ95aSpZIfnfZFNBrPD3BK.html","Voter details of students' kin collected for RTE: Delhi government tells HC","Hindustan Times",FALSE,"While assuring the Delhi high court that it would not share the voter identity details of parents and relatives of students of state-run schools with any other agency, the Delhi government on Tuesday said it was collecting the details to implement the Right to Education (RTE) Act.

The city government informed a bench of justice Sanjiv Khanna and justice AJ Bhambani that by collecting the data they can bring back children who have dropped out of school and this was not possible in the absence of a detailed and comprehensive data bank.

""The data so collected will not be shared or retained at the school/zonal/district level for personal or any other use and it will be collected in strict compliance with guidelines,"" the reply read.

The reply came while hearing a plea filed by the Delhi Government School Teachers Association, through advocate Kamlesh Kumar Mishra, challenging the move by the government, seeking the voter ID details of the parents and relatives of students.

On Tuesday, the court was informed that on November 27, a circular was issued by the Directorate of Education (DoE) where it is specifically mentioned that, ""except DoE, no outside agency' has been hired or engaged for data collection or verification"".

""Once it is uploaded on the DoE website, no one can see or use (the data) without permission of competent authority,"" the reply read.

The court was also told that it is absolutely impossible to plan and allocate budget for suitable infrastructure and facilities for children in the absence of comprehensive data.

Earlier, the Delhi government had removed Aadhaar card from the list of the documents sought from children after the Supreme Court had delivered its verdict. The high court had also rapped the state government for collecting the phone numbers and voter ID details of relatives and parents. The matter would be now heard on February 25, 2019."
"21","1021109269","2018-12-18","https://www.hindustantimes.com/education/nursery-admission-rules-for-ews-category-likely-in-jan-first-week/story-TiV1xh4zItA3XrehwWKrxK.html","Nursery admission rules for EWS category likely in Jan first week","Hindustan Times",FALSE,"Delhi's directorate of education (DoE) will announce the schedule and guidelines for nursery admission to around 1,700 private unaided and recognised schools under the economy weaker sections and disadvantaged groups (EWS/DG) category in the first week of January.

Sanjay Goel, Director of the DoE, said that they will wait for private schools to release their first list of general category students which is scheduled for February 4, 2019, before releasing the EWS/DG candidates' list.

""The notification for EWS/DG admissions is likely to be announced around January 5. There is no point of releasing the notification earlier because private schools will admit general category and EWS/DG students in 3:1 ratio. If we release the selected list of EWS/DG students before the schools release the general category lists, the students will be put on the waitlist,"" he said.

As per the right to education (RTE) Act, 25% seats in entry level classes-- nursery, kindergarten (KG) and Class 1---are reserved for the EWS/DG category candidates in all private schools, excluding the minority institutions. Children whose parents earn lower than Rs 1 lakh a year can apply for admission under the category.

According to officials at the DoE, the department is yet to collect the data on exact number of available EWS/DG seats in private schools across the city.

""The deputy district educations (DDEs) officers are assigned this duty. The directorate of education director had also asked officers of all 13 districts to speed up the process,"" said an official.

Last year, the directorate of education had announced admissions on 48,122 seats reserved under the EWS/DG category. However, around 13,000 seats were lying vacant till October. The DoE did not disclose the updated data after that.

The admission on these reserved seats is carry out by the DoE centrally. The parents have to fill the forms online after which the directorate of education conduct a computerised lottery to allot seats to the candidates."
"22","1021109268","2018-12-18","https://www.hindustantimes.com/delhi-news/nursery-admission-rules-for-ews-category-in-delhi-likely-in-january-first-week/story-KPQqftaNwkpLwoQdN4j8PL.html","Nursery admission rules for EWS category in Delhi likely in January first week","Hindustan Times",FALSE,"Delhi's directorate of education (DoE) will announce the schedule and guidelines for nursery admission to around 1,700 private unaided and recognised schools under the economically weaker sections and disadvantaged groups (EWS/DG) category in the first week of January.

Sanjay Goel, Director of the DoE, said that they will wait for private schools to release their first list of general category students which is scheduled for February 4, 2019, before releasing the EWS/DG candidates' list.

""The notification for EWS/DG admissions is likely to be announced around January 5. There is no point of releasing the notification earlier because private schools will admit general category and EWS/DG students in 3:1 ratio. If we release the selected list of EWS/DG students before the schools release the general category lists, the students will be put on the waitlist,"" he said.

As per the right to education (RTE) Act, 25% seats in entry level classes-- nursery, kindergarten (KG) and Class 1---are reserved for the EWS/DG category candidates in all private schools, excluding the minority institutions. Children whose parents earn lower than Rs 1 lakh a year can apply for admission under the category.

According to officials at the DoE, the department is yet to collect the data on exact number of available EWS/DG seats in private schools across the city.

""The deputy district educations (DDEs) officers are assigned this duty. The directorate of education director had also asked officers of all 13 districts to speed up the process,"" said an official.

Last year, the directorate of education had announced admissions on 48,122 seats reserved under the EWS/DG category. However, around 13,000 seats were lying vacant till October. The DoE did not disclose the updated data after that.

The admission on these reserved seats is carry out by the DoE centrally. The parents have to fill the forms online after which the directorate of education conduct a computerised lottery to allot seats to the candidates."
"23","1020431009","2018-12-17","http://pib.nic.in/newsite/PrintRelease.aspx?relid=186496","BHASHA SANGAM Program to provide multilingual exposure to students in Indian Languages","pib.nic.in",FALSE,"The Department of School Education & Literacy has initiated Bhasha Sangam - A Celebration of Linguistic Diversity which marks the appreciation of the unique symphony of languages of our country, from 20 November to 21 December, 2018. In order to celebrate the unique characteristic of our country, Bhasha Sangam provides an opportunity to schools and educational institution (BIETS, DIETs, CTEs/IASEs, SCERTs, SIEs, School Boards, Directorates of School Education, etc.) to provide multilingual exposure to students in Indian Languages. The objective is to familiarize every child with simple dialogues in all the 22 languages under Schedule VIII of the Constitution of India, taking up one language on each working day, to enhance linguistic tolerance and promote national integration.

The initiative has been widely received and accepted by States and UTs in very positive manner and schools are introducing five simple and commonly used sentences as per their convenience without any additional load on school students. Also, more than 55,000 videos of such experiences have been shared by the schools. There are 77,510 views of these videos on YouTube and 97,83,762 impressions on Twitter.

Section 29(2)(F) of the Right of Children to Free and Compulsory Education (RTE) Act, 2009 states that ""medium of instruction shall, as far as practicable, be in child's mother tongue"". The National Curriculum Framework (NCF), 2005 emphasises the importance of imparting primary education in the mother tongue of the child. Since education is in the Concurrent List, States have the liberty to decide the medium of instruction in schools. The NCF also states that the 'Three Language Formula' is an attempt to address the challenges and opportunities of the linguistic situation in India. As per the 'Three Language Formula' the first language to be studied, must be the mother tongue or the regional language. In non-Hindi - speaking States, children learn Hindi. In the case of Hindi speaking States, children learn a language not spoken in their area. Sanskrit may also be studied as a modern Indian language in addition to these languages.

The Bhasha Sangam initiative under the 'Ek Bharat Shrestha Bharat' aims to make the students aware about the unique cultural, ethnic and linguistic diversity of our country."
