"","ID","date","url","title","source","duplicate","body"
"8","1025421508","2018-12-24","https://timesofindia.indiatimes.com/city/chandigarh/english-forms-for-rte-seats-discourage-parents/articleshow/67222214.cms","English forms for RTE seats discourage parents - Times of India","The Times of India",FALSE,"CHANDIGARH: After much delay, when the family-income certificates are being made finally for the poor man's quota of school seats, parents have now been asked to face the language hurdle. The income-declaration form has been made available only in English.

The parents of children competing for reserved seats under the Right to Education (RTE) Act had struggled to fill even the registration form for different private schools, as those too were in English. Parents allege that it has been done to discourage poor families who want good education for their children. ""Not just the forms, even the guidelines and admission notice were printed in English. They don't want our children to even qualify,"" said a disgruntled parent from the slum colony of Bapu Dham.

Some of the parents even had to ask the document-centre people to fill their form for a price. They others asked their employers to help them. Some of the parents were pleading with people at e-Sampark centres to interpret the form for them. ""I asked a Sampark-centre employee to tell me what was written in the form, but he said he was too busy to help. So I requested the customers who had come to deposit their utility bills to translate the form so that I could know what documents to arrange for my child's admission,"" said Shashi Pal, who had come to the e-Sampark centre of Sector 10.

Chandigarh parents Association president Nitin Goyal said: ""Most of the families from the EWS (economically weaker section) category have poor literacy level, with hardly any proficiency in English. The EWS applicants don't know what to do with the form, as they cannot read English. The administration should provide them with forms in Hindi and Punjabi versions, too.""

RTE consultant Chanchal Singh of the Chandigarh Commission for the Protection of Child Rights, who is also former deputy director of school education, said: ""The forms for admission and income declaration should be in both Hindi and English, so that these are easier for people to interpret. Otherwise, it will be a disadvantage to parents from poor class. The information mismatch might lead to cancellation of the form, even if the case is genuine. And if it is not genuine, the parents will have an excuse that they were not aware, as they got someone else to fill their form."""
"9","1024431374","2018-12-22","http://bengaluru.citizenmatters.in/rte-helpline-launch-how-do-you-use-it-effectively-30142","RTE helpline: How to use it effectively? |","bengaluru.citizenmatters.in",FALSE,"Our work is to empower citizens, made possible by your donation. Click to Donate

Right To Education (RTE) helpline was launched recently by the Social Welfare Department of Karnataka, which allows one to lodge complaints and get information on the Act. The Executive Director of the Child Rights Trust, Vasudeva Sharma, spoke to RadioActive about how the helpline could be used effectively.

Vasudeva Sharma explained that the RTE Act had been introduced way back in 2009 in Karnataka, and a lot of calls used to be received by the Child Rights Trust members on their personal numbers seeking clarifications. Even though there were no instructions available regarding RTE at that time, they used to clarify or give information in a comprehensible way. Of late, the calls had been about more specific and less common information.

He said they had attempted to set up a hotline back then, which failed because their personal numbers were still popular. The new helpline would have to have employees well-versed in the intricacies of RTE - the national Act as well as the rules for Karnataka and section (12)(1)(C), because (12)(1)(C) was often misused.

He spoke about the dangers of (12)(1)(C) being misused and despite it having popular aspects like forbidding corporal punishment, or stating the kinds of facilities an institution must have, how that could cause people to lose trust in it. It gave the impression that (12)(1)(C) was introduced as an attempt to control private institutions, as the condition laid down for availing this provision spoke only of what was expected of the institutions without placing any responsibility on the government. With the rampant misuse of this section, private institutions became richer but could not be brought under the control - and that such situations would lead to mistrust in the RTE Act itself.

Vasudeva Sharma said that he used to find a lot of children in government schools, but of late the number had been dwindling because they had moved to private schools. However, over time, parents were faced with demands for multiple additional payments. This at times forced the children back into government schools, and other times, they continued education there despite the heavy expenditure.

He also proposed some solutions:

On the move to make 8th standard the equivalent of 10th standard, Vasudeva Sharma said that though there had been discussions, the Central Government was yet to make a decision. He opined that it could not be taken without thorough discussions and analysis but was apprehensive about the imbalance a positive answer would create.

Vasudeva Sharma said that ignorance among activists and officials will deprive the children of the rights extended to them by the government. He suggested that guidelines be prepared wherein the responsibilities of each official is clearly mentioned and that such clarity would enable effective implementation of the Act.

He added that ignorance causes lack of coordination between the concerned departments and organisations, which could lead to failure of the programme."
"10","1024302885","2018-12-22","https://www.dnaindia.com/mumbai/report-mumbai-got-your-kid-into-kg-no-guarantees-of-primary-admission-2698800","Mumbai: Got your kid into KG? No guarantees of primary admission","Daily News and Analysis (DNA) India",FALSE,"In a fine example of the inefficiency of the reservation system in the country, many schools in the city may have to cancel the admissions of a few students in order to accommodate students under the 25 per cent admissions quote under the Right To Education (RTE) for the economically weaker section (EWS). This is forcing the schools to discontinue the admissions of a few students from the Open category.

Even as admissions for pre-primary sections began in October, many schools in the city are not assuring promotion to selected children from senior kg to the 1st grade. As a result, aggrieved parents are running from one school to another to seek admission for their children.

A parent from South Mumbai said, ""Earlier, the school would give admission forms which the parents would take home to fill them up and submit the next day. But, now the schools are asking parents to fill the forms the same day in the school itself, and return them immediately. This is all because they don't want parents to click pictures of the admission forms and send it to the media to expose them. The schools are mentioning in the forms that there's no guarantee of a child getting promoted to class 1. When we went to one of the South Mumbai schools to fill the form, we saw read this and were very disappointed.""

Jayant Jain, president of Forum for Fairness in Education, said, ""Most of the schools still don't guarantee admission of children in class 1 after taking them in pre-primary as they wanted to conduct fresh admissions in class 1 and also fill the 25 per cent quota under RTE. But this is all wrong and this practice should be stopped. Parents first have to buy so many admission forms and spend so much money on them and the prospectus, and yet they have to be insecure about their child's admission.""

Experts say most schools, in order to fill the 25 per cent quota under the Right To Education, do not guarantee admissions to kids to the 1st grade despite granting them seats in kindergarten"
"11","1024030263","2018-12-21","https://www.thehindubusinessline.com/opinion/school-education-in-india-whats-gone-wrong/article25800734.ece","School education  --  what's gone wrong?","The Hindu Business Line",FALSE,"With drastic improvement in infrastructure and enrolment, there must now be a shift towards education outcomes

There is no doubt that the school education sector is beset with huge problems. However, whether the dismal performance is on account of policy gap or there are other factors that are responsible for the current state of affairs is a moot point.

Let us first try to understand what has not happened in the education sector. Why has it not happened? And, how can it happen (whether through policy intervention or otherwise)?

Two things have certainly happened during the current millennium. The infrastructure (school buildings) has shown remarkable improvement though there is still a long way to go. And, thanks to the mid-day-meal, we have managed to get the child to the school.

However, what is appalling is the poor quality of education that is imparted in most of the government schools. This is evidenced by the fact that the learning outcomes have actually come down during the past decade despite enormous amount of investments. The number of teachers has gone up substantially and the average pupil-teacher ratio comes close to the required levels.

However, this does not solve the problem of quality. To begin with, a large number of teachers are not qualified to teach, yet they are teaching. According to a rough estimate, out of eight million teachers around 1.4 million fall in this category. Politics has seeped into this cadre in the most insidious manner resulting in skewed distribution of teachers in most of the States as the tendency is to hang in and around urban areas.

The Right to Education Act did precious little on this front. In fact, the legislation made the task of delivering quality education complex and difficult. The focus of the Act is primarily on 'inputs' (like infrastructure) rather than 'outcomes'. It has created an adversarial role between 'public' and 'private' schools. The Act mandates under Section 12(1)(c) that even private schools ""shall admit in Class I, to the extent of at least 25 per cent of the strength of that class, children belonging to weaker section and disadvantaged group."" The manner in which reimbursement is to be provided has created a number of problems.

The norms and standards prescribed in the schedule for a school are far removed from ground reality. What is perhaps desirable has been made mandatory. This has resulted in a phenomenal increase in the number of teachers. During 2015-16, there were 39,608 government schools that had less than 10 children but each school was mandated to have minimum of two teachers.

The budget private schools, most of whom are doing a great job in imparting education, are under enormous pressure to meet the prescribed standards or face closure. No attempt was made while enacting this legislation to look at the ground reality.

The consequences have been disastrous. On an average, an amount of around ₹10,000 per child gets spent in government schools. The budget schools do it for much less and impart as good, if not better, education. Unfortunately, the focus so far has primarily been on regulation (legislations are perhaps meant for that) and not on development of the private sector. Consequently, even after eight years of enactment, the country is none the better than what it was.

The RTE Act has done more damage to delivery of education. Section 16 of the Act provides that ""No child admitted in a school shall be held back in any class or expelled from school till completion of elementary education.""

The 'expulsion' part can be understood but not holding back a child in a class has meant that a large number of children are getting promoted without acquiring the necessary attributes. The model of 'no detention' was apparently picked up from the West and transplanted in this country without taking into account the objective conditions obtaining here.

Yet again, the consequences have been devastating as there is a huge bottleneck getting created at Class X where the pass percentage has plummeted. The States were not even given freedom to take a call on the issue. The government has subsequently decided to provide an option to the States and the amendment is under consideration of Parliament.

A new Education Policy is round the corner. However, what needs to be understood is whether there is a need for a policy to address the issues that afflict school education. Most of the action relating to education lies in the States. In any case, the country is too diverse to consider a single mandate by way of policy for the entire country. If a teacher does not go to a school in Kerala, he could well be ""lynched"" but in some of the States of northern India, they consider it their right not to go to the school. There are instances of these regular teachers employing a ""substitute"" to represent them and even teach on their behalf.

What is actually required is an action plan clearly outlining: What needs to be done? How it will be done? Who will do it? And, by when it will be done? The roles of respective entities should be clearly defined so that the performance can be assessed. One has often wondered why should only the Centre assess the performance of States? Why can't it be the other way round?

The action plan needs to focus on the teacher who plays a pivotal role in imparting education. The entire value chain needs to be looked at, understood and interventions clearly outlined. Beginning with pre-service training, to selection process, to in-service training, to transfer and posting, to engagement of teachers in non-educational activities, to their promotional avenues and morale will need to be looked at.

An action plan for each State will have to be worked out in detail, clearly outlining the roles of the Centre and the respective State government. Intervention for each State will vary from State to State. Unlike the present dispensation, there will have to be sufficient flexibility in the central schemes to accommodate the differences among States. The whole approach has to be outcome based rather than input based as has been the case so far.

Our country has been obsessed with the western world. We had looked at Finland, England, Scotland, Holland and all the lands of the world but not at motherland. A lot of wonderful work is being done within the country but has so far gone unnoticed. ""Policy"" cannot help in this regard.

What needs to be done is to facilitate identification, understanding and scaling of successful practices. If these home-grown practices have succeeded in the prevalent objective conditions, the chances of their replication and scaling are pretty high as compared to an 'imported' idea or practice.

What is also required is to learn from States, like Rajasthan, that have turned it around through some remarkable State level interventions both administrative and financial.

Policy debates provide food for intellectual stimulation but what matters is what is done on the ground. Hence, the dire need for an action plan."
"12","1023879544","2018-12-21","http://pib.nic.in/newsite/PrintRelease.aspx?relid=186730","Samagra Shiksha Scheme running successfully to ensure inclusive and equitable quality education at all levels of school education","pib.nic.in",FALSE,"Samagra Shiksha - an Integrated Scheme for School Education has been launched throughout the country as a Centrally Sponsored Scheme with effect from the year 2018-19. This programme subsumes the three erstwhile Centrally Sponsored Schemes of Sarva Shiksha Abhiyan (SSA), Rashtriya Madhyamik Shiksha Abhiyan (RMSA) and Teacher Education (TE). It is an overarching programme for the school education sector extending from pre-school to class XII and aims to ensure inclusive and equitable quality education at all levels of school education. It envisages the 'school' as a continuum from pre-school, primary, upper primary, secondary to senior secondary levels. The States/UTs are assisted by the central government to implement the Samagra Shiksha as a programme for providing universal access and retention, bridging of gender and social category gaps in education and enhancement of learning level of children at all levels of school education.

The major interventions under the scheme are: (i) Universal Access including Infrastructure Development and Retention; (ii) Gender and Equity; (iii) Inclusive Education; (iv) Quality; (v) Financial support for Teacher Salary; (vi) Digital initiatives; (vii) Entitlements under the Right of Children to Free and Compulsory Education (RTE) Act, 2009 including uniforms, textbooks etc.;(viii) Pre-school Education; (ix) Vocational Education; (x) Sports and Physical Education; and (xi) Strengthening of Teacher Education and Training. The main emphasis of the Scheme is on improving quality of school education and the strategy of all interventions would be to enhance the Learning Outcomes at all levels of schooling.

The major features of Samagra Shiksha are as under:-

Preference for opening of new school is given to tribal areas, and areas with high concentration of Scheduled Caste (SC), Scheduled Tribe (ST) and minority population. The districts with high concentration of population of SCs, STs and Muslims have been identified as Special Focus Districts (SFDs) for ensuring equity and inclusion at all levels of school education. Provisions have also been made for 1020 residential schools/hostels for children living in sparsely populated areas, children living in areas where schools cannot be opened due to unavailability of land and children in need of care and protection.

The RTE Act also provides for Special Training for age-appropriate admission of out-of-school children including children of disadvantaged groups in urban and rural areas. Approval has been given for special training of 8.08 lakh children with the financial outlay of Rs. 56353.95 lakh in 2018-19.

During 2018-19 an amount of Rs. 19668.26 crore has been released (as on 30.11.2018) to States/UTs as central share against the total Budget of Rs. 30891.81 crore for implementation of various interventions under Samagra Shiksha."
"13","1023780322","2018-12-21","https://www.apherald.com/Politics/ViewArticle/328622/AP-didn-t-make-proposal-to-center-for-Vijayawada-Metro/","AP didn't make proposal to center for Vijayawada Metro","APHerald [Andhra Pradesh Herald]",FALSE,"New Delhi sources stated that when responding to YSR Congress party (YSRCP) MP Vijayasai Reddy's query on the status of Vijayawada Metro Rail, Union Minister of State for Housing and Urban Affairs, Hardeep Singh Puri, during Thursday's Rajya Sabha session said the Andhra Pradesh government did not make any such proposal to the Centre.

Accordingly no proposal was sent by the State government after the Centre in September, 2017 sought a proposal for the Metro Rail project as per the new guidelines of the revised Metro Rail policy. He clarified ""Urban transportation is an element of the town planning framework, which is completely a State subject. The State governments have the responsibility to provide the basic amenities related to urban transportation"".

Moreover when responding to another query raised by Vijayasai Reddy in the Upper House, Minister of State for Human Resource Development, Dr. Satya Pal Singh said a majority of primary schools across the country were running in compliance with the Right to Education (RTE). Reportedly the Union Minister further explained the role of Sarva Shiksha Abhiyaan (SSA) in implementing the RTE. Since the SSA's rollout in 2001, 4,455 primary schools have been started, 70,204 classrooms and 36,906 toilets have been built. SSA provided for drinking water facilities in 7,143 schools.

5/ 5 - (1 votes) Add To Favourite Share on Facebook Share on Twitter Share on Google+ Share on Reddit Share on Pinterest Share on Linkedin metro rail proposal vijayawada andhra affairs statusandhra pradesh politics andhra politics telugu political news apherald news apherald politics news latest politics news politics latest news"
"14","1023726410","2018-12-21","https://www.hindustantimes.com/education/here-s-why-jharkhand-government-is-planning-to-shut-6-646-schools/story-Dc4yti1lzbBXHu9p5rHfkK.html","Here's why Jharkhand government is planning to shut 6,646 schools","Hindustan Times",FALSE,"These schools would be merged with upgraded high schools in phases, starting with the institutions, which have less than 50 students(HT File)

After merger of 4,600 primary schools, the Jharkhand government is planning to shut over 6,466 middle schools (classes 6 to 8), having less than 100 students.

These schools would be merged with upgraded high schools in phases, starting with the institutions, which have less than 50 students, education department officials said on Thursday.

Initially, 3,732 middle schools having less than 50 students would be undertaken for merger. The process of merging has already been started.

""Merger is an effort to provide quality education to students in a better educational ambience. Jharkhand has around 411 such middle schools where number of students is less than 10. If these schools are merged with high schools, students would get better education,"" said state education secretary AP Singh.

""As per the rules in the right to education (RTE), there should be at least three trained graduate teacher (TGT) in middle schools where number of students is less than 100. It means, we would have to afford additional Rs 18 lakh on teachers' salary even in the schools where number of students is less than 10, which is not logical,"" he added.

The decision comes at a time when the opposition parties and critics have been criticising the state government for merging the primary schools. Several ruling party elected representatives have also been lobbying with the government against the move. There have been protests in several parts of the state as well, against merger of schools.

The officials, however, argue that, ideally, there should be one middle school and five to seven primary schools in a panchayat. As many as 6,466 middle schools have been identified in Jharkhand, which could be merged with high schools within a 5-km radius in a panchayat, Jharkhand Education Project Council (JEPC) officials said.

The state government has decided to offer bicycles to the students, who would be shifted to other schools so that they do not face any trouble in commuting to the school.

Meanwhile, the JEPC officials said they have completed the merging exercise of 4,600 primary schools.

JEPC director Uma Shankar Singh said there were 39,600 schools in 2016-17 under education department in Jharkhand. ""Of them, 18,000 schools had 60 or few students. These schools had an average of 1 or two teachers per school. Providing quality education was a major challenge. One teacher was handling four to five classes at a time. How could one expect a better education in these schools,"" he said.

The council said four-step process including field inspection, cross-district verification, block and district consultation and final notification to merge the schools.

Singh said 98% students from the 4,600 primary schools have been shifted and 96% students have expressed satisfaction with the consolidation. ""We faced difficulty to shift 150 students due to some technical reasons. Now, the issue is resolved and 120 students were shifted,"" he said.

The reorganisation of primary schools benefited seven lakh students with better teachers' availability and reduced the requirements of teachers by 4,500. Besides, the process saved government's Rs 400 crore through reduced teachers and infrastructure requirements, JEPC officials said.

Education Dept ropes in IIM Ranchi for merged school evaluation

State education secretary AP Singh said the department has roped in Indian Institute of Management (IIM), Ranchi, for evaluation of the merged schools. The IIM, Ranchi would see if the reorganization process brought any difference in improving the education of students, who were shifted in merging process.

He said IIM Bangalore has also expressed willingness for a study of the reorganization process and its benefit."
