"","ID","date","url","title","source","duplicate","body"
"9","1027703281","2018-12-27","https://kashmirobserver.net/2018/local-news/governor-lays-stress-varsities-research-capabilities-39022","Governor Lays Stress On Varsities' Research Capabilities​​​​​​​","Kashmir Observer",FALSE,"SRINAGAR -- Governor Satya Pal Malik on Thursday emphasised the need to enhance research capabilities of the universities and promote entrepreneurship.

Chairing a high-level meet with the all the state universities' vice-chancellors at the Raj Bhawan here, Malik suggested regular update of the syllabus to keep pace with the rapidly-changing global developments.

The governor observed that there should be a state-level advanced research facility with the latest equipments for promoting research in the new and innovative areas.

Malik laid stress on enhancing the research capabilities and introduction of courses to promote entrepreneurship among the youth. He underlined to need to introduce vocational and entrepreneurial courses for the skill development of the students.

The governor advised the farm universities to undertake innovative research in improving seed varieties, particularly oilseeds and pulses.

The other suggestions by the governor are: compulsory biometric attendance, improved teacher-student ratio, issuing academic calendars well in advance, selection procedure for teaching positions in compliance with the UGC norms.

Malik emphasised that all higher education institutions must ensure NAAC accreditation and extracurricular activities be encouraged.

The Jammu and Kashmir accountant general (AG) is yet to make the CAG's report for the year 2017-18 public, even as the year is nearing its end, a senior official said Thursday.

The report of the Comptroller and Auditor General (CAG) was submitted to Governor Satya Pal Malik long ago and it was supposed to be tabled in the budget session of the Jammu and Kashmir Legislative Assembly during January-March, the official said.

""The report has not been made public. We have submitted the report to Jammu and Kashmir governor,"" In-charge AG of J&K, Shourjo Chatterjee told PTI.

Citing past precedents, the AG said unless the report was tabled in the state assembly, it could not be made public.

As the state is under President's rule, the Governor has to table the report in Parliament before it can be made public, he added.

""It is up to the Governor to facilitate tabling of the report in Parliament and after that it can be made public or he can wait for the new legislature to get elected,"" the AG said."
"10","1027605479","2018-12-27","https://www.business-standard.com/article/pti-stories/j-k-guv-lays-stress-on-varsities-research-capabilities-118122700898_1.html","J&amp;K guv lays stress on varsities' research capabilities","Business Standard",FALSE,"Chairing a high-level meet with the all the state universities' vice-chancellors at the Raj Bhawan here, Malik suggested regular update of the syllabus to keep pace with the rapidly-changing global developments.

The governor observed that there should be a state-level advanced research facility with the latest equipments for promoting research in the new and innovative areas.

Malik laid stress on enhancing the research capabilities and introduction of courses to promote entrepreneurship among the youth. He underlined to need to introduce vocational and entrepreneurial courses for the skill development of the students.

The governor advised the farm universities to undertake innovative research in improving seed varieties, particularly oilseeds and pulses.

The other suggestions by the governor are: compulsory biometric attendance, improved teacher-student ratio, issuing academic calendars well in advance, selection procedure for teaching positions in compliance with the UGC norms.

Malik emphasised that all higher education institutions must ensure NAAC accreditation and extracurricular activities be encouraged.

(This story has not been edited by Business Standard staff and is auto-generated from a syndicated feed.)"
"11","1027567490","2018-12-27","https://www.businessinsider.in/medical-students-use-this-lifelike-robot-that-actually-bleeds-cries-and-urinates/articleshow/67274992.cms","Medical students use this lifelike robot that actually bleeds, cries, and urinates","Business Insider",FALSE,"Narrator: This medical robot actually bleeds and cries. His name is Pediatric HAL.

HAL: Hi, I'm Pediatric HAL. I can show you how I feel by moving my face and my eyes.

Narrator: HAL is part of a line of medical training robots manufactured by a company called Gaumard. Gaumard makes humanlike robots that simulate childbirth, newborn care, surgery, and trauma wounds. Pediatric HAL is designed to mimic the reactions of a child around five years old. During training, doctors, nurses, and first responders all practice various simulations on HAL before treating real patients.

Narrator: In many situations, medical students practice on standardized patients who are actors faking certain symptoms, but those actors probably don't want to be stuck with a needle over and over again. Instead, students can use HAL to learn how to do more physically invasive procedures, like putting in a breathing tube or starting an IV. And because his body is programmable, HAL can show signs of poor health that an actor might not be able to mimic.

When you shine a light on HAL's eyes, his pupils may or may not dilate. Even really good actors probably can't control their pupils. And HAL actually responds to real equipment. If he starts to flatline, a nurse can use a defibrillator to shock his heart back into action. HAL also has a variety of internal motors and pumps that move air and fluids around, which help it mimic bodily functions, like breathing and using the bathroom.

Archetto: He has a small reservoir in his left finger, left middle finger, for glucose measurement. So you can take a regular glucometer and you can actually put a glucose solution in there, prick his finger, and it would give you an actual glucose reading.

Narrator: HAL also has reservoirs for holding fake urine, fake blood, and there's even one in his head for holding fake tears. We have artificial blood. It's honestly just a powder that you add water to and it creates a red fluid, but there's also urine and as I mentioned, there are tears. For tears, it's water. For urine, it's food coloring. Narrator: The educator can also modify HAL's responses on the fly. If a training team isn't working fast enough, the teacher can program HAL's software to make his blood pressure go up or his breathing get faster.

Archetto: Nothing ever goes according to plan in the emergency room or in critical care. So you may have a plan of care for a particular patient, but something changes and it all goes south in a hurry. We can make HAL respond just as a patient would be. So that's become so valuable in those learning environments.

Henry Henao: We have a concept called suspending disbelief. So it's the fact that, okay I know that it's a mannequin, it's a simulator. They know it's a mannequin and it's made of plastic and electronic parts, but they look beyond that. So we ask them to forgive the fact that it's not a real patient, and once they break through that they really start making very human connections to the patient in front of them. And they, yeah, it kind of melts away.

Narrator: People don't always communicate verbally, especially young children, and that's why HAL's creators programmed him to have these non-verbal reactions.

Archetto: When he cries, he cries real tears and that's important because, again, that's a way of communicating.

Narrator: At times, HAL's responses are so real that people respond to him like he's a human. Archetto: HAL was there and he was sitting in his bed and we made him cry, and one of the nurses, who was in attendance, reached down and actually picked him up and tried to console him. She actually hugged him. So, it does have that impact on caregivers. It makes the scenario very realistic.

HAL: My family says I'm one of the smartest kids around. I can show you how I feel by moving my face and my eyes and if you talk to me, I'll talk back."
"12","1026850495","2018-12-26","https://indianexpress.com/article/world/as-china-cracks-down-on-churches-christians-declare-we-will-not-forfeit-our-faith-5510818/","As China cracks down on churches, Christians declare 'we will not forfeit our faith'","The Indian Express",FALSE,"China is capping a year in which the government of President Xi Jinping has led an unrelenting campaign against unofficial churches in China.

Written by Javier C. Hernández

For months, Gu Baoluo had been looking forward to a boisterous Christmas celebration at one of China's best-known Protestant churches. He loved decorating trees, singing songs like ""Silent Night"" and watching the annual Christmas pageant recounting the birth of Jesus.

But in early December, the police shut down Gu's usual place of worship, the Early Rain Covenant Church in the southwest city of Chengdu as part of what activists said is the most severe crackdown on Christianity in more than a decade. The police confiscated Bibles, shuttered a school and seminary run by the well-known church and detained Early Rain's outspoken pastor on charges of ""inciting subversion,"" punishable in serious cases by at least five years in prison.

On Christmas Eve, Gu, 31, a rice seller, went to the only safe place to worship that he knew: a friend's home, where he recited hymns and prayed for the two dozen Early Rain members that are in detention. Fearing that he and his friends might be arrested, Gu used encrypted chat apps to share information about surveillance and harassment by the police.

Advertising

""We will not forfeit our faith because of suppression by the authorities,"" Gu said.

As millions around the world gathered to celebrate Christmas, China is capping a year in which the government of President Xi Jinping has led an unrelenting campaign against unofficial churches in China, which by some estimates serve as many as 30 million people.

Xi, apparently concerned that independent worship might pose a threat to the ruling Communist Party's dominance over daily life in China, has sought to bring Christianity more firmly under the party's control. The government this year banned online sales of the Bible, burned crosses, demolished churches and forced at least a half-dozen places of worship to close.

The campaign comes as Xi, the most powerful Chinese leader since Mao Zedong, has worked to more aggressively control religion across China, including the detention of thousands of Muslims in the western region of Xinjiang.

Renee Xia, international director for China Human Rights Defenders, an advocacy group, described the effort as targeting the ""heart of the underground Christian resistance."" The government has focused its campaign on unofficial Christian churches that promote ideas like social justice or have been critical of the party's grip on society.

""The message,"" Xia said, ""is that Xi can't be messed with.""

The crackdown has escalated in the weeks leading up to Christmas. The police this month shut down the 40-year-old Rongguili Church in the southern Chinese city of Guangzhou, which attracted thousands of worshippers. And in September, the authorities in Beijing ordered the closure of the 1,500-member Zion Church, one of the largest unofficial churches in the capital.

The government requires religious groups to register, though many still worship in unofficial churches, sometimes called underground or house churches.

Many in the party believe Christianity, which by some estimates is China's fastest-growing religion, promotes Western values and ideals like human rights that conflict with the aims of China's authoritarian government and Xi's embrace of traditional Chinese culture and Confucian teachings that emphasize obedience and order.

But the government's heavy-handed efforts to obliterate several high-profile churches have been met with resistance among Christians.

On Christmas Eve, the authorities posted a sign at Early Rain's former headquarters saying its 23rd-floor sanctuary had been converted into office space for the local government.

Li Shuangde, a teacher in Chengdu who has been part of Early Rain since 2011, said that church members had been asked by the authorities to sign letters stating that they no longer believe in Christianity. He said Early Rain had no choice but continue to exist in secret. ""We have moved underground,"" he said.

Members have continued to hold Sunday services, sometimes on the banks of a river near the church's former headquarters in a downtown high-rise. They have called for the release of detained leaders, including Wang Yi, the pastor of Early Rain, and his wife, Jiang Rong.

Wang, in a pre-written message released after his detention, spoke about the importance of disobedience.

""The Communist regime's persecution of the church is an extremely vicious crime,"" he wrote. ""As a pastor of the Christian church, I must strictly and publicly condemn such crimes.""

Wang had been scheduled to deliver a Christmas Eve sermon at Early Rain titled, ""The God Who Bestows Peace."" Instead, hundreds of Early Rain members on Monday scattered across Chengdu for services inside the homes of friends and relatives or at welcoming churches.

At Chengdu Xishuipang Reformed Church, a Protestant church with close ties to Early Rain, more than 100 people gathered inside a worship hall on the 16th floor of an apartment building.

A children's choir sang ""Silent Night,"" and a small Christmas tree, decorated with snowflakes, was on display near the lectern.

The anxieties brought on by the recent arrests hung over the ceremony.

""If you see the police, national security or community workers greet them with gentleness,"" Wen Hongbin, an elder at Xishuipang, told the congregation. ""If they try to grab the microphone, I ask the brothers sitting in the front row to please stop them.""

While he did not explicitly mention Early Rain, Wen asked those in attendance to remember ""those who are criminally detained."" Then he began a sermon about the meaning of Christmas and the sacrifice made by Jesus.

Since Xi rose to power in 2012, the authorities have led a sustained campaign against unregistered churches. In one province, more than 1,500 crosses were removed from churches between 2014 to 2016, according to advocacy groups.

This year, some Chinese cities have banned Christmas displays. But the government also allows some degree of celebration, in part to stimulate the economy. Here in Chengdu, the capital of Sichuan province, Christmas trees stand side by side on city streets with propaganda posters, and music from ""The Nutcracker"" plays in the background at malls.

Officials in the United States have denounced the Chinese government's efforts to limit the spread of Christianity.

""China's Christians and other faith communities are under siege and treated as enemies of the state for daring to worship and peacefully live out their faith,"" Sen. Marco Rubio of Florida and Rep. Chris Smith of New Jersey said in a joint statement condemning the recent detentions.

But China's growing influence in world affairs has shielded it from some criticism.

One notably silent voice: the Vatican, which in September reached a provisional deal with the Chinese government to end a decades-old power struggle over the right to appoint bishops in China. The Vatican said it sent a delegation of leaders to China this month to work out details of the agreement, but declined to comment on the crackdown on Christian churches.

Despite Xi's efforts to expand the officially atheist party's control of worship, religious life in China is flourishing. While official figures are imprecise, experts believe there are about 60 million Christians in China, with roughly half worshipping at state-sanctioned churches and half at unofficial churches.

Independent churches like Early Rain, with more than 500 members, have attracted large followings in recent years, especially among white-collar workers seeking an escape from rampant materialism at the center of modern Chinese life.

While sermons at state-sanctioned churches are often tightly scripted, independent churches boom with searing indictments of corrupt officials and rousing calls to protect the rights of the poor.

Early Rain, which Wang founded in 2008, was among the most daring. Wang called Xi a sinner, held prayer sessions each year to mark the brutal crackdown on pro-democracy demonstrations at Tiananmen Square in 1989, and organized a fund to support relatives of political prisoners in China.

Gu, the rice seller, began attending services at Early Rain two years ago after finding videos of Wang's fiery sermons online. He felt Wang's concern for the poor was in line with his own view that the government was abusing workers and violating human rights by destroying their homes to make way for expensive developments. Gu was baptized last year.

""I saw injustices in society,"" Gu said. ""I saw that the government's promotion of China as a just country that enforces laws in a civilized manner was all a lie.""

Worried for his own safety, Gu recently closed his business, hoping to avoid government scrutiny. He said he has grown fearful as he has watched the police arrest his friends.

Advertising

Gu has turned to the Bible in recent days for support. Sometimes, he recites a verse from the Book of Proverbs: ""The path of the righteous is like the morning sun, shining ever brighter till the full light of day."""
"13","1026595371","2018-12-26","https://www.latestly.com/india/news/iit-jee-aspirant-commits-suicide-in-kota-3-student-suicides-in-48-hours-shake-countrys-coaching-city-558396.html","IIT JEE Aspirant Commits Suicide in Kota: 3 Student Suicides in 48 Hours Shake Country's Coaching City | LatestLY","Latestly",FALSE,"The educational coaching city, Kota appears in the headlines for tragic incidents -- three student suicides back to back in just 48 hours. After 17-year-old medical student and 16-year-old, another Indian Institute of Technology (IIT) aspirant took his life by hanging himself from the ceiling fan. According to reports, the boy hailed from Bihar was preparing for the Joint Entrance Exam (JEE) Main and JEE Advanced 2019 exams. These cases have once again highlighted the issues of stress and parental pressure on students which leads to student suicides in Kota since 2013. The recent number suicides have now increased to 19 in the city. Dental Student Commits Suicide at His Residence in Madannapet, Alleges Harassment by College Staff in Suicide Note.

The city's police have identified the young aspirant as Jitesh Gupta, a resident of Hardobara in Siwan district of Bihar. He cleared the class 12 exams, for the past three years, Jitesh has been preparing for IIT JEE entrance examinations from a premier institute, the name of which has not been reported. The incident happened in the Christmas morning. His parents were calling in the morning. After getting no response, they called his friends to find out if their son was okay. His friends rushed to the hostel room and found the gate bolted from inside. They peeped through the window and saw the boy hanging from the ceiling fan. IIT Guwahati Student Commits Suicide at Campus Hostel! Leaves Note Saying She Wanted to Become a Teacher & Not Engineer.

The Police were informed immediately who recovered the body and had placed in the mortuary of Maharao Bhim Singh hospital for post-mortem. The reason behind the extreme step is not known as no suicide note was recovered from his room. Within two days, another 17-year-old NEET student from Uttar Pradesh, Diksha Singh who hanged herself on Sunday noon, December 23. Just a day before that, another IIT aspirant, 16-year-old Deepak Dadhich took his life by hanging himself at his coaching institute's upper storey room. IIT Madras Student Commits Suicide for Poor Attendance.

For providing preparatory courses to the many engineering and doctor hopefuls, the city over the years has earned itself fame and initially being dubbed as the country's coaching city. Along with its reputation of giving excellent educations and successful candidates to the famous institutes, Kota has also become infamous for its increasing number of suicide rates. The recent incidents have increased the tally to 19 since January this year."
