"","ID","date","url","title","source","duplicate","body"
"209","1025275549","2018-12-23","https://www.thehindu.com/news/cities/Kochi/exam-centric-education-kills-creativity-minister/article25814884.ece","Exam-centric education kills creativity: Minister","The Hindu",FALSE,"Society should rethink its attitude towards education as a means of making the grade in examinations, Education Minister C. Ravindranath has said. He was speaking at the P.M. Foundation Education Awards function here on Sunday.

Students' creative aptitude gets killed when education becomes examination-centric. Probably, such a trend does not create geniuses -- be it scientists or artists -- despite the fact that the State has made immense progress in the education sector.

The government is not in favour of examination-centric education, and it aims to transform the education system from being teacher-centric to student-centric. It is also the objective of the education protection campaign, the Minister said.

He added that studies should be considered as a journey towards making discoveries, and that one does not gain much by learning things by heart. An A+ in life is more important than an A+ in examinations, and students, teachers, and parents should be sensitive to this significant aspect, Mr. Ravindranath said. He also called upon students to use their mother tongue as a tool to excel in life.

The Minister pointed out that parents and teachers should motivate students to excel in their own creative fields. Never should a student be discriminated against for not making the grade.

The foundation's Haritha Vidyalayam Awards were presented to KMHSS, Valakkulam, Malappuram; Krishnavilasam UPS, Pangode, Thiruvananthapuram, and GHSS, Udinoor, Kasaragod.

P.M. Foundation chairman A.P.M. Mohammed Hanish presided over the function. IMG Director K. Jayakumar delivered the keynote address, and P. Mohammed Ali gave the message.

Venu Rajamony, India's former Ambassador in Netherlands, and Alappuzha District Collector S. Suhas were present."
"210","1019723398","2018-12-16","https://www.ptcpunjabi.co.in/sirjanhari-award-ceremony-live-updates-former-education-minister-daljit-singh-cheema-ceremony/","Sirjanhari Award Ceremony LIVE updates : Former Education Minister Daljit Singh Cheema is here at ceremony - PTC Punjabi Sirjanhari Award Ceremony LIVE updates : Former Education Minister Daljit Singh Cheema is here at ceremony","PTC Punjabi",FALSE,"Sirjanhari Award Ceremony LIVE updates : Former Education Minister Daljit Singh Cheema is here at ceremony

Role of today's women is boundless, be it at home front or in the commercial setting. With an idea to promote women's who have excelled in different areas of life with their confidence and strength despite their struggles in life.""Nanhi Chaan Charitabale Trust""on the completion of its 10 years will felicitate the women's who have excelled in different areas of life."
"211","1019527777","2018-12-16","https://timesofindia.indiatimes.com/city/goa/draft-natl-edu-policy-soon-hrd-minister/articleshow/67110424.cms","Draft national education policy soon: HRD minister Prakash Javadekar - Times of India","The Times of India",FALSE,"PANAJI: Union minister for human resource development (HRD) Prakash Javadekar, on Saturday said the much-awaited draft National Education Policy would be ready shortly.

At the Goa University's 31st annual convocation ceremony, Javadekar said work on the report on higher education, authored by former Indian Space Research Organisation chief K Kasturitangan, was completed on Saturday and would be submitted to the government soon.

Javadekar also said a separate category would be created for smaller universities in the National Institutional Ranking Framework (NIRF) of the HRD, to ensure that such institutions don't lose out to larger ones.

""The National Education Policy will include accessibility, affordability, equity, quality and accountability,"" Javadekar said. ""These will be its five pillars. Our committee, under Kasturirangan, met for the last time on Saturday. Members said work was over and that they would hand over the education policy to me any time now. This will give a new direction to our education system.""

After GU vice-chancellor Varun Sahni said in his speech that it would be better if NIRF considered not just absolute numbers but per capita data, so that smaller universities don't find themselves disadvantaged, Javadekar said, ""It is a good suggestion that smaller universities should have a different category under NIRF so that they are not compared to universities having 1 lakh to 1.5 lakh students. If we compare smaller universities, they will appear to not be performing on par. But if we assess them on per capita output, the picture will be different. I assure you that a different category will be made in the NIRF ranking for smaller universities. I want to announce it here.""

The minister said other organisations would also be involved in the National Assessment and Accreditation Council's accreditation of institutes, so that each institute could be ranked at least once in five years.

Sahni also maintained that the GU legitimately had a place in Institutes of Eminence (IoE) competitions. ""At least a couple of IoEs should be small universities doing excellent work that can rapidly be scaled up to comparative size,"" he said."
"213","1018538746","2018-12-14","https://www.clipper28.com/en/several-steps-have-been-taken-to-promote-quality-education-in-country-says-minister/","Several steps have been taken to promote quality education in country, says Minister","Clipper28 Digital Media",FALSE,"He further said that government is open for other agencies to take the responsibility of accreditation and IITs and IIMs have been asked for the same so that more and more institutions can be accredited from reputed agencies.

Union Minister for HRD Shri Prakash Javadekar has said that the government is committed to increase quality education in the country right from primary education to higher education.

Mr Javadekar was speaking at the national Conference on 'Positioning India on the Global Education Map' in New Delhi today. In higher education, we have taken tremendous steps to improve college education, for this we are making accreditation process more scientific and tough. Government wants to increase the strength of NBA and NAAC so that more number of institutions can be accredited, the Minister added.

He further said that government is open for other agencies to take the responsibility of accreditation and IITs and IIMs have been asked for the same so that more and more institutions can be accredited from reputed agencies.

The Minister said that ranking and rating increase competitiveness among institutions for better performance. He gave the example of National Institutional Ranking Framework (NIRF) and said that because of NIRF every institute has constituted an internal committee to improve the ranking. Students also see institutions ranking before taking admission, he added.

The Union Minister said that teacher is the most important component to increase quality educationin the colleges and universities. He said that attendance should increase in the classroom because of teacher's skills not because of the infrastructure of the college. He further said that we are lacking good teachers in the institutions because good people are not becoming teachers.

We have to attract good people for teaching profession and we have to give respect to teachers then only we can create a good learning environment in the institutions. Best teachers attract students to the institution not the best infrastructure, he added.

Graded autonomy is another major step of the government to boost quality education in the country, the Minister said. Shri Javadekar explained that the universities will remain within the ambit of UGC but will have the freedom to start new courses, off campus centers, skill development courses, research parks and any other new academic programs. They will also have the freedom to hire foreign faculty, enroll foreign students, give incentive based emoluments to the faculty, enter into academic collaborations and run open distance learning programmes.

The Minister said that we are focusing on research and innovation to boost research culture in the country. The Ministry of HRD successfully conducted two Smart India Hackathon in 2017 and 2018 and started process for third installment of Smart India Hackathon- 2019, he said.

The Minister further said that to promote innovation culture in India we have started Innovation Cell in AICTE and more than 1000 colleges started Innovation Club in their campuses. The research and innovation culture will make education more relevant and reliable, he added.

Beside these steps to promote quality education in the country we have increased budget amount for the higher education through HEFA, the Minister added. He said that India is improving its ranking in world class institutions but we want to enter in top 100 club of best institutions, therefore we are trying to make 20 Institutes of Eminence in the country, 10 each in public and private category.>"
"214","1016418470","2018-12-12","https://freepresskashmir.com/2018/12/12/delhi-education-minister-manish-sisodia-orders-probe-into-reprehensible-law-exam-question-with-communal-overtones/","Delhi Education Minister Manish Sisodia orders probe into 'reprehensible' law exam question with 'communal overtones'","Free Press Kashmir",FALSE,"A day after a report revealed a controversial question was put in a law exam paper for third semester examinees of Guru Gobind Singh Indraprastha University (GGSIPU), Education Minister of Delhi, Manish Sisodia ordered a probe, asking how a ""reprehensible"" question with ""communal overtones"" could be asked.

A report regarding the same is to be given within five days. The university has also separately launched an internal probe into the matter.

First reported by Indian Express, the question in the exam paper read as follows: ""Ahmed, a Muslim, kills a cow in a market in the presence of Rohit, Tushar, Manav and Rahul, who are Hindus. Has Ahmed committed any offence?"". The paper appeared on December 7.

IMAGE TWEETED BY BILAL ANWAR.

On Tuesday, Sisodia wrote to the Higher Education Secretary: ""It has been brought to my notice through media reports that a highly objectionable question was asked in the LLB third semester exam in the college, namely School Law at Narela, affiliated to GGSIPU. How could such a reprehensible question with a communal overtone be framed for an LLB exam? Secretary (Higher Education) to get the matter inquired into and status report be sent to the undersigned within five days.""

GGSIPU had on Monday said that they had retrospectively ""deleted"" the question and would not be marking students based on it.

(With inputs from Indian Express)

Related Items:Cow, education, Examination, India, law, MANISH SISODIA, Muslim Recommended for you #MeToo: Filmmaker Sajid Khan faces one-year suspension by IFTDA Indian Assembly Elections: MP CM Shivraj tenders resignation, BSP, SP to support Congress in forming govt Indian Assembly elections: Congress beats BJP in three states, emerges single largest party in MP with 114 seats"
"215","1016064894","2018-12-11","https://indianexpress.com/article/education/delhi-education-minister-manish-sisodia-orders-probe-into-communal-law-exam-question-5489105/","Delhi education minister Manish Sisodia orders probe into 'communal' law exam question","The Indian Express",FALSE,"A contentious question posed to law students at Guru Gobind Singh Indraprastha University (GGSIPU) has prompted Education Minister Manish Sisodia to order a probe into how a ""reprehensible"" question with ""communal overtones"" could be asked. A report has been sought within five days. The GGSIPU has also launched an internal probe into the matter.

As reported by The Indian Express, the question -- ""Ahmed, a Muslim, kills a cow in a market in the presence of Rohit, Tushar, Manav and Rahul, who are Hindus. Has Ahmed committed any offence?"" -- was asked to third semester law students in their Law of Crimes-I paper at Chandra Prabhu Jain College of Higher Studies & School of Law on December 7.

Also Read: Law exam paper: If a Muslim kills a cow...

On Tuesday, Sisodia wrote to the Higher Education Secretary: ""It has been brought to my notice through media reports that a highly objectionable question was asked in the LLB third semester exam in the college, namely School Law at Narela, affiliated to GGSIPU. How could such a reprehensible question with a communal overtone be framed for an LLB exam? Secretary (Higher Education) to get the matter inquired into and status report be sent to the undersigned within five days.""

GGSIPU had on Monday said that they had retrospectively ""deleted"" the question and would not be marking students based on it."
"216","1011509687","2018-12-05","http://www.newindianexpress.com/states/kerala/2018/dec/05/expert-panel-set-up-to-streamline-higher-edu-1907315.html","Expert panel set up to streamline higher education: Minister KT Jaleel","The New Indian Express",FALSE,"THIRUVANANTHAPURAM: An expert panel consisting of pro-vice-chancellors (PVC) from the state's varsities has been set up by the government for devising a common academic calendar to ensure timely conduct of varsity examinations and announcement of results, Higher Education Minister KT Jaleel informed the Assembly on Tuesday.

The higher education sector will witness major changes, once the common academic calendar comes into existence, he said. According to the minister, the authorities are exploring the possibility of informing examination results to students and parents via mobile phones. The moves under way to turn institutions into centres of excellence will give a fillip to research programmes, Jaleel said.

Engg education quality hit

Jaleel told the House mushrooming of engineering colleges coupled with understaffed faculty have resulted in a slide in the quality of education provided by them. Though, the existing guidelines allow only those with MTech/ PhD to be appointed as faculty members, many colleges had to recruit BTech holders as teachers due to manpower shortage.He also directed the colleges to establish internal quality assurance cell to maintain quality in education. ""Syllabus revision will take place from next academic year,"" he said."
"217","1010952251","2018-12-05","https://www.mid-day.com/articles/protesting-teachers-assured-of-meeting-with-punjab-education-minister-o-p-soni/20055168","Protesting teachers assured of meeting with Punjab Education minister O P Soni","mid-day",FALSE,"On the demand of the Morcha to cancel the transfers and suspensions of their leaders, Soni said after completing the required course of action, the transfers and suspensions would be scrapped

Punjab Education minister O P Soni Tuesday assured protesting teachers of arranging a meeting with Chief Minister Amarinder Singh to address their issues.

The minister met a group of teachers protesting under the banner of the Sanjha Adhiapak Morcha and told them that the meeting will take place on December 16 or 17 after the assembly session commences on December 13. He also advised them to end their agitation and resolve the issues through dialogue. On the demand of the Morcha to cancel the transfers and suspensions of their leaders, Soni said after completing the required course of action, the transfers and suspensions would be scrapped.

Teachers have been protesting against the Punjab government's decision to fix their monthly salary at Rs 15,000 during their probation period of three years for regularisation of their jobs. Currently, contractual teachers in Punjab get Rs 42,300 per month. On October 3, the Punjab Cabinet had given its go ahead to the regularization of the services of 8,886 teachers recruited under Sarv Shiksha Abhiyan (SSA) and Rashtriya Madhyamik Shiksha Abhiyan (RMSA), as well Adarsh and Model Schools."
"218","1009596184","2018-12-03","https://www.outlookindia.com/website/story/jingling-sound-of-anklets-can-distracts-boys-says-tn-education-minister/321132","'Jingling Sound Of Anklets Can Distracts Boys', Says TN Education Minister","http://outlookindia.com/",FALSE,"Tamil Nadu Minister for School Education KA Sengottaiyan's remarks during a recent visit to his assembly constituency to distribute free cycles to school students has left many bewildered.

Sengottaiyan said that ""jingling sound of anklets distracts boys,"" in response to reports that girl students in state-run schools were prohibited from wearing anklets and flowers.

When asked if the Department had made an announcement to this effect, he was not aware of any such development.

He, however, went on to provide an explanation for the reported ban.

""When someone wears rings and complains that it has gone missing, it will create a mental bitterness about who has stolen them. When anklets are worn and the jingling sound is heard, there could be a difference in the studies of boy students. There is no objection to any girl students wearing flowers though,"" The News Minute quoted Sengottaiyan as saying.

There has been no official response from the school department yet."
"219","1009097130","2018-12-03","https://www.indiatoday.in/india/story/clinking-sound-of-anklets-can-distract-boys-says-tamil-nadu-education-minister-ka-sengottaiyan-1401208-2018-12-03","Clinking sound of anklets can distract boys, says TN education minister","India Today",FALSE,"Anklets should be banned, they can affect boys' studies and concentration: Sengottaiyan

The minister for school education in the Tamil Nadu government, KA Sengottaiyan, has said ""the clinking sound of anklets distracts boys"", in response to reports that wearing anklets and rings was prohibited for girls in the state-run schools.

Sengottaiyan was speaking to mediapersons at Gobichettipalayam on Sunday, after attending a function where free bicycles were given to Class XI and XII students.

ALSO READ | Ban pizza, burger, other junk food on college campuses, says UGC

When the education minister was quizzed about reports that the education department of the state had announced a ban on girls wearing rings, flowers and anklets to the schools, Sengottaiyan said that he had not come across any such development.

He, however, went on to furnish an explanation to the reported ban.

""Rings can be banned. They can go missing. Flowers, I am sure, would not be banned,"" he said, adding, ""anklets should be banned. The clinking sound can distract boys. It can affect their studies and concentration.""

ALSO READ | This college in Uttar Pradesh has banned mobile phones in premises

ALSO READ | No entry in Delhi schools if students come from 'banned' groups"
"220","1008600524","2018-12-02","https://www.firstpost.com/india/west-bengal-education-minister-partha-chatterjee-raps-students-for-blocking-roads-over-attendance-rule-5657761.html","West Bengal education minister Partha Chatterjee raps students for blocking roads over attendance rule - Firstpost","Firstpost",FALSE,"Kolkata: Taking strong exception to road blockades staged by college students over attendance mandate, West Bengal education minister Partha Chatterjee has asserted the government will be forced to take action if the agitators cause inconvenience to public for ""personal benefit"". A large number of students from two institutes -- Shibnath Shastri College and Heramba Chandra College -- took to streets on Thursday and Friday to protest against the Calcutta University (CU) mandate of 60 percent minimum attendance for appearing in examinations.

File image of Partha Chatterjee. Facebook page of Partha Chatterjee

The agitators of Heramba Chandra College blocked thoroughfares in Golpark area for two consecutive days, demanding immediate relaxation of norms. The protest was also backed by students of Gurudas College and Jaipuria College, who demonstrated outside their campuses. The education minister said the government will not succumb to the pressure tactics of the students. ""Under no circumstances will the administration tolerate such pressure tactics. Many people were inconvenienced as they (students) blocked the roads to get their demands fulfilled. This is unacceptable,"" Chatterjee told reporters on Saturday.

Earlier this year, the CU authorities had asked all affiliated colleges to ensure that only those with a minimum 60 percent attendance would be allowed to sit for semester exams. A list of non-eligible students was recently published at Heramba Chandra College, triggering the agitation. Chatterjee pointed out that the state education department has fixed 60 percent attendance as a criterion to sit for semester exams, even as the UGC suggested 75 percent attendance for higher educational institutions.

""Maybe the agitating students wanted to sit for exams without attending classes or studying,"" he said. Heramba Chandra College Principal Nabanita Chakraborty, who met Chatterjee Saturday morning, said the authorities are planning to reduce the cut-off figure for attendance from 60 percent to 55 percent. Trinamool Congress Chhatra Parishad (TMCP), the students' wing of the ruling party, also appealed to the education minister to find a ""way out of the deadlock"" to restore normalcy in the institutes.

TMCP president Trinankur Bhattacharya, who met the minister at his residence, told reporters that the unit has sought a solution that would be acceptable to all sides. A TMCP source said the union urged Chatterjee to consider relaxation in attendance norm for this year.

Updated Date: Dec 02, 2018 17:24 PM"
"221","1004578197","2018-11-27","https://www.business-standard.com/article/pti-stories/minister-calls-for-reforms-in-education-sector-118112700873_1.html","Minister calls for reforms in education sector","Business Standard",FALSE,"Addressing vice-chancellors and college principals, at the inaugural session of a workshop here, he said the fundamental changes require greater accountability, transparency, and morality.

""Time has come to create a wave of institutional building and of excellence in the fields of higher education, research, and capability with enhanced capacities,"" he said.

The minister said that the challenge of quality education with globalisation as an opportunity calls for change in the mindset of all the stakeholders.

Higher Education institutions (HEIs) should foster their link with their community at the local, national and regional levels, to answer societys needs, Ngandam said.

The minister said quality in technical education is an indication of the quality of society and country and its economic growth and the quality should be imparted in all aspects of a technical institute.

He called for a holistic approach to design the quality of an academic organisation.

Terming the workshop as important, Bangalore-based National Assessment & Accreditation Council (NAAC) advisor Dr M S Shyamasundar said that NAAC reviews the institutional quality procedures on a regular basis in order to safeguard the quality of HEIs.

Out of the 56 higher education institutions in the state, only one university and seven colleges have been accredited by the NAAC.

(This story has not been edited by Business Standard staff and is auto-generated from a syndicated feed.)"
"222","1004481370","2018-11-27","https://www.clipper28.com/en/minister-presents-award-bagged-by-hp-in-education-sector-to-cm/","Minister presents Award bagged by HP in education sector to CM","Clipper28 Digital Media",FALSE,"Award was received by Education Minister Suresh Bhardwaj from Vice President of India M. Venkaiah Naidu at a function organised in New Delhi on 22 November, 2018

Education Minister Suresh Bhardwaj today presented the best performing and implementation Award bagged by Himachal Pradesh in education sector in Big State's category in the India Today State of State's Survey 2018 to Chief Minister Jai Ram Thakur, here today.

This Award was received by Education Minister Suresh Bhardwaj from Vice President of India M. Venkaiah Naidu at a function organised in New Delhi on 22 November, 2018.

Jai Ram Thakur appreciated the efforts of the Education department and said that the Award presented to the state was result of consistent and sincere efforts of the state government to improve quality of education.

He said the state government was committed to provide best educational facilities to the students nearer to their homes.

The efforts were on to provide best infrastructural facilities and filling up the vacant posts of the teachers.

Secretary, Education Dr. Arun Sharma, Director, Higher Education and Elementary education were also present on the occasion.>"
