"","ID","date","url","title","source","duplicate","body"
"294","939621204","2018-09-05","https://www.ibtimes.co.in/mp-education-minister-sets-wrong-example-teachers-day-ridicules-transgenders-779706","MP Education Minister sets wrong example on Teacher's Day; ridicules transgenders","International Business Times, India Edition",FALSE,"The minister said that youngsters should clap in the honour of their teacher, else they will have to go and clap in front of every home in their next birth.

It seems like the leaders of Bhartiya Janata Party are involved in a weird kind of competition as to who can speak the most nonsensical stuff that's possible. After BJP MLA from Mumbai Ram Kadam told youngsters during a Dahi Handi event on Janamashtmi that he will abduct girls for them if they did not respond to their advances, the next BJP member to join the bandwagon is Madhya Pradesh's Education Minister Kunwar Vijay Shah.

Addressing a gathering on the ocassion of Teacher's Day, Shah ridiculed transgenders of the nation. Speaking to youngsters, the education minister said that if they won't clap in the honour of their teacher, they will have to go and clap in front of every home in their next birth.

""Agar Guru ke samman mein apne taaliyan nahi bajayi to agle janam mein ghar ghar ja kar taaliyan bajani padengi"", Shah said. Such an insensitive comment coming from an education minister calls for some introspection for the Shivraj Singh Chouhan-led BJP government in the central Indian state. The surprising part about his comment was that after he had made the derogatory statement about transgenders, he even laughed.

This is not the first instance when a BJP leader has made an insensitive or unscientific remark in a public gathering. Recently Tripura Chief Minister Biplab Kumar Dev had said that ducks raise the oxygen level in water bodies when they swim.

More recently, Uttar Pradesh Chief Minister Yogi Adityanath was criticised for advising people in Mathura to read the Hanuman Chalisa to get rid of the notorious monkeys in the city. Speaking on the Ram Mandir issue, Adityanath had said that the date of construction of the Ram Mandir in Ayodhya will be decided by Lord Ram himself.

Prime Minister Narendra Modi's remarks about a tea stall owner making tea from gutter gas had also left social media in splits. We wonder who is going to be next in line to make insensitive, regressive and unscientific statements unabashedly."
"295","939567929","2018-09-05","https://timesofindia.indiatimes.com/home/education/news/karnataka-chief-minister-h-d-kumaraswamy-for-emulating-delhi-govts-education-sector-initiatives/articleshow/65684817.cms","Karnataka chief minister H D Kumaraswamy for emulating Delhi govt's education sector initiatives - Times of India","The Times of India",FALSE,"BENGALURU: Karnataka Chief Minister H D Kumaraswamy on Tuesday said his government accorded top most priority for quality of education and suggested officials to study steps taken by the AAP government in Delhi in the field and submit a report.

He asked the officials to recommend ways to improve the quality of education in the state, the Chief Minister's Office said in a tweet.

Responding to the tweet, Delhi chief minister Arvind Kejriwal said his government would be happy to share its experience with Karnataka.

Kumaraswamy made the suggestion following a meeting he held with the education department officials Monday.

""Recruitment of teachers, maintenance of school buildings and infrastructure issues, were among the points discussed in the meeting,"" he said.

Kejriwal in his tweet said: ""Delhi govt will be more than happy to share its experiences wid (sic) Govt of Karnataka."""
"296","938389510","2018-09-03","http://www.newindianexpress.com/cities/kochi/2018/sep/04/yet-to-decide-on-ideal-compensation-package-higher-education-minister-k-t-jaleel-1867152.html","Yet to decide on ideal compensation package: Higher Education Minister K T Jaleel","The New Indian Express",FALSE,"KOCHI: Higher Education Minister K T Jaleel on Monday took stock of the devastation wrought by the deluge at the Sree Sankaracharya University of Sanskrit (SSUS). After reviewing the devastation, the minister said he will be appraising the Chief Minister of the damages suffered by the university.

""An ideal compensation package will be announced,"" he said.

The minister said, ""The educational institutions are the milestones which highlight the state's development. Hence, it is important these abodes of knowledge are restored to their former state. The government will do everything within its power to achieve this."" The deluge had resulted in losses to the tune of Rs 7.33 crore, said Dharmaraj Adatt, Pro Vice-Chancellor.

""The generators, control panels of the buildings, the main control panel inside the electrical room and the potable water treatment systems were completely damaged in the flood,"" he said. Meanwhile, the engineering, internal quality assurance cell, Kerala State Audit department, Regional office, publications, public relations, International School for Sree Sankara Studies, career guidance cell and the general store were partially damaged. Around 60 computers which were to be distributed to the various departments too were damaged in the flood."
"299","937143313","2018-09-01","https://www.dnaindia.com/india/report-bhagwad-gita-non-religious-nothing-wrong-in-distributing-it-in-schools-colleges-maharashtra-education-minister-2658052","Bhagwad Gita 'non-religious', nothing wrong in distributing it in schools, colleges: Maharashtra Education minister","Daily News and Analysis (DNA) India",FALSE,"Terming the Bhagwad Gita a ""non-religious"" text and ""a way of life"", Maharashtra Education Minister Vinod Tawde on Saturday said there is nothing communal in distributing the text in educational institutes.

Tawde also said the copies of holy books of other religions can also be given to colleges, provided they are made available for free.

Nowadays, even if anyone thinks of distributing the Gita in educational institutions, the move is seen as BJP's attempts of saffronising the education system, he alleged, blaming the media for ""projecting it that way"".

""Today, distribution of the Bhagwad Gita means one is communal. When will we come out of this mentality? Even a Class 1 child can be taught several aspects of life through the Gita,"" Tawde said at the launch of Bhaktivedanta Vidyapitha Research Centre at Girgaum in south Mumbai.

""The Gita, Vedas and Upanishads are not religious texts, but philosophical and scientific in nature and these texts should not just be confined to temples, but be made available to common man as they are a way of life,"" he said.

""If copies of the Quran and the Bible are provided free of cost, they will also be distributed in colleges,"" the minister said.

In July this year, the office of the Joint Director, Higher Education for Mumbai region had issued a letter asking NAAC 'A' and 'A+' ranked colleges in the city to collect the copies of the Gita from its office. The letter, however, did not mention which group or organisation gave the copies for distribution.

The move had kicked up a row with the opposition Congress calling it an effort to ""saffronise"" the education system.

""If anyone thinks of distributing Bhagwad Gita (in educational institutions), it is termed as BJP's attempts of saffronising the education system by newspapers and television channels,"" Tawde said.

He said when Bhaktivedanta Trust of Bhiwandi in adjoining Thane district wanted to distribute the copies of the Gita in colleges, he informed them that the government itself cannot do so, but it could give a list of colleges to which the copies of the Gita could be provided.

""I asked the officials to help them (the Trust). But, the Gita bhakts (people of the Trust) themselves went to the colleges and distributed the copies,"" he said.

Tawde said the key question concerning the education system today is whether students were being imparted knowledge or just information was being passed on to them.

The minister said that between 2020 and 2045, India will be the youngest country in the world and the aim should not just be to supply human resource to the world, but also to give the country's immense knowledge on Vedas to transform the world."
"300","937016630","2018-09-01","https://indianexpress.com/article/india/gita-non-religious-nothing-wrong-in-distributing-it-in-educational-institutions-maharashtra-education-minister-5335352/","Gita 'non-religious', nothing wrong in distributing it in educational institutions: Maharashtra Education Minister","The Indian Express",FALSE,"Maharashtra Education Minister Vinod Tawde also said the copies of holy books of other religions can also be given to colleges, provided they are made available for free.

Terming the Bhagwad Gita a ""non-religious"" text and ""a way of life"", Maharashtra Education Minister Vinod Tawde said on Saturday there is nothing communal in distributing the text in educational institutes.

Tawde also said the copies of holy books of other religions can also be given to colleges, provided they are made available for free.

Nowadays, even if anyone thinks of distributing the Gita in educational institutions, the move is seen as BJP's attempts of saffronising the education system, he alleged, blaming the media for ""projecting it that way"".

""Today, distribution of the Bhagwad Gita means one is communal. When will we come out of this mentality? Even a Class 1 child can be taught several aspects of life through the Gita,"" Tawde said at the launch of Bhaktivedanta Vidyapitha Research Centre at Girgaum in south Mumbai.

""The Gita, Vedas and Upanishads are not religious texts, but philosophical and scientific in nature and these texts should not just be confined to temples, but be made available to common man as they are a way of life,"" he said.

""If copies of the Quran and the Bible are provided free of cost, they will also be distributed in colleges,"" the minister said.

In July this year, the office of the Joint Director, Higher Education for Mumbai region had issued a letter asking NAAC 'A' and 'A+' ranked colleges in the city to collect the copies of the Gita from its office. The letter, however, did not mention which group or organisation gave the copies for distribution.

The move had kicked up a row with the opposition Congress calling it an effort to ""saffronise"" the education system.

""If anyone thinks of distributing Bhagwad Gita (in educational institutions), it is termed as BJP's attempts of saffronising the education system by newspapers and television channels,"" Tawde said.

He said when Bhaktivedanta Trust of Bhiwandi in adjoining Thane district wanted to distribute the copies of the Gita in colleges, he informed them that the government itself cannot do so, but it could give a list of colleges to which the copies of the Gita could be provided.

""I asked the officials to help them (the Trust). But, the Gita bhakts (people of the Trust) themselves went to the colleges and distributed the copies,"" he said.

Tawde said the key question concerning the education system today is whether students were being imparted knowledge or just information was being passed on to them.

The minister said that between 2020 and 2045, India will be the youngest country in the world and the aim should not just be to supply human resource to the world, but also to give the country's immense knowledge on Vedas to transform the world.

Must Watch Demonetisation, a success? Is it still a question: News in Numbers Kerala Floods: How The River Damaged My Hometown India in shortlist for Uber Air launch Shenanigans with 'Stree' Actors Rajkummar Rao, Aparshakti Khurrana and Abhishek Banerjee Start your day the best way with the Express Morning Briefing"
"301","1030112582","2018-12-31","https://www.siasat.com/news/iraqi-education-minister-shaima-khalil-resigns-over-alleged-isis-links-1451762/","Iraqi education minister Shaima Khalil resigns over alleged ISIS links - The Siasat Daily","The Siasat Daily",FALSE,"Baghdad: The newly appointed Iraq's education minister Shaima Khalil Al-Hayali has resigned over allegations that he has links with ISIS. It was alleged that her brother was a leader with Daesh. Shaima resigned just days after she was handed the post.

The scandal came as a blow to Prime Minister Adel Abdul Mahdi who has still not completed his Cabinet. The Parliament's main political blocs are divided over the key positions.

The parliament approved Shaima Khalil Al-Hayali as education minister last week, however, she had not yet taken the ministerial oath.

She resigned on Saturday after intelligence information emerged that her brother was a Daesh leader in Mosul during 2014 and 2016."
"303","1029479779","2018-12-30","http://www.easternmirrornagaland.com/education-essential-vital-for-dev-of-the-state-manipur-minister/","Education essential, vital for dev. of the state -- Manipur minister","Eastern Mirror",FALSE,"Thounaojam Shyamkumar addressing the inaugural programme of the Nongbrang Primary School on Sunday.

Imphal, Dec. 30 (EMN): Education is essential and vital for the development of the state therefore focus should be given at imparting education to the students at the grassroots level, said Thounaojam Shyamkumar,

Forest & Environment, Horticulture & Soil Conservation, Municipal Administration, Housing & Urban Development and Town Planning minister was addressing the inauguration programme of the new building of Nongbrang Primary School on Sunday.

The school was constructed under the joint funding of the Sarva Shiksha Abhiyan and MLA Local Area Development Fund.

The minister urged the local residents to get their children admitted to the school. To generate more income, the minister advised the community of Nongbrang to utilise their paddy fields after the harvest by planting vegetables and other crops.

In an another development, the minister also inaugurated a rural market shed constructed under the central scheme Mission for Integrated Development of Horticulture (MIDH) by the Horticulture and Soil Conservation department at Kongpal Kongkham Leikai in Imphal East district on the same day.

Opening the new market shed, Shyamkumar appealed the residents to maintain cleanliness and to preserve the environment besides conserving the local pond located near the market.

Hoping that the rural market shed will help the women of the area to generate income, the minister announced that another market shed will be constructed to accommodate the women vendors who have been shifted from in and around the Jawaharlal Nehru Institute of Medical Sciences at Porompat area in Imphal East.

He further assured the people of the area that the pond located near the rural market shed at Kongpal Kongkham Leikai will be protected and cleaned under the scheme of the Environment Directorate."
"304","1029385650","2018-12-30","https://www.latestly.com/india/politics/rajasthan-minister-accuses-previous-vasundhara-raje-govt-promoting-rss-saffronisation-programme-primary-education-sector-564956.html","Rajasthan Minister Accuses Previous Vasundhara Raje Govt of Promoting RSS And its Saffronisation Programme in Primary Education Sector | LatestLY","Latestly",FALSE,"Jaipur, December 30: Chief Minister Ashok Gehlot-led Rajasthan Government would soon review changes made in the education sector by the previous Vasundhara Raje government, informed state Education Minister Govind Singh Dotasara in Jaipur on Saturday. He added that the previous government worked for promoting the RSS and its saffronisation programme in primary education sector in the state.

Stating that colour of bicycles was changed to saffron, which closely resembled the Sangh attire. Dotasara said, as reported by The Indian Express, ""The issue of saffronisation was raised by the media and we had taken it up in the Assembly... we will take a decision based on what is beneficial to the public."" Rajasthan Congress to Review Textbooks, Reference Material Revised by Previous BJP Government.

Stating that decisions taken by previous BJP government out of 'political vendetta' would be reviewed, Dotasara said, ""In the past five years, decisions were made as per the list provided to the government by the RSS. We have ordered officials that whatever changes were made in the education sector -- whether it is relocation of schools, change in textbooks and uniforms -- all of it should be reviewed.""

Alleging that the education sector became a laboratory for the RSS in the BJP rule, he said, ""The education department in Rajasthan had ended up being a laboratory for the RSS. We are forming a separate committee of educationists to review the changes made in textbooks and distortion of history. Gandhiji has been reduced to a note and they (BJP) forgot to mention the contribution of people such as Nehru, Indira Gandhi, Rajiv Gandhi and other figures.""

Among other things, the Rajasthan government in their first Cabinet meeting decided to remove the logo of Deendayal Upadhyay from all government letter pads and said that the national emblem would replace it."
"305","1029223475","2018-12-30","https://www.thehindu.com/news/cities/kozhikode/education-should-strengthen-values-of-renaissance-says-chief-minister/article25863735.ece","Education should strengthen values of renaissance, says Chief Minister","The Hindu",FALSE,"Take in culture transcending communal thoughts, students told

Chief Minister Pinarayi Vijayan has said that education should be able to strengthen the values of the renaissance, humanity and secular ideals, calling on students to grow up as righteous people who can take in human culture transcending communal and casteist thoughts.

Inaugurating the second floor of the higher secondary block of the Chala Government Higher Secondary School here, and the State-wide launch of 'Relish', the project to improve the English language skill of secondary students, on Saturday, Mr. Vijayan said there was a time when a large section of people in the State had been denied the right to education based on their caste. That situation changed now. ""We won that right not because those who imposed the denial of education voluntarily withdrew it, but as a result of strong struggles."" The move from certain quarters to push people into old social conditions and the dark ages should be defeated, he said.

Mr. Vijayan said the State had reached the present condition by defeating casteist division and discrimination practised by the feudal system.

Students should understand facts and analyse subjects scientifically, he said, adding that the educational programmes being implemented in the State catered to that goal.

As a result of the education protection initiatives, the academic standard in government schools has been improved, he said.

Stressing the need to improve the standard of education in accordance with the changing times, Mr. Vijayan said that 'Relish English' is a research-oriented project implemented under the leadership of the NCERT.

It was being introduced in ten schools in the State, he added."
"306","1028619881","2018-12-29","https://timesofindia.indiatimes.com/city/hyderabad/education-sector-on-standstill-over-cms-failure-in-ministers-appointment/articleshow/67295392.cms","Education sector on standstill over CM's failure in minister's appointment - Times of India","The Times of India",FALSE,"HYDERABAD: From issuance of common entrance test schedule to key appointments, various decisions in the education sector are on standstill because of chief minister K Chandrasekhar Rao's delay in appointing the education minister even after 18 days of swearing-in.

With the new academic year set to commence in the next few months, there are various key decisions that are now lying in the backburner as the CM is yet to allot ministries to the newly-elected members of the assembly.

Take for instance the schedule for common entrance tests and school admissions. Last year, the Telangana State Council of Higher Education (TSCHE) had declared the schedule for all common entrance tests on December 28 and released the admission schedule for schools on December 30. However, this year, the government is yet to commence the process for the same. ""The release of the schedule will take another 2-3 weeks. We have to wait before the minister of education department is appointed,"" said Papi Reddy, chairman of TSCHE, adding that there won't be much of loss as there is sufficient time before the exams are held.

Finalising of a committee to issue notification for fee fixation of professional courses also lies pending. ""First, a committee is constituted that will issue a notification calling applications from private colleges to fix the fee structure for the next three years. Once we receive applications, the same shall be audited and subsequently fee will be fixed. However, we have to wait for the minister to be appointed to seek approval on the committee,"" said Rama Rao, consultant at Telangana Admission and Fee Regulatory Committee (TAFRC).

Other aspects such as affiliation process for intermediate colleges and finalization of admission process for degree courses are also pending.

Making matters worse, several key positions such as principal secretary, commissioner of school education and chairman of the TAFRC also have to be finalised by the new education minister.

The delay by the chief minister has not only irked the opposition parties but also the parents community. ""The fee hike issue has been pending for the last four years. While the TRS party added the school fee issue in it's manifestos in 2014 as well this year, no results were yielded. Once the education minister is appointed, we intend to meet him and seek relief before commencement of the new academic year,"" said Subramanyam Neerukonda, president of Hyderabad School Parents Association (HSPA)."
"307","1028164029","2018-12-28","http://www.newindianexpress.com/states/kerala/2018/dec/28/protests-against-jaleel-to-be-intensified-1917482.html","Protests against Kerala Higher Education Minister K T Jaleel to be intensified","The New Indian Express",FALSE,"MALAPPURAM: After a break, protests demanding Higher Education Minister K T Jaleel's resignation have started again in the district. The Youth Congress state committee on Thursday took out a march to Jaleel's house at Kavumpuram near Valanchery.

Named 'long march,' the protest rally started from Changuvetty and culminated at Kavumpuram where Youth Congress workers blocked road for almost two hours. Youth Congress leader Riyas Mukkoli said the protests would continue until Jaleel quits. The organisation plans to expand the protests to other districts and dharnas will be organised in front of all district collectorates on January 14. Besides, a march will be taken out to the office of the Kerala State Minorities Development Finance Corporation at Nadakkavu in Kozhikode.

Thursday's rally was attended by around 15,00 Youth Congress workers. A P Anilkumar MLA flagged off the rally from Changuvetty. KPCC secretary V A Khareem presided over. DCC president V V Prakash inaugurated the siege in front of Jaleel's house.

The Muslim Youth League has decided to strengthen protests against Jaleel. ""We have approached the VACB seeking the outcome of a complaint lodged with it. We have plans to approach the court seeking action against the corrupt minister,"" Youth League state general secretary P K Firos said."
"308","1026412755","2018-12-25","http://risingkashmir.com/news/uttarakhands-education-minister-meets-guv","Uttarakhand's Education Minister meets Guv","RisingKashmir",FALSE,"Arvind Pandey, Minister for Education, Uttarakhand State, accompanied by Balraj Pasi, former Member Parliament from Uttarakhand, met Governor Satya Pal Malik at the Raj Bhavan here on Tuesday.

According to an official, Pandey and Governor discussed a range of issues relating to the interventions required in the Education sector to make it responsive to the job market and ways and means to enhance enrolment in schools and provide quality infrastructure for improving the overall literacy rate in India.

They discussed the crucial importance of promoting sports and other extra- curricular activities and providing ample opportunities to youth for their holistic development, the official added."
