"","ID","date","url","title","source","duplicate","body"
"203","1027316930","2018-12-27","https://www.hindustantimes.com/education/delhi-government-to-carry-forward-1-145-vacant-seats-reserved-for-differently-abled-in-private-schools/story-33lvmCsQxUQcFjedEmlXrO.html","Delhi government to carry forward 1,145 vacant seats reserved for differently abled in private schools","Hindustan Times",FALSE,"Officials in the DoE said that they are planning to organise awareness campaigns among parents to motivate them to apply. (HT File)

After four rounds of admissions, less than a quarter of the 1,400 reserved seats on offer in the city's private schools for differently abled students were filled this year. This has prompted the government to carry forward the vacant seats to the next academic year.

Hindustan Times had reported last week that the Delhi government's directorate of education (DoE) had invited fresh online applications for 1,268 entry-level reserved seats for a fourth round of admissions to the current academic year which has just three months left.

On Wednesday, the draw of lots were held for these seats but only 123 were filled. The DoE cited ""lack of applications"" for the large number of seats going vacant.

""Of the 125 applications we received during the fresh round of admission, 123 candidates were absorbed. The selected candidates have to approach the allotted school on or before December 31,"" DoE director Sanjay Goel said.

According to the Rights of Persons with Disabilities (PWD) Act, 2016, three per cent of the total number of seats meant for the economically weaker section and disadvantaged groups (EWS/DG) category are reserved for children with disabilities.

Goel said that the department will carry forward the remaining reserved seats to next academic session (2019-20). ""The seats will be counted in the category during next year's admission,"" he said. The notification of admission in the entry level classes under the 25% reserved seats for the EWS/DG category is likely to be announced in the first week of January, next year.

Officials in the DoE said that they are planning to organise awareness campaigns among parents to motivate them to apply.

""There is lack of awareness among parents about the reserved seats because this was the first time the quota was introduced within the 25% EWS/DG seats. We are planning to organise campaigns to aware parents from the coming admission session,"" an official said.

Experts, however, said that the ""lack of inclusiveness"" in schools make parents reluctant from applying. ""Though the situation in private schools is better than the government schools, parents of children with disabilities are still reluctant from applying there. They think their kids will only be able to adjust in special schools. More efforts need to be put in to make campuses more inclusive by appointing trained special educators and providing better infrastructure facilities,"" said Dr Satender Singh, disability rights activist."
"204","1027314916","2018-12-27","https://www.hindustantimes.com/education/in-a-first-2-private-schools-of-noida-to-return-hiked-fees/story-NKzCtqeDbTH4PFWCBok5qO.html","In a first, 2 private schools of Noida to return hiked fees","Hindustan Times",FALSE,"In a first, two private schools in Noida have agreed to roll back hiked fees and return the excess to the parents, the district education department informed, after continued agitation by the parents' body against ""arbitrary fee hike"" by schools which was not in accordance with the UP school fee regulatory act.

The district inspector of school (DIOS) PK Upadhyay said two schools, Cambridge School in Sector 27 and Bal Bharti School in Sector 21, have agreed to return hiked fees. While Cambridge School management agreed to return hiked amount per semester (₹17,000), Bal Bharti School has decided to return ₹7,000 as hiked amount in one semester.

""We had served notices to the two schools regarding hiked fees in the past and they have now agreed to roll it back. Till now, we have got confirmation from two schools only. We are probing other schools which have also hiked fees,"" Upadhyay said.

The move comes after continued agitation by the All Noida Schools' Parents' Association (ANSPA) against ""arbitrary fee hike"" which is not in accordance with the Uttar Pradesh Self Finance Independent Schools (Regulation of Fees) Act. The ordinance was first brought into motion on April 9, 2018 and the Act was enforced in August this year.

According to K Arunachalam, general secretary of the ANSPA, they had sent a complaint to the DIOS regarding six private schools, namely Apeejay School, Somervillle School, Amity International School, Delhi Public School, Noida, Cambridge School and Bal Bharti School, for increasing fees in an alleged arbitrary manner.

""Although we have received information regarding two schools agreeing to roll back hiked fees, they have not done it yet. If schools really intend to adjust the hiked amount with the future fees, they have to do it in the next quarter. It has been four months since the Act has been enforced, however, no private school has followed it yet,"" Arunachalam said.

On November 3, the district magistrate of Gautam Budh Nagar had held a meet with principals of all private schools in the district and asked them to decided their fee structure as per the newly regulated Act and upload it on their school's website within a week's time.

Reacting to allegations of inaction by the district fee regulatory committee, Upadhyay said, ""We will decide in the next committee meeting on schools which do not follow the fees Act.""

However, Asha Prabhakar, principal of Bal Bharti School, denied claims made by the DIOS.

""We had already returned the hiked fees to parents in July this year. The ordinance came in April and we were told to roll back hiked fees. There was a rise of ₹7,000 in the first quarter and we returned the amount in the second quarter fees. The claims of DIOS that Bal Bharti School has agreed to roll back fees now only is untrue,"" Prabhakar said.

The management of the Cambridge School could not be contacted at the time of this report going to publication."
"205","1026578144","2018-12-26","https://timesofindia.indiatimes.com/city/delhi/fat-is-in-the-fire-private-schools-found-wanting-on-food-safety/articleshow/67248795.cms","Fat is in the fire: Delhi private schools found wanting on food safety - Times of India","The Times of India",FALSE,"NEW DELHI: The kids aren't eating healthy: an inspection of at least 10 private schools in Delhi has revealed that these institutions don't have a canteen policy in place and, in most cases, the students are ""being given to eat what they ask for"". The Delhi Commission for Protection of Child Rights, which has been making rounds of canteens in private schools to check if they are providing nutritious food, found that in all the 10 cases so far, students are being given food high in fat, salt and sugar content, something that is strictly prohibited.

DCPCR has been inspecting the schools to ensure effective implementation of Food Safety and Standard Authority of India guidelines, which are prepared by the central advisory committee of the body as advised by the Delhi high court in 2015. Recently, the National Commission for Protection of Child Rights had asked states to ensure an effective implementation of the norms.

Ranjana Prasad, member DCPCR, said: ""NCPCR had decided to check if these guidelines were being followed and we are doing that in Delhi. We have so far covered 10 private schools in south Delhi. In most schools we saw that the canteens were selling HFSS food and gave whatever the students asked for. The children do not know what is good for them and what they should eat."" The canteens were serving burgers, chowmein and beverages -- all strictly prohibited in the guidelines.

A research recently published in the Asia Pacific Journal of Clinical Nutrition showed that there is a link between consumption of HFSS food and obesity. Numerous studies done among schoolchildren of Delhi, Amritsar and southern India show that the prevalence of overweight/obesity is high and on the rise. In urban post-pubertal children of Delhi, it increased from 16% in 2002 to about 24% in 2006. It is high among the affluent class and children of private schools compared to low and middle-income groups.

Apart from selling food that's high in sugar and fat content, none of these schools had a canteen policy in place.

""It is most surprising that none of the schools knew about the canteen policy. As per guidelines, the canteens are required to provide different kinds of food. They are supposed to have 80% of the menu as green food, which includes vegetables, fruits and others. It is important to raise awareness about it among schools, children and parents so that the children grow up healthy,"" said Prasad.

The inspection will be carried out in all the schools of the city and the Directorate of Education has recommended that the guidelines are strictly implemented."
"206","1026568185","2018-12-26","https://www.hindustantimes.com/education/private-schools-to-join-maharashtra-international-board/story-oWkvdFdwstriNQJrTCgFoL.html","Private schools to join Maharashtra international board ","Hindustan Times",FALSE,"Private schools will be part of the state's international school board, which is set to be operational from the next academic year, state education minister Vinod Tawde said at the launch of the board on Tuesday.

According to the earlier norms, only government schools were allowed to become part of the board. Through the Maharashtra International Education Board (MIEB), the state education department aims to bring in a curriculum similar to that of international schools in state-run institutions. A total of 455 schools, including government, aided and self-financed schools from across the state, have applied to become a part of the board. In the first phase, the schools will follow the curriculum of the new board from pre-primary to Class 3, with Marathi as the medium of instruction for the first year. Currently, the governing body of the board is in the process of scanning the applications from schools to select the final 100.

Tawde said the government would pick 25 private schools and 25 aided schools, along with 50 government schools, as the first 100 schools under the board. ""We have got around 40-45 applications from private schools this year, so we decided to allow a few good private schools to join,"" he said.

Heramb Kulkarni, an educationist from the state, said the government needs to be careful before allowing private schools to become a part of the initiative. ""While some private schools are doing good work, they need to set criteria for selection. The move should not benefit schools run by politicians and big corporates,"" he said.

Government schools that would become a part of the selected 100 will be named 'Bharat Ratna Atal Bihari International School' in the memory of the late former Prime Minister Atal Bihari Vajpayee. Currently, 13 schools in the state are being run as per the MIEB curriculum on a pilot basis. ""We want to ensure people pick state's international schools over international boards. Experts who are a part of the initiative have come up with a great curriculum,"" said Tawde."
"207","1026399968","2018-12-25","https://www.abplive.in/india-news/uidai-cautions-private-schools-on-making-aadhaar-mandatory-for-admission-884033","UIDAI cautions private schools on making Aadhaar mandatory for admission","ABP Live",FALSE,"New Delhi: The Unique Identification Authority of India (UIDAI), the Aadhaar issuing body, has recently informed the school administrations that they cannot make the 12-digital Aadhaar number mandatory for admission of students and warned that doing so will be against the recent directive of the Supreme Court of India. The announcement from the Aadhaar issuing body came in the backdrop of the start of admission process in Nursery and entry-level classes in over 1,500 private schools in the national capital. As per media reports, several schools are insisting parents to submit their Aadhaar as one of the documents required for admissions.

Speaking about the same with news agency PTI, UIDAI chief Ajay Bhushan Pandey has said that the department is aware about the fact that some private schools are demanding Aadhaar cards for admission of students. ""This is not right. This is not as per the provisions of law...school admission and other facility to children cannot be made conditional to production of Aadhaar,"" Pandey told the news agency.

The UIDAI has also warned the school administration to make sure that none of the students are denied admission for not providing Aadhaar as admission document. ""In fact, schools should admit children without Aadhaar and ensure that children are given Aadhaar once they are in schools by arranging special camps for them,"" Pandey said.

The Supreme Court, in September this year, upheld the constitutional validity of Aadhaar and stated that it would remain mandatory for filing income tax returns and allotment of Permanent Account Number (PAN). However, the top court also mentioned that the 12-digital unique identification number will not be mandatory for opening bank accounts, mobile connections and school admissions.

The apex court's directive also stated that Aadhaar would not be mandatory for school admissions, as also for the examinations conducted by the Central Board of Secondary Examination (CBSE), National Eligibility cum Entrance Test (NEET) for medical entrance and the University Grants Commission (UGC).

(With agency inputs) Tags: aadhaar school admissions uidai"
"208","1025427162","2018-12-24","https://timesofindia.indiatimes.com/city/noida/noida-seeks-private-help-for-boards-benches-in-schools/articleshow/67222199.cms","Noida seeks private help for boards and benches in schools - Times of India","The Times of India",FALSE,"NOIDA: The district administration of Gautam Budh Nagar has issued an expression of interest to sign MoUs with private companies to improve the quality of education and infrastructure in government primary schools through CSR initiatives.

District magistrate BN Singh said the administration started signing such pacts last year and roped in some private players. The district currently has 685 government primary and upper primary schools.

""The administration is signing MoUs with private companies to uplift the infrastructure and quality of education in these schools. In the past one year, DLF, HCL, Paytm, etc have signed MoU through their CSR initiative. These companies have adopted some schools and fixed blackboards, benches, tables, toilets, etc. They have also developed smart classes and digital blackboards for interactive teaching,"" said Singh. He added that there are some other government schools which need renovation. The administration aims to strengthen education in all the government schools and plan to rope in some more private players.

Singh said there is perceptible gap in the quality of established private schools as compared with that of government schools. ""This gap needs to be bridged. We have issued a list of 580 schools which need to be adopted,"" he said."
"209","1025378315","2018-12-23","https://indianexpress.com/article/cities/mumbai/bmc-says-no-to-renting-out-shut-civic-school-premises-to-private-aided-schools-5506634/","Mumbai: BMC says no to renting out shut civic school premises to private aided schools","The Indian Express",FALSE,"About 14 private-aided Marathi language schools had requested the municipal corporation to give the premises on rent, as their own buildings were in a dilapidated state.

Citing a Bombay High Court order, Brihanmumbai Municipal Corporation (BMC) refused to provide buildings of shutdown municipal schools to private-aided schools for holding classes.

About 14 private-aided Marathi language schools had requested the municipal corporation to give the premises on rent, as their own buildings were in a dilapidated state.

In the last five years, more than 100 BMC schools have been shut down owing to dwindling student numbers.

""We got applications from 14 such aided schools, seeking municipal schools' premises on rent. Their own buildings are in ruins. However, there is a Bombay High Court order barring to rent out any municipal school building. Hence, we have refused their plea,"" said a senior official in the Education Department.

Advertising

He added, ""Earlier, BMC had given some of the schools' rooms to non-government organisations and political organisations for educational purposes. But they started using them as offices and for non- educational activities. Due to these irregularities, somebody filed a petition in court. The court ordered the civic body to remove all such offices and keep the schools only for educational purposes.""

""The request from aided schools is genuine. Students in these schools are risking their lives. I will bring this proposal in group leaders meeting and come up with a solution,"" said Education Committee Chairman Mangesh Satamkar.

The civic body data showed that there are over 1,300 BMC schools across the city."
"210","1025278677","2018-12-23","http://risingkashmir.com/news/will-take-action-against-private-schools-flouting-norms-dsek","Will take action against private schools flouting norms: DSEK","RisingKashmir",FALSE,"Directorate of School Education Kashmir (DSEK) Sunday said that the department is going to take strict action against schools flouting norms by collecting the tuition fee of vacation months in one go.

DSEK in a circular issued said, ""It has been brought into the notice of DSEK that some private schools press the parents to pay the tuition fee of vacation months in one go.""

DSEK director, Ghulam Nabi Itoo said, ""In some cases, transport charges are being collected by several private schools for vacation period also, even there are instances where it has been alleged that heating charges are being collected from students without such service being used.""

The department said that there is no rule or norm where a private school will force or pressurise the parents to pay a fee in one go.

The orders of DSEK read, ""No (Private) school can force the parents to pay a fee in one go. The school fee, as per norms, is to be paid only in monthly instalments including for vacation period.""

""During the vacation period, the fee is to be charged only for the services which are being utilised by the students and no other fee can be charged,"" DSEK said.

DSEK also clarified that no heating charges can be recovered from students when these services are not being used by students during the vacation period.

Pertinently, Rising Kashmir received a number of calls from the parents of the wards studying in various leading private schools of Srinagar who complained of issues like increase in tuition fee, charging of bus fare for vacation months, extra charges and the onetime tuition fee of winter months.

One of the parents said, there are many private schools in Srinagar who keep the students result withheld till the parent pay tuition fee and transportation in one go for the vacation months."
"211","1025171466","2018-12-23","http://risingkashmir.com/news/charge-only-for-services-provided-to-students-dsek-to-private-schools","Charge only for services provided to students: DSEK to private schools","RisingKashmir",FALSE,"Charge only for services provided to students: DSEK to private schools

Director School Education Kashmir, Dr. GN Itoo on Sunday warned action against private schools demanding lump sum fee and the charges for heating and transport facilities for the time when these facilities are not being provided to students by the school.

Taking cognizance of media reports, DSEK issued a circular on Saturday clarifying that no school can force the parents to pay fee in one go and the school fee, as per norms, is to be paid only in monthly installments including for the vacation period.

The circular further stated that during vacation period, fee is to be charged only for the services which are being utilized by the students and no other fee can be charged. ""Schools can charge only tuition fee in case of teachers and salary of drivers in case of transport. No heating charges can be recovered from students when these services are not being used by students during vacation period,"" the circular reads.

DSEK has also advised the administrators of Private schools of complying with these orders in letter and spirit and added that they can charge tuition and transport facilities from the parents for winter vacations only when they are giving the salary to the teachers and drivers for these months.

Meanwhile the Jammu and Kashmir Joint Coordination Committee of Private Schools has assured Director School Education Kashmir that the rules and regulations of the Department shall be followed by all the private schools and the Coordination Committee shall stand by the side of the Department in taking action against private schools that violate these norms."
"212","1025081041","2018-12-23","http://www.newindianexpress.com/cities/delhi/2018/dec/23/some-pvt-schools-still-flouting-admission-norms-1915413.html","Some private schools in Delhi still flouting admission norms","The New Indian Express",FALSE,"NEW DELHI: At least 15-17 private schools, which have uploaded criteria on the Directorate of Education (DoE) website, are giving points prohibited by the Delhi High Court and the city government, especially on interstate transfer which was the first criterion in the list of 50 disallowed criteria. Sample this: Neo Convent in Paschim Vihar is accused of alloting five points on ""special ground parents"", which includes professionals such as doctors, engineers, architect, etc, and 10 points to ""proven track record"", which, it says, means, ""service towards the betterment of society"".

In November, the DoE issued a list of 50 disallowed criteria, including transferable jobs/ state transfers/interstate transfer, social/noble cause, special grounds if a candidate is having proficiency in music or sports, declaration regarding picking or drop, first-come first- get, vegetarianism, nonalcoholic, non-smoker parent, school-specific criteria, oral test, joint family, which it found to be ""unfair, unreasonable and non-transparent"".

""To bring transparency, the DoE had started this link of uploading the point system of all schools on its website two years ago, before starting the admissions, so that schools cannot flout the guidelines. But, the whole purpose is defeated when over 20 schools have uploaded admission criteria barred by the court,"" claimed Sumit Vohra, founder of admissionsnursery. com.

""We have asked the deputy education officers to send us complaints if they receive any from parents regarding these schools in their zones. We will take action accordingly,"" Director, Education, Sanjay Goel asserted."
