"","ID","date","url","title","source","duplicate","body"
"292","935937983","2018-08-31","http://www.newindianexpress.com/states/telangana/2018/aug/31/government-schools-give-private-peers-a-run-for-money-in-telangana-1865342.html","Government schools give private peers a run for money in Telangana","The New Indian Express",FALSE,"Fun designs, quality teachers, high standards: Telangana seems to have given a twist to its approach to education

Nalgonda

High demand for admissions

Despite there being 35 private schools in the district, parents seem to prefer the Zilla Parishad High School in Bakhalwada colony. Unable to handle the number of applications for admission, this school has put up a ""no admissions"" board at the entrance. In the last few years, admissions get filled within the first week of June in this school. The High School has 796 students studying between classes 6 and 10 who are accommodated in 35 classrooms. There are two sections for Telugu students and three for English in each class. The school has 46 teaching staff, 3 non-teaching staff, a library, science lab and playground apart from other facilities. ""Last three years, we secured 100 per cent pass in Class-X examinations,"" says the school headmaster Banda Venkat Reddy. While the school is 'almost perfect' the headmaster has urged the government to construct a kitchen where midday meals can be cooked.

Rajanna-Sircilla

'Train' them for future!

Going to school is exciting for children enrolled in Mandal Parishad Primary School. For, classrooms of this school in the remote area of Veernapalli look like train compartments. As many of the children studying here have not travelled in train, this gives them a good reason to attend classes. The makeover has worked wonders! Every since the boring school became a 'train school' dropout rates have frozen, say authorities. Also, they are seeing a sudden jump in attendance rate. Children are often seen standing at the classroom entrances, pretending to be boarding or alighting the train. ""At present, we have 270 students coming from Kancherla, Maddimall and Veernapalli villages. Since the makeover, donations have increased and we used this amount to hire two additional teachers,"" says the school headmaster Bukya Gajan. It's not just students, the school has also become a local tourist attraction with people visiting the spot to take selfies.

Nizamabad

How the 'best teacher' turned around a school

The Zilla Parishad High School at Borgaon (P) Village is also giving private schools a run for their money. Over the last four years, there has been a steady flow of students from private schools to this government institution. It is not without a reason, as six students who studied in this school have made it to different IIITs. This sudden prosperity was ushered in around 2014, when the current headmaster N Ram Rao took charge. His funda was to focus on quality improvement. This, he believed, would help increase enrolment. And that formula has actually paid off. He was recently awarded the best teacher award by the Government of India. Like a magic, at least 70 students from different private schools have switched to this school after that. Rao attributes the success to teaching staff. ""The teachers are responsible for the change in perception about the school among the villagers,"" he says. Established in 1977, the school runs from a multi-storage building on 1.14 acre. It has 1,200 students studying in classes 6-10. The school's infrastructure is also robust. It has a digital education lab, playground and other facilities. Weekly sports and other extracurricular activities are conducted to ensure the holistic development of the students. The school also takes care of the health of the students and organises regular health camps with the help of medical and health department. The school now acts as a model example for government schools to learn and replicate.

Adilabad

Nizam-era Telugu medium school still going strong

The Government School Gazetted No 2 is giving tough competition to private schools, despite being a Telugu-medium one. It has classes 8-10 with two sections for each class. A total of 302 students study here. Interestingly, the school is situated in the heart of the town surrounded by English medium private schools. Still, it's witnessing steady growth in admissions over the years. This academic year, the school got 50 new admissions. This is primarily because the school is achieving good results. Established in 1935, it has also produced several luminaries. Apart from the robust infrastructure, the school also boasts of a Legal Literary Club for students to discuss various issues including harassment. Students from here have also participated in State level sports tournaments."
"293","935162016","2018-08-30","https://www.financialexpress.com/india-news/delhi-private-schools-not-to-celebrate-teachers-day-on-september-5-here-is-why/1297016/","Delhi private schools not to celebrate Teachers' Day on September 5; here is why","The Financial Express",FALSE,"The school authorities also alleged that they were treated in poor, unfair manner. An association of over 160 senior secondary private schools, The National Progressive Schools' Conference (NPSC), has reportedly issued an advisory to schools.

Several Private schools in Delhi have decided not to celebrate the Teachers' Day on September 5. A few of those are likely to observe a muted celebrations. The private schools have taken this decision citing ""spate of arrests"" of teachers and principals in the national capital. The school authorities also alleged that they were treated in poor, unfair manner. An association of over 160 senior secondary private schools, The National Progressive Schools' Conference (NPSC), has reportedly issued an advisory to schools.

The Affordable Private Schools' Association has also decided not to celebrate Teachers' Day on September 5. ""We, the educationist fraternity, have to restore the value in our society and respect of the teachers, so that we can bring trust in the system,"" it said in a statement. Earlier on August 21, the Springdales Education Society had sent a note stating it will not be hosting the Teachers' Day dinner this year.

The Springdales Education Society circular said this is ""owing to a series of disturbing events in schools, in and outside Delhi, where principals and teachers have been held accountable for situations that in many instances have not been the responsibility of schools and their management"". ""Teachers are being targeted on unproven allegations of a lack of safety of school children. The relationship between the school and parents, too, is merely transactional and not what we desire it to be or what it used to be,"" it said.

Two teachers and the principal of a school were arrested after a Class IX student allegedly committed suicide. Parents had accused teacher and the school of harassing the student.

Earlier in April, the National Coalition for School Education (NCSE) had demanded reforms in education, including amendment to the Right to Education Act. Speaking to reporters, NCSE chairman Kulbhushan Sharma said, ""While the state of education calls for urgent reform, the government seems to be working only for appeasement and quick fix."" ""Amendments needs to be made to RTE legislation for learning outcome-based school recognition system instead of mere infrastructure-based norms, which have led thousands of schools to close down,"" Sharma said."
"294","934346187","2018-08-29","https://timesofindia.indiatimes.com/home/education/news/90-students-in-urban-private-schools-cannot-read-english-survey/articleshow/65587370.cms","90% students in urban private schools cannot read English: Survey - Times of India","The Times of India",FALSE,"A survey reveals 9 out of 10 children in urban private schools cannot read in English correctlyA survey reveals 9 out of 10 children in urban private schools cannot read in English correctly

A survey that assessed students across 20 states revealed that 9 in 10 children in urban private schools cannot read in English.

The report, 'Where India reads 2017-18', covered 19,765 children of classes IV, V and VI in 106 private schools in cities, across 20 states, including Delhi, Karnataka, Maharashtra, West Bengal and Jammu and Kashmir among others.

The survey conducted by Stones2Milestones, an organisation that aims to address the reading and learning levels of school going students. This was reviewed by Australian Council of Educational Research (ACER).

The report suggests that problem lies within our households. ""English is a second or even third language, in several Indian households and children speak in their mother tongue which is either Hindi or a regional language. However, at school they are expected to learn a language which is foreign to them, in a formal setting.""

Nikhil Saraf, co-founder, Stones2Milestones, said, ""The test was conducted online to check comprehension, vocabulary and reading habits of students under their teachers' supervision. Some students answered a few test items in an unreasonably short time. Since it is unlikely for a small child to read and respond in snap of a finger, we did not count for scoring.""

""This also points to several behavioural peculiarities, which could include reading fatigue, non-seriousness and bad monitoring practices.""

The schools were provided with a list of suggestions and actions needed to improve reading levels based on the assessment report.

""The focus should be to make reading to the core as a learning focus rather than just restrict it to a namesake library period,"" said Kavish Gadia, co-founder and CEO, Stones2Milestones.

Christel R Devadaswon, head, Department of English, University of Delhi, said, ""A policy is required to improve the literacy rate and stakeholders should look at the perspective of children and their socioeconomic situations.""

Venita Kaul, ex-senior education specialist and chairperson of the Advisory Committee of Center for Early Childhood Education and Development (CECED), said, ""I hope this report will initiate a discussion on challenges many Indian children face due to multi-lingual environment at home. It will sensitise parents, teachers and other stakeholders regarding the need to revisit classroom pedagogy for teaching reading to children. This is an urgent need in primary schools since children learn best in ways more developmentally and contextually appropriate for them. Once that is done, future assessments of children's reading skills will undoubtedly present a more favourable picture of their reading levels."""
"295","933272396","2018-08-27","http://risingkashmir.com/news/strictly-adhere-to-traffic-guidelines-dsek-asks-private-schools-","Strictly adhere to traffic guidelines: DSEK asks private schools ","RisingKashmir",FALSE,"Strictly adhere to traffic guidelines: DSEK asks private schools

Director School Education Kashmir (DSEK), Dr. G.N. Itoo Monday asked the administrators of all the private schools to strictly adhere to the traffic guidelines and make sure the safety of the students.

DSEK stated this at a meeting held here today with the representatives of private schools.

Talking about the directions of the Supreme Court, DSEK told the representatives of the private schools to ensure that there is no overloading in school buses. In order to streamline the transport system in schools, he asked the representatives of private schools to submit their suggestions to the Department in this regard by 30th August 2018.

DSEK also highlighted the guidelines issued by the Divisional Administration regarding the issues pertaining to transport facilities for students in private schools and directed them to adhere to these guidelines and the directions from the Department in order to make sure the safe transport facility for the students."
"296","933266851","2018-08-27","https://kashmirobserver.net/2018/city-news/private-schools-asked-adhere-sc-guidelines-transport-facilities-35447","Private Schools Asked To Adhere SC Guidelines On Transport Facilities ","Kashmir Observer",FALSE,"SRINAGAR -- Director School Education Kashmir, Dr. G.N. Itoo on Monday asked the administrators of all the Private Schools to strictly adhere to the guidelines issued by the Supreme Court of India regarding the transport facilities and ensure the safety of the students and taking the parents into confidence.

Reviewing the tranSport facilities being provided to the students of Private Schools, the Director asked the administrators of all the Private Schools to strictly adhere to the guidelines issued by the top court in letter and spirit.

He passed the instructions after a meeting with the representatives of Private Schools in the Conference Hall of Directorate of School Education Kashmir.

Talking about the directions of the Supreme Court DSEK told the representatives of the Private Schools to keep a strict vigil on the overloaded school buses and direct those bus drivers to do away with that practice. In order to streamline the tranSport system in schools, DSEK asked the representatives of Private Schools to submit their suggestions to the Department in this regard by 30th August 2018.

The meeting was attended by the representatives of Private Schools and some senior officers of the Department.

DSEK also appraised the meeting about the guidelines issued by the Divisional Administration regarding the issues pertaining to tranSport facilities for students in private schools and directed them to adhere to these guidelines and the directions from the Department in order to make sure the safe tranSport facility for the students."
"297","932045194","2018-08-25","http://www.asianage.com/metros/delhi/260818/private-schools-to-boycott-teachers-day.html","Private schools to boycott Teachers' Day","The Asian Age",FALSE,"New Delhi: Many private schools in the city have decided to boycott Teachers' Day this year in protest against the arrest of a principal and two teachers over what they call ""false allegations"".

""It is highly unfortunate that our fellow principal and two teachers of a school in East Delhi were arrested by the police on the basis of false allegations. They spent 35 days in jail. The investigations have not found any evidence against the teachers as well as the principal. It is highly unfortunate that the principal and teachers have been arrested in this manner,"" said a statement by Affordable Private Schools' Association.

The police had arrested the principal and two teachers of a private school in Mayur Vihar in July, four months after a 15-year-old girl committed suicide alleging harassment. The girl -- a student of Class 9 -- committed suicide at her residence on March 20 in Noida sector 52.

The family members had alleged that she was under stress due to her poor performance in two subjects in the exams.

""There are so many cases and instances that the police have arrested teachers and principals in unproven allegations and false charges. It is a matter of shame for our society in which without knowing the facts and circumstances of the case, parents asked the immedi-ate arrest of the principal and teachers,"" the statement said.

""Therefore it has been decided by the members of the association that our fellow schools will not celebrate this Teachers day on 5th September, 2018 and we are ready to support any protest to uphold the respect, safety and security of our teachers,"" it added."
"298","931958855","2018-08-25","http://www.newindianexpress.com/nation/2018/aug/25/families-cut-food-entertainment-expenses-to-send-kids-to-private-schools-research-1862728.html","Families cut food, entertainment expenses to send kids to private schools: Research","The New Indian Express",FALSE,"NEW DELHI: Indian families which send all their children to private schools spend over 4 per cent of their total expenditure more on education than a similar household which sends all its children to public schools. This is a 60 per cent increase above the average education expenditure and is financed by a reduction of expenditure on food, institutional medical care, entertainment among others.

These are some of the facts that were presented by two development researchers in a presentation titled ""How do Households Finance Private School Education?"" in an international conference on public policy and management organised by IIM, Bengaluru in New Delhi recently.

""We set out to analyse the financing patterns of private education by families because it's a common experience that even urban poor and low-income families in rural areas now prefer private schools over government schools,"" said Nishant Chadha of India Development Foundation, a researcher.

""And the findings so far, I would say, have been startling as families cut their other expenses significantly to ensure things like tuition, uniforms and recurrent fee that private schooling demands.""

The researchers used data from 68th round of National Sample Survey Office for the analysis The motivation for the analysis came from a 2015 Assocham survey which had said that nearly one in ten respondents indicated that the cost associated with schooling has actually affected even their choice of school.

Over 70 per cent of parents spend 30-40 per cent of take-home pay on their children education, placing a significant burden on their family budget, the survey had also found. ""While the annual fees are on average Rs 65,000 to Rs. 1,25,000 on a single child for regular schools, even the preschools for those aged 3 to 5 cost, parents about Rs 35,000 to Rs 75,000 a term,"" Assocham survey had said.

Bharti Nandwani of Indira Gandhi Institute of Development Research, another researcher with the project said that it was important to probe ""at what cost families make a choice that is considerably costlier."" ""Private schooling entails higher out-of-pocket expense so we wanted to understand how families manage to do that and how it affects their other needs and choices,"" she said. Chadha, however added that the findings are preliminary and more analyses needs to be done to ""answer a lot of other questions."
"300","931348746","2018-08-24","https://indianexpress.com/article/cities/delhi/128-private-schools-in-delhi-roll-back-arbitrary-fee-hike-5323717/","128 private schools in Delhi roll back 'arbitrary' fee hike","The Indian Express",FALSE,"By: PTI | New Delhi | Published: August 24, 2018 10:24:19 pm Chief Minister Arvind Kejriwal had issued directions to the schools to roll back their ""arbitrary"" fee hike after receiving several complaints from parents.

Around 128 schools in the national capital have rolled back their ""arbitrary"" fee hikes following complaints from parents, a government official said.

Chief Minister Arvind Kejriwal had issued directions to the schools to roll back their ""arbitrary"" fee hike after receiving several complaints from parents.

The Directorate of Education (DoE) had in April sent notices to 195 private schools of the city and asked the school heads to roll back their fee hike.

Last month, Kejriwal had asked DoE to submit a compliance report on whether the private schools had rolled back their fee hike as ordered by the government.

""Out of 195 private schools, 128 have informed us that they are rolling back their hiked fees. Remaining 67 private schools will soon be served show-cause notices for not complying with the orders,"" a DoE official said.

Education Minister Manish Sisodia would be meeting the representatives of all the 128 schools who had complied with the government's directive.

Must Watch From The Archives: As we complete one year since SC's landmark verdict on privacy, a look at the dangers of mass surveillance Xiaomi's Pocophone launches Poco F1 in India: Here's a first look Rajkummar Rao and Shraddha Kapoor Reveal Eerie Experience on Stree Sets Kerala floods: A quick guide of DOs and DON'Ts for the people of Kerala after returning home Start your day the best way with the Express Morning Briefing"
"301","1029536109","2018-12-30","http://risingkashmir.com/news/amid-harsh-weather-private-schools-defy-govts-winter-vacation-order","Amid harsh weather, private schools defy Govt's winter vacation order","RisingKashmir",FALSE,": Defying the state government's winter vacation orders, scores of private schools are operating in the harsh weather conditions -- forcing students to attend early morning tutorials.

However, Department of Schools Education, Kashmir (DSEK) has given allowance to some private schools for only remedial classes that even on terms and conditions.

A number of parents said that there are several private schools that are giving winter tutorials to the students in the early morning.

Parents while questioning the government order regarding the winter vacations said, ""If the Directorate of School Education Kashmir (DSEK) has announced the winter vacation in all schools so that the students will evade the biting cold and when it is not being implemented on ground level then what is the fun of announcing such vacations.""

One of the parents wishing anonymity said that there are some private schools that function for winter schooling, where classes start from 10 Am upto 2 PM.

He said, ""This freezing winter has returned after many years and the students are being compelled to attend the winter schooling starting from 10 Am.""

He said that this seems to be a punishment to the students and nobody from the education department is showing any concern to overcome the issue.

Another parent while lamenting on the issue said that her ward felt ill twice due the cold and he is not able to go for winter schooling in the misty morning.

Director Education, Kashmir, Ghulam Nabi Itoo, said that the department had already issued the circular regarding the functioning of the winter schooling in the valley.

He said, ""We have only allowed private schools for only remedial classes and we have asked the concerned authorities to make proper arrangements of heating and seating available."" ""The scheduled timing for the approved private schools and the coaching centres is from 11 AM to 3 PM,"" he said."
"302","1027571301","2018-12-27","https://www.thehindu.com/news/cities/bangalore/private-schools-allege-delay-in-rte-reimbursements/article25842661.ece","Private schools allege delay in RTE reimbursements","The Hindu",FALSE,"Private school managements across the State have alleged a delay on the part of the Department of Public Instruction in releasing reimbursements for students admitted under the RTE quota.

D. Shashi Kumar, General Secretary of the Associated Managements of Primary and Secondary Schools in Karnataka, stated that schools had not even received the first instalment of the reimbursements that were due in September. It was difficult for private schools to pay salaries of their teaching and non-teaching staff, and meet the day-to-day expenditure. ""Some schools, in fact, had appealed to rectify the reimbursements of last year, which the department us yet to address,"" he said, adding that several low-cost budget schools are finding it difficult to sustain their operations.

He warned that many schools would refuse admissions for students admitted under the quota next year, as the delay in reimbursements is an annual problem.

Department officials acknowledged the delay, and stated that they are trying to simplify the process. They added that they would extend the date for filing for reimbursements by 10 days."
