"","ID","date","url","title","source","duplicate","body"
"25","789005367","2018-01-06","https://timesofindia.indiatimes.com/city/kochi/peace-school-yet-to-get-closure-notice/articleshow/62390406.cms","Peace School yet to get closure notice - Times of India","The Times of India",FALSE,"KOCHI: The department of general education has sent a letter to the director of public information (DPI), directing the latter to shut down the Peace International School, which was caught in controversy.

The directive was issued since the department found that it was necessary to ""prevent Muslims from joining IS activities.""

The educational institution, with classes up to middle-school, grabbed the government's attention after the district educational officer complained against the school for teaching objectionable content.

The letter said preliminary inquiries revealed that the textbooks being used at schools were ""aimed towards the propagation of ideas contradicting the secular policies of the country.""

Ernakulam's Peace International School's primary class students were taught lines like, ""He (Allah) is not one of a group of gods and goddesses who fall in love, marry and plot against each other or put silly curses on humans.""

The controversial books, highlighted the benefits of being a Muslim. The books said ""how we (Muslims) should never give up in any matter,"" stating that Allah is one and unique and there can't be any comparison in this case. The children's book even says that ""all other faiths violate this simple command, either explicitly or implicitly.""

The letter said the government had not issued an NoC to the school and it has no CBSE affiliation. The DPI has been requested to take immediate action under the RTE Act to close Peace International School, Kochi, and transfer the students to nearby schools.

""In order to prevent the Muslims from joining IS activities, it is highly necessary to stop the operation of such institutions,"" said the letter from A Shahjahan, secretary, department of general education.

The police probing the case had searched Peace International Schools at Thathappilly near North Paravoor and Chakkaraparambu near Vennala and seized textbooks.

Among the seized books there were those which referred to other religions.

""A lot of people worship objects that can neither harm them nor bring any good,"" an activity for the students was titled in the book.

A case was registered against the management committee of the educational foundation in October 2016.

Meanwhile, Peace International School's PTA president, A Sajimon said that they have not yet received information regarding the school's closure.

Assistant police commissioner K Laljy, investigating the case, said that probe was progressing. ""The director of the foundation is still abroad. We are trying to get him back. The school in Kochi city has been dysfunctional for a while and didn't function during this academic year,"" the ACP said."
"26","788977400","2018-01-06","https://www.deccanchronicle.com/nation/current-affairs/060118/kerala-govt-orders-closure-of-school-to-prevent-muslims-from-joining-isis.html","Kerala govt orders closure of school 'to prevent Muslims from joining ISIS'","Deccan Chronicle",FALSE,"Thiruvanathapuram: The Kerala government has ordered the closure of a private school at Kochi for having contents in its syllabus that go against the country's secular policies.

The order for the school's closure, issued on Thursday, said it was highly necessary to stop the operation of such institutions ""to prevent the Muslims from joining ISIS (Islamic State) activities.""

Inquiries revealed that the textbooks at the Peace Foundation International School, were aimed at the propagation of ideas contradicting the country's secular policies besides trying to spread propaganda which was against the country's policies, an order said.

""Hence in order to prevent the Muslims from joining IS activities, it is highly necessary to stop the operation of such institutions,"" the order said.

It also said the government has not issued a no objection certificate (NOC) to the school and that it has no Central Board of Secondary Education (CBSE) board affiliation.

The school at Thammanam in Ernakulam came under the scanner in October 2016 after the district educational officer filed a complaint against the school on the contents of the textbooks.

The Education Secretary to the Director of Public Instruction issued the order under the Right to Education Act to close the school and transfer students to neighbourhood schools."
"27","788761777","2018-01-05","https://timesofindia.indiatimes.com/city/noida/noida-dm-orders-school-closure-till-january-10-schools-yet-to-receive-order/articleshow/62385582.cms","Noida: DM orders school closure till January 10, schools yet to receive order - Times of India","The Times of India",FALSE,"NOIDA: For the third time this winter, the district administration has extended the school-closure for classes nursery to 8th owing to ""prevailing cold conditions.""

A few schools which had re-opened on Friday after their winter-break had however opened as the order did not reach on time.

""Due to cold wave and extreme fog prevailing in the district, the district magistrate BN Singh has ordered that the schools will remain closed from classes nursery to VIII. This order will apply on all the government schools, non-affiliated, affiliated, CBSE and ICSE schools,"" a statement from the DM office said.

Earlier on January 1, the DM had ordered the schools to remain closed till January 4. However, the order hardly had any impact as most private schools had already closed for winter vacations.

While most private schools are set to open next week, some schools had re-opened on Friday while a few had opened on January 1. The government schools which did not have winter vacations, had observed a holiday owing to the Guru Gobind Singh Jayanti. They were supposed to open on Saturday but have decided to observe closure for classes nursery to class VIII after the order was issued.

In Noida, some schools were open for all classes on Friday while some students went to give preparatory tests in a private school in Greater Noida.

The Assisi Convent School, Sector 33 had reopened on Friday and was working on Friday.

""We have not received any order about closing operations from the DM Office so far. We had opened the school on Friday after the winter vacation that started on December 22. We will close the school in case such an order is received,"" Sister Sheeba, Principal of the school told TOI.

DSM Public school in Noida's Bahlolpur village was also open. Marigold Public School, Sector 27 was also open for all classes on Friday.

An official in the school administration said that they have not received the order so far. ""We had to re-open school for all classes on January 2 but had to shut operations since the DM had ordered school earlier on January 1. We had opened today and will open on Monday. In case, we get the order, we will abide by the same. The DM's order usually comes late,"" the official said.

""The school was closed on Friday owing to the Guru Gobind Singh Jayanti. We will now close classes nursery to VIIIth,"" Hemlata, Principal, Government Government Kanya Inter College, Hoshiarpur told TOI. Most private schools open on 11th or 15th.

When contacted, DM BN Singh said that the administration expects that the schools which get the information should remain closed.

The administration had ordered school closure in November when the air quality index deteriorated to dangerous levels."
"28","788401607","2018-01-05","http://www.newindianexpress.com/states/kerala/2018/jan/05/peace-international-school-dismisses-reports-of-closure-1744911.html","Peace International School dismisses reports of closure  ","The New Indian Express",FALSE,"T'PURAM/KOCHI : Even as there are reports the government is planning to close down the Peace International School in Kochi in the wake of allegations that the institution was teaching students objectionable and communal content, the school authorities on Thursday denied any such move.

The school's PTA president A Sajimon told Express the school had not received any communication in this regard from the government. ""We are not aware of any such order. School is functioning normally and students are attending classes,"" he said.

However, a senior government officer said the Education Department, which conducted an inquiry, found the charges against the institution to be true.""The inquiry found the school was functioning in violation of the Right to Education Rules (RTE) and that it wasn't following any prescribed syllabus. The decision to shut it down was taken after consultation with the Chief Minister's office,"" he said. ""The Director of Public Instruction will be asked to issue formal orders for the school's closure."" Its students will be shifted to other institutions in the region.

Sajimon said a few months ago, when the school was in the news for including Islamic extremist thoughts in its syllabus, steps were taken to retrieve the books. He said 80 per cent of the teachers are non-Muslims and if the school was involved in any Islamic extremism, they would have questioned it. He emphasised the school is presently following a proper curriculum like any other schools in the state.Meanwhile, sources from the District Education Department said they were yet to receive any order from the Chief Minister office stating to close down the school."
"29","788068276","2018-01-04","http://www.sify.com/news/kochis-peace-international-school-in-trouble-after-objectionable-syllabus-cm-orders-closure-news-national-sbesx6abhiaie.html","Kochi's Peace International School in trouble after 'objectionable syllabus', CM orders closure ","Sify",FALSE,"Thiruvanathapuram: Kerala Chief Minister Pinrayai Vijayan has ordered the closure of Peace International School in Ernakulum after reports of objectionable and non-secular contents in the school syllabus.

This comes after the District Collector and Educational Department filed reports on the issue. The Kozhikode -based peace foundation is currently running more than 100 schools under the name 'Peace International.'

It is yet to be known if the directive is applicable to the other schools operated under the foundation. CM Pinarayi has asked the students in the school located in Chakkaraparambu to other schools in the same region.

In a complaint filed, the school has been accused of encouraging Islamic extremist ideologies. The police have filed a complaint against the school principal, administration and management committee members. Kerala Police are also making attempts to bring the school Managing Director MM Akbar, who is currently living abroad.

A case against the Peace Foundation School was registered in October 2016 on charges of promoting enmity between different groups on grounds of religion, race, residence, language etc., and indulging in actions disruptive to maintenance of harmony.

A probe by the Education Department revealed that they were not following the NCERT, CBSE or SCERT textbooks.

The government has decided not to give a NOC or CBSE nod to the school after The Director of Public Instruction and the Education Secretary submitted reports on the findings.

According to intelligence agency sources, Abdul Rashid and Yasmin Ahammed, who are facing NIA probe for alleged links with the Islamic State, are known to have worked in the school.

The school teaches textbook compiled by Burooj Realization, an Islamic education institution based in Navi Mumbai. Three people who have read the book have been arrested. Although it is speculated that they might have connection with Islamic preacher Zakir Naik, the same is yet to be confirmed.

""The words in the textbooks have been so intelligently phrased that one gets an idea about the Islamic orthodoxy they preach only if one reads at least 50 to 60 of their books back-to-back. For instance, one of the textbooks meant for II Standard asks how many students would be ready to submit themselves for Islam,"" The Hindu quotes the Kerala Police as saying.

SEARCH"
