"","ID","date","url","title","source","duplicate","body"
"28","938145547","2018-09-03","http://www.madhayamam.com/en/international/2018/sep/3/phone-ban-school-french-children-forced-hang","Phone ban at school: French children forced to hang up","Madhyamam",FALSE,"Paris: French children who are going back to school today after summer vacation will have to do so without their mobile phones.

The government passed a law banning phone use in all primary and middle schools for the entire day, including during breaks with exceptions in cases of emergency and for disabled children.

Pupils are requested to shut down their mobiles or put them in a locker.

High schools can also voluntarily implement the measure. Education Minister Jean-Michel Blanquer said it aims to help children focus on lessons, better socialize and reduce social media use. The ban is also designed to fight online bullying, and prevent thefts and violence in school.

The law allows teachers to confiscate phones until the end of the day in cases of non-compliance."
"29","937983227","2018-09-03","https://www.business-standard.com/article/pti-stories/phone-ban-at-school-french-children-forced-to-hang-up-118090300364_1.html","Phone ban at school: French children forced to hang up","Business Standard",FALSE,"French children who are going back to school today after summer vacation will have to do so without their mobile phones.

The government passed a law banning phone use in all primary and middle schools for the entire day, including during breaks with exceptions in cases of emergency and for disabled children.

Pupils are requested to shut down their mobiles or put them in a locker.

High schools can also voluntarily implement the measure.

Education Minister Jean-Michel Blanquer said it aims to help children focus on lessons, better socialize and reduce social media use. The ban is also designed to fight online bullying, and prevent thefts and violence in school.

The law allows teachers to confiscate phones until the end of the day in cases of non-compliance."
"30","937938072","2018-09-03","https://timesofindia.indiatimes.com/world/europe/phone-ban-at-school-french-children-forced-to-hang-up/articleshow/65654784.cms","Phone ban at school: French children forced to hang up - Times of India","The Times of India",FALSE,"PARIS: French children who are going back to school Monday after summer vacation will have to do so without their mobile phones.

The government passed a law banning phone use in all primary and middle schools for the entire day, including during breaks -- with exceptions in cases of emergency and for disabled children.

Pupils are requested to shut down their mobiles or put them in a locker.

High schools can also voluntarily implement the measure. Education Minister Jean-Michel Blanquer said it aims to help children focus on lessons, better socialize and reduce social media use. The ban is also designed to fight online bullying, and prevent thefts and violence in school.

The law allows teachers to confiscate phones until the end of the day in cases of non-compliance."
"31","937824810","2018-09-03","https://timesofindia.indiatimes.com/city/chennai/as-fleet-of-school-vehicles-shrinks-more-students-forced-to-take-unsafe-private-rides/articleshow/65649364.cms","As fleet of school vehicles shrinks, more students forced to take unsafe private rides - Times of India","The Times of India",FALSE,"Surge in number of students travelling in unsafe modes of private transport including autorickshaws can be directly

attributed to a significant drop in the number of buses or vans

operated by educational institutions.

The number of newly-registered school and college buses has halved in the past five years and an increasing number of institutions are shying away from adding new vehicles to their existing fleet.

Of late, some schools have reduced the frequency of existing buses and merged routes.

Also, more than 6,400 school buses have been booked for overloading in the past three years.

School managements defended reduction of bus services saying they did not want to take the 'extra risk' and the amount collected as bus fee from parents was not covering the cost of maintaining vehicles.

Schools said it was difficult to meet the criteria set by the special cell -- which comprises transport, education and police departments -- that inspects and renews fitness certificates of buses.

""Parents want school buses to drop their wards at their doorsteps and quarrel with us if we try to merge bus stops or take a longer route due to practical constraints,"" said R Vishalakshi, president of the Tamil Nadu Private Matriculation Schools Association.

""Share autos and cabs pick them up and drop them at a lesser cost. So, parents prefer these modes of transport over school buses,"" she added.

S Arumainathan, state president of Tamil Nadu Students' Parents Welfare Association, said most schools in the city were ""least bothered"" about safe transportation of students and do not keep ""basic details about private auto drivers"" who pick up children outside school premises."
"32","930657593","2018-08-23","https://timesofindia.indiatimes.com/videos/news/struggle-for-education-students-forced-to-walk-8-km-to-reach-school-in-chhattisgarh/videoshow/65520489.cms","Struggle for education: Students forced to walk 8km to reach school in Chhattisgarh | News - Times of India Videos ►","The Times of India",FALSE,"This exposes the shocking state of infrastructure facilities available to the people of Chhattisgarh where students from Balrampur village are forced to walk all the way to their school covering a distance of 8 kilometers for their share of education. Absence of road in the village force students to walk past the forest area in between where there is always fear of attack from the wild animals, claims a girl student. Authorities said that they are planning to build a bridge so that students don't have to walk past the forest area and fins an alternative route to shorten the distance for students."
"33","928972805","2018-08-21","https://timesofindia.indiatimes.com/videos/city/kolkata/shocking-students-physically-assaulted-forced-into-labour-at-a-school-in-west-bengal/videoshow/65485206.cms","Shocking! Students physically assaulted, forced into labour at a school in West Bengal | City - Times of India Videos ►","The Times of India",FALSE,"In a shameful incident, students from a residential private school in West Bengal were allegedly forced into construction work in West Bengal's Bolpur. The minor kids used to be physically assaulted, forced into labour and made to run errands to operate the school. The students were even forced to do construction work. Students were reportedly also made to bathe cows and clean the cowsheds. A complaint against the school administration is yet to be lodged."
"34","927657317","2018-08-18","http://www.newindianexpress.com/nation/2018/aug/19/jabalpur-school-forced-to-apologise-for-not-inviting-students-to-independence-day-flag-hoisting-1859602.html","Jabalpur school forced to apologise for not inviting students to Independence day flag-hoisting","The New Indian Express",FALSE,"JABALPUR: A right-wing organisation allegedly forced a missionary-run school in Jabalpur district of Madhya Pradesh to tender apology for celebrating Independence Day in the absence of school children.

The school, located at Ghana in Khamaria region of the district, celebrated Independence Day a day earlier, on August 14, by organising cultural programs, said Father Maria Stephen, spokesperson of Madhya Pradesh Catholic Church.

On August 15 the principal hoisted the tricolour in the presence of all staff members, but students were not invited as there was possibility of rain and the school ground was slushy, he said.

The next day, activists of Hindu Sena, a local organisation, and some parents reached the school and demanded apology from the principal for not inviting students for the Independence Day function, Stephen alleged.

The school had a valid reason for not inviting students, and it had been celebrating Independence Day and Republic Day with zeal every year, he said.

""We condemn such type of pressure tactics. We missionaries celebrate the national festivals with great zeal,"" he added.

While representatives of Hindu Sena could not be contacted for comment, Khamaria Police Station in-charge inspector J Masram said the organisation's activists and the school management sorted out the issue ""amicably"" and the principal tendered an apology."
"35","923598311","2018-08-12","https://www.mid-day.com/articles/coleen-rooney-gutted-after-being-forced-to-change-klays-school/19694179","Coleen Rooney gutted after being forced to change Klay s school","mid-day",FALSE,"Wayne Rooney takes his wife Coleen and sons sightseeing in Washington

Coleen Rooney and sons Kai, eight, Klay, five, Kit, two, and Cass, six months, followed Wayne to Washington after he signed for American football club DC United last month.

Rooney is reportedly earning a staggering £300,000-a-week (approx Rs 2.6 crore) from the move. While the family is having a great time sightseeing, house hunting and searching for schools for the kids, Coleen said she was 'gutted' to take Klay out of the school he went to in UK.

""My eldest is so outgoing he is fine -- you put him anywhere and he will get on with it. But my five-year-old loves home and being comforted. ""He said, 'What are my friends going to do without me?'. But they are young enough to adapt to it - and there are so many school holidays anyway. I don't think it [the move] will affect us as a family -- as long as you are all together, we can take on anything. When [Wayne] signed, there was no doubt in my mind that we wouldn't go,"" Coleen told mirror.co.uk."
"36","923055210","2018-08-10","http://www.newindianexpress.com/states/karnataka/2018/aug/11/primary-school-kids-forced-to-wash-toilets-bikes-in-gokak-teachers-face-enquiry-1856306.html","Primary school kids forced to wash toilets, bikes in Gokak; teachers face enquiry","The New Indian Express",FALSE,"GOKAK: Instead of encouraging students to pursue learning with a passion, teachers from a government primary school at Badigwad, Gokak taluk, are allegedly making them clean toilets and wash bikes. Videos showing the children doing these tasks have gone viral on social media, and following public outrage, officials from the Education Department rushed to the school to take stock of the situation.

A report has been sent to the Deputy Director of Public Instructions (DDPI) in Chikkodi, who says that action will be taken against those found guilty. According to sources, headteacher of the school, Jaipal Bajantri, has been pulled up for this incident. The school, with 280 students, has classes from first to seventh standard and is known as one of the best in the rural Gokak region.

After the video clips were widely circulated, several netizens expressed shock and anger at the school management's actions and demanded that the government initiate action against them immediately. Furious parents too questioned the school authorities.

Mudalgi BEO Gangadhar said that a report on why the teachers had forced students to wash bikes and toilets was sent to DDPI on Friday, and that action will be taken against those responsible.

Speaking to The New Indian Express, DDPI Gajanand Manikeri said, ""I have received the complaint from Gokak and have asked the block level officer to inquire into the matter and submit a report by Monday. The guilty will face action. I will send notices to all government schools in Chikodi region to avoid such practices in schools."""
"37","921425451","2018-08-08","https://www.indiatimes.com/news/india/welcome-to-haryana-where-students-are-beaten-up-forced-to-repair-road-outside-their-school-350835.html","Welcome To Haryana; Where Students Are Beaten Up & Forced To Repair Road Outside Their School","indiatimes.com",FALSE,"Cruelty against school students is on a rise across the country. From harassment, sexual assault to labour - reports of young students suffering these ordeals are surfacing from everywhere.

In a shocking incident, a group of boys in school uniform were spotted fixing a broken road outside a government school in Haryana's Mahendragarh. The students allege that they are beaten up if they say no the given work.

""We are beaten up if we refuse to do these tasks,"" one of the students told news agency ANI.

At a time when the students should be studying or taking coaching, they were asked to fix roads outside their school. The matter has been escalated to the higher authorities who have promised proper action.

""I have received information about it. Proper action will be taken if the allegations are found to be true,"" Education Officer Rajbala said.

This is not the first such case, earlier this week, former Agra district social welfare office was found guilty of forcing a student at a government-run school to clean toilets, give massages and do menial tasks."
"38","921214081","2018-08-08","https://www.news18.com/news/india/haryana-school-students-forced-to-repair-roads-say-refusal-leads-to-thrashing-1837579.html","Haryana School Students Forced to Repair Roads, Say Refusal Leads to Thrashing","News18",FALSE,"Haryana: A group of school boys were seen repairing a damaged road near a government school in Haryana's Mahendragarh.

In a picture, the boys, all dressed in school uniforms, can be seen fixing a road.

The students said that were forced to do the mending as they are beaten if they refuse to do so.

""We are beaten up if we refuse to do these tasks,"" one of the boys was quoted as saying by news agency ANI.

The issue has been taken to higher authorities who have said that they would be taking strong action. Education Officer Rajbala said, ""I have received information about it. Proper action will be taken if the allegations are found to be true."""
"39","921023955","2018-08-07","http://www.newindianexpress.com/states/karnataka/2018/aug/08/koppal-school-children-forced-to-wash-physical-education-teachers-clothes-1854805.html","Koppal school children 'forced' to wash physical education teacher's clothes","The New Indian Express",FALSE,"KOPPAL: Seems like a physical education teacher in a government school in Koppal has taken his job too seriously. He is training his students in even washing cloths.

The students of Government Higher Primary School at Hosalli village in Gangavati taluk, with a strength of 230, are now made to wash cloths of their physical education teacher Chandrashekhar during Saturdays and Sundays.

""We are forced to go to the house of the teacher to wash his clothes. If we say no, we will be deprived of textbooks,"" said a student.

Headmistress Monamma claimed to be unaware about the incidents. Yet, the school boys were found in the village carrying washed clothes to the house of teacher Chandrashekhar last Sunday. Some villagers recorded students' washing the clothes and the video went viral.

In another incident, students of Government Higher Primary School at Vanagera village in Yelburga taluk of Koppal district were allegedly forced to construct school compound."
"40","917610775","2018-08-02","https://www.ibtimes.co.in/class-11-student-renowned-ajmer-boarding-school-allegedly-forced-take-drugs-sodomised-by-6-776745","Class 11 student of renowned Ajmer boarding school allegedly forced to take drugs, sodomised by 6 seniors","International Business Times, India Edition",FALSE,"In the complaint, in which the school's management committee is a co-complainant, the father of the student said that the class 12 boys barged into his son's room on July 10 and forced him to consume alcohol and take drugs. They then took the boy to the washroom and took turns to sodomise him.

The world may not be such a happy place, but until a few years ago, schools were considered to be safe havens for students. It was a place where they not just learnt their lessons and about life in general, they made friends and enjoyed their time under the watchful eyes of the teachers. However, things aren't the same anymore and schools are fast becoming a place where students sometimes go through very tough and traumatising times.

In a shocking incident, the father of a student of Mayo College, Ajmer, has alleged that his son was sexually assaulted and sodomised by six of his seniors. The class 11 student was reportedly abused multiple times by six class 12 boarders between July 10 and 26.

The family of the boy filed a complaint against the students at the Alwar Gate police station on Tuesday, July 31.

Speaking of the complaint, Priti Chaudhary, deputy superintendent of police, who is investigating the case, told Hindustan Times: ""We have registered a case on the father's complaint under different sections of the Protection of Children from Sexual Offences Act (POSCO) Act against six named students of Mayo College and are investigating. It is very early to say anything on this.""

In the complaint, in which the school's management committee is a co-complainant, the father of the student said that the class 12 boys barged into his son's room on July 10 and forced him to consume alcohol and take drugs. They then took the boy to the washroom and took turns to sodomise him.

""Each time they sexually abused my son, they forced him to take drugs. They threatened him of dire consequences if he reported the incident to anyone,"" he added.

The boy's ordeal continued until July 26, when he finally left the school and told his parents about the abuse. ""He is under great distress and is deeply disturbed. This was his first year in the boarding school,"" the father added.

Even though Mayo College's management committee is a co-complainant, the school has refused to comment on the case. ""The police is investigating the matter, let's wait for the findings; I have nothing more to say at this juncture,"" Mayo college's principal and director Surendra Kulkarni told HT.

Just weeks ago, a class nine student of a private school in Bihar's Saran district alleged that she was raped by about 18 people in her school over the last eight months. The 18 people include the school's principal, two of the teachers and 15 other students.

The girl explained that she remained quiet for all these months fearing social stigma, but approached the police later and filed a complaint alleging that she was raped since December 2017. She explained that three of her schoolmates had raped in the school toilet in December and shot a video of the act. They then warned her against telling anyone and said that they would make the video public.

Even though she did not discuss the incident with anyone, the students circulated the video that even reached the teachers. However, instead of taking action, they too are said to have blackmailed and raped her.

The class nine girl then approached her principal hoping for some action. However, she was asked not to speak of it as it would bring her and the school bad name. If that wasn't enough, the principal of the school too is said to have called her to his office and raped her"
"41","915374102","2018-07-30","https://www.business-standard.com/article/news-ani/c-garh-students-forced-to-skip-school-due-to-heavy-rainfall-118073000085_1.html","C'garh: Students forced to skip school due to heavy rainfall","Business Standard",FALSE,"Raman Singh drinking to bed since Punia's appointment: Congress MLA

Due to heavy rainfall in various parts of Chhattisgarh, students in Koriya district of the state are forced to skip classes due to unavailability of a bridge across the river.

""We can't go to school when it rains heavily, there's no bridge across the river we cross daily,"" a student said.

A teacher in Dulku said that the students on normal days cross the river by foot.

""When it rains heavily, they (students) can't come. At other times they take off their uniforms to cross the river,"" the teacher said.

However, Sub-Divisional Magistrate (SDM) Pradeep Sahu said the administration is unaware of any such need in the region.

""We have not received any information as such on this. We will probe this to find out if there are nullahs and rivers without bridges. Bridges will be constructed wherever they are needed,"" Sahu said."
"43","915366266","2018-07-30","http://www.newindianexpress.com/nation/2018/jul/30/chhattisgarh-students-forced-to-skip-school-due-to-heavy-rainfall-1850598.html","Chhattisgarh: Students forced to skip school due to heavy rainfall","The New Indian Express",FALSE,"KORIYA: Due to heavy rainfall in various parts of Chhattisgarh, students in Koriya district of the state are forced to skip classes due to unavailability of a bridge across the river.

""We can't go to school when it rains heavily, there's no bridge across the river we cross daily,"" a student said.

A teacher in Dulku said that the students on normal days cross the river by foot.

""When it rains heavily, they (students) can't come. At other times they take off their uniforms to cross the river,"" the teacher said.

However, Sub-Divisional Magistrate (SDM) Pradeep Sahu said the administration is unaware of any such need in the region.

""We have not received any information as such on this. We will probe this to find out if there are nullahs and rivers without bridges. Bridges will be constructed wherever they are needed,"" Sahu said."
"44","915351342","2018-07-30","https://www.aninews.in/news/cgarh-students-forced-to-skip-school-due-to-heavy-rainfall201807300823110002/","C'garh: Students forced to skip school due to heavy rainfall","http://aninews.in",FALSE,"Koriya (Chhattisgarh) [India], July 30 (ANI): Due to heavy rainfall in various parts of Chhattisgarh, students in Koriya district of the state are forced to skip classes due to unavailability of a bridge across the river.

""We can't go to school when it rains heavily, there's no bridge across the river we cross daily,"" a student said.

A teacher in Dulku said that the students on normal days cross the river by foot.

""When it rains heavily, they (students) can't come. At other times they take off their uniforms to cross the river,"" the teacher said.

However, Sub-Divisional Magistrate (SDM) Pradeep Sahu said the administration is unaware of any such need in the region.

""We have not received any information as such on this. We will probe this to find out if there are nullahs and rivers without bridges. Bridges will be constructed wherever they are needed,"" Sahu said. (ANI)"
"45","914681474","2018-07-28","https://timesofindia.indiatimes.com/videos/news/chhattisgarh-without-building-government-school-students-forced-to-study-under-tree/videoshow/65177863.cms","Chhattisgarh: Without building, government school students forced to study under tree | News- Times of India Videos ►","The Times of India",FALSE,"In Balrampur's Jagima village of Chhattisgarh, government school students are forced to study under tree. At a time when education has become one of the most important aspects of life, a harrowing case has come to the fore from Chhattisgarh. As per the villagers, a dispute over allotment of land for the school's construction between the government and some villagers has led to this dispute. The school either declares a holiday or conducts classes in nearby Anganwadi during monsoon season or rainfall."
