"","ID","date","url","title","source","duplicate","body"
"60","853221451","2018-04-19","https://timesofindia.indiatimes.com/city/coimbatore/forced-to-take-tc-parents-protest-in-front-of-pvt-school/articleshow/63837578.cms","'Forced to take TC', parents protest in front of pvt school - Times of India","The Times of India",FALSE,"Coimbatore: Parents of students studying at St Joseph's Matriculation Higher Secondary School in Ondipudur staged a protest in front of the school on Thursday alleging that the school had forced students from class VI to class IX, who were not good at studies, get transfer certificates (TC).

About 30 parents, who had gathered in front of the school, said the school management had been pressuring them to shift their children to other schools as their wards were weak in studies. ""The authorities told us that the school would detain our wards for one year or else they said we had to shift our wards to other schools,"" said the parent of a class VIII student. ""Last year, they had given my child a 'warning promotion', meaning if he didn't perform well the next year, they would detain him. This year, they are asking me to move my child to another school,"" he said.

Also, some parents said when they approached the school management for TC, the authorities asked them for a letter stating they had got the TC willingly. ""How can we give such a letter when the school management had forced us into taking TCs,"" said another parent, who had approached the school on Monday to get TC for his child, a class VI student.

On Thursday, when the parents gathered in front of the school, the management held talks with four of them. Another meeting is scheduled for Friday.

Meanwhile, Fr A Maria Joseph, principal of the school, said the school management had not forced any parent to get TC. ""We had just highlighted the positions of students, who were not performing well in academics. In the case where both the parents were working, we asked them to devote more time to their children's studies. If they were not able to do so, we gave them the option of moving their wards to a boarding school, where they stood a chance to perform better,"" he said."
"61","841960644","2018-04-01","https://timesofindia.indiatimes.com/city/ludhiana/forced-to-walk-to-school-teacher-suffers-miscarriage-files-complaint/articleshow/63563316.cms","Forced to walk to school, teacher suffers miscarriage, files complaint - Times of India","The Times of India",FALSE,"LUDHIANA: Forced to walk for kilometres to reach her school due to poor road connectivity, an education volunteer, who worked as a teacher in Jagraon, suffered a miscarriage on Friday, following which she wrote a complaint against local education officials for transfering her to that institution.

On Saturday, Alternative Innovative Education (AIE) volunteer Vaneeta, 32, lodged a complaint with education minister Aruna Chaudhary; secretary education, Punjab, Krishan Kumar; and the ministry of woman and child welfare, demanding action against officials of the district education department.

Earlier, Vaneeta taught in Government Primary School, Mandi. In February, the local education department transferred her to Government Primary Central Girl School which was 3km away from Mandi school. Since she was pregnant for two months, doctors recommended her bed rest.

Thereafter, she approached the block primary education officer (BPEO), central master trainer (CMT), block master trainer (BMT) requesting them to stop her transfer, but to no avail. She also approached the district education officer (elementary) and deputy district education officer (elementary), but got no response.

Vaneeta said, ""I approached all officials, but they did not listen to my pleas."" ""When the officials did not listen, I joined duty. The first day I got an auto-rickshaw to reach the school, but the bumpy ride left me in severe pain. On days, I did not even get even an auto-rickshaw and I had to walk for three kms to reach the school,"" she added.

""I lost my baby all due to the physical and mental stress. All officials of the district education department, whom I had approached, are responsible for my miscarriage,"" said Vaneeta.

The teacher and her husband have also submitted a complaint with the teacher union and Navchetana Bal Bhalai Committee, an organisation of local government teachers. The organisation has further taken up the complaint with the education minister.

Vaneeta's husband Harbhajan Singh, a farmer, said, ""All officials used to keep us waiting for hours at offices. Their behaviour was so inhuman towards my wife. We want action against them.""

Education minister Aruna Chaudhary said, ""The matter has come to my notice and I am personally looking into it."""
"63","840937641","2018-03-30","http://www.newindianexpress.com/states/odisha/2018/mar/30/pupils-forced-to-clean-school-loos-1794624.html","Pupils 'forced' to clean school loos  ","The New Indian Express",FALSE,"JAGATSINGHPUR: At a time when primary education in the State is in dire straits due to lack of adequate infrastructure and teachers, an incident of students being allegedly forced to clean toilets in a school has sparked public outcry in Tirtol block of the district.Parents and guardians on Thursday demanded action against teachers who allegedly engaged students in cleaning toilets at Tulang Project UP school. On Tuesday, students of the school were allegedly forced to clean toilets by teachers.

The incident came to light after a student, Parsuram Khuntia of Class VI, informed his parents that teachers in the school were making him and other students clean the toilets. Parsuram also refused to attend classes over the issue.Students should not be engaged in any work other than studies in schools. Asking the children to clean toilets is unlawful and an act of infringement on child rights, said Ward member Subash Mohanty.

Parsuram's father Khetramohan is a leprosy patient and mother Satyabhama is suffering from cancer. They are unable to take care of the kid. Taking advantage of the situation, the school headmaster and other teachers engaged Parsuram and other poor students to clean toilets and school floor on a daily basis, Mohanty alleged. As many as 64 students are enrolled in Tulang Project UP School. Headmistress Suajata Nayak said, ""As there are no sweeper and peon, we asked the students to clean toilets and school premises. It is routine affair.""

After being informed by their son about his plight in school, Khetramohan and Satyabhama took up the matter with Collector Yamini Sarangi. The Collector directed District Education Officer (DEO) Prativa Manjari Das to conduct an inquiry into the allegations.Das said on the direction of the Collector, Tirtol Block Education Officer has been asked to conduct an inquiry into the allegation. ""If any teacher is found guilty, stern action will be taken,"" she added.

This is not the first case of teachers forcing students to clean school toilets in the district. Earlier in 2014, headmaster and a teacher of Karilo Primary school in Kujang block had engaged Dalit kids to clean toilets. In 2015, students of Olara UP School in Erasama block were found colouring the building and kitchen rooms. Last year, teachers had allegedly made students clean the toilets of Nehru Memorial UP School at Jota village in Salijanga panchayat of Jagatsinghpur block."
"64","832348036","2018-03-18","http://www.firstpost.com/india/kolkata-school-that-forced-students-to-confess-to-lesbianism-exemplifies-how-not-to-treat-queer-children-4391763.html","Kolkata school that forced students to 'confess' to lesbianism exemplifies how not to treat queer children - Firstpost","Firstpost",FALSE,"""No lesbians please, we are Bengali,"" seems to be the message coming from all quarters as a ""lesbian scandal"" engulfs a south Kolkata school.

The basic facts are these: On 8 March, 10 students of the Kamala Girls School said they were forced to sign a ""confession letter"" admitting they were lesbians. The angry parents claimed the girls were arm-twisted into signing the letter. They said that if two persons hold hands or put their arms around each other, it does not mean they are lesbians. The acting headmistress Sikha Sarkar said some students had complained about other students engaging in ""such behaviour"". So she called them in and considering ""the sensitive nature of the issue"", she asked them to admit it in writing and then called in their guardians to discuss the matter, ""so we can bring these girls on the right course"".

Whatever might have been demonstrated in this whole sorry episode, it's certainly not sensitivity. ""Sadly our teachers are being trained to teach different subjects,"" says Paro Anand, award-winning author of books for young adults. ""But they are not taught to handle issues that confront young people.""

Stigmatising sexuality or the suggestion of it is treading into dangerous territory. Representational image from Reuters

First off, why does anyone have to ""confess"", and that too in writing, to being a lesbian? In an official statement, the Indian Psychiatric Society has declared there is ""no evidence to substantiate the belief that homosexuality is a mental illness or a disease."" ""Are students in co-ed schools asked to write a confession about their heterosexuality when they are seen spending time together?"" wonders Malobika, co-founder of Sappho for Equality -- The Activist Forum for Lesbian, Bisexual Woman and Transman Rights, in a report by Indian Express.

And what is the ""right course"" anyway? It's one thing for a school not to promote homosexuality, or even approve of it, it's another thing to extract letters of confession.

The parents are right in saying two girls holding hands does not mean they are lesbians. But even if they are, does it mean the school can make them sign a ""confession""? ""In this kind of public name-and-shame game, what space do we leave for honesty?"" wonders Anand.

The issue is not whether some girls in Kamala Girls School are lesbians or have romantic crushes on each other, or play pranks. The issue is that schools and authorities seem to have no idea about how to deal with the sexuality of young people. ""Adolescent sexuality is a problem for schools and parents,"" says YA author Himanjali Sankar. She points to the Delhi Public School scandal from some years ago where two students recorded a sexual act which someone tried to sell on baazee.com (now acquired by eBay). ""The discourse is particularly skewed when it comes to homosexuality. One doesn't need video recordings. Just the suggestion of homosexuality is condemnation enough,"" she says.

Sankar is the author of Talking of Muskaan, a book which deals with a 15-year-old girl and homosexuality, among other things. Talking of Muskaan, along with Payal Dhar's Slightly Burnt where a teenaged girl grapples with the knowledge that her friend is gay, is one of the few YA books that deals with the subject in an Indian context. Sankar says her previous books about the Superdog Rousseau resulted in many interactions at schools. But when Talking of Muskaan came out, her publisher found that schools were reluctant to invite her. ""Some got back saying they liked the book but are afraid parents will complain if they have a session around it,"" she says.

""Through my work with over 3 lakh young people and their guardians, I have discovered that we as a people are less queasy about violence than about sex and sexualities,"" says Anand. ""So we can watch, read and witness violent acts, but an act of affection, between opposite, or worse, same-sex people, is too 'hot to handle'.""

But not wanting to talk about it can backfire, as the incident at Kamala Girls School shows. The state's education minister Partha Chatterjee says the government does not approve of the fact that the school extracted ""the statement under duress"" and has not handled the matter with maturity. But Chatterjee also tells The Quint he does not approve of inculcating the idea of lesbianism in schools because it ""can influence others"" and that this ""is not the culture of Bengal"".

Adolescent sexuality can be confusing and complicated enough, without dragging the ""culture of Bengal"" into it. Schools obviously have to maintain discipline and they are well within their rights to reprimand, rebuke and even punish students who violate their rules. But stigmatising sexuality or the suggestion of it is treading into dangerous territory.

The students say they were told to write they had put their hands in their friend's blouses and tickled them under their skirts. They were asked why they held hands. Whether minister Chatterjee or the school headmistress likes it or not, teenagers are curious about sex and sexuality. But the very idea of homosexuality lays bare an ""underlying outrage"" says Sankar. An overt exhibition of heterosexual romance could also draw rebukes, but in that case, the more likely outcome is of a student being counseled about how this is not the ""right age"" and that their studies must not suffer. But even a mention of lesbianism brings forward threats of transfer certificates and signed statements.

What is tragic is that in its effort to bring girls on the ""right course"", school authorities miss how vulnerable homosexual children are in a school. A school is a place where fitting in is all-important and a child who seems different from her peers risks bullying, or worse. They are called names, teased, and ostracised. A survey by Mental Health America says LGBT youth are four times more likely to commit suicide and two-and-half times more likely to harm themselves with each instance of verbal or physical harassment. The fact that we do not conduct such studies in India does not mean we do not face these issues.

In Talking of Muskaan, Muskaan is comfortable with her sexuality but some of those around her are not, and she attempts to kill herself. That's fiction. But in real life, by stigmatising even the suggestion of lesbianism, a school sends out a terrible message. Students will often bully a student who seems different, who seems gay. That is sad, but not unusual. It is much more disheartening when the school itself comes across as the bully.

Published Date: Mar 15, 2018 18:26 PM | Updated Date: Mar 15, 2018 22:07 PM

Tags : #Delhi Public School #Kamala Girls School #Kolkata #LGBTQ #Partha Chatterjee #Sikha Sarkar #Slightly Burnt #Talking Of Muskaan"
"65","831346855","2018-03-14","https://www.news18.com/news/india/lesbianism-against-culture-bengal-minister-backs-school-that-forced-girls-to-confess-1688839.html","'Lesbianism Against Culture': Bengal Minister Backs School That Forced Girls to 'Confess'","News18",FALSE,"Kolkata: West Bengal's education minister Partha Chaterjee on Wednesday stirred a controversy by supporting the Kolkata school that had allegedly forced a bunch of Class IX students to sign ""confessional statements"" that they indulged in ""lesbian"" acts within the school's premises.

The minister, claiming that ""lesbianism is against our culture"", said the school was free to take any action it deemed fit. ""We believe we should maintain our culture. If the school found it was indecent, it is free to take action against those students,"" he said.

He further said that he had learnt that the students were lesbians through media reports and has asked his department to investigate this issue. ""We have sought a report form the school,"" he said.

The minister's remarks came despite the Kamala Girls' School rubbishing the allegations that 10 girls were summoned to the office of the headmistress on March 8 and were made to sign such statements in the school's bid to ""discipline students who were up to mischief"". Parents of the girls reportedly stormed into the headmistress's chamber on Monday and confronted her for the act.

Speaking to News18 on Wednesday, the acting headmistress Sikha Sarkar said, ""No such incident happened in our school. There were some disciplinary issues and some miscommunication with parents and it was resolved in a meeting with the students and their parents.""

""I have strong objection to the word 'lesbian' used by a section of the media. While running a school we face several issues related to student's future and discipline. It's our duty to guide them towards right direction. I don't know from where the issue of lesbianism came into the picture,"" she added.

Asked about the so-called 'confession letter' she said: ""We have not asked anyone to write such a letter. I would like to request you, not to sensationalize the matter. I think it was blown out of proportion.""

The acting headmistress, however, admitted that the girls were made to write a statement saying they indulged in ""mischief"", but refused to explain what that word meant.

Parents, however, alleged that the school authorities were using the incident to shift focus from the alleged molestation of a student by a non-teaching staff of the school on February 9. The accused staff, Malay Barua, was later arrested.

Talking to News18, father of one of the students who was allegedly forced to write the so-called ""confessional letter"" said: ""There were three eyewitnesses to the molestation and all four girls involved in the previous incident were among the 10 girls who were forced to sign the statement on March 8. The incident was even videographed by school authorities.""

He asserted that nothing has been sorted out between the school authorities and the parents as claimed by the acting headmistress.

President of West Bengal Board of Secondary Education (WBBSE), Dr. Kalyanmoy Ganguly, refused to comment on the matter on grounds that he was busy with the Board exams.

Dr. Saumitra Mohan, Commissioner of School Education, also denied knowledge about the incident."
"67","825611828","2018-03-05","http://www.newindianexpress.com/states/karnataka/2018/mar/06/govt-school-students-forced-to-use-drains-near-railway-track-as-toilets-1782720.html","Govt school students forced to use drains near railway track as toilets","The New Indian Express",FALSE,"BELAGAVI: Students of Government Urdu School No 5 in Belagavi are having to hold their bladders or run to relieve themselves in a dangerous gutter located about 200 metres away from it, beside a railway track at New Gandhi Nagar in Belagavi. It does not have facilities like toilets, drinking water and even faces dearth of classrooms since a portion of its building collapsed two years ago during rainy season.

If anyone wants to gauge the government's sanitation programme success rate, a visit to Government Urdu School No 5 will give them a good understanding. According to the staff members of the school, when the portion of the school collapsed, only a portion of the toilet was damaged. Students, especially girls, continued to utilise them. It was demolished 15 days ago, they added. The staff said that elder girl students, when they go home for lunch during break time, they utilise their toilets at home and return. They said that most of the students reside close to the school.

But the students of the school had a different story to tell. They have been urinating in an open gutter near a railway track since the building collapsed. Few temporary mobile toilets were brought to the school premises but they were not fitted and so remain unused, they alleged. One of the school staff members, on condition of anonymity, said, ""Our misery cannot be explained in words. Students are forced to relieve themselves in the open. But the situation of older school girls especially during menstruation and even lady teachers is worse.""

This school has a total of 595 students and among them, 399 are girls. After the building collapse incident, it has been facing dearth of classrooms. The madrassa just beside the school provided its community hall premises, which is being utilised as classrooms. The huge open and deep gutter, which is utilised as toilets by students, may prove life threatening to them, if they accidentally fall into it. The school does not have a compound wall, due to which several students jump over the gutter and cross the railway track to reach their homes, which is again dangerous. These issues have been persisting for a long time but they are not being looked into by authorities concerned despite being brought to light several times, alleged parents of a few students. They said that they themselves had met a few authorities and even local public representative."
"69","810293069","2018-02-10","http://www.dnaindia.com/india/report-as-mp-ministers-enjoy-cultural-event-at-tikamgarh-school-students-forced-to-write-exams-on-terrace-amid-blaring-music-2583211","As MP ministers enjoy cultural event at Tikamgarh school, students forced to write exams on terrace amid blaring music","Daily News and Analysis (DNA) India",FALSE,"Students write exams on terrace at Tikamgarh govt school , ANI

For the past few days, students at a government school in Madhya Pradesh's Tikamgarh district are being forced to take their exams on the terrace of their school and amid the din caused by a cultural programme organised by a local BJP MLA.

In the memory of a former MLA Late Sunil Naik, a volleyball tournament and other cultural events are being organised in a government-run higher secondary school in the district that is clashing with the final exams of students of 9th and 11th standard. Between both events, the priority has been given to the former.

To that effect, the students can be found seated on the school's terrace as their classrooms have been occupied due to the events. To add to their discomfort, they also have to face the blaring music of the cultural programmes.

On Thursday,while the students could be seen struggling to write their paper, state's Minister Lalita Yadav, Tikamgarh Collector Abhijeet Agrawal, and the local MLA Anita Naik were busy watching the cultural events.

On asking the District administration whether any action was being taken against this, District education officer, B L Luhariya told ANI that he was unaware of the incident and was yet to receive any complaint."
"70","809914724","2018-02-09","https://timesofindia.indiatimes.com/videos/city/delhi/delhi-students-forced-to-sit-in-open-as-parts-of-school-sealed/videoshow/62853424.cms","Delhi: Students forced to sit in open as parts of school sealed | City- Times of India Videos ►","The Times of India",FALSE,"The ongoing sealing drive has started having un-intended consequences, with students being forced to attend classes out in the open and sit right next to debris in at least one school in northwest Delhi for the past one week. Principal of the school said a north corporation team sealed all the rooms a week ago, leaving them with no space for the hundreds of students. The school authorities claimed that eight children had already fallen ill. The principal also revealed that they have replied to all corporation notices but the classes have been sealed as ""they refused to pay a bribe of Rs 3 lakh""."
"71","809553064","2018-02-09","http://www.dnaindia.com/jaipur/report-protests-forced-govt-to-shelve-ppp-model-in-school-education-2582930","Protests forced govt to shelve PPP model in school education","Daily News and Analysis (DNA) India",FALSE,"Hailing the state government decision to postpone its policy to hand over government schools to private firms on Public Private Partnership (PPP) mode, the government teachers said the loss in bypolls forced the BJP government to withdraw its decision. However, they also pointed out that protests carried out by teachers' association against the decision also played a vital role.

In Rajasthan, at least 300 government schools were set to be handed over to private firms in the first phase by April and May this year.

Devesh Goyal, principal of government girls' senior secondary school, Mandana in Kota, said that the teachers' associations along with the villagers and Bhamashahs across the state had been carrying out protest against the government decision on PPP mode. But the state government kept ignoring it. However, the debacle in the recent bypolls forced the government to withdraw the decision.

The ruling BJP has learnt a few lessons with the defeat in bypolls and now foresees it apparent defeat in the upcoming state assembly elections this year, Jhalawar district president of Rajasthan Shikshak Sangh (Shekhawat) Ghanshyam Singh Shaketwat said.

Rajasthan School Education Lecturer Association's state president Mohan is also of the view that the crushing defeat in three by-elections came as a rude jolt to the ruling party.

Thanks to bypolls, results yielding defeat to the ruling party that the government was now forced to withdraw the decision on PPP mode of government schools, Hemant Sharma, a teacher in government secondary school in Lakheri town of Bundi district said.

At least, 15 government schools from Kota district were enlisted to be handed over on PPP mode and procedure for the same had been initiated with the survey reports having been sent to state government, deputy director, secondary education Ramswroop Meena said, adding the decision on the same has now been postponed.

At least, 15 government schools from Kota district were enlisted to be handed over on PPP mode and procedure for the same had been initiated with the survey reports having been sent to state government.The decision on the same has now been postponed."
