"","ID","date","url","title","source","duplicate","body"
"13","873674631","2018-05-23","http://www.newindianexpress.com/states/tamil-nadu/2018/may/24/railways-school-facing-closure-gets-100-per-cent-result-in-tamil-nadu-1818800.html","Railways school facing closure gets 100 per cent result in Tamil Nadu","The New Indian Express",FALSE,"TIRUCHY: With uncertainty looming over the future of their institution, even maintaining an all-pass record for Class X for 14 consecutive years has not brought cheer to students of the Railway Mixed Higher Secondary School (RMHSS) in Ponmalai.Though Southern Railway (SR) initially decided to stop admissions for the 2018-19 academic year at its schools, criticism from several quarters compelled SR to resume admissions. However, keeping in mind the Bibek Debroy Committee report with its suggestions to stop offline activities like running educational institutions, the future of Railways schools is now unclear.

Significantly, RMHSS is the top performer among the schools under SR jurisdiction. This year 34 students (16 girls and 18 boys) appeared for the Class X examination. Top performers of this school suggested Indian Railways should continue running schools. ""I am very proud of my school and support from theteachers helped me to secure good marks. The Railways must not close this academic institution and should continue running its schools. I am sure our school would again come up with excellent results in the near future,"" said Aathee Akshaya, the RMHSS Class X topper.

Currently, about 300 students are studying at the school and the institution is expecting to start a Central Board of Secondary Education (CBSE) batch this year. ""We are expecting to get CBSE affiliation to start classes I to VIII. This would increase the student strength of the institution, but many parents are worried the Railways would close this school,"" said an employee.

Meanwhile, sources informed Express it would not be possible for SR to close the school. Even if the Railways decides to stop offline activities, it would probably hand over the institution to Kendriya Vidyalaya or Navodaya.

However, many parents are not ready to take the risk with their wards' futures at stake. ""I came to know about the centum result of the school and thought about enrolling my children to this educational institution. I interacted with some parents about a possible closure, then I dropped the plan of admitting my children,"" said S Salim."
"14","842026874","2018-04-01","http://www.newindianexpress.com/thesundaystandard/2018/mar/31/school-closure-doe-panel-yet-to-decide-on-recognition-1795332.html","School closure: DoE panel yet to decide on recognition","The New Indian Express",FALSE,"NEW DELHI: A seven-member committee formed by the Directorate of Education (DoE) to ease the process of recognising private-unaided schools in Delhi hasn't taken any decision on the matter as yet, reveal two RTIs.

The committee was constituted in June 2017 to ""identify the problems and prepare guidelines to simplify the process/procedure for grant of Essentiality Certificate/Scheme of Management /Recognition/ Up-gradation to Private Unaided Schools in Delhi.""

The committee's decision is vital as in February 2018, the Delhi Government had ordered private schools functioning without DoE recognition to discontinue all educational activities from the next academic session beginning from April 1, 2018.

In a response to two RTIs filed separately by Chandrakant Singh and Gaurav Tyagi, General Secretary and Joint Secretary, respectively, Private Land Public Schools Association, inquiring about the committee's decision, the DoE replied with ""no such recommendations were submitted till date.""

The purpose of the committee was also to ""examine the provision of Delhi School Education Act & Rules, 1973, RTE Act 2009 and the suggestions received from school management/societies/trusts running Private Unaided Schools in Delhi.""

""The committee was constituted to simplify the existing procedure, not to amend the Act. The committee is still in existence and examining the provision. Probably in a month or two, it may finalise a decision and announce it,"" said a spokesperson from the DoE.

Singh and Tyagi argue that in the wake of closure threats issued by the Delhi government to unrecognised schools in the city, where lakhs of students are studying, the committee's say in the decision-making process could save thousands of schools from closing before the start of the new academic session.

Chandrakant Singh, had also sent a letter to Delhi Education Minister and Deputy Chief Minister Manish Sisodia requesting him not to close any of the unrecognised schools until a decision was taken by the committee.

The request was then forwarded by Sisodia's office to the DoE, asking Director Saumya Gupta to ""look into the matter for taking appropriate action"". ""No one has the right to put the future of lakhs of students at stake,"" said Singh."
"15","839340788","2018-03-27","http://www.thehindu.com/news/national/kerala/school-closure-govt-told-totake-lenient-stand-in-hc/article23365732.ece","School closure: govt told totake lenient stand in HC","The Hindu",FALSE,"As a petition against the closure of unrecognised schools is expected to be taken up in the Kerala High Court on Wednesday, the Association of Minority Management Institutions, an organisation representing owners of educational institutions run by minority groups, has urged the government to take a stand in their favour.

P.M.A. Salam, Indian Union Muslim League leader, and one of the functionaries of the association, told the media here on Tuesday that around 3,000 schools across the State had been served closure notices by the Education Department. Though the department was claiming that the schools were not providing the facilities as mandated by the Right to Education Act, Mr. Salam alleged that the schools were not given enough time to act on the requirements.

""When the Act came into force in 2013, the United Democratic Front (UDF) government had asked unrecognised schools to either fulfil the obligations or close down. Around 1,000 schools managed to get recognition after officials examined the facilities. This government, however, is arbitrarily asking us to shut down without giving us a chance,"" he alleged.

The schools facing closure included those approved by the Central Board of Secondary Education and functioning for over two decades. Education Minister C. Ravindranath had claimed on the floor of the House that 1,585 schools had been served notice, of which a majority were run by minority groups, Mr. Salam added.

Nisar Olavanna, president of the association, accused Education Department officials of adopting a hostile attitude towards the managements, affecting the future of lakhs of students, teachers and non-teaching staff. Asked about the allegation that the teachers and other staff were being paid a meagre amount as salaries, he said that only a few schools were resorting to such tactics. ""There is a proposal to have a joint fight against the government move by roping in organisations such as the Nair Service Society (NSS), Sree Narayana Dharma Paripalana (SNDP) Yogam, and Christian managements,"" he said."
"16","825863123","2018-03-06","https://timesofindia.indiatimes.com/city/bhubaneswar/ayurveda-school-faces-closure-in-kendrapada/articleshow/63183466.cms","Ayurveda school faces closure in Kendrapada - Times of India","The Times of India",FALSE,"Kendrapada: Every morning, in Kendrapada town, a single student makes his way to a 104-year-old school. He is taught by just one teacher. After school, the student and the teacher shut the gate and walk back home.

In March of 2019, when the last teacher of the Abhaya Ayurvedic school retires, the doors of the seven classrooms will close, once and for all, bringing to an end the lonely march of the town's singular Sanskrit institution.

The Ayurvedic school was established in 1914 by noted Sanskrit scholar and Ayurvedic practitioner Sudarshan Das. In 1956, noting its popularity, the government took over the school management.

""The school's past is glorious. Many of the school's students have become Ayurvedic doctors, Sanskrit scholars, writers and poets,"" said Rabi Narayan Pati, a retired school teacher and an old boy of the school.

Three years ago, the Central human resource development ministry constituted an expert committee in its attempt to revive interest in Sanskrit and age-old Ayurveda practices, but such measures have not seeped into the prospective students of the town, said Pati. ""With the number of students thinning, the school has been struggling for survival for a while now,"" said the alumnus. He is echoed by Ayurvedic practitioner and former student Dr Balabhadra Das. ""It is hard to believe that a school that once bustled with teachers and students is now on the verge of closure,"" said Das.

Basudev Suar the only teacher of the school has - for all his life - been encouraging parents to send their children to this school. ""But nobody is interested to study Sanskrit. Ayurvedic science too is not a field towards which parents wish to push their children,"" said Suar.

Suar's comments come at a time when Ayurvedic science is seeing a renewed interest. ""In Kerala, Ayurvedic remedies attract so many. Yet an institution like this suffers for want of students,"" said Kali Prasan Nayak, a retired teacher. The only student of the school, Diptiranjan Barik, now studies in Class X.

""The school used to provide Sanskrit along with Ayurvedic lessons for students from Class VI to X,"" said Suar.

When contacted, district education officer Dr Udayanath Majhi said the school has long since been accustomed to decline. ""As per the order of the government, a school cannot function with fewer than 25 students. We will soon have to send a proposal to the government to close this institution,"" said Majhi."
"18","813912611","2018-02-16","http://www.newindianexpress.com/states/odisha/2018/feb/16/parents-slam-ppl-over-closure-of-dav-school-1774191.html","Parents slam PPL over closure of DAV school","The New Indian Express",FALSE,"PARADIP: Members of PPL DAV Parents' Committee on Wednesday criticised the authorities of Paradeep Phosphates Ltd (PPL) for making false statement over closure of Odia DAV Public School in its township area.

Committee president Sriballav Kar alleged that the clarification of PPL management that they have no intention to shut down the school is false. He said the allegation by PPL regarding non-submission of road map to enhance the quality of education by DAV is fabricated as the school authorities have already submitted it. Similarly, the DAV school authorities have denied the other charges made by Chief Operating Officer (COO) of PPL Vishwajeet Kumar Sinha on February 5, Kar added.

After the PPL's 30-year agreement with DAV management expired in January, a meeting was convened hurriedly on January 17 where the COO had expressed unwillingness to run the school on PPL premises. Later, the PPL authorities levelled charges against the DAV over the issue. Even on February 7, officials of another private educational institution visited the school premises, he informed.

Kar said on February 10, the authorities of Bhubaneswer-based DAV Public School had conducted a meeting with principal of PPL DAV School SK Das over the matter. During the meeting, it was found that a draft copy of the proposed agreement for renewal was submitted to PPL by DAV in May 2017. The agreement was supposed to be renewed in May 2017, but it could not work out due to some unavoidable circumstances, he added.

Meanwhile, organising secretary of the committee Subrat Mohapatra and parents have threatened to intensify their strike demanding that the issue be resolved by February 16."
"19","806167061","2018-02-03","https://timesofindia.indiatimes.com/city/pune/secrecy-on-school-closure-survey-troubles-activists/articleshow/62773057.cms","Secrecy on school closure survey troubles activists - Times of India","The Times of India",FALSE,"Pune: The education minister as well as the secretary of the department have refused to divulge details regarding the NGO that worked on the survey report, responsible for the decision to close zilla parishad schools where attendance was poor.

The report has also not been made public, triggering concern among retired educationists and activists. In fact, activists are of the opinion that the report should be made public at the soonest so that it is made open to scrutiny.

Mukund Kirdat, an education activist working against the decision to close schools in remote areas, pointed out that any document affecting the education of such a considerable number of children should be made public.

""It looks like there is a vested interest in not sharing the name of the NGO and making the report public. Secondly, there are also rumours that certain corporate entities will be allowed to run these schools a their corporate social responsibility (CSR) activity,"" said Kirdat.

Kirdat further went on to mention that for a government trashing reports of NGOs such as Pratham, taking such a big decision without any review process on its own also seems rather fishy.

""When the report came out, the government should have formed a committee comprising a civil society member or an activist, a retired judge and a government official in order to review the report and take samples to ascertain if the report is, in fact, true or not,"" said Kirdat.

Matin Mujawar, another education activist, explained that the top-down decision will only hurt rural Maharashtra in the long run. ""The problem with this model is that someone sitting in Mumbai has come to a decision whether the schools in these villages should be shut or not, without even knowing what is happening in villages. These decisions should be taken with utmost care and field officers must ensure that they recommend the name of the schools where an alternative is available to the seniors rather than vice versa,"" said Mujawar.

According to a zilla parishad teacher, the entire issue has created a fear among tutors as well as parents whose children attend these schools.

""Once the name of your school is on the list, we don't know what will happen next. Parents continue to ask us and we don't have an answer to their questions. Some schools were being spruced up and the process had to be stopped midway because what is the point of the renovation if the school is being shut down"" the teacher sought to know."
"21","801978178","2018-01-27","https://timesofindia.indiatimes.com/city/pune/school-faces-closure-kids-have-to-trek-for-2-hrs-to-reach-new-one/articleshow/62676976.cms","School faces closure, kids have to trek for 2 hrs to reach new one - Times of India","The Times of India",FALSE,"Pune: In March last year, the Japanese government shut down a train station on the island of Hokkaido after a girl, who had to take a train to school, finally graduated. The entire station had been kept operational for three years, just for one passenger.

Back home in Maharashtra, the remote village of Kalakrai is now faced with the prospect of sending its young children on a two-hour trek through thick woods to another school after its only school was ordered to close.

Only 70 km from Pune, this village of 200 residents is almost cut off from the outside world. The nearest motorable road is two hours away on foot. The isolation is so acute that most women here have given birth at home.

A team from TOI had to carefully make its way through the forest to reach Kalakrai - two hours from Sawale village, where the new school is located. During the rains, numerous waterfalls and streams hide some massive boulders. The path, lined with thick undergrowth, is slippery and dangerous. When the school shuts, the children of Kalakrai will be forced to take this route to the nearest school, every day.

The government's order has been aimed at zilla parishad schools with student strengths of 10 or fewer. Kalakrai doesn't stand a chance.

""Class I has just one student; Class 2 has three; there are only four studying in Class III; and just two in Class IV. There are indeed 10 students, but in total,"" says Suryakant Talpe, one of the two teachers at the school.

Parents, stunned by the closure order, are furious. ""The only government facility we have is that school. How can they shut it? Don't we deserve some semblance of a system here?"" asks Shobhaji Kavale, whose grandson is one of the two children in Class IV.

The tiny one-room school was built 20 years ago. It has no functioning toilet and its roof is near collapse. Inside, however, there is evidence showing the teachers and the kids had tried to make the most of what they were given. Common English and Marathi words have been spelt out on colourful charts.

""Besides the 10 kids we have, there are young children - between the ages of 3 and 6 - turning up to just sit around here and play. Every school in a remote region of the state doubles as a 'Balewadi', or a playschool, if there's no alternative,"" says Talpe.

The villagers are worried about children losing out on early education. ""This school was helping our kids learn to read, write and calculate,"" says Sakaram Kathe. ""If it shuts, they will miss out on primary education. We do have just one student in a class, but that child must be given a chance.""

The alternative is the near-impossible trek through dense forest. ""But the students studying here are just 6 to 10 years old. We cannot send them alone through the hills. What if a child falls into a ravine or gets bitten by a snake?"" asks Chandrakant Kavale, a resident.

Kavale works in Mumbai - over 70 km away. Every Saturday, when he comes home to Kalakrai, he has to walk two hours to reach home. ""And then on Monday, I have walk to the bus stop again. You have to study to escape such circumstances. That's the reason why our school must stay open."""
"22","791551757","2018-01-10","https://www.indiatoday.in/india/story/kerala-government-shuts-down-school-to-prevent-muslims-from-joining-isis-1124018-2018-01-06","Kerala govt orders closure of Kochi school for promoting, teaching communal content","India Today",FALSE,"The Kerala government has issued an order against Peace International School for allegedly propagating communal content. The Chief Minister's Office issued an order to the Director of Public Instructions (DPI) asking the latter to take necessary actions to shut down the institution.

""In order to prevent Muslims from joining IS activities, it is highly necessary to stop the operations of such institutions,"" read the letter.

The school managed by Peace Education Trust had come under the scanner after reports emerged that the school was promoting and teaching communal content.

In 2016, the state police registered a case against the principal and other trustees of the school under Sections 153A and 34 of IPC.

A probe conducted by the Ernakulam district education officer revealed that the school was teaching no secular content.

Top sources in the Chief Minister's Office told India Today that ""we cannot let anyone destroy the secular nature of this country. The school was not following any of the approved syllabi.""

""The school was not affiliated to CBSE, NCERT or state syllabus board. The findings by the district collector were shocking as the school was trying to inject communal divide in young minds. We cannot let this happen in our country,"" said the top official, who wished to remain anonymous.

Even before this allegation, the school was in the eye of storm after two of its employees reportedly joined ISIS.

Abdul Rashid and his wife Merin Mariam were among the 21 people who went missing from Kerala and have reportedly joined ISIS. Abdul Rashid was working as the PRO and Merin was a teacher in the school. After marriage, Merin converted to Islam and embraced the name Mariam.

Based on the letter from the Chief Minister's Office, Directorate of Public Instruction will now issue a closure notice to the school.

However, the representatives of the school management refused make a comment in this issue, citing that they have not got any official confirmation from the state government."
"23","790345573","2018-01-09","http://www.dnaindia.com/mumbai/report-school-closure-report-is-a-rumour-state-2573978","School closure report is a rumour: State","Daily News and Analysis (DNA) India",FALSE,"Officials on Monday scrambled to scotch rumours about closure of schools across the state. The misinformation spread like wildfire after a regional newspaper published a report saying that the government was planning to shut down 80,000 schools. It even quoted the principal secretary of education department.

As panic struck the teachers, Principal Secretary (Education) Nandkumar assured the community that neither the government had taken any such decision nor had he given a statement to that effect.

In its report, the regional newspaper said that the government planned to bring down state-run schools from 1,10,000 to 30,000 in 15 years.

Anil Bornare, Mumbai president of Shikshak Parishad, an umbrella body of teachers, said they wrote to Education Minister Vinod Tawde seeking a clarification. ""The minister replied in the afternoon saying it was fake news and asked us not to believe in rumours.""

Assuring that no schools were closing down, Nandkumar said, ""The state has 1,30,000 schools and if there are 1,000 children in each school then 30,000 schools will be sufficient was my statement. Nowhere I have mentioned or spoken that government has planned to shut 80,000 schools or has made a policy decision. The newspaper is not able to prove what they have printed today."""
"24","789734799","2018-01-08","http://www.hindustantimes.com/india-news/kerala-govt-orders-closure-of-school-for-communal-curriculum/story-Pwla0zex6GmukKn7QDIbBN.html","Kerala govt orders closure of school for communal curriculum","Hindustan Times",FALSE,"The Kerala government on Thursday ordered the closure of a chain of schools for its alleged radical curriculum aimed at disrupting communal harmony.

Peace International School that runs a chain of schools in the southern state faced a police probe after it was found that at least three of its staff were among the 21 people who left their homes in 2016 to allegedly join Islamic State.

""We were really shocked to see some of the content. They propagated extremist ideology and carried details of so-called atrocities against Islam,"" said a member of the panel that examined the school curriculum. The member didn't wish to be identified as he was not authorised to speak to media.

The school management criticised the government's decision, based on reports filed by the education department and Ernakulam district collector, as ""a vilification campaign aimed at tarnishing a well-managed minority educational group"".

The group has 10 schools in Kerala and one each in neighbouring Tamil Nadu and Karnataka.

Initially the school in Ernakulam will be shut down. Other branches would be closed after accommodating students in other schools, government sources said.

The probe panels found that though the schools were affiliated to the Central Board of Secondary Education (CBSE), they taught books compiled by Burooj Realization, a Mumbai-based Islamic educational institute.

CBSE schools typically use books published by the State Council of Educational Research and Training or the National Council of Educational Research and Training.

Some of the content was radical and promoted enmity on the basis of religion and race, the probe found.

Police had raided the Ernakulam branch in 2016 after they go to know that a teacher at the school, Merin Jacob alias Mariyam, was among the missing 21 and a case was registered against the group for promoting enmity on the basis of religion.

Five of the missing people were converts to Islam.

Similarly, Yasin Ahmed, who was arrested from Delhi airport allegedly on way to Turkey to join Islamic State, taught English at the Malappuram branch.

The alleged leader of the missing group, Abdul Rashid, was a public relations officer with the school chain.

The school chain was founded in 2006 by MM Akbar, a Muslim preacher, often referred to as Kerala's Zakir Naik, the Mumbai-based evangelist who is on the run now.

Akbar, who lives in Qatar, has not responded to police notice."
