"","ID","date","url","title","source","duplicate","body"
"155","951776626","2018-09-21","http://www.newindianexpress.com/nation/2018/sep/21/bengal-school-firing-toll-reaches-2-state-education-minister-suspects-rss-hand-1875333.html","Bengal school firing toll reaches 2; state education minister suspects RSS hand","The New Indian Express",FALSE,"KOLKATA: A day after two former students of Darivit High School in Uttar Dinajpur district of West Bengal were shot dead in alleged police firing during a protest against appointment of Urdu teachers, state education minister Partha Chatterjee claimed that Rashtriya Swayamsevak Sangh (RSS) cadres were brought from 'outside' to foment trouble and politicise the deaths. ""RSS cadres were brought from outside to foment trouble in the school and politicise the unfortunate deaths,"" he said.

However, state BJP president Dilip Ghosh denied RSS involvement and demanded CBI inquiry into the incident.

Rajesh Sarkar died after being shot at allegedly by police on Thursday while another former student Tapas Barman succumbed to his injuries at North Bengal Medical College and Hospital in Siliguri on Friday. The school witnessed pitched battles between students and police on Thursday after students protested appointment of Urdu teachers and demanded Science, Computer and Bangla teachers instead.

However, Uttar Dinajpur superintendent of police Sumit Kumar said: ""Seven people have been arrested in connection with the incident of which some are BJP supporters. We have not yet received the post-mortem reports to know the cause of death. There was a violent mob at the school which had illegal firearms and bombs so we don't yet know whose guns killed the two people. Police had not opened fire on the protesters.""

On the other hand, education minister Partha Chatterjee removed district inspector of education Rabindra Kumar Mondal from his post on Friday after the incident and said the education ministry was in the dark over the appointment of Urdu teachers.

""A DI has no rights to appoint teachers on their own. Education ministry was kept in the dark. We had no information about the appointment. We are also scrutinising the role of the school principal who did not seek any permission for appointing new teachers,"" he said.

Despite the police washing off its hand from the incident, victims' relatives claimed that cops with masked faces had shot the two students with silencer-fitted guns.""My son was supervising construction work at our shop outside our residence when he was shot by a policeman who was wearing blue uniform and had his face covered with a black cloth,"" deceased Tapas Barman's mother said.

On the other hand, deceased Rajesh Sarkar's niece Bhiti Sarkar said that police used silencer-fitted guns 'to silence' his uncle. ""Policemen tore off clothes of girl students and verbally abused them. When my uncle protested against it, they shot at him with a silencer gun,"" she said. Another witness Tumpa Biswas said police had shot at Rajesh from a police vehicle."
"156","951633509","2018-09-21","http://www.freepressjournal.in/headlines/surgical-strike-day-is-bjp-agenda-wont-celebrate-in-bengal-education-minister/1360345","'Surgical Strike Day' is BJP agenda, won't celebrate in Bengal: Education Minister | Free Press Journal","Free Press Journal",FALSE,"Kolkata: The UGC direction to universities to mark September 29 as ""Surgical Strike Day"" is a part of the BJP's ""political agenda"" and educational institutes in West Bengal will not observe the day, state Education Minister Partha Chatterjee said Friday. Chatterjee criticised the BJP-led central government for trying to ""malign and politicise"" the Army. The BJP said the TMC government has made it a practice to oppose each and every decision of the central government.

On September 29 in 2016, the Indian Army carried out 'surgical strikes' on seven terrorist launchpads across the LoC as a response to an attack on its base in Uri earlier that month. The Indian Army had said its special forces inflicted ""significant casualties"" on terrorists waiting there to cross onto the Indian territory.

""This is an agenda of the BJP and it is trying to push this agenda by using the UGC ahead of elections. It is a matter of shame that they are using the UGC to achieve their political agenda. We won't abide by the directions of UGC,"" Chatterjee said.

The University Grants Commission yesterday directed varsities and higher education institutions across the country to observe September 29 as ""Surgical Strike Day"".

Talk sessions by ex-servicemen about sacrifices by the armed forces, special parades by NCC and visit to exhibitions are among the prescribed events by the University Grants Commission for the celebration.

Chatterjee said, ""We would have understood it had they asked us to observe the day in the name of sacrifices made by our soldiers. We have full respect for our soldiers and their sacrifices.""

""The Indian Army has always been kept above politics and controversies. But now we are seeing that the BJP is trying to malign and politicise the Indian Army. This is not right and we won't support it,"" he said.

Reacting to the allegations, BJP state president Dilip Ghosh said the TMC government has made it a practice to oppose each and every decision of the Centre.

""Earlier also, we had seen Bengal government opposing directions by the UGC. This is not new,"" he said."
"157","951546096","2018-09-21","https://swarajyamag.com/insta/constitution-is-subservient-to-the-quran-west-bengals-mass-education-minister-seems-to-think-so","Constitution Is Subservient To The Quran? West Bengal's Mass Education Minister Seems To Think So","swarajyamag.com",FALSE,"West Bengal Minister Siddiqullah Chowdhury with Chief Minster Mamata Banerjee (Twitter)

Mamta Banerjee government's minister of state for mass education, Siddiqullah Chowdhury said that the Quran would prevail over the constitution, a day after the Triple Talaq Ordinance was passed by the government, Indian Express has reported. Many Muslim organisations are planning to protest against the ordinance. Siddiqullah Chowdhury is also the president of Jamiat-e-Islami Hind.

""For us, our holy scripture, the Quran Sharif, is supreme and if any constitutional provision or any law contradicts the Quran, then our scripture will prevail and not the law or Constitution... BJP is playing the religion card and is playing with Constitution. The ordinance will have no effect on Muslims. No one will adhere to it, but will follow the religion and the holy book,"" Chowdhury said.

The minister has also called the Supreme Court verdict outlawing triple talaq as unconstitutional. Further, he added that whatever tricks Bharatiya Janata Party (BJP) may play, they will not be able to influence Hindus or Muslims. He predicted that both communities would throw out BJP of power."
"158","950570745","2018-09-20","http://www.newindianexpress.com/cities/bengaluru/2018/sep/20/pressure-lobbying-going-on-for-the-syndicate-posts-karnataka-higher-education-minister-gt-devegowd-1874647.html","Pressure, lobbying going on for the syndicate posts: Karnataka Higher Education minister GT Devegowda","The New Indian Express",FALSE,"BENGALURU: It's been two months since the state Department of Higher Education withdrew the government nominees from all state-run university syndicates, but the fresh nominations are yet to take place.

The department of Higher Education has received over 3,000 applications for the post of syndicate member and Higher Education minister GT Devegowda has said, no person will be nominated if he/she is ineligible. ""There is pressure and lobby going on for the post. But, I have made it clear that no political appointment will be made. I don't bother which party the person is affiliated to, but he/she should fit the criteria,"" said GT Devegowda.

As the government has withdrawn the nominations made by the previous government, some of the universities are struggling to conduct syndicate meetings as there is no quorum. Reacting to it, G T Devegowda said, all these appointments will be made by October 15.

To appoint pure academicians for these posts, the department of Higher Education is revising the guidelines for appointments. ""Though the Karnataka State Universities Act (2000) says, any expert from the field of education can be appointed as a syndicate member, there were many people appointed with just graduation as their qualification. From this year onwards, one should be a professor, a research scholar or a PhD holder to get appointed,"" mentioned minister.

These new set of guidelines for nomination/appointment of syndicate members have been submitted to CM H D Kumaraswamy.The minister even said that he had received recommendation letters from several politicians across all the parties to appoint syndicate members. ""I will personally sit with my department officials and shortlist the names. I don't bother if the candidates are affiliated to any political party, all I will look for, is their academic qualification and expertise in the field of education,"" he said."
"159","950552620","2018-09-20","http://www.newindianexpress.com/cities/thiruvananthapuram/2018/sep/20/kerala-general-education-minister-c-raveendranath-calls-for-academic-administrative-screening-in-sc-1874466.html","Kerala General Education Minister C Raveendranath calls for academic, administrative screening in schools","The New Indian Express",FALSE,"TIRUVANANTHAPURAM: The action plan of the academic master plan should be prepared in all schools in the state before November 30, General Education Minister C Raveendranath has said. He was addressing the Deputy Director of Education (DDE) officers in all the 14 districts in the state in a one-day review and planning meeting on Public Education Rejuvenation Mission at Central School in Attakulangara on Wednesday.

""Various educational officers should coordinate to help the schools for preparing the action plan. DDEs should ensure that the master plans will bear fruit. The priority of the action plan should be to ensure the completion of 200 working days in the academic year as several school days were lost due to rain and flood,"" Raveendranath said.

He also listed out three priorities that need to be done as part of a quality improvement programme. The minister emphasized the need for academic and administrative monitoring in all schools at district level once in a month to ensure the smooth functioning of academic and administrative proceedings.

A five-member administrative committee has been constituted for overseeing the monitoring programme. The committee comprises a DDE, SSA officer, a teacher of District Institute of Education and Training (DIET), an expert of IT@school, district coordinators of rejuvenation programme.

""In the academic monitoring process, the DDEs should instruct school authorities to take special care of those students who are poor at studies. Proper planning is needed before the periodical monitoring at schools. We can't compromise on academic excellence. So the DDEs are also responsible for the academic performance of students. They should ensure that every student passes examinations,"" Raveendranath added.

He also stressed the importance of administrative monitoring process in which the officers should ensure that the construction of 141 international-level schools is completed before June 1, 2019. The minister said all the school buildings, being constructed at a cost of Rs 5 crore and 3 crore, should be functional on the next Praveshanolsavam day. The DDEs should also be responsible to monitor the functioning of Samagra portal in all the schools.

The DDEs should also ensure that the distribution of volume-II textbooks to all the students is completed by the end of this month, said Raveendranath ""With the government cancelling the first quarterly examination, the question papers which were printed earlier should be discussed in classes. The DDEs should monitor that the schools are complying with this"", he said. On an end note, Raveendranath said the proper monitoring of biodiversity maintenance in all school campuses is also needed."
"160","948889176","2018-09-18","http://www.newindianexpress.com/states/odisha/2018/sep/18/stones-pelted-at-odisha-school-and-mass-education-minister-badri-narayan-patras-vehicle-1873533.html","Stones pelted at Odisha School and Mass Education Minister Badri Narayan Patra's vehicle","The New Indian Express",FALSE,"KEONJHAR : Unidentified miscreants pelted stones at the vehicle of School and Mass Education Minister Badri Narayan Patra at Belabahali under Anandpur block here on Monday evening. However, the Minister escaped unhurt.

Patra, who is also the MLA of Ghasipura Assembly seat, was on his way to participate in a Ganesh idol immersion ceremony when the miscreants pelted stones at his SUV. While the Minister escaped unhurt, the rear windshield of his vehicle was damaged in the stone pelting.Following the incident, tension flared up in the area. Meanwhile, police have started investigation into the incident and launched a manhunt to nab the miscreants."
"161","948063285","2018-09-16","http://www.newindianexpress.com/states/tamil-nadu/2018/sep/17/private-schools-may-neglect-class-11-syllabus-again-school-education-minister-ka-sengottaiyan-1872945.html","Private schools may neglect Class 11 syllabus again: School Education minister KA Sengottaiyan","The New Indian Express",FALSE,"CHENNAI: Private schools may once again stop giving importance to Class 11 syllabus as the government has withdrawn its proposal to give a consolidated higher secondary mark sheet, say some teachers' associations.

On Saturday, School Education minister KA Sengottaiyan, announced that separate mark sheets each for 600 marks will be issued for Classes 11 and 12. He also said Class 12 mark sheet alone will be enough for higher education. ""We received complaints that students get too stressed and are unable to deal with the pressure. In order to ease the pressure on students, we decided that only Class 12 marks will be sufficient for higher education,"" the minister told reporters on Saturday.

The government last year, introduced board exams for Class 11 and a consolidated mark sheet, to ensure that schools do not give unequal importance to Class 12. The composite mark sheets of both years put together was brought in, as students performed poorly in first year of college, which is based on Class 11 syllabus.

""In government schools, we always give equal importance to both Class 11 and 12. But, private schools rush through the first year, give importance to Class 12 exams and score better and make it to the better colleges,"" said KPO Suresh, president of Tamil Nadu Post Graduate Teachers' Association, adding that this may even lead to students migrating to private schools.

""Students who go to private schools have better exposure and can get privately coached for competitive exams. School is the only exposure for government school students. When Class 11 public exam's importance is reduced, students will not have incentive to study well,"" he said.

However, teachers from private schools welcomed the decision. ""Simply knowing that their higher education will depend on only 600 marks and not 1,200 marks will reduce a lot of stress on them,"" said A Mayavan, a history teacher."
"162","947921443","2018-09-16","http://pragativadi.com/stones-pelted-at-mass-education-ministers-vehicle/","Stones pelted at mass education minister's vehicle - PRAGATIVADI:LEADING ODIA DAILY","pragativadi.com",FALSE,"Bhubaneswar: Tension erupted at Belabahali village under Anandapur block of Keonjhar district on Sunday after unidentified miscreants pelted stones at the car of school and mass education minister Badri Narayan Patra.

The incident took place during immersion of the idol of Lord Ganesh today. While the rear window glass of Patra's car was damaged in the stone attack, the minister did not suffer any injury, sources said.

Following the incident, tension erupted in the area. While the reason behind the stone pelting and persons involved were not ascertained immediately, the police launched a probe into the matter.

Related Items:anandapur, Badri Narayan Patra, Keonjhar, School and Mass Education Minister, stone pelted Recommended for you Two hurt in separate incidents of bear attack Cops foil gang war, nab nine criminals in Keonjhar Teachers to continue stir; threaten to resign en mass"
"163","941755472","2018-09-07","http://www.newindianexpress.com/states/karnataka/2018/sep/08/higher-education-minister-gt-devegowda-skips-meet-with-hrd-minister-raises-eyebrows-1869126.html","Higher Education Minister GT Devegowda skips meet with HRD minister, raises eyebrows","The New Indian Express",FALSE,"BENGALURU: Higher Education Minister G T Devegowda skipped an important meeting with Union HRD Minister Prakash Javadekar on Friday afternoon as the language of conversation would be English, and he finds it difficult to converse in that the language, according to a senior official working closely with the minister.

At 2 pm on Friday, the HRD Ministry had organised a meeting of Javdekar with higher education ministers of 10 states, including Karnataka, through video conferencing. The meeting was to discuss the celebrations planned for the 150th birth anniversary of Mahathma Gandhi on October 2. The same was scheduled in the state higher education minister's daily engagements, and room number 118 at Vikasa Souda was booked for this.But the minister decided not to take part in the meeting.

""The minister had agreed to take part in the video conference meeting and everything was ready ... but at the last minute he decided to skip it just because he was wrongly advised by some people around him,"" he said.

Senior officials of the Higher Education Department were supposed to accompany the minister for the video conference, but they did not even bother to take it forward in the absence of the minister as far as efforts to translate it for the minister was concerned. And when the minister decided to skip it, the officials did not even bother to communicate the same to the HRD Ministry.

This is not the first time that Devegowda is doing this. He had expressed the same when a foreign university delegation came to meet him just after he had taken charge of the department. It was one of the reasons for him initially refusing to take charge of the portfolio when it was allocated to him.Moreover, when the higher education portfolio was allocated to him, he was trolled on social media for not completing his high school education.

S G Siddaramaiah, chairperson, Kannada Development Authority, said, ""He should be confident and communicate in Kannada. If the Union minister wants to understand, let him get it translated.""

Meanwhile, several calls and SMS messages to Devegowda went unanswered while trying to seek his comments."
"164","940553720","2018-09-06","https://starofmysore.com/higher-education-minister-to-meet-striking-music-varsity-students/","Higher Education Minister to meet striking Music Varsity students - Star of Mysore","starofmysore.com",FALSE,"MLA Ramdas visits campus; assures students of all help

Mysuru: The students of the Karnataka State Dr. Gangubai Hangal Music and Performing Arts University scaled down their protest on day three this morning, after a meeting with JD(S) District Youth President Girish Gowda, representative of Higher Education Minister G.T. Devegowda and the Registrar Prof. Nagesh Bettakote.

The students, on the assurance that GTD will personally come on Sept.10 to the campus to listen to their problems and try to solve them, decided to withdraw the protest. However, they said that they would continue to agitate inside the Varsity with songs and playing instruments till their demands are met.

Meanwhile, on the second day yesterday they wore black bands and were shouting slogans against the University authorities at the premises on JLB Road in Lakshmipuram. On hearing about the protest, MLA S.A. Ramdas visited the spot and heard about the students' problems.

Later, he met the in-charge Vice-Chancellor Prof. R. Rajesh, Registrar Prof. Nagesh Bettakote and Engineer Ramamurthy and discussed the issues with them.

He asked them to first take steps to provide five classrooms. He directed the engineer to immediately call for tender. Asking the authorities to provide the toilet facilities to women at the earliest, he said that if it was not possible for them, he would help in building the toilets.

Ramdas assured that he would talk to the Corporation authorities and arrange for drinking water facilities. As it is a Music University, lot of cultural programmes are held regularly. Hence, the students need a proper stage and auditorium to rehearse.

There are also requirements for projectors and audio studio, besides other demands and he promised to fulfil all of them.

Since the Music University comes under his K.R. Constituency, he said that he would concentrate on all development works that is required for the Music University.

Stir to continue till GTD intervenes"
"165","939668046","2018-09-05","https://www.financialexpress.com/india-news/mp-education-ministers-message-on-teachers-day-clap-for-your-master-or-youll-end-up-clapping-outside-houses/1303612/","MP Education Minister's message on Teachers' Day: 'Clap for your master or you'll end up clapping outside houses'","The Financial Express",FALSE,"Vijay Shah had a special message for students on Teacher's Day - ""Agar Guru ke samman mein apne taaliyan nahi bajayi to agle janam mein ghar ghar ja kar taaliyan bajani padengi.""

Madhya Pradesh Education Minister Vijay Shah had a special message for students on Teacher's Day - ""Agar Guru ke samman mein apne taaliyan nahi bajayi to agle janam mein ghar ghar ja kar taaliyan bajani padengi."" (If you don't clap in your teacher's honour, you will end up clapping outside every household in your next birth)

The minister's comments, which sound derogatory to the community, gained huge applause from the crowd, he then said, ""Iska matlab hai koi agle janam mein ghar-ghar jaakar taliyan nahi bajana chahta."" (It seems that no one wants to clap in next birth)

Traditionally, clapping at people's doorstep is a practice exercised by transgenders in India in order to seek donations for their livelihood. Also, the transgender community is looked down upon by the people.

Shah is not new to controversies. In 2013, he had to resign from his post of state's tribal minister after allegedly making derogatory remarks against BJP leader Nirmala Bhuria and the Chief Minister's wife Sadhna Singh. Shah made the alleged remarks while attending a summer camp in Jhabhua district.

In 2010, Shah had also faced criticism for organising belly dance show near a holy shrine in Malgaon. He was also accused of organising a grand birthday celebration on government expense."
"166","939621204","2018-09-05","https://www.ibtimes.co.in/mp-education-minister-sets-wrong-example-teachers-day-ridicules-transgenders-779706","MP Education Minister sets wrong example on Teacher's Day; ridicules transgenders","International Business Times, India Edition",FALSE,"The minister said that youngsters should clap in the honour of their teacher, else they will have to go and clap in front of every home in their next birth.

It seems like the leaders of Bhartiya Janata Party are involved in a weird kind of competition as to who can speak the most nonsensical stuff that's possible. After BJP MLA from Mumbai Ram Kadam told youngsters during a Dahi Handi event on Janamashtmi that he will abduct girls for them if they did not respond to their advances, the next BJP member to join the bandwagon is Madhya Pradesh's Education Minister Kunwar Vijay Shah.

Addressing a gathering on the ocassion of Teacher's Day, Shah ridiculed transgenders of the nation. Speaking to youngsters, the education minister said that if they won't clap in the honour of their teacher, they will have to go and clap in front of every home in their next birth.

""Agar Guru ke samman mein apne taaliyan nahi bajayi to agle janam mein ghar ghar ja kar taaliyan bajani padengi"", Shah said. Such an insensitive comment coming from an education minister calls for some introspection for the Shivraj Singh Chouhan-led BJP government in the central Indian state. The surprising part about his comment was that after he had made the derogatory statement about transgenders, he even laughed.

This is not the first instance when a BJP leader has made an insensitive or unscientific remark in a public gathering. Recently Tripura Chief Minister Biplab Kumar Dev had said that ducks raise the oxygen level in water bodies when they swim.

More recently, Uttar Pradesh Chief Minister Yogi Adityanath was criticised for advising people in Mathura to read the Hanuman Chalisa to get rid of the notorious monkeys in the city. Speaking on the Ram Mandir issue, Adityanath had said that the date of construction of the Ram Mandir in Ayodhya will be decided by Lord Ram himself.

Prime Minister Narendra Modi's remarks about a tea stall owner making tea from gutter gas had also left social media in splits. We wonder who is going to be next in line to make insensitive, regressive and unscientific statements unabashedly."
