"","ID","date","url","title","source","duplicate","body"
"80","922143592","2018-08-09","http://www.newindianexpress.com/nation/2018/aug/09/education-minister-krishnandan-varma-gets-social-welfare-charge-after-manju-vermas-resignation-1855552.html","Education minister Krishnandan Varma gets social welfare charge after Manju Verma's resignation","The New Indian Express",FALSE,"PATNA: Bihar Education Minister Krishnanandan Prasad Verma was given the additional charge of the Social Welfare Department after its minister Manju Verma resigned in connection with the Muzaffarpur shelter home sex scandal case.

A notification to this effect was issued by the Cabinet Secretariat Department. Though the notification had yesterday's date, it was put on the official website today.

Manju Verma had stepped down yesterday following allegations of links between her husband and Brajesh Thakur, who was the key accused in the case of sexual abuse of young girls at the state-funded shelter.

The call details of Thakur's phone revealed that he had talked to her husband 17 times from January to June this year.

Speaking to media from a prison van in the court compound at Muzaffarpur yesterday, Thakur said he used to speak to the minister's husband, Chandeshwar Verma, but it was ""on political issues"".

The official website of the Bihar Social Welfare Department promptly replaced the name and photograph of Manju Verma with that of Krishnandan Verma.

Political observers see the allocation of the Social Welfare Ministry to Krishnandan Verma as part of efforts to placate the Kushwaha caste to which both Manju Verma and Krishnandan Verma belong.

In the midst of intense demand for her resignation after name of her husband cropped up in the case, Manju Verma had alleged that she was targeted as she belonged to the backward Kushwaha community.

Kushwaha caste was the second largest block after the Yadavs among the politically dominant OBC in Bihar.

Chief Minister Nitish Kumar from the beginning had carved out a strong support base in his own OBC Kurmi caste and the Kushwaha caste, popularly called as ""Luv and Kush""."
"81","922113728","2018-08-09","https://www.business-standard.com/article/pti-stories/education-minister-krishnandan-varma-gets-social-welfare-charge-after-manju-verma-s-resignation-118080901149_1.html","Education minister Krishnandan Varma gets social welfare charge after Manju Verma's resignation","Business Standard",FALSE,"A notification to this effect was issued by the Cabinet Secretariat Department. Though the notification had yesterday's date, it was put on the official website today.

Manju Verma had stepped down yesterday following allegations of links between her husband and Brajesh Thakur, who was the key accused in the case of sexual abuse of young girls at the state-funded shelter.

The call details of Thakur's phone revealed that he had talked to her husband 17 times from January to June this year.

Speaking to media from a prison van in the court compound at Muzaffarpur yesterday, Thakur said he used to speak to the minister's husband, Chandeshwar Verma, but it was ""on political issues"".

In the midst of intense demand for her resignation after name of her husband cropped up in the case, Manju Verma had alleged that she was targeted as she belonged to the backward Kushwaha community.

Kushwaha caste was the second largest block after the Yadavs among the politically dominant OBC in Bihar.

Chief Minister Nitish Kumar from the beginning had carved out a strong support base in his own OBC Kurmi caste and the Kushwaha caste, popularly called as ""Luv and Kush""."
"83","919935974","2018-08-06","https://timesofindia.indiatimes.com/home/education/news/up-govt-wants-to-bring-madrassas-in-mainstream-education-minister/articleshow/65291507.cms","UP govt wants to bring madrassas in mainstream education: Minister - Times of India","The Times of India",FALSE,"MUMBAI: The Uttar Pradesh government wants to bring madrassas into the mainstream education system, Minister of State for Minority Affairs Mohsin Raza said on Monday.

The Uttar Pradesh minister also favoured introducing a ""new dress code"" for students at madrassas (Islamic schools) across the country and added that he will take up the issue with the Centre.

However, Raza did not elaborate on what should be the new dress code in these institutes, where students currently wear white kurta-pyjama.

He rued that no leader from his community has till date thought about standardising the madrassa system.

""Our government in Uttar Pradesh wants to bring madrassas in the mainstream education system. And why only in UP, I think all these religious institutions across the country should be brought into mainstream,"" he told PTI.

Raza said he intends to discuss the issue with Prime Minister Narendra Modi.

""I would meet Modiji in this regard and seek his advise on how we can have a formal education system in madrassas in the country. Regrettably, so far, no Muslim leader has ever thought about standardisation and formalisation of the madrassa education system,"" he said.

Last month, Raza had said that the Uttar Pradesh government might ""soon propose a new dress code"" for madrassa students.

However, Cabinet Minister for Minority Welfare, Muslim Waqf and Haj Laxmi Narayan Chaudhary had contradicted Raza, saying that ""the government has not formed any new policy"" in this regard.

Raza was in the city to take part in the 'Kajari' festival organised by an NGO run by Mumbai BJP leader Amarjeet Mishra.

The minister said the Yogi Adityanath government is sincerely implementing the vision of 'sabka saath sabka vikas' (support of all, development of all) and has made ""never before provisions"" to uplift minorities in the country's most populous state.

""Around Rs 4,000 crore was allocated for minority welfare in this year's budget. This kind of allocation has not been done before. Besides, we have restarted disbursing education loans to minority students, a practice shunned by previous governments.

""We plan to modernise madrassas and have introduced the NCERT curriculum for them. We want to see a computer in one hand and the Koran in the other hand of madrassa students as envisioned by our prime minister,"" he said.

Raza, a member of the Legislative Council, said under Modi's leadership, the country has embarked on the path of progress.

To a query, he sought to downplay talks about a likely alliance between the Samajwadi Party and the Bahujan Samaj Party in Uttar Pradesh for the next Lok Sabha polls.

Such an alliance will have no impact on the BJP's electoral prospects, the minister said.

""All opposition parties are zero. But as you know addition of only zeroes will never add up to a countable number. Modiji's model of governance was discussed even in Pakistan. This proved Modiji is a world leader,"" Raza said.

He rejected the opposition's claim of saffronisation of institutions in the state under the BJP rule.

""Even the Sun begins the day with saffron colour and ends with the same colour. This energising colour should not be confined with a particular religion,"" the minister said.

Raza, a former Ranji cricketer, termed incidents of violence by cow vigilantes as a ""conspiracy"" against the BJP by its opponents.

""These are the outcomes of a conspiracy hatched by our opponents. But the good thing is that governments (at the Centre and states) and courts have taken a tough stand against (such incidents) and no one will be spared,"" he said."
"84","919525680","2018-08-05","https://www.business-standard.com/article/pti-stories/up-govt-wants-to-bring-madrassas-in-mainstream-education-minister-118080500481_1.html","UP govt wants to bring madrassas in mainstream education: Minister","Business Standard",FALSE,"The Uttar Pradesh minister also favoured introducing a ""new dress code"" for students at madrassas (Islamic schools) across the country and added that he will take up the issue with the Centre.

However, Raza did not elaborate on what should be the new dress code in these institutes, where students currently wear white kurta-pyjama.

He rued that no leader from his community has till date thought about standardising the madrassa system.

""Our government in Uttar Pradesh wants to bring madrassas in the mainstream education system. And why only in UP, I think all these religious institutions across the country should be brought into mainstream,"" he told PTI.

Raza said he intends to discuss the issue with Prime Minister Narendra Modi.

""I would meet Modiji in this regard and seek his advise on how we can have a formal education system in madrassas in the country. Regrettably, so far, no Muslim leader has ever thought about standardisation and formalisation of the madrassa education system,"" he said.

Last month, Raza had said that the Uttar Pradesh government might ""soon propose a new dress code"" for madrassa students.

However, Cabinet Minister for Minority Welfare, Muslim Waqf and Haj Laxmi Narayan Chaudhary had contradicted Raza, saying that ""the government has not formed any new policy"" in this regard.

Raza was in the city to take part in the 'Kajari' festival organised by an NGO run by Mumbai BJP leader Amarjeet Mishra.

The minister said the Yogi Adityanath government is sincerely implementing the vision of 'sabka saath sabka vikas' (support of all, development of all) and has made ""never before provisions"" to uplift minorities in the country's most populous state.

""Around Rs 4,000 crore was allocated for minority welfare in this year's budget. This kind of allocation has not been done before. Besides, we have restarted disbursing education loans to minority students, a practice shunned by previous governments.

""We plan to modernise madrassas and have introduced the NCERT curriculum for them. We want to see a computer in one hand and the Koran in the other hand of madrassa students as envisioned by our prime minister,"" he said.

Raza, a member of the Legislative Council, said under Modi's leadership, the country has embarked on the path of progress.

To a query, he sought to downplay talks about a likely alliance between the Samajwadi Party and the Bahujan Samaj Party in Uttar Pradesh for the next Lok Sabha polls.

Such an alliance will have no impact on the BJP's electoral prospects, the minister said.

""All opposition parties are zero. But as you know addition of only zeroes will never add up to a countable number. Modiji's model of governance was discussed even in Pakistan. This proved Modiji is a world leader,"" Raza said.

He rejected the opposition's claim of saffronisation of institutions in the state under the BJP rule.

""Even the Sun begins the day with saffron colour and ends with the same colour. This energising colour should not be confined with a particular religion,"" the minister said.

Raza, a former Ranji cricketer, termed incidents of violence by cow vigilantes as a ""conspiracy"" against the BJP by its opponents.

""These are the outcomes of a conspiracy hatched by our opponents. But the good thing is that governments (at the Centre and states) and courts have taken a tough stand against (such incidents) and no one will be spared,"" he said."
"85","916990589","2018-08-01","https://www.hindustantimes.com/punjab/former-punjab-education-minister-tota-singh-acquitted-in-pseb-recruitment-case/story-GXEwuaMTPcN2YDlTxX052K.html","Former Punjab education minister Tota Singh acquitted in PSEB recruitment case ","Hindustan Times",FALSE,"Former education minister and Shiromani Akali Dal leader Tota Singh (HT File )

Former education minister and Shiromani Akali Dal (SAD) leader Tota Singh was acquitted by the Mohali court in a 16-year-old Punjab School Education Board (PSEB) recruitment case on Wednesday.

However, the court convicted Jora Singh, Amar Singh, Jagjeet Singh Sidhu, Pavitter Pal Kaur for involvement in the case under Sections 465, 467, 471 and 120 B of the Indian Penal Code (IPC). They were sentenced to three-year imprisonment.

After his acquittal, Tota Singh said, ""I was falsely implicated in the case. I had no role in appointments in PSEB as it is an autonomous body.""

Tota Singh's counsel, Satnam Singh Kaler, said the former minister was charged under Section 120B of IPC, even though he had no role in appointments in the board.

The SAD leader, along with five others, was accused in a scam involving the recruitment of 134 clerks by the PSEB in 2000 and 2001. At the time, Tota Singh was the education minister in the Akali government. The case was registered by the Vigilance Bureau in 2001 and charges were framed in 2007."
"86","914345088","2018-07-28","http://www.newindianexpress.com/cities/thiruvananthapuram/2018/jul/28/ghana-education-minister-matthew-opoku-prempeh-receives-kalam-smriti-award-on-behalf-of-president-1849611.html","Ghana Education Minister Matthew Opoku Prempeh receives Kalam Smriti award on behalf of president","The New Indian Express",FALSE,"THIRUVANANTHAPURAM: Ghana Education Minister Matthew Opoku Prempeh accepted the Dr Kalam Smriti International Excellence Award on behalf of Ghana President Nana Akufo-Addo from Mizoram Governor Kummanam Rajasekharan on Friday.

The award is instituted by the Dr Kalam Smriti International, Dale View, Poovachal, and carries a statuette designed by Kanayi Kunhiraman and a citation. The award strengthens the relationship between India and Ghana which dates back to the non-alignment movement, Matthew Opoku Prempeh said.

The long-term, sustainable programmes designed by President Nana Akufo-Addo to lead the West African nation on the path of progress has made him eligible for the award. He made higher education free which has opened the doors of higher education to 90,000 more students, Prempeh said.

Former President Kalam was a leader who inspired the world with his extraordinary thoughts, Kummanam Rajasekharan said. ISRO chairman K Sivan was felicitated at the function. He said Ghana too could follow the India 2020 model suggested by Kalam.

Former Ambassador T P Sreenivasan presided over the function. Deputy Speaker V Sasi, K S Sabarinadhan MLA, VSSC director S Somanath, Dale View founder Christu Das and Dr Kalam Smriti International managing trustee Shaiju David Alfi were present."
"87","912336867","2018-07-25","https://www.moneycontrol.com/news/politics/bihars-former-education-minister-demands-a-happiness-department-in-the-state-2756971.html","Bihar's former education minister demands a 'Happiness Department' in the state","MoneyControl",FALSE,"Ram Chandra Purbey, the former education minister of Bihar, believes that the state government has no dedicated plan to ensure the happiness of poor people and has demanded the creation of a 'Happiness Department' in the state.

Madhya Pradesh formed a happiness department in July 2016 and was followed by Andhra Pradesh opening a similar department in April 2017.

The former education minister of Bihar and RJD MLC (Rashtriya Janata Dal - Member of Legislative Council) Ram Chandra Purbey has raised a demand for a Happiness Department in Bihar on Monday.

As per a report in The Times of India, the former education minister raised this demand through a non-governmental resolution in Bihar's Legislative Council. He believes that while the state government advertises its developmental works, common people are still unhappy. Purbey also feels that the state government should consider his demand and create a separate department which can ensure happiness of these common people. Purbey referred to the happiness index and cited examples of the Happiness departments in Madhya Pradesh and Andhra Pradesh and argued for the creation of a similar department in Bihar.

Bihar's water resources minister Rajiv Ranjan Singh responded on behalf of the Cabinet and rejecting the demand. The report quoted him as saying, ""no such proposal is under consideration of the state government."" He also urged the former education minister to withdraw the resolution and was quoted as saying, ""You always remain in mood of happiness. And even today, you are looking very happy. So, why are you asking for a 'happiness department'?""Purbey, on the other hand, refused to withdraw his resolution and claimed that he was not demanding this department for himself but for the common people of Bihar. Later in the Upper House, his resolution was rejected by a voice-vote though."
"88","912230927","2018-07-25","http://www.newindianexpress.com/nation/2018/jul/25/manipur-education-minister-appeals-to-student-organisations-to-call-off-stir-at-university-1848343.html","Manipur Education Minister appeals to student organisations to call off stir at University","The New Indian Express",FALSE,"IMPHAL: Education Minister Thokchom Radheshyam appealer to the agitating bodies, student organisations and all other stakeholders to call off the present stir at Manipur University to enable restoration of academic atmosphere in the educational institutions of the State.

He made the appeal while speaking to media persons at a press conference held at his New Secretariat office chamber.

Th. Radheshyam, who is also the Government Spokesperson, urged all the stakeholders to help declaration of results of the 6th semester examination for the sake of the students and their welfare.

The Minister sought people's support, especially, from the parents, teachers and students in this regard.

He also urged the agitating bodies to allow conduct of regular classes in Manipur University, colleges and schools, and also to let the admission procedures begin.

Radheshyam said that the issue relating to the demand for removal of the Vice Chancellor of Manipur University has seriously affected the academic atmosphere of different educational institutions of the State.

In order to sort out the matter, discussions at the level of the Chief Minister Shri N.

Biren Singh with the representatives of Manipur University Students' Union (MUSU) and Manipur University Teachers' Association (MUTA) had already been held on various occasions, the Government Spokesperson informed.

The Chief Minister along with senior members of the State Government had brought the issue to the highest levels of the Government of India including the Prime Minister, the Union Human Resources Development Minister and other high ranking officials, he added.

Stating that there had been responses from the MHRD in consideration of the demands raised by MUSU and MUTA, Th Radheshyam said that the first response was in the nature of the constitution of a Fact Finding Committee led by a Joint Secretary of UGC vide order dated 12th July, 2018.

The same is now to be headed by a retired acting Chief Justice, he added.

However, the above developments are not fully acceptable to MUSU and MUTA.

They continue to demand that the enquiry should be made under the provisions of the Commissions of Inquiry Act, 1952 so that the body may function more independently.

They are also demanding that the Vice-Chancellor should be asked to proceed on leave and an in-charge VC be appointed in his place, Shri Radheshyam said.

Maintaining that detailed discussions covering the entire gamut of issues had been conducted on the floor of Manipur Legislative Assembly on July 23, 2018, Th.

Radheshyam recalled that Chief Minister N.

Biren Singh while taking part at the discussion had conveyed the House that the Government has been making serious efforts to resolve the issue.

The Government would still continue to explore to resolve the crisis, he assured.

He informed that about 93 colleges are currently affiliated to Manipur University.

With a total strength of about 82,000 students suggesting that there are about 27,000 students in each year of the three year under graduate degree programme.

Students who passed the 6th semester which may number about 20,000 are expected to seek for higher studies at Manipur University and other universities.

The Manipur University has a strength of about 3000 students which suggest that its intake capacity annually is limited to about 1500 students, he said while adding that the balance of students are expected to seek admissions for further studies in different universities of the country.

Radheshyam said the delay in declaration of the results of students who have taken the 6th semester examination is limiting the option of pursuing higher studies and is expected to create a grave situation in the future management of higher education in the State.

In case, a backlog is created of such huge numbers, it will be critically challenging for the authorities involved in the management of higher education in the future, he added.

The Minister said that the State Government is also taking up step for the initial functioning of Dhanamanjuri University from the current academic year.

He appealed to allow the Dhanamanjuri authority to continue with the admission procedure so that the functioning of the new university is not affected in its very infancy."
"89","911766804","2018-07-24","https://indianexpress.com/article/education/expert-panel-to-study-pass-fail-reintroduction-in-wb-schools-5274026/","'Pass-fail' system may be re-introduced in West Bengal schools: WB Education Minister Partha Chatterjee","The Indian Express",FALSE,"By: Education Desk | New Delhi | Published: July 24, 2018 6:46:49 pm The state government is yet to decide from which class it will be implemented. Xiaomi Mi A2, Mi A2 Lite Launch Live Updates: Mi A2 gets 6GB RAM variant, Mi A2 Lite to sport 4000 mAh batterySBI Clerk Prelims Result 2018 LIVE: Result declared, main exam admit card to release soonLaos dam collapse: Hundreds missing, several feared dead in flash flood

West Bengal Education Minister, Partha Chatterjee, today said the state government has formed

an expert committee to look into the possibility of reintroducing the pass-fail system in the state-run schools. The erstwhile Left Front government had abolished the ""pass fail"" system or no detention of students till Class 8, in 2010. ""We have taken the opinion of the educationists

regarding this matter. There are different kinds of opinions regarding it. We have formed an expert committee to look into the matter,"" Chatterjee said.

After the committee submits its report, it will be discussed with Chief Minister Mamata Banerjee and a final decision will be taken, he said. The state government is yet to decide from which class

it will be implemented.

Union HRD Minister Prakash Javadekar had said on different occasions that the Centre will introduce a detention policy for students in classes 5 and 8 with support from different states."
"90","911076087","2018-07-23","https://timesofindia.indiatimes.com/india/former-education-minister-demands-creation-of-happiness-department-in-bihar-on-line-of-madhya-pradesh-andhra-pradesh/articleshow/65108468.cms","Former education minister demands creation of 'Happiness Department' in Bihar on line of Madhya Pradesh, Andhra Pradesh - Times of India","The Times of India",FALSE,"PATNA: Bihar's former education minister and RJD MLC Ram Chandra Purbey on Monday demanded creation of a separate 'Happiness department' in the state on the pattern of Madhya Pradesh and Andhra Pradesh to promote 'happiness' among its people.

In July 2016, Madhya Pradesh became the first state in the country to set up a 'Happiness Department'. Andhra Pradesh formed a similar department in April 2017.

Raising the demand through a non-government resolution in the Bihar legislative council, Purbey said it was a unique proposal hence the state government should consider his demand and create a separate department to ensure well-being of common people.

Attacking the state government for its alleged ""wrong policies"", Purbey said though Bihar currently has a government of 'double engine' and the state government leaves no stone unturned to trumpet its development works, happiness is still missing from the lives of common people.

Referring to data related to happiness index, Purbey, a fourth-term MLC, said Bihar government had no exclusive plan to ensure happiness in the lives of poor people and strongly argued for creation of a 'happiness department' citing examples of Madhya Pradesh, Andhra Pradesh as well as of a country like Bhutan.

Responding on behalf of the cabinet secretariat department's minister, the state's water resources minister Rajiv Ranjan Singh alias Lalan Singh, however, rejected Purbey's demand saying, ""no such proposal is under consideration of the state government.""

""You always remain in mood of happiness. And even today, you are looking very happy. So, why are you asking for a 'happiness department'?"" the minister told Purbey and urged him to withdraw his non-government resolution.

To this, Purbey said he was demanding 'happiness department' not for himself, but in the interest of common people of Bihar. He also refused to withdraw his resolution on the minister's request.

Later, Purbey's resolution was rejected by the upper house through a voice-vote."
