"","ID","date","url","title","source","duplicate","body"
"139","995704618","2018-11-16","https://timesofindia.indiatimes.com/city/chandigarh/students-lock-main-gate-of-government-school/articleshow/66645086.cms","Students lock main gate of government school - Times of India","The Times of India",FALSE,"MOHALI: Around 150 students of Government Model Senior Secondary School, Jayanti Majri, along with their parents locked the main gate of the school to protest against the transfer order of an English teacher. The students sat outside the main gate demanding the roll back of state government's decision.

The row started after a new English teacher Sakshi reached the school to take charge of her transfer appointment leaving the staff and students in a state of shock, including the serving teacher Sukerna.

Sukerna was so taken aback by the news that she suffered a shock and had to be admitted to a local hospital. Following this, the students and their parents locked the main gate of the school to protest against the transfer decision. The students sat near the entrance for the whole day.

Terming the transfer order a vendetta against serving teacher Sukerna, the parents alleged that the latter didn't not get a prior notice about her transfer or Sakshi's appointment and neither did the principal receive any official communication in this regard.

""The government should reverse the transfer order of the current English teacher. The school result is already very good and there was no need to transfer the teacher. Secondly, there was no prior notice about the transfer order and the new teacher came for her joining the very next day of the issuance of the order,"" parents said, which included Raj Kumar, Binita Devi, Karan Singh, Anil Kumar and Rajlakshmi.

The drama continued till district education officer (secondary) Himmat Singh Hundal intervened in the matter and pacified the parents and students. The school gate was unlocked on Thursday. Hundal said, ""There was some confusion over the transfer of the teacher. The new teacher is a regular and the transfer is purely departmental. The transfer order was dispatched to the school principal and the teacher. The new teacher came for the joining as per the transfer orders."""
"140","995552824","2018-11-15","http://www.newindianexpress.com/states/karnataka/2018/nov/15/ssa-fund-crunch-deprives-karnataka-government-school-students-of-uniforms-1898447.html","SSA fund crunch deprives Karnataka government school students of uniforms","The New Indian Express",FALSE,"BENGALURU: Students studying in state government schools will not get a second set of uniforms for the coming academic year. The Sarva Siksha Abhiyan (SSA) has decided not to provide a second set due to shortage of funds.

All these years students used to get two sets of uniforms, one from State Department of Public Instruction and second one from the SSA. Now, due to fund crunch, the SSA has decided not to provide a second set and students will have to manage with only one.

SSA sources said Centre has only released 34% of total funds allocated to the state to run schemes under SSA. Considering this shortage, the officials at SSA have taken a decision to lower the supply of uniforms for the next academic year.

Funds allocated from the Centre under SSA was Rs 1,700 crore for 2018-19, of which it has only received Rs 577 crore. ""Even of this Rs 577 crore, what we got only Rs 370 crore in the first phase. We need Rs 328 crore just to pay the salaries of SSA and Rashtriya Madhyamik Siksha Abhiyan teachers,"" said a senior official of SSA.

Following the fund crunch, SSA officials have written a letter to the state government requesting additional funds apart from the committed share. ""Of the funds allocated to SSA, 60% comes from Centre and 40% from the state. This time we have requested the state to release additional funds in order to continue programmes,"" explained the official. However, they have not received any communication from the government about their request.

According to the details available, SSA spends Rs 200 per student to provide uniforms, and the total budget needed to supply uniforms is Rs 80 crore. Centre used to provide funds to supply uniforms for girls and students belonging to SC/ST and BPL families from class 1 to 8."
"142","987897044","2018-11-06","https://telanganatoday.com/ntpc-donates-ro-water-plant-to-government-school-in-hyderabad","NTPC donates RO water plant to government school in Hyderabad","Telangana Today",FALSE,"Hyderabad: To improve access to clean drinking water for students of Government Primary School at Mekalamandi near Kavadiguda in Secunderabad, NTPC, Southern Region Headquarters constructed and donated a Reverse Osmosis (RO) water plant as part of their CSR programme.

R Harikumar, General Manager (HR), NTPC who inaugurated the plant on Monday at the school premises said, ""We learned from the school that they have difficulty in providing drinking water to the children. We then began the implementation of the RO plant so that we can provide safe drinking water to the schoolchildren"".

The school at present has around 400 students with a majority of them coming from underprivileged backgrounds. The plant has a tank capacity of 500 litres, he added. As part of their CSR initiative, NTPC had already installed one RO plant at Kavadiguda Govt. High School in Secunderabad."
"143","986879704","2018-11-05","https://www.latestly.com/india/news/gujarat-teachers-caught-kissing-cuddling-in-government-school-classroom-in-dahod-inquiry-ordered-473400.html","Gujarat: Teachers Caught Kissing, Cuddling in Government School Classroom in Dahod, Inquiry Ordered; Watch Video | LatestLY","Latestly",FALSE,"Dahod, November 5: Two teachers were caught kissing inside the classroom in Gujarat. The incident took place in a government school in Dahod district. An inquiry has been launched into the matter after a video showing them cuddling and kissing went viral. The video was shot on mobile phone inside a classroom in Sanjeli taluka's Bhaman village.

The identity of the teachers in the video is not yet identified and inquiry has been ordered into the matter, said District Primary Education Officer N.G Vyas. The complaint was filed after some villages found the video disgusting and submitted and brought it to the notice of the police. 'Good Touch, Bad Touch' Teacher in Pune School Arrested For Sexually Assaulting Four Class 9 Boys.

In a similar incident from Gujarat, a female teacher was arrested for showing obscene videos to the students. The teacher danced and talked in an obscene manner, she also threatened students against informing their parents. The incident came to light when a student told the entire episode to his parents. As soon as parents complained about the teacher's lewd act. She was arrested and several pornographic clips were found on the teacher's cell phone. Later she was booked under various sections of the POCSO Act."
"145","985861152","2018-11-04","https://timesofindia.indiatimes.com/city/delhi/43-girl-students-report-govt-school-teacher-for-harassment/articleshow/66493631.cms","43 Delhi girl students report government school teacher for harassment - Times of India","The Times of India",FALSE,"NEW DELHI: Forty-three girl students of a Delhi government school in Outer district have filed a complaint against a teacher stating that he looks at them inappropriately and asks obscene questions.

In a complaint signed by the students from classes XI and XII and addressed to the principal, they said it was important to raise the issue for the future of other students in the school.

""This teacher looks at girls inappropriately and to some he has even asked obscene questions, the answer of which is not with anyone of us. When we have confronted him and told him, he says he was testing our minds. That is not the way for a teacher to test our minds. We do not want a teacher who tests our mind ask obscene questions. It was important for us to raise this now so that our juniors do not have to go through it,"" according to the letter written in Hindi.

The school confirmed that it had received the complaint on October 31. ""We have even conducted an inquiry and submitted a report to the education office,"" said the principal.

He, however, refused to divulge if the teacher has been found guilty, but claimed, ""It is not a case of sexual harassment."" Hence, the school has not filed any police complaint.

The students have threatened that if the school tries to suppress the matter, all girl students will stop attending classes. ""We do not want our school to get defamed, so we haven't even shared this with our parents. But if the school does not listen to us and act, we will be forced to inform our parents,"" they said.

This letter comes at a time when the education department has been carrying out workshops and seminars on sexual abuse and safety of students."
"146","985786793","2018-11-03","https://indianexpress.com/article/india/school-students-forced-to-strip-punjab-5433185/","Punjab: Two government school teachers shifted after six girl students say 'forced to strip' in front of seniors","The Indian Express",FALSE,"Punjab Chief Minister Captain Amarinder Singh also ordered an inquiry into the matter that needs to be completed by Monday in order to initiate further disciplinary action against the teachers.

Two teachers of Government Middle School in Kundal village, Fazilka, were issued transfer orders after six Class VI students alleged that they were forced to strip in front of their senior girl students (of Classes VII and VIII) after a sanitary napkin was found in the school's toilet.

The two teachers are Jyoti, the class teacher and Kuldeep Kaur, in-charge of the school. Jyoti has been transferred to a school in Khui Khera village and Kaur to Balluana in the same district. Punjab Chief Minister Captain Amarinder Singh also ordered an inquiry into the matter that needs to be completed by Monday in order to initiate further disciplinary action against the teachers.

The alleged incident happened on October 31. The six girls alleged that when a sanitary napkin was found in the school's toilet, the class teacher wanted to find out who had thrown it there without disposing of it in a bin. As per their complaint, she decided to take them to a vacant classroom, where she called some students of Classes VII and and VIII.

Abohar Sub-Divisional Magistrate (SDM) Poonam Singh said, ""The six girl students said they were asked to strip in front of their senior girl students and class teacher to find out who was using sanitary napkin that day. The girls' complaint came to me following which I constituted an inquiry which is being done by two principals of Government Senior Secondary Schools and as per the preliminary report of their inquiry, both teachers have been transferred. The final inquiry report will be submitted on Monday after taking the statement of the teachers. We have already taken statements of girl students and they will not be called again.""

Meanwhile, the girl students have also alleged that the class teacher had made derogatory remarks, too.

However, Kuldeep Kaur told mediapersons that she was ""unaware"" of the incident. Parents of the girls alleged that as they did not get a satisfactory response from the school authorities, they decided to approach the SDM. Class teacher Jyoti has gone on leave.

Kulwant Singh, district education officer, said, ""We are conducting inquiry into the allegations of the students. After a preliminary inquiry, the two teachers were transferred on administrative grounds.""

According to the official spokesperson of the CM, further disciplinary action, as per conduct rules, will be taken once a formal report is received after completing the inquiry. He directed Education secretary Krishan Kumar to complete the investigation into the incident by Monday and update him on the final inquiry report."
"147","985649095","2018-11-03","https://www.firstpost.com/india/punjab-government-school-teachers-strip-girls-to-check-for-sanitary-pads-amarinder-singh-orders-inquiry-5499831.html","Punjab government school teachers strip girls to check for sanitary pads, Amarinder Singh orders inquiry - Firstpost","Firstpost",FALSE,"Chandigarh: Some students at a government girls' school in Punjab's Fazilka district were allegedly stripped by teachers to check which one of them was wearing a sanitary pad, after one was found discarded in the school toilet.

A video clip showed some girls crying and complaining that teachers stripped them on the premises of their school in Kundal village three days back.

File image of Punjab chief minister Amarinder Singh. AFP

Two teachers were transferred and an inquiry ordered after the matter was brought to the notice of Punjab Chief Minister Amarinder Singh, an official spokesperson said Saturday.

The teachers were trying to find out which of the girls was wearing a sanitary napkin, after one was found in the school toilet, officials said.

Instead, they said, the teachers should have educated the students on proper disposal of sanitary napkins.

The chief minister directed education secretary Krishan Kumar to complete the investigation by Monday and take further action as necessary.

The district education officer was asked to visit the school, and on questioning the students and their parents found prima facie evidence of the involvement of the two teachers.

A government spokesperson said further disciplinary action, according to rules, will be taken after the students' statements are recorded and the inquiry report received.

Amarinder Singh asked the education secretary to personally monitor the investigation and update him with the final report on Monday.

Updated Date: Nov 03, 2018 23:04 PM"
"148","984171729","2018-11-01","http://www.newindianexpress.com/states/tamil-nadu/2018/nov/01/madurai-government-school-students-protest-over-replacement-of-7-teachers-with-incompetent-staff-1892876.html","Madurai government school students protest over replacement of 7 teachers with 'incompetent' staff","The New Indian Express",FALSE,"Students of Government Girl Higher Secondary School, Thondi, along with their parents, staged a protest against School Education Department (SED) for sending seven postgraduate teachers including headmaster of their school on transfer at a time overlooking the impact on the students' education on Wednesday.

As many as 250 students of this school, in which about 526 women students from Class VI to Class XII are studying, took part in the sit-in protest staged in front of the school after leaving their school bags in a marriage hall located near the school. ""After sending seven postgraduate teachers on transfer, we had only 14 teachers who do not have skill-set to take classes for Class X, XI and XII. We are now forced to accept newly deputed teachers who have never taken classes for higher secondary students,"" said, Sivakami (name changed), a Class XII student.

""We wonder how could the SED decide to transfer these many Post Graduate teachers at a time while the students are preparing for a public examination. Some of these teachers frankly said to the students that they had paid up to Rs. five lakh to get transfer to their native place. After taking up this issue with District Educational Officer and Chief Educational Officer repeatedly, they have temporarily deputed another six teachers from nearby school, some of them have not yet joined duty and do not teach secondary school students,"" said H Mohammad, district secretary of Manithaneya Jananayaga Katchi.

Banu (name changed), a student of Class XI and medical aspirant, concerned on writing NEET examination. ""Only due to the poverty, we joined this government school. But we are frequently asked to pay money up to Rs. 600 for books and notes. We do not even have a clean toilet. I thought of taking NEET examination next year but it seems my ambition would be spoilt by the SED by not appointing the required Post Graduate teachers who can teach me for NEET examination,"" she added.

The Chief Educational Officer Murugan said that the issue has been resolved as some new teachers have been deputed to this school for the present education year."
"149","982525997","2018-10-30","https://timesofindia.indiatimes.com/city/noida/science-park-soon-for-government-school-students/articleshow/66437183.cms","Science park soon for government school students - Times of India","The Times of India",FALSE,"NOIDA: The district administration of Gautam Budh Nagar is planning to develop a science park for government school students. After a review meeting with 25 CSR partners, the administration decided that HCL foundation will develop the park.

District magistrate B N Singh said the administration has signed MoUs with private companies to improve quality of learning in government schools. ""These private companies are supporting infrastructural upgrade, construction of toilets, installation of smart classes and setting up of libraries and science labs. Sports and cultural events are also organized to encourage holistic growth and development of students. HCL foundation has proposed to develop a science park in Noida. We found this is a good idea and we're exploring options to develop this soon,"" the DM said. The science park will facilitate scientific knowledge, entrepreneurship skills, start-ups, etc. The officials said the students of government schools will be able to exchange their ideas, share knowledge and also display their models.

Noida MLA Pankaj Singh also attended the programme. ""I am all for quality education to children. I will support this initiative at each level to provide them with good education,"" said the MLA. At present, 25 private companies are running development programmes in 85 government schools."
"150","980669937","2018-10-28","http://www.newindianexpress.com/thesundaystandard/2018/oct/28/migrant-labourers-get-a-lesson-in-malayalam-script-at-kerala-government-school-1890856.html","Migrant labourers get a lesson in Malayalam script at Kerala government school","The New Indian Express",FALSE,"MALAPPURAM: A lower primary school in the quaint village of Peruvallur in Kerala's Malappuram district has gone the extra mile to satiate its quest to teach. Functionaries of the Olakara Government Lower Primary School's Parent Teachers Association (PTA) has launched an exclusive literacy programme for migrant labourers in and around Peruvallur.

ALSO READ: Migrant children taught in their own lingo in Kerala

Having spent many years in Kerala, these workers can speak Malayalam. Now, the PTA and the public have come up with a project called Njangalum Vayikkum, which translates into ""we will also read"", to enhance reading skills.

The response to the programme has been good with 30 labourers enrolled in the scheme. PTA president P P Saidu Mohammed said the literacy programme would help migrant workers not only to communicate better, but also to interact more effectively with the locals.

""The migrant workforce is fast becoming the backbone of several sectors in the state,"" he pointed out.

The school authorities got support from Usman Koomanna, who helps migrant workers and teachers here communicate with others in a better way.

Through the camps, which are held during weekends at the school, the migrants are taught the basics of Malayalam.

Most of these 30 labourers hail from Odisha. Workers from West Bengal and Tamil Nadu, too, are taking the classes.

Migrant workers from Olakara and Pukayur are ferried to the class in the school bus. Tea and snacks are provided to the 'students' during breaks. As for the migrants, it's a whole new journey."
"151","980300454","2018-10-28","https://timesofindia.indiatimes.com/city/mysuru/government-school-students-hit-by-delay-in-transfer-process/articleshow/66398368.cms","Government school students hit by delay in transfer process - Times of India","The Times of India",FALSE,"MYSURU: It appears as though many government school teachers are more preoccupied with being transferred to schools of their choice as the annual transfer process is set to commence in November. While many private schools in the district have managed to complete 80% of the SSLC syllabus, students of government institutions are contending with prolonged truancy of their teachers. Consequently, a very significant amount of their syllabus has not been covered, leaving the students in a lurch.

The teachers have laid the blame squarely at the doors of the officials of the department of public instruction (DPI) for the protracted delay in finalising the transfer process. Sources in the Karnataka primary and secondary education department said that the process was initiated as early as December 2017, but stiff resistance from teachers unwilling to relocate to rural areas resulted in the delay.

An officer in the primary education department said, ""We will complete the transfer of primary school teachers by October 30, following which we will start the transfer process of high school teachers. As a result, many schools will not have teachers for various subjects till December, which might pose problems to SSLC students.""

That private schools were holding camps on how best to tackle SSLC examinations set the dire situation in state-run institutions in stark relief, he said. ""At government schools, students are more worried about, who their new teacher will be, whether he or she will complete the syllabus on time and if the teacher will continue where the previous one stopped, etc. In the absence of a full-time primary and secondary education minister, this is a fiasco. Students at government schools are likely to lose some marks owing to the delay in completion of syllabus,"" the official added.

President of the primary school teachers' association Basavaraj Gurikar attributed the delay in the transfer process to software glitches. ""We hope things change in the next few years and the process can be completed in a seamless manner, so as to avoid trouble for the students,"" said Gurikar.

Raghu Kumar, an SSLC student at a government high school in Mysuru city, said, ""The government must not let the students down. If a teacher is transferred in the middle of the academic year, it creates a lot of problems for the students. The government must ensure that such a situation does not arise next year.""

Deputy director of public instruction, Mysuru Mamata said that as many as 2,032 primary school teachers from across the district had sought transfer. ""The transfer of primary teachers was to be completed by October 22,"" said Mamata.

Former primary and secondary education minister and BSP leader N Mahesh told STOI that the delay was the result of a host of issues - the result of elections, confusion pertaining to additional teachers and technical glitches. ""It is unfortunate that students have to suffer. But, the department was also helpless in many cases,"" he added."
"152","977359157","2018-10-24","https://timesofindia.indiatimes.com/city/bengaluru/intruders-scale-wall-break-into-a-government-school-staff-room-to-party/articleshow/66341877.cms","Intruders scale wall, break into a government school staff room to party - Times of India","The Times of India",FALSE,"BENGALURU: Staff members had an unpleasant surprise awaiting them when they returned on Monday to reopen Government Junior Primary School in Vijayanagar, Whitefield, after Dasara vacation. They found the padlock to the staff room broken and the doors wide open. Realising that intruders had broken in, they rushed inside and were relieved to find that nothing was missing. But the state that the intruders left the staff room in was another matter altogether.

Empty liquor bottles, plastic glasses, discarded snack packets and cigarette butts were strewn all over the room: The intruders clearly found the staff room an ideal place to party after the school closed for Dasara holidays on October 6. They found it such an ideal place that they made their way past a fence and scaled the school's six-foot-high compound wall on multiple occasions to gain access, as police later discovered.

""It was clear from the scene that the culprits had partied there on three or four occasions,"" a police officer said after a probe on a complaint by the headmistress to Whitefield police. ""The parties appear to have been night-long affairs.""

""The intruders did not touch documents or damage anything,"" he said. ""Attendance registers, notebooks, textbooks and documents pertaining to the school welfare committee were intact."" The school has 53 students, most of whom are from Vijayanagar, Ambedkar Nagar, Gandhipura and other nearby areas. Police registered case under IPC sections 427 (mischief causing damage of Rs 50 or more) and 447 (criminal trespass)."
