"","ID","date","url","title","source","duplicate","body"
"73","950557181","2018-09-20","http://www.newindianexpress.com/states/andhra-pradesh/2018/sep/20/three-months-on-andhra-pradesh-government-school-students-yet-to-get-uniforms-1874617.html","Three months on, Andhra Pradesh government school students yet to get uniforms","The New Indian Express",FALSE,"VIJAYAWADA:Even three months after commencement of the academic year, the State government is yet to complete the process of distribution of uniforms to government school students.

Replying to a query in the AP Legislative Council during question hour on Wednesday, Human Resource Minister Ganta Srinivasa Rao said out of 59,63,070 uniforms, the government had distributed 38,68,926 uniforms so far. The minister said delay in supply of cloth by weavers to the APCO, the uniforms distribution agency, had led to the situation.

Stating that APCO and officials of the HRD department are closely monitoring the situation, he said stitching process has been entrusted to a large number of tailors to ensure supply of uniforms to students at the earliest."
"74","949847239","2018-09-19","http://tehelka.com/police-arrest-class-9-student-for-stabbing-schoolmate-to-death-outside-government-school-in-panchkula/","Police arrest class 9 student for stabbing schoolmate to death outside government school in Panchkula","Tehelka - Investigations, Latest News, Politics, Analysis, Blogs, Culture, Photos, Videos, Podcasts",FALSE,"A class 9 student of government school was arrested on September 17 when a high-school rivalry at a school went out of hand when a 17-year-old Vikas Kumar was stabbed to death by accomplices of a schoolmate he got into a fight outside the premises of Government Senior Secondary School in Sector 7 Panchkula, Haryana.

The police officer handling the case reportedly said, ""The body has been sent for the postmortem and the report will soon be out. We are carrying out the investigation.""

The confrontation began on September 15 when Kumar slapped one of his schoolmates for allegedly snatching his best friend's cell phone. After the incident the accused summoned 15-20 of his friends, some of whom were school seniors outside the school premises on September 17.

After stepping out of the school Vikas was surrounded by the accused and other boys and a heated argument ensued. In the heat of the moment, one of the minors in the crowd allegedly took out a knife and stabbed Vikas.

A Class 10th student was also reportedly injured in an attempt to save Vikas.

Taking note of the incident the School faculty alerted the police and rushed the boy to the Civil Hospital in Sector 6. He was declared brought dead by the hospital authorities.

Deputy Commissioner of Police (DCP) Abhishek Jorwal said, ""Two accused involved in the murder have been arrested and charged under Justice Juvenile Act, 2015. With the help of the CCTV footage and names given by students, cops managed to identify the minors."""
"75","948881540","2018-09-18","http://www.newindianexpress.com/states/karnataka/2018/sep/18/non-academic-work-a-headache-for-government-school-teachers-in-karnataka-1873590.html","Non-academic work a headache for government school teachers in Karnataka","The New Indian Express",FALSE,"BENGALURU: Government school teachers across the state are at their wits end with the non-academic works they have been asked to do as these are basically eating into their classroom time. So, they have requested the authorities to relieve them from this. They have submitted a representation to the Chief Secretary, Commissioner for Public Instructions and the Primary and Secondary Education Minister in this regard.

The teachers have been working as data entry operators and uploading students scholarship details online. This has been going on since the last 20 days, and teachers have been reportedly asked to work even on Sundays to complete the work within September 30.

All these years, parents had to apply for scholarships from the government on their own. This year, the CM has instructed the authorities reach the 100% target and enrol all eligible students at government and aided schools. So, the pressure was passed on to the teachers.

Following the government's direction, teachers have asked the students to bring their parents to schools with necessary documents like Aadhaar card, income and cast certificates among others. But teachers are facing a tough time collecting and uploading details of many children as their parents do not have income certificates.

Karnataka State High School Assistant Teachers Association president H K Manjunath said, ""This is real harassment for the teachers. We need to prepare the kids for the first term examinations which will begin this month end. When we all are busy doing this data operators work, how can we concentrate on academics and teaching.""

As the applications have to be uploaded online, the system will not accept if there is lack of even a single document, said Manjunath adding, ""Most parents do not have income certificates which is mandatory to apply for scholarship. I request the government to outsource these kind of works and not harass us."""
"76","948516123","2018-09-17","http://www.newindianexpress.com/states/tamil-nadu/2018/sep/17/government-school-students-reluctant-to-turn-up-for-free-neet-coaching-classes-in-trichy-1873221.html","Government school students reluctant to turn up for free NEET coaching classes in Trichy","The New Indian Express",FALSE,"TRICHY: Despite allotment of 16 centres for free NEET coaching across Trichy district, not many students have turned up for the weekend classes that literally worries the education department.

According to teachers, the students are reluctant to attend the weekend NEET coaching classes as they fear in losing their focus on curriculum. The teachers also claimed that just a few Biology group students in each government school have given names to their headmasters.

Although around 1,200 students enrolled for the cost-free coaching, most of them did not turn up for the inauguration classes.

Sources said that the education department must urge the teachers to convince their students to attend the free coaching classes.

Teachers say the quarterly examinations for higher secondary students are currently underway, that leaves students to not to attend the weekend coaching classes.

A government school headmistress said, ""There is no proper planning on the conduct of free coaching classes. The enrolled students are asked to attend the weekend classes despite the quarterly examinations. Alternatively, both the class XI and XII students are made to sit in a single class and there are not been segregated as per their studies.""

A government school headmistress further stated that the Education Department officials themselves are puzzled that they are yet to understand the students' mentality about coaching classes only in the upcoming days.

D Randeep Rajkumar, a clinical psychologist said the government school students who are scoring good grades could already be attending the coaching classes. ""Such students if forced to go through the cost-free NEET, JEE coaching could lead to mental pressure,"" he added.

The education department officials told Express that they would analyse the strength of the students visiting the coaching classes at the end of this week. The total strength of higher secondary students in government schools in Tiruchy is nearly 40,000."
"79","944109538","2018-09-11","https://www.indiatimes.com/trending/human-interest/meet-sanjay-sen-the-man-who-battled-all-odds-to-teach-at-this-government-school-in-rajasthan-352849.html","Meet Sanjay Sen, The Man Who Battled All Odds To Teach At This Government School In Rajasthan","indiatimes.com",FALSE,"There are too many things we take for granted in our lives. But it's when people like Sanjay Sen who put things into perspective.

Mr Sen is physically challenged, but this didn't stop him from pursuing a career in teaching. In a post that's now gone viral, Sanjay Sen is said to be working in a government school in Rajasthan under the Shiksha Sambal Project since 2009.

The picture shows Sanjay Sen teaching the students despite the absence of proper facilities. It touched hearts of thousands of people on the internet and Sen was lauded for his dedication. Take a look at the reactions below:

Shiksha Sambal is a government of Indian flagship which aims to help students who have dropped out of school due to financial difficulties and help schools that don't have enough teaching staff.

The program is spread across Ajmer, Bhilwada, Chittorgarh, Rajsamand and Udaipur districts of Rajasthan. Siksha Sambal reaches out to over 7,000 students from classes 9th to 12th."
"80","942532824","2018-09-09","https://timesofindia.indiatimes.com/city/ludhiana/government-schools-plea-to-resolve-waterlogging-issues-falls-on-deaf-ears/articleshow/65740340.cms","Government school's plea to resolve waterlogging issues falls on deaf ears - Times of India","The Times of India",FALSE,"AMBALA: A government primary school in block-II of Ambala is facing serious waterlogging issues. The challenge for the school has doubled with continuous rainfall that the region is witnessing for the last few days. The teachers, students and other workers are facing major inconveniences and the civic body has failed to be of any help. The situation went bad to worse after the students started getting injured.

In August, the district elementary education officer (DEEO), Ravinder Chaudhary, and Block-II education officer (BEO) Ravinder Singh visited this school. After acknowledging the state of the school, the DEEO assured the school management that the issues will be resolved at the earliest. What is more interesting is the fact that even after more than a month, his orders are lingering midway.

The school management, which blames the municipal corporation and the railways for the mess, said, ""Some locals have demolished a wall adjacent to the school. They have made it a passage to reach railway lines. We got the wall repaired multiple times, but they keep on demolishing it. The MC is not bothered to remove the filth near the school. Even the railway department does not care enough about the wall.""

A TOI team tried to contact the DEEO and BEO multiple times, but they did not respond. A local nongovernmental organisation had also given a memorandum to the deputy commissioner (DC) earlier in August regarding the same problem, but no action has been taken since then.

Meanwhile, DC Sharandeep Kaur Brar has assured that she will look into the matter at the earliest."
"81","941432425","2018-09-07","https://www.thehindu.com/news/cities/Madurai/medical-admission-for-1000-government-school-students-targeted-minister/article24894692.ece","Medical admission for 1,000 government school students targeted: Minister","The Hindu",FALSE,"The Department of School Education, by fine-tuning the coaching for NEET, has set a target of ensuring admission for a minimum of 1,000 government school students in the government medical colleges across Tamil Nadu, Minister for School Education K.A. Sengottaiyan has said.

During an informal chat with reporters at the Collectorate here on Friday after flagging off the relief materials, worth about ₹ 1.46 crore, to flood-ravaged Kerala on behalf of the schools in the southern districts, Mr. Sengottaiyan said the State Government, which always wanted the scrapping of NEET, had trained 3,200 teachers for preparing the NEET aspirants in 412 centres across Tamil Nadu.

Besides coaching the students on weekends for three hours a day, arrangements had been made to conduct coaching classes in designated coaching centres every day for 60 minutes.

After 72,000 students from Tamil Nadu appeared for NEET in 2016, over 1.13 lakh students took the test last year. Hence, the government had ensured infrastructure required for the smooth conduct of NEET in over 1,000 schools across the State as it was expected that over two lakh students would appear for the test this year.

""Though 1,472 government school students had cleared the NEET this year, only 24 of them could get admission to the government medical colleges,"" said Mr. Sengottaiyan, who formally inaugurated the NEET coaching centre at Avvaiyar Government Higher Secondary School at Paavoorchathram in the evening.

He assured that the complaints of sexual harassment of women teachers would be dealt with seriously within 24 hours if they registered complaints by calling 14417.

The Minister said the Department of School Education had so far sent ₹ 4.06 crore-worth relief materials to Kerala as the first consignment, worth about ₹ 2.60 crore, were transported to the neighbouring State from Erode recently.

He also participated in a function organised at Thulukkarpatti in Radhapuram taluk to mark the upgradation of the government high school into higher secondary school.

Collector Shilpa Prabhakar Satish, Minister for Adi Dravida Welfare V.M. Rajalakshmi, MPs and MLAs participated in the functions."
"82","940063889","2018-09-05","http://www.newindianexpress.com/states/karnataka/2018/sep/06/12k-government-school-teachers-unpaid-since-six-months-1868304.html","12K government school teachers unpaid since six months","The New Indian Express",FALSE,"BENGALURU: Thursday was not a happy Teachers' Day for over 12,000 of them who work at various government schools across the state, as they have not received salaries for the last six months.

The teachers have repeatedly pleaded with local- as well as state-level officers for their money, but the officials have been shirking the responsibility by blaming the finance department for the delay, which in turn has been passing the buck onto the Union Ministry for Human Resource Development.

As per details available from the teachers, of the 25,000 teachers appointed under Rashtriya Madhyamik Shiksha Abhiyan (RMSA), over 12,000 working in 14 taluks including Beltangadi, Madhugiri, Gadag and Bantwal have not got their salaries.

ALSO READ | No end to teacher shortage at Bengaluru Central University , classes begin today

""When we approached local block education officers and deputy directors, they said some technical issues at the state level was the cause for the delay. But when we approached state-level officers, they said they had not received funds from the MHRD to pay us,"" a teacher told Express.

When the issue was brought to the notice of RMSA officials, they blamed Khajane-2 software, which monitors Human Resource Management System (HRMS) for the ""glitch"". It is said that code numbers of the 12,000-odd teachers were wrongly uploaded, which has caused a ""technical error"" in distribution of salaries.

""These 25,000 teachers were recruited under RMSA, so their salaries are being paid from funds released by the MHRD. To pay salaries for these teachers, there is a system called HRMS in which code numbers have been given to each teacher, against which salaries are credited. This code number is wrongly used at Khajane-2 causing a technical error,"" said an official from the department of public instructions who handles RMSA.

Chief Minister H D Kumaraswamy has taken note of this. While addressing the event organised by the state higher education department on the occasion of Teachers' Day on Wednesday, he said, ""I am told that salaries have not paid to over 12,000 teachers. Upon enquiring with officials, they said it was because the Centre had stopped the relevant funds. I have instructed officials of Finance and Education departments to address the issue immediately."" The CM went on to add that there was no shortage of finances in the state. ""We have enough funds in the treasury. The government is not stopping the funding of any of the ongoing projects,"" he added."
"83","937164662","2018-09-01","https://scroll.in/latest/892804/delhi-vice-principal-of-government-school-suspended-on-corruption-charge-on-retirement-day","Delhi: Vice principal of government school suspended on corruption charge on retirement day","Scroll.in",FALSE,"Gomti Devi was also barred from leaving the city without obtaining permission.

The Delhi government on Friday suspended the vice principal of a government school on the day of her retirement following corruption allegations against her, IANS reported. Gomti Devi, vice principal of Sarvodaya Kanya Vidyalaya in Mayur Vihar's Phase II, had allegedly been pocketing some of the money meant for teachers to purchase learning material.

In an order issued on August 30 by Chief Secretary Anshu Prakash, Devi was also barred from leaving Delhi without obtaining permission.

Teachers are given Rs 500 to purchase teaching-learning material, including stationery, globes, maps and charts. After an inquiry was conducted by a team of Directorate of Education, it was found that Devi was giving Rs 350 to the teachers, and kept the rest claiming it was a deduction under the Goods and Services Tax.

""I am a single woman and a Scheduled Caste candidate, so an easy target,"" Devi, who had worked at the school for five years, told The Indian Express. ""I have 40 years of service without facing any such allegation...Why should I do all this when my career is at an end?"""
"84","935487603","2018-08-30","http://heraldkeeper.com/market/door-access-control-solution-market-rising-demand-sectors-hospital-hotel-office-building-government-school-university-107777.html","Door Access Control Solution Market: Rising Demand in the Sectors Hospital and Hotel, Office Building and Government, School and University - Herald Keeper","Herald Keeper",FALSE,"The research report on Door Access Control Solution Market analyzes the entire production and supply chain of the market and provides data as per the different scenarios. On the other hand, the report also provides the data related to price, cost, value, volume, income, revenue, and profit margin of the market used in different fields, which are in high demand in the major regions and by different companies.

The report also provides regional level market analysis and future outlook for: North America, Europe, Asia Pacific, Latin America, and the Middle East and Africa.

This Door Access Control Solution Market report also takes into account the past price of 2012-2016 and future price of 2017-2025 as per the supply-demand relation along with perspectives and Door Access Control Solution Market forecasts. Additionally, the Market report also discusses the data on deals (distributors) and buyers, providing a holistic insight into the supply chain and details of the Market.

Types: Fingerprint, Digital, Merchanical

Applications: Hospital and Hotel, Office Building and Government, School and University

Get discount on Door Access Control Solution Market Report @:

https://www.reportsmonitor.com/check_discount/88744

With the present market standards revealed, the market research report has also illustrated the latest strategic developments and patterns of the market players in an unbiased manner. The report serves as a presumptive business document that can help the purchasers in the market plan their next courses towards the position of the market's future.

The report provides an overview of the Door Access Control Solution Market, consisting of product definitions, classifications, applications, segmentation, comprehensive analysis, and the industry chain structure. It also includes a number of factors such as the market dynamics, ranging from the basics to advanced market intelligence, which helps the companies in expanding their footprint over the market.

The research report provides solutions to various prominent questions with regards to the growth of the market. In the last section, the feasibility of new investment projects is evaluated, and the overall research conclusions are presented. In all, the report provides major statistics on the current landscape of the industry and is a valuable source of substance and direction for all the companies, stakeholders, service providers, and individuals who're interested in heightening their share in the market.

About Us:

Reports Monitor is a market intelligence and consulting firm with extensive experience and knowledge of the Market Research industry.

Our aim is to change the dynamics of the Door Access Control Solution Market Research industry by providing quality intelligence backed by data. Your requirement for market forecasting is fulfilled by our exclusive quantitative and analytics-driven intelligence. Decision makers can now rely on our distinct data gathering methods to get factual market forecasting and detailed analysis."
"85","935457420","2018-08-30","https://www.indiatimes.com/news/india/madrassa-in-flood-hit-kerala-makes-sure-that-government-school-works-from-its-building-352129.html","Madrassa In Flood-Hit Kerala Makes Sure That Government School Works From Its Building","indiatimes.com",FALSE,"Kerala floods have claimed over 400 lives, left a million others in relief camps, not only this the deadly floods managed to wash away over 10,000km of highways and roads along with hundreds of bridges. People in Kerala might not be able to forget the 'deadly months' of July and August because of the massive effect of the calamity on life and infrastructure.

Help has been pouring in from all over the country for those who have been hit by the flood. Despite fewer resources, Keralites have come together to help each other.

This government lower primary school at Kurichiarmala in the district will remain the testimony to nature's fury that has left a trail of death and destruction across the state.

A landslide on August 9 had torn through the school's one-acre compound and created two craters near the building and making it inaccessible.

Until Monday, the teachers and villagers were unsure of the future of the institute's 92 students.

In two days, the uncertainty gave way to a new-found confidence -- now seen across the state -- as the exuberant students started school on the top floor of a madrassa, barely a kilometre away.

The temporary establishment has become a symbol of communal harmony and determination of a resilient village that refused to be cowed down by adverse conditions, despite their debilitating effect.

There was an effort to clean up the three-foot mud and slush from the school building so that the classes could commence. Recurring landslides, however, posed a constant risk, forcing the authorities and volunteers to abandon their efforts.

Realising the need for continuing the school, the local mahal committee stepped in and offered space in the Hayathul Islam Madrassa building. Local residents and volunteers swung into action and made necessary arrangements on the top floor of the building.

They converted the top floor into a full-fledged school with four classrooms and a staffroom in 72 hours.

As the classes restarted on Wednesday morning, the building earned the distinction of having a madrassa, a mosque and a government school under the same roof.

The school, meanwhile, adjusted its working days. It would be closed on Fridays -- so that the faithful would have enough space for their prayers -- and instead, would work on Saturdays. The arrangement would continue for the rest of the academic year.

Authorities said the school would function in the madrassa until it a new building somewhere nearby.

Among the students who attended school on Wednesday, five have been rendered homeless by the landslides. A Facebook community, Human Being Collective, Malabar Flood Relief Forum and Green Palliative Volunteers had raised around Rs 4 lakh and helped the villagers recreate the school, which now sport brand new furniture, blackboards, teaching aids and colourful walls with animated characters and even indoor plants.

The pre-primary section has been accommodated in the madrassa's courtyard, where the Hayathul Islam mosque is also located.

""Even the children hailing from families who had suffered huge losses in the landslide were so happy on seeing their new school. It will immensely help them in erasing their traumatic experiences,"" district collector Keshvendra Kumar said.

The school is also a reaffirmation of the secular credentials of Kerala where everyone is helping each other, cutting across religious, social and other barriers,"" who spent around three hours at the school, added.

The school's PTA President Mohammed Aslam, also the vice president of the mahal committee, said the entire Mahal was very forthcoming in opening up its premises for the school. ""Though properties worth crores were lost in the landslide, our biggest loss was the Kurichiar Mala LP School. Most of the people in the village work in the nearby tea plantation and the school was their only hope for a better future of their children,"" Aslam said.

School headmaster Sasi P K said the deputy director of education has sanctioned the changes in the school working days to facilitate the Friday prayers at the mosque.

C K Saseendran, representing Kalpetta in the state assembly, said the school would be upgraded to an upper primary school with Rs 1 crore from the MLA fund and a Rs 49 lakh grant from the central government's multi-sectoral development programme. The Tata Group, meanwhile, has promised to construct a new building for the school on identifying a new location.

The district collector said the damaged school building would be converted to a memorial to showcase how the people overcame the natural calamity."
