"","ID","date","url","title","source","duplicate","body"
"224","1010632733","2018-12-04","http://www.newindianexpress.com/cities/delhi/2018/dec/04/teachers-hired-till-feb-2018-in-nov-1907025.html","Government school teachers hired till Feb 2018 in November","The New Indian Express",FALSE,"NEW DELHI: IN a rush to fill vacancies of teachers in various government schools, the Directorate of Education (DoE) made yet another embarrassing mistake while releasing the order for recruitment. The DoE passed an order on November 22, appointing 16 guest teachers for subjects such as Mathematics, Science, Drawing and English in schools. But the tenure of these teachers was already over before it started. According to the order, the teachers were to complete their terms by February 28, 2018.

""The deployment of guest teacher is up to 28.02.2018 or joining of regular teacher, as the case may be, and directed to report for duty immediately,"" says the order issued last month. Although, on Monday the department put out a corrigendum stating instead of 2018, the tenure is up to February 2019.

The corrigendum states, ""In partial modification to this office order dated 22.11.2018, wherein the tenure of deployment of guest teacher has inadvertently been mentioned as up to 28.2.2018 or joining of regular teacher, as the case may be, now the same may be read as up to 28.2.2019, instead to 28.2.2018.""

TNIE highlighted another similar gaffe by the DoE on Sunday, where three teachers hired for physical education subject were given the date of joining as September 1, while the order was signed and put on Delhi government's website on November 30.

Calls to Sanjay Goel, director, Directorate of Education , went unanswered."
"226","1008442816","2018-12-02","https://timesofindia.indiatimes.com/city/gurgaon/1-booked-for-axing-44-trees-in-naraingarh-government-school/articleshow/66904092.cms","1 booked for axing 44 trees in Naraingarh government school - Times of India","The Times of India",FALSE,"AMBALA: The Ambala district police have booked a person of illegally axing 44 healthy trees from the premises of a government primary school at Fatehpur village in the Naraingarh block of the district. A case has been registered on the complaint of block development and panchayat officer (BDPO) Sumit Bakshi.

According to sources, ages of the cut trees varied from 10-15 years and include 12 of 'papri', nine of 'jamun', eight of 'neem', four of 'siras', three of 'amla', two of 'arjan' and one each of 'sheesham', 'babool', 'morus' and 'dek' varities.

Two of the axed trees were of unknown variety.

Investigation officer assistant sub-inspector (ASI) Amar Singh said, ""On the complaint of the BDPO, we have registered a case against one person, who has been identified as Maya Ram, under the Prevention of Damage to Public Property Act. The accused has stated that he was asked by the village sarpanch to cut the trees in order to prepare a ground on school premises. However, he was not able to provide any documentation supporting his claim. We are investigating the matter.""

On the other village sarpanch Ashok Kumar, while talking to TOI, said, ""I did not give any permission to Maya Ram, who is a professional contractor of cutting trees. I was out of the village on the day of the incident. I came to know about the matter after I came back.""

Deputy commissioner (DC) Sharandeep Kaur Brar said, ""We will look into the matter and relevant action as per the law will be taken against the erring person. As per information from the block patwari (revenue official), 44 trees have been cut and a case in this regard has also been registered. The wood is in our possession and the BDPO has been asked to send a detailed report whether the village sarpanch too is involved in the incident or not.""

District forest officer Hairatjeet Kaur said, ""Since the trees are not on forest land and were without numbers at the school premises, the police have not invoked sections of the Conservation of Forest Act."" The axed trees are still lying in the school premises when TOI reporter visited the spot."
"227","1007950613","2018-12-01","https://www.hindustantimes.com/pune-news/education-takes-a-stand-still-as-government-school-turns-into-temporary-shelter-for-pune-slum-fire-victims/story-mxz3llrWjUjXKHFAQRmMJO.html"," Education takes a stand still as government school turns into temporary shelter for Pune slum fire victims","Hindustan Times",FALSE,"The education of nearly 650 to 700 children has been hit adversely ever since the PMC Colony government school in which they were studying was transformed into a temporary shelter for the victims of the Patil Estate slum fire. Over 1,200 families were rendered homeless after a devastating fire broke out in the slum on Wednesday.

The school is located in PMC Colony area near the Patil Estate slum which suffered a fire incident three days ago. The children running in the corridors are not on campus for education but for mere survival after losing their entire households in the fire.

""Most of the children in the school are from Patil Estate. The school was informed about the incident and the required arrangement was made a little after 2pm (The fire brigade received a call at 1.10pm). The teachers were in the school till around 6:15pm when the last child was handed over to his parents,"" said Shilpa Gholap who works closely with the principal of the school. ""In fact, the number goes up in the evenings as everyone is looking for space to sleep,"" she added on Friday.

Thursday, Friday and Saturday (half day) of the school work was lost for the 650-700 students of the school. The pupils missing academic work include ones studying in English, Marathi and Urdu medium.

The principal of the school, Anjali Mandhale, was on leave when the incident happened and the school was headed by Ujwala Nangre, vice principal, in her absence.

Ganesh Sonune, disaster management department officer at Pune Municipal Corporation (PMC) said government structures for such situations are pre-identified and people are shifted there and provided with water, sanitation and food.

""That is the protocol. For example, people were provided with blankets and donations from us as well as private organisations. If needed, private halls and open private spaces are taken into consideration as well. For the (school) days which are lost, we have to make sure that the timings are adjusted later on - in 3-7 days - when everyone has found a replacement shelter,"" he said.

When asked for how long the school will suffer loss of academic days, Nangre said that cannot be specified.

While the teachers were gathered in one room, 13 classrooms were allotted for shelter and one for medical help. Dr Geetanjali Joshi sat with one nurse in the day shift and while they did not get any fire-related cases, the doctors had attended to 108 patients for common conditions like cold, fever, sore throat, among others, within 20 hours of the tragedy."
"228","1006820580","2018-11-29","http://www.newindianexpress.com/states/karnataka/2018/nov/29/this-govt-school-in-gadag-has-only-one-teacher-and-3-students-1904799.html","This government school in Gadag has only one teacher and 3 students","The New Indian Express",FALSE,"GADAG : A government school in a Gadag village is a quiet affair. It has only one teacher, who picks up all the school students from their homes on his bike and even drops them off later. How can he fit all the students on his bike? Well, he has only three students. If the teacher takes off, the school is shut for the day. The three students study in Classes 1, 2 and 5. The government primary school in Bandemma Nagar near Naragund town once had a good numbers of students but after locals started to migrate, the school was left with only three children.

The teacher, H S Sunkad, hails from Naragund and he was appointed on deputation to this school four months ago.A few years ago, Bandemma Nagar had several families living here and many children went to the school. However, most of the residents got houses under a Central government scheme and left the village.

The three children continue to come to school, thanks to their dedicated teacher. ""When I first came here, I was surprised to see only three students. But it is my duty as a teacher to teach, irrespective of the number of students. I teach all the children in the same class. Of the three students, one was planning to quit school and had joined his father in cattle grazing. But I convinced the family as well as the boy to pursue his studies. After this I started picking and dropping the three children,"" Sunkad said.

The Education Department, however, plans to get more children to this school. Gadag Deputy Director Of Public Instruction (in charge) G L Baratakke said the department is aware about the issue. ""I have informed Naragund BEO to take up a survey on how to increase the number of students. I am waiting for the report, and based on it I will take steps to improve the numbers. We will request the transport corporation to run regular buses to the area where the school is,"" he said.

Gadag district Kannada Jagruti Vedike president Prabhurajgouda Patil appreciated the efforts of the teacher who has been teaching just three kids. ""We will visit this government school and check the possibility of increasing the number of students by creating awareness in nearby areas,"" he said.

Villagers say that they feel for the teacher as he is unable to take any leave."
"229","1006797541","2018-11-29","http://www.newindianexpress.com/states/tamil-nadu/2018/nov/29/this-government-school-in-kurichi-leads-the-way-in-empowering-girls-1904842.html","This government school in Kurichi leads the way in empowering girls","The New Indian Express",FALSE,"COIMBATORE: While the Ministry of Human Resource Development has only now started to give

importance to martial arts training for girl students as part of its self-defence programme, this government higher secondary school in Kurichi has been a pioneer in the field with seven of its students getting ready to participate in a State-level meet to be held soon.

Even its first year of training, as many as 120 of its 147 students participated in the divisional meet concluded in the city; 91 of them managed to bag medals too. The school offers training in various disciplines like fencing, judo and taekwondo.

At a time when most government schools in the city and rural areas alike concentrated on conventional games like kabaddi, volleyball and football, this schools took the initiative to introduce martial arts with the help of its physical education teachers P Sivaprakasham and N Nisar. This training was then extended to the school's girl students in the form of self-defence lessons. Teachers wanted them equipped to handle any situation they might face. After being briefed about the different forms of martial arts, many girls volunteered to be trained in fencing; they also managed to win a few

medals, he recalls.

Five girls -- S Swetha, D Mercy, R Ranjani, of class XI, and Rajeshwari (class X) and K Logeshwari (class IX) -- have been qualified to participate in the State-level event to be held soon in Kankeyam

of Tirupur district. The girls, on their part, are happy to have overcome all odds to make a mark in the

sport. Though their mothers were hesitant to allow them to be trained in martial arts, all parents are now happy that their girls have managed to achieve so much. Now, they eagerly inquire about fencing practice before asking about academics, narrates Swetha.

Headmistress N Shanthi cannot appreciate the effort more. The teacher's job is not just to improve the students' skills in academics; they should also identify their talents and put them on the path of development. She also remarks that such training has increased attendance among students. A year ago, only 50 per cent of students were willing to attend classes; this has increased to 95 per cent, she claims.

While the school might have its reasons to introduce martial arts to its students, the motivations for single

mother M Gowri are quite simple. Raising her two girls -- M Praveena and M Durgadevi -- on her own, after the demise of her husband, she wanted them to be fiercely independent. When the school

announced self-defence lessons, she was more than happy to sign them up for it. True to spirit, the girls managed to bag a silver medal in karate and Praveena has a bronze in fencing to add to it. It was the mother's aspiration that pushed them to their best, Praveena declares.

The school allows students to excel in swimming too. Four boys -- T Akash, V Mahadevan, M Muthukathiravan, S Logeshwaran (all class VIII students) -- were identified after teachers saw them

swimming in the Kurichi lake, located adjacent to the school.

All these boys had not had formal training before. Akash learnt to swim in the Kuruchi lake, for Mahadevan it was a check dam near Madukkarai and Muthukathiravan and Logeshwaran had the good local old wells."
"230","1005089621","2018-11-28","https://timesofindia.indiatimes.com/city/delhi/govt-school-guest-teachers-say-yet-to-get-oct-salaries/articleshow/66835731.cms","Government school guest teachers say yet to get October salaries - Times of India","The Times of India",FALSE,"NEW DELHI: With November almost coming to an end, guest teachers in government schools are yet to get their salaries for October. In most schools, they have been paid their salaries just till September.

There are three schools where teachers have not been paid for the last three months. The All India Guest Teachers Association has written to the director, directorate of education (DoE), complaining about the guest teachers of three schools not being paid for the past two to three months. There are close to 17,000 guest teachers in government schools.

A complaint written by Shoaib Rana, a guest teacher at a school in Sunder Nagri, said, ""Our salary was stopped due to some reason. Most teachers in the school stay on rent. Not getting the salary on time creates problems for us.""

These three schools include Government Girls Senior Secondary School, Sunder Nagri, Sarvodaya Kanya Vidyalaya, Malkaganj and Bulbuli Khana (Urdu Medium), Sarvodaya Vidyalaya (Middle).

A guest teacher at the Malkaganj school said, ""The principal told us today that the August salary will be processed in two days. They said there were some technical issues.""

The principal of Bulbuli Khana said that the process has started, while at Sunder Nagri, the two months' salary has been processed, said the principal Alka H Singh. ""Right now, they are just clearing the backlog salary,"" said another guest teacher.

However, the director of DoE, Sanjay Goel, said the disbursal of the guest teachers' salary is the responsibility of the principal. ""I don't have the complaint yet but this must be an issue only with some schools,"" said Goel."
"231","1005060271","2018-11-28","https://timesofindia.indiatimes.com/city/goa/students-of-govt-school-at-karvem-boycott-classes/articleshow/66835671.cms","Students of government school at Karvem boycott classes - Times of India","The Times of India",FALSE,"CANACONA/POINGUINIM: All 38 students of a government primary school in Karvem stayed away from their classes on Tuesday, as their parents demanded the transfer of a teacher posted at the school.

The parents gathered outside the school in a peaceful protest, as they expressed opposition to the teacher's posting to Karvem.

The protest is a fall out after a female teacher was sought to be transferred to Karvem from the government primary school, Nuem, Shristhal.

The parents of students from the Nuem school had held a dharna before Diwali vacations and complained against the female teacher. Expressing dissatisfaction with her teaching abilities, they had also alleged that she used abusive language in the classroom.

They had demanded that the teacher be transferred and a new one posted in her place or else their wards would stay away from school.

Deputy director (education, South Goa) Uday Gaonkar had visited the school and had assured parents that a proper decision would be taken after Diwali vacation. And her transfer to GPS Karvem followed.

On Tuesday, the parents categorically stated that they would not send their wards to class till the teacher was transferred. The parents waited till 11am, as ADEI, Ganesh Shet visited the school and informed the parents that the transfer decision has been been taken by higher authorities. Canacona MLA Isidore Fernandes had also approached the ADEI, Canacona, which prompted a discussion between the official, MLA and parents over the issue. Sarpanch of Gaondongorim panchayat, Suman Gaonkar also visited the school."
"232","1004410699","2018-11-27","https://www.hindustantimes.com/it-s-viral/classroom-inside-plane-draws-more-students-to-this-government-school-in-rajasthan/story-p9ZpImwvatuFGp3lQBPWNP.html","Classroom inside 'plane' draws more students to this government school in Rajasthan","Hindustan Times",FALSE,"The classroom inside the plan is fitted with an internet-enabled LED screen where senior students get YouTube lessons and the juniors watch cartoons and hear stories.(Rajesh Lawania)

Most students studying in government schools in India have never seen a plane, leave alone travelling in one. For 406 students of Government Senior Secondary School in Rajasthan's Indargarh village, too, it was a dream to sit in an airplane. A government engineer made this possible a few months ago by erecting a replica of a plane for a classroom in Alwar district. One class for all students is held in this special classroom inside the plane. The students feel so thrilled sitting in a plane that they don't want to go home even after school gets over.

""It has become a major attraction in the village,"" says principal Pushpa Meena. ""Even people from outside the village come here for posing in front of the plane. It has become a selfie point in the village,"" she adds.

Meena said recently after a wedding, the bride and groom came to the school for a photo shoot near the plane.

Until six months ago, the Indargarh government school, 16km from Alwar city, had a dilapidated building, broken classrooms, ceilings that leaked and an unattractive facade.

According to 2016 Annual Status of Education Report (ASER) survey of schooling and learning levels in rural India, Rajasthan is among the top three states with highest dropout rate in children of 11 to 14 years. Against the all-India average of 3.5%, Rajasthan has 5% dropout rate in this age group.

Unattractive schools are a major reason for high dropout rates.

The district unit of Sarv Shiksha Abhiyan (SSA) took up the renovation of the Indargarh school six months ago. SSA junior engineer Rajesh Lawania prepared a proposal for developing facilities at the school and constructing an airplane for a classroom. He approached Sehgal Foundation, a non-profit organisation that has developed 30 government schools in the district, with the project.

In six months, the foundation has spent Rs 45 lakh on the development of the Indargarh school, said foundation official Mahipal Singh.

The classroom inside the plan is fitted with an internet-enabled LED screen where senior students get YouTube lessons and the juniors watch cartoons and hear stories, said the principal.

""The school is already drawing new students. This year, we have had 22 new admissions. The plane classroom has started only this week. We hope to reap its benefits in the next academic session,"" she added.

""Kabhi nahi socha tha ki hawai jahaz me baithkar padhenge, yeh kisi sapne se kam nahi hai (We never thought we will ever sit in a plane. This is nothing short of a dream),"" said Priyanka Saini of Class 11. Her friends, Kanchala and Anju, couldn't agree more.

The villagers are happy with the development and feel a sense of ownership. ""We will look after the school. It has changed our vision towards a school,"" said Jatan Singh, a local.

Former sarpanch Ramjilal Meena said the gram panchayat was fortunate to have a school like this.

The plane has two entries with stairs to climb. There's pathway from the classrooms to the stairs with trees on both sides. ""We planted 1,100 plants to improve the landscape and make the campus children friendly,"" Lawania said.

The SSA engineer had earlier got classrooms of a government school painted like the coaches of a train. ""I am constantly thinking of innovations to make the schools attractive to increase enrolment and to check dropouts,"" he said.

Lawania said he has also never been inside a plane. He looked at YouTube videos to see the insides before designing the classroom."
"233","1001969978","2018-11-23","http://www.newindianexpress.com/states/karnataka/2018/nov/23/government-school-students-to-be-introduced-to-22-languages-in-a-month-1902104.html","Government school students to be introduced to 22 languages in a month","The New Indian Express",FALSE,"BENGALURU: Students at government schools across the country will get introduced to 22 Indian languages in a span of one month, under a new project initiated by the Ministry for Human Resource Development (MHRD).

The Bhasha Sangam programme, under the 'Ek Bharat Shreshtha Bharat' project of the MHRD, will be followed in schools from November 20 to December 21, 2018, during which schoolchildren will be introduced to all 22 India languages of Schedule VIII of the Constitution.

The ministry has released a schedule marking dates for each language, and students have already been introduced to Assamese and Bengali on November 20 and 22, respectively. Next on the schedule is Bodo on November 26, and Dogri on November 27. Kannada is scheduled for introduction on November 30.

During the Bhasha Sangam programme, the school authorities have to introduce students to five sentences of the language fixed for that particular day/date by reading out the sentences in the morning assembly and asking the students to repeat them.

""We need to read out five simple short commonly-used sentences, for eg, what is your name, hello, how are you, etc. In case there are any students who know that particular language we can make them read out the sentences in the morning assembly,"" said a teacher from a government school in the city.

According to the notification issued by MHRD, this programme aims to enhance linguistic tolerance and respect, and promote national integration.

A digital book with audio recordings of the sentences is available on the websites http://epathshala.gov.in/ and the MHRD website http://mhrd.gov.in/bhashasangam so that students can hear the correct pronunciations."
"234","1001943749","2018-11-23","http://www.newindianexpress.com/cities/delhi/2018/nov/23/delhi-government-school-pupils-eat-more-nutritious-food-than-private-school-kids-1901968.html","Delhi government school pupils eat more nutritious food than private school kids","The New Indian Express",FALSE,"NEW DELHI: Quashing a popular belief, a report has revealed that students attending government schools in the national capital have better access to nutritious food than their counterparts in private schools. The Indian Council for Research on International Economic Relations (ICRIER), which compiled the report titled Survey of Fruits, Vegetables and Juice Intake of School Children, Nutritionists and Dieticians, found that students in government schools consumed around 250 grams of vegetables in a day while those in private schools had only 210 grams.

The National Institute of Nutrition (NIN), Hyderabad, recommends that a person should consume at least 300 grams of vegetables a day. Of this, according to NIN guidelines, 50 grams each must constitute leafy vegetables and tubers, while 200 grams should be other vegetables. The institute also recommends intake of 100 grams of fresh fruits.

""Schoolchildren need maximum nutrition and deficiency of micronutrients leads to fatigued learning. Non-consumption of vegetables leads to deficiency of micronutrients, which significantly affects learning abilities. Hence, it is important for schoolchildren to have the required amount of vegetables (micronutrients),"" said Dr YG Deosthale, former director of NIN.

The ICRIER, as a part of the survey, studied the dietary habits of 98, 596 students across 36 government schools and 54 private schools in the city. The students were from Class V to Class XII.The survey found no significant difference in the intake of fruits and vegetables between girls and boys. ""More than 56 per cent students enrolled in Classes V to XII in Delhi-NCR consumed lesser green vegetables than what is mandated. And, only over one-fourth of the students ate fruits daily,"" the report said.

However, according to the report, students in private schools consumed more fruits that those enrolled in government schools. ""While 34 per cent of students enrolled in private schools ate fruits daily, only 25 per cent of those in government schools consumed fruits,"" the report said.

The principal of a private school said that it was not the school's duty to instruct kids on what to eat. ""Almost all students eat what they are told to by parents. What we can do is to make them aware of the benefits of healthy eating. But, in the end they will follow the dietary routine of their house,"" she said.

Officials of the Delhi government's education department could not be reached to answer queries."
