"","ID","date","url","title","source","duplicate","body"
"84","938324035","2018-09-03","https://www.hindustantimes.com/delhi-news/30-students-at-model-govt-school-without-books/story-jj69Tknc3NWEZqfMGCXNBJ.html","30% students at 'model' govt school without books","Hindustan Times",FALSE,"At around 2.30pm, a 12-year-old student sitting outside the government coed senior secondary school in Rohini Sector 22, was hurriedly copying a poem on her notebook from her classmate's English textbook. As she rushed through the task, her classmate patiently waited her to finish.

The class VII student at the school has to do the same thing every day after class because she has not received textbooks for any subject -- which were meant to be provided by the school administration -- even as the ongoing academic session has entered in its sixth month.

The Sarvodaya school, which started functioning in April last year was hailed as an example for how government schools should be run in the Capital and across the country. Not only did it have a spanking new building with a playground, no vacant posts for teachers, and a supply of books and study materials.

The school had become so popular that at least 800 students had moved from private schools in the vicinity to this school, according to the school administration, the Delhi government and parents of students, because of better facilities available free of cost.

But, school officials and parents say that, 17 months later, the school is fast becoming like any other government institution in the city, with 'guest teachers' being hired to fill regular teaching posts and about 30% of the students between Classes VI and VII not receiving textbooks and other study material that they are entitled to under the Right to Education (RTE) Act, 2009.

""I have to copy everything taught by the teachers during the classes as I don't have textbooks to read at home. I like reading. I have copied this poem today. I will read it out to my younger sister at home,"" said the student cited above. She was studying in a private school in the neighbourhood until last year and had moved because of the facilities available at the Rohini government school.

""I have to wait for her to complete her work every day. The class teacher told me that the books will come by the end of this month,"" said the student's mother.

Other parents complained of the same problem. ""I have come here to meet the principal to know about the status of my grandson's books. He has to go at his friend's place every day for whatever work he gets at the school. The officials say that my grandson will not fail the exams as there is some policy for it. But what will he learn without books?"" said the grandfather of a Class VIII student who is among the 20 students in his class who has not received textbooks yet.

As per the section 8 (1) of the Delhi RTE rules, students studying at government schools are entitled to free textbooks, writing material and uniforms up to Class VIII.

Officials at the school say they have provided books to around 80% students. ""Only those who got late admissions are yet to receive text books. We do not have exact number of such students. This year, we got unprecedented number of admissions. The strength is almost doubled from last year's tally of 1,000 admissions,"" said an official who asked not to be named.

The school was also struggling with inadequate staffing till late July. ""The school was not ready to cater the needs of so many students. Until July,it was struggling with shortage of teachers. The teachers were taking combined classes of different sections. We had received complaints from parents and then raised it with the school authority.The problem was fixed after the government deployed 15 guest teachers in August,"" said Satyprakash, convener of the Delhi chapter of All India Parents Association, who has been visiting the school since last year.

Officials at the Directorate of Education (DoE) accepted there was a problem with the supply of books and contended that it had been caused due to a delayed request by the school.

When contacted, Delhi's education minister Manish Sisodia said that he will look into the matter. ""As per my knowledge, we have streamlined the supply of books which was conventionally late every year. But, in this case, I will have to inquire and fix where our system is still failing,"" Sisodia told the Hindustan Times.

Experts working in the field, however, said the situation was similar to what was faced by several other government schools. ""This is just one example. Thousands of students studying in Delhi government schools are waiting for books. We have been receiving such complaints on a daily basis. How do they expect students to study without books?"" said Khagesh Jha of social jurist, an education NGO.

There are 1,024 government schools in Delhi where 15 lakh students are enrolled."
"85","937948858","2018-09-03","https://www.hindustantimes.com/lucknow/in-leaking-govt-school-in-up-students-learn-with-umbrellas-in-hand/story-QaREKNonOXbWnxbVV084aN.html","In leaking govt school in UP, students learn with umbrellas in hand","Hindustan Times",FALSE,"A video and photographs of students holding umbrellas inside the classroom of a government primary school in Barabanki district of Uttar Pradesh is being widely shared on social media.

The children can be seen with umbrellas in one hand and writing with the other in the video because the ceiling of their classroom leaks every time it rains in Banki, which is around 30 km from the state capital of Lucknow.

""As you can see the ceiling of our classroom is leaking so we have no option but to study under an umbrella. We always carry umbrellas to our classroom,"" Muskan, a Class 1 student, is heard saying in the video.

It is not just the leaking roofs of the school, which has just two rooms, that has the children and their parents worried.

""Most of the time parents discourage us from going to school as the building is in a bad condition. Things are scary here. We don't know when our school building will collapse,"" Muskan says.

""Many parents want to withdraw their children from the school as the building is not safe. The leakage has also caused a drop in attendance,"" their teacher, Sunita Mishra, is also heard saying in the video.

She says that they have sent a number of applications to the state education department and the civic bodies in the area but no one has responded so far.

The school gets funds under the Sarva Shiksha Abhiyan, a government programme aimed at boosting education among children in the country. And, the Bharatiya Janata Party-led government in Uttar Pradesh earmarked Rs 18,167 crore for the programme in its budget for this financial year.

The state's basic education minister Anupama Jaiswal said it was shocking to see students sitting with an umbrella in a classroom.

""We will shift the students to some another building. We cannot compromise with the safety of our students,"" Jaiswal said as she promised to seek a detailed report from her department.

Basic Shiksha Adhikari Vinay Kumar said the matter has come to his knowledge.

""I have asked the block education officer to shift the school temporarily to another building and submit a report. Funds have also been issued for the maintenance of the school,"" Kumar said."
"86","937674994","2018-09-02","https://indianexpress.com/article/cities/chandigarh/punjab-education-department-looks-at-ngos-pvt-firms-to-improve-govt-school-infrastructure-5336560/","Punjab Education Department looks at NGOs,  pvt firms to improve govt school infrastructure","The Indian Express",FALSE,"Punjab: In bid to boost results, govt cuts English syllabus by 40 per cent for class 10thPunjab: To fill vacant seats, qualifying marks in entrance exam lowered from 50 % to 45%Punjab: Schools directed to create book bank; Decision taken as PSEB fails to supply required number of textbooks

PUNJAB GOVERNMENT is looking at NGOs, charitable trusts and private firms to improve critical infrastructure in its government schools, to address the financial deficit that government schools face.

Punjab government's Education Department has already launched a project in government schools in the state under its smart school project to enhance the overall performance of school.

A letter by the Director General School Education (DGSE) -cum-State Project Director office to NGOs and all others said that in addition to this, the schools can be supported by introducing digital education (setting up smart class rooms); constructing more class rooms , laboratories and toilets; providing books in libraries; uniform to the students; furniture and free boards in class rooms; creating infrastructure for mid day meals and sports; installing solar power system and RO water coolers and any other way that the donors and schools deem fit.

The Secretary (School Education), Krishan Kumar, has already roped in a large number of donors under smart school project through government schools' staff. With their contribution, the infrastructure of 425 government schools has been improved so far, and the project has set a target for 4250 schools to be converted into smart schools by the end of this academic session.

""With the contribution of such people and organisations, we want to create a sense of belonging in the community that will fund it, so that it will become a sustainable model through ownership and accountability,"" said Kumar, adding that the government will provide support in teaching and resolving specific problems, which will enhance the performance of the government schools in every possible manner.

Must Watch Motorola One first look at IFA 2018: A new Android One device Stree: Public Verdict IFA 2018: Motorola One Power first look, launches in India in October Kerala Floods: How The River Damaged My Hometown Start your day the best way with the Express Morning Briefing"
"87","936619069","2018-08-31","https://indianexpress.com/article/delhi/vice-principal-of-govt-school-kept-money-for-learning-material-claims-govt-5334568/","Delhi: Vice-principal of govt school kept money for learning material, claims govt","The Indian Express",FALSE,"Gomti Devi, the vice-principal of Sarvodaya Kanya Vidyalaya (Annie Besant) in Mayur Vihar's Phase II, was suspended after an inquiry was conducted. When contacted, Devi said she was being victimised for being from the scheduled caste. High Court orders Chennai civic body to transfer all Vigilance Cell officials over corruptionUlhasnagar civic body official suspendedChandigarh Sports Council: Sports equipment worth lakhs bought from govt funds for UT brass, reveals Audit

The Delhi government suspended the vice-principal of a government school on Friday -- the day of her retirement -- for allegedly keeping a part of the money meant for teachers to purchase teaching-learning material.

Gomti Devi, the vice-principal of Sarvodaya Kanya Vidyalaya (Annie Besant) in Mayur Vihar's Phase II, was suspended after an inquiry was conducted. When contacted, Devi said she was being victimised for being from the scheduled caste.

An order issued on August 30 by Chief Secretary Anshu Prakash read, ""In exercise of power conferred by sub rule (1) of Rule 10 of CCS Rules 1995 hereby places Gomti Devi under suspension with immediate effect. It is further ordered that during the period that this order shall remain in force, the headquarters of Gomti Devi should be in Delhi and shall not leave the headquarter without obtaining permission.""

According to the government, teachers are given Rs 500 to purchase teaching-learning material, which includes, stationery, globes, maps and charts. The government has alleged Devi was giving Rs 350 from the amount to teachers, and keeping Rs 150, claiming it was ""GST deduction"".

Education Minister Manish Sisodia had ordered the inquiry following complaints. Following the completion of the inquiry, she was suspended.

Devi, when contacted, said: ""The Education Minister and the Director, Education, had come to the school for inspection. The computer lab was not working so I told them I have informed the company and officers about it. As I raised my voice against the officer, I am being subjected to this. I am a single woman and an SC candidate, so an easy target. I have 40 years of service without facing any such allegation... why should I do all this when my career is at an end? I have been in this school for the past five years.""

She said she received the suspension notice at 12.30 pm on Friday: ""Now they will stop my gratuity and all financial benefits. I don't know what to do.""

Must Watch Demonetisation, a success? Is it still a question: News in Numbers Kerala Floods: How The River Damaged My Hometown India in shortlist for Uber Air launch Shenanigans with 'Stree' Actors Rajkummar Rao, Aparshakti Khurrana and Abhishek Banerjee"
"88","935977919","2018-08-31","https://timesofindia.indiatimes.com/city/chennai/kg-classes-launched-in-govt-school/articleshow/65616922.cms","KG classes launched in govt school - Times of India","The Times of India",FALSE,"CHENNAI: More than three decades after private schools made kindergarten education mainstream, the government has launched KG education in a girls' school in Chennai in a bid to boost student enrolments amid struggles to attract interest in statesponsored education.

Presidency Girls Higher Secondary School in Egmore is the first of 32 schools in the state where KG classes will be held under PPP mode.

A few parents have already enrolled kids in the KG section at Egmore school, set up at a cost of ₹8.9 lakh and opened by school education minister KA Sengottaiyan on August 15.

Headmistress Kanmani said more students were expected to join on October 19, Vijayadasami, considered auspicious to begin schooling. The classroom has been revamped to handle classes for children who are below five years, she added.

S Suba, a teacher who handles this class, said, ""Besides conventional teaching-learning materials, Montessori sensorial models, provided by top private schools, are made available here to help the students learn about sizes, shapes and colours.""

She added that other models would help them learn numerals, basic arithmetic, alphabets and two-four letter words.

Alongside these two teachers, one special teacher named Priscilla has been appointed to train them in English and Tamil pronunciation for one hour daily. Classes are scheduled between 9am and 2.30pm. ""At a time when private schools are charging heavily for KG admissions, this has come as a breather,"" said K Manikandan who is planning to enrol his second daughter in the same school."
"89","935754863","2018-08-30","https://www.thehindu.com/news/cities/Mangalore/govt-school-teacher-arrested-in-puttur/article24824222.ece","Govt. school teacher arrested in Puttur","The Hindu",FALSE,"The Puttur Rural Police on Thursday arrested a teacher from a government school near Nettanige Muduru village in Puttur taluk for allegedly sending a vulgar text message to a student from Class 10 of the school.

According to the police, teacher Manjunath (32), who hails from Pandavapura in Mandya district, reportedly sent the vulgar text message to his student on Wednesday. The girl brought this to the notice of her parents, who rushed to the school with other residents of the village.

After questioning the school's headmaster over Manjunath's conduct, the girl's parents filed a compliant with the Puttur Rural Police. The police took Manjunath into custody and seized his mobile phone. Then, they booked him under the provisions of Protection of Children from Sexual Offences Act. He was produced before the jurisdictional magistrate on Thursday who remanded him to 14 days in judicial custody."
"90","934955017","2018-08-29","https://timesofindia.indiatimes.com/city/thiruvananthapuram/wayanad-madrassa-opens-doors-to-house-govt-school/articleshow/65599946.cms","Wayanad madrassa opens doors to house govt school - Times of India","The Times of India",FALSE,"Kalpetta (Wayanad): The government lower primary school at Kurichiarmala in the district will remain testimony to the nature's fury that has left a trail of death and destruction across the state.

A landslide on August 9 had torn through the school's one-acre compound and created two craters near the building and making it inaccessible.

Until Monday, the teachers and villagers were unsure of the future of the institute's 92 students.

In two days, the uncertainty gave way to a new-found confidence -- now seen across the state -- as the exuberant students started school on the top floor of a madrassa, barely a kilometre away.

The temporary establishment has become a symbol of communal harmony and determination of a resilient village that refused to be cowed down by adverse conditions, despite their debilitating effect.

There was an effort to clean up the three-foot mud and slush from the school building, so that the classes could commence. Recurring landslides, however, posed a constant risk, forcing the authorities and volunteers to abandon their efforts.

Realising the need for continuing the school, the local mahal committee stepped in and offered space in the Hayathul Islam Madrassa building. Local residents and volunteers swung into action and made necessary arrangements on the top floor of the building.

They converted the top floor into a full-fledged school with four classrooms and a staffroom in 72 hours.

As the classes restarted on Wednesday morning, the building earned the distinction of having a madrassa, a mosque and a government school under the same roof.

The school, meanwhile, adjusted its working days. It would be closed on Fridays -- so that the faithful would have enough space for their prayers -- and instead, would work on Saturdays. The arrangement would continue for the rest of the academic year.

Authorities said the school would function in the madrassa until it a new building somewhere nearby.

Among the students who attended school on Wednesday, five have been rendered homeless by the landslides. A Facebook community, Human Being Collective, Malabar Flood Relief Forum and Green Palliative Volunteers had raised around Rs 4 lakh and helped the villagers recreate the school, which now sport brand new furniture, blackboards, teaching aids and colourful walls with animated characters and even indoor plants.

The pre-primary section has been accommodated in the madrassa's courtyard, where the Hayathul Islam mosque is also located.

""Even the children hailing from families who had suffered huge losses in the landslide were so happy on seeing their new school. It will immensely help them in erasing their traumatic experiences,"" district collector Keshvendra Kumar said.

The school it is also a reaffirmation of the secular credentials of Kerala where everyone is helping each other, cutting across religious, social and other barriers,"" who spent around three hours at the school, added.

The school's PTA President Mohammed Aslam, also the vice president of the mahal committee, said the entire mahal was very forthcoming in opening up its premises for the school. ""Though properties worth crores were lost in the landslide, our biggest loss was the Kurichiar Mala LP School. Most of the people in the village work in the nearby tea plantation and the school was their only hope for a better future of their children,"" Aslam said.

School headmaster Sasi P K said the deputy director of education has sanctioned the changes in the school working days to facilitate the Friday prayers at the mosque.

C K Saseendran, representing Kalpetta in the state assembly, said the school would be upgraded to a upper primary school with Rs 1 crore from the MLA fund and a Rs 49 lakh grant from the central government's multi-sectoral development programme. The Tata Group, meanwhile, has promised to construct a new building for the school on identifying a new location.

The district collector said the damaged school building would be converted to a memorial to showcase how the people overcame the natural calamity."
"91","933908678","2018-08-28","https://www.firstpost.com/india/inside-one-of-the-happiness-classes-introduced-by-delhi-govt-for-school-students-up-to-class-viii-5064481.html","Inside one of the Happiness classes introduced by Delhi govt for school students up to class VIII - Firstpost","Firstpost",FALSE,"Watch Full Video

Delhi govt launched Happiness Curriculum in around 1000 Delhi govt schools last month. Firstpost attended one of the Happiness classes in a school at Chirag Enclave.

Updated Date: Aug 28, 2018 19:42 PM"
"92","933326434","2018-08-27","https://www.thehindu.com/news/cities/Delhi/land-allotted-to-govt-for-school-construction-dda-tells-hc/article24796046.ece","Land allotted to govt for school construction, DDA tells HC","The Hindu",FALSE,"The Delhi Development Authority (DDA) told the High Court on Monday that it has allotted land to the government for construction of a building for a minority school.

The school has been functioning out of tents since its demolition over 40 years ago during Emergency.

A Bench of Chief Justice Rajendra Menon and Justice V.K. Rao was told that a plot of 4,000 square metre has been allotted by the DDA for construction of the school in Old Delhi.

Plea disposed

It noted that the competent authority had in principle granted approval for construction of the secondary school at Eidgah at Quresh Nagar in the Walled City. The Bench disposed the plea after the petitioner expressed satisfaction over the development.

The court had last year asked the government and the authorities concerned to explore the possibility of allotting land for the minority school. It had asked the Delhi Chief Secretary to coordinate with all agencies, including the DDA and the civic body.

The court was hearing a petition filed by civil activist Firoz Bakht Ahmed, who contended that the State of affairs at the Qaumi School was ""sad and pitiable"" as it was functioning from Eidgah grounds in Old Delhi after its building was demolished."
"93","932266689","2018-08-26","http://www.asianage.com/metros/delhi/260818/govt-school-teacher-arrested-for-sexual-abuse-of-minor-student-in-delhis-burari.html","Govt school teacher arrested for sexual abuse of minor student in Delhi's Burari","The Asian Age",FALSE,"New Delhi: A 52-year-old teacher of a government school in north Delhi's Burari was arrested for allegedly sexually abusing his 15-year-old student, police said on Saturday.

The incident came to light after a video of the act was forwarded by the teacher to an acquaintance who made it viral with an intention to blackmail the accused, a senior police officer said.

The incident came to light day following which the teacher was arrested, the officer said, adding it was suspected that the video was shot in June.

The police were probing whether the accused had abused other students and how long he had been abusing the victim.

The victim stays with his family in northwest Delhi's Swaroop Nagar. The parents of other students staged a protest outside the school on Saturday demanding strict action against the teacher.

Earlier this month, an electrician was arrested for allegedly raping a Class 2 student in a New Delhi Municipal Council School."
"94","932149826","2018-08-26","https://www.indiatvnews.com/news/india-govt-school-teacher-arrested-for-sexually-abusing-student-in-delhi-459809","Govt school teacher arrested for sexually abusing student in Delhi","India TV News",FALSE,"The incident came to light on Friday following which the teacher was arrested, the officer said, adding it was suspected that the video was shot in June.

A 52-year-old teacher of a government school in north Delhi's Burari was arrested for allegedly sexually abusing his 15-year-old student, police said.

The incident came to light after a video of the act was forwarded by the teacher to an acquaintance who made it viral with an intention to blackmail the accused, a senior police officer said on Saturday.

The incident came to light on Friday following which the teacher was arrested, the officer said, adding it was suspected that the video was shot in June.

The police were probing whether the accused had abused other students and how long he had been abusing the victim.

The victim stays with his family in northwest Delhi's Swaroop Nagar.

The parents of other students staged a protest outside the school today demanding strict action against the teacher. Earlier this month, an electrician was arrested for allegedly raping a Class 2 student in a New Delhi Municipal Council School."
"95","932033612","2018-08-25","https://www.business-standard.com/article/pti-stories/govt-school-teacher-arrested-for-sexually-abusing-student-in-delhi-118082600009_1.html","Govt school teacher arrested for sexually abusing student in Delhi","Business Standard",FALSE,"The incident came to light after a video of the act was forwarded by the teacher to an acquaintance who made it viral with an intention to blackmail the accused, a senior police officer said.

The incident came to light yesterday following which the teacher was arrested, the officer said, adding it was suspected that the video was shot in June.

The police were probing whether the accused had abused other students and how long he had been abusing the victim.

The victim stays with his family in northwest Delhi's Swaroop Nagar.

The parents of other students staged a protest outside the school today demanding strict action against the teacher.

Earlier this month, an electrician was arrested for allegedly raping a Class 2 student in a New Delhi Municipal Council School."
