"","ID","date","url","title","source","duplicate","body"
"151","965379502","2018-10-09","https://telanganatoday.com/police-reconstruct-govt-school-in-warangal","Police reconstruct govt school in Warangal","Telangana Today",FALSE,"Warangal Rural: Touched by the sorry state of affairs at the government primary school at Chilakammanagar village, the Khanapur police with the support of Narsampet ACP Sunitha Mohan have reconstructed the school. They have constructed a five-room shed with asbestos roof and also provided benches to the students. They have also got beautiful pictures and maps on the walls of the school.

All it happened following a visit by the then Narsampet rural inspector Bonala Kishan, who saw the deplorable conditions at the school, and brought the issue to the notice of ACP Sunitha Mohan. Following this, the ACP after consulting the officials have decided to contribute money from their pockets and also raise funding from the local philanthropists and dismantled the building as it was in a dilapidated condition, after getting the due permission from the district education officer (DEO), and reconstructed the school.

While there are about 50 students at the school, three teachers are working. When asked how much money they had spent on the reconstruction, ACP Sunitha Mohan did not wish to disclose the amount. ""I wish not to reveal the amount spent on the reconstruction since it is a philanthropic activity,"" she told Telangana Today.

Meanwhile, Commissioner of Police (CP) Dr Vishwanath Ravinder has paid a visit to the school on Tuesday and appreciated the police including ACP Sunitha Mohan, Inspector Kishan, Inspector Satish Babu and Sib-Inspector Abhinav for contributing money from their pockets. ""Police are also in the forefront in responding to the social issues,"" he said. Meanwhile, East Zone DCP Anuradha, who accompanied the CP, promised to donate Rs 10,000 in memory of her father for setting up the library at the school."
"152","963230185","2018-10-06","http://www.dailyexcelsior.com/grp-katra-organizes-civic-action-program-govt-school/","GRP Katra organizes 'Civic Action Program' in Govt school","Jammu Kashmir Latest News | Tourism | Breaking News J&K",FALSE,"Excelsior Correspondent

REASI, Oct 6: GRP Katra today organized a ""Civic Action Program"" in Government Primary/Middle School Blad Sangar, in Zone Gandhi Nagar.

School toilets have been repaired to facilitate both male and female students of the school under the said programme. On the occasion, SSP Railways Katra, Ranjit Singh Sambyal while speaking, emphasized upon the teachers to inculcate ethical values among students.

The students were also advised to keep themselves away from the drug abuse and illegal activities which are growing faster in the society. The SSP also stressed upon the parents, who were also present in the function, to keep a close watch on the activities of their kids so that they can be kept away from indulging in any illegal activities.

The programme was attended by Bodh Raj, Surinder Singh Baloria (SDPOs Katra/ Udhampur), SHO Manwal and I/C, PP Sangar, Headmaster of the school, students, school staff and prominent citizens of the locality."
"153","963093628","2018-10-06","http://www.asianage.com/india/all-india/061018/no-roof-toilet-plight-of-students-of-this-jammu-and-kashmirs-govt-school.html","'No roof, toilet': Plight of students of this Jammu and Kashmir's govt school","The Asian Age",FALSE,"Udhampur: The students of a government primary school have been studying under the open sky for over a year now. The roof of the school was blown away by a storm in June last year.

The students of Government Primary School Mohalla Tallaian are often compelled to sit in front of the damaged school building in the open to take their classes.

The school with forty students, many of whom are girls, also lacks facility of a working toilet.

Highlighting the concerns of the students and teachers, Jagdish Singh a local resident of the village said, ""This is a government school which has 40 students and two teachers. In 2017 the roof of this got damaged during a storm. Since then no one bothered to repair the roof.""

He further said the school has to be closed whenever there is a rain.

""The education of students is suffering. We have now taken a small room in the village on rent but that is not adequate as five classes in one room cannot be taught properly. The students can't fit in that room as well and students have to mostly sit outside.""

A student of the school, Vandana, shared, ""We sit in sunlight and face a lot of problem. We do not have any place for sanitation nor a playground. We want that school should be repaired.""

Manoj Kumar, another village resident echoed similar sentiments and added, ""The school has remained damaged since June last year. The roof of school was of tin and it flew away in the storm. There is no place for students to study. They somehow manage in a room provided by a village resident. We have approached authorities but it has been fifteen months and we have not got any response.""

Vijay Kumar, the teacher at the school also claimed to have informed the concerned authorities.

He said, ""We have informed concerned authorities about our problem. We appeal to the government to provide us with a building. There is neither facility of toilet nor any playground.""

Upon being apprised about the poor condition of the school, Deputy Commissioner of Udhampur assured immediate action.

Udhampur Deputy Commissioner Ravinder Kumar told ANI, ""It has come to my notice and it is very unfortunate if the building hasn't been repaired since last one and half years. I have sought a report in this regard. We have released money and are hopeful the contractor will start repair work in 3-4 days."""
"155","960921984","2018-10-04","https://timesofindia.indiatimes.com/city/mysuru/govt-school-teacher-keeps-liquor-bottle-inside-teetotaller-headmasters-bag/articleshow/66060000.cms","Govt school teacher keeps liquor bottle inside teetotaller headmaster's bag - Times of India","The Times of India",FALSE,"Hassan: How to get your colleague defamed and sacked? Plant a liquor bottle inside his lunch bag and ask students to create a ruckus. An assistant teacher in Doddagavanahalli, under Arkalgud Block Education office, came up with this trick to corner the headmaster. However, the move boomeranged as the headmaster does not consume liquor. The department of public instruction has suspended teacher Nanjappa pending inquiry.

It all started on Tuesday noon with Nanjappa allegedly keeping a liquor bottle inside the lunch bag of H D Nagaraj while the latter was inspecting the kitchen while midday meal was being prepared. He allegedly told the students to check the headmaster's lunch bag. Students found the liquor bottle and Nanjappa alerted the School Monitoring and Development Committee (SDMC) members.

As the news spread, villagers gathered in front of the school and threatened to lock the school if the issue was not resolved. Locals education department officials visited the school and sought time to find the culprit.

On Wednesday, Block Education Officer (BEO) K V Suresh informed that the teacher in question Nanjappa is suspended. ""We have also directed headmaster Nagaraj to furnish a report on the incident. It was a bad development. Schools are equal to holy places,"" he said.

According to locals, Nanjappa and Nagaraj had differences since the past few months due to various reasons. ""The school has just 37 students with three teachers. The teachers must work hard to attract more students. These incidents will force the parents to send their kids to other schools,"" opined Rama Gowda, a local resident."
"156","959923312","2018-10-02","https://www.thehindu.com/news/cities/Coimbatore/free-breakfast-scheme-introduced-in-govt-school/article25106685.ece","Free breakfast scheme introduced in Govt. school","The Hindu",FALSE,"A joint initiative of philanthropists, alumni and members of the public

As many as 60 students of the Government Primary School in Urumandampalayam will no longer skip the first meal of the day as a group of socially-minded people have joined hands to serve freshly-cooked breakfast free of cost.

The free breakfast scheme, a joint initiative of a few philanthropists, alumni and members of the public, was launched on Tuesday to coincide with the 150th birth anniversary of Mahatma Gandhi and death anniversary of former chief minister K. Kamaraj, who introduced mid-day meal scheme in schools.

According to those behind the humanitarian gesture, the free breakfast scheme was one of the several efforts being taken to increase the student strength of the school. While the school had barely 25 students studying in Class I to V around five years ago, it has now increased to 60. Located in a remote area near Thudiyalur, the school has two teachers.

C.K. Kannan, a businessman from Urumandampalayam who is part of the initiative, said that people from all walks of life should come forward to help the school increase the number of students. He said that the free breakfast scheme would help achieve the goal. The breakfast menu includes either roti, dosa or idli along with egg and milk on all working days.

The event held on Tuesday was organised by the alumni of the school, the public and members of the Indian Health Service."
"157","959877750","2018-10-02","https://timesofindia.indiatimes.com/city/coimbatore/public-alumni-pitch-in-to-provide-breakfast-to-govt-school-students/articleshow/66046071.cms","Public, alumni pitch in to provide breakfast to govt school students - Times of India","The Times of India",FALSE,"Coimbatore: Residents of Urumandampalayam near Thudiyalur and former students of the 94-year-old government primary school in the area, have come together to provide free breakfast to the students. They began the scheme on Tuesday to mark the 150th birth anniversary of Mahatma Gandhi and the death anniversary of former Tamil Nadu chief minister K Kamaraj.

Former students said they had gathered both alumni and old-time residents of Urumandampalayam and had devised a plan to make sure that the plan to provide free breakfast to the students would go on without hiccups. They further said they had prepared a list of dishes to be provided, spoken with a caterer in the locality and had decided the cost for providing them.

""Later we calculated the cost for providing the breakfast per month and selected 12 people to provide breakfast every month,"" said U K Babu, 49, a farmer and businessman from the area, who would provide food to the students for October. He said there were 55 students in the school and the cost for providing them food for a day came around Rs 1, 200. For 22 working days per month, it would cost around Rs 28, 000. Babu said they had selected people who were ready and afford to help.

""We often see news reports saying students faint in the morning classes as they haven't had breakfast. Private schools can afford to provide morning tiffin to their students. We thought Urumandampalayam residents and old students had to pitch in to help our school students,"" Babu said.

Babu said the school's alumni had earlier helped the school by constructing toilets. ""Earlier 350 students had studied in the school, but now only 55 students are there. We also wanted our school to continue working and not locked up like other schools which were closed due to low student strength,"" he added.

School authorities said the school was started in 1924 as a 'Thinnai Pallikkoodam' and later became a government-aided school. It became a government school in 2010."
"158","959077080","2018-10-01","http://www.asianage.com/metros/delhi/021018/govt-school-heads-to-be-trained-at-cambridge.html","Govt school heads to be trained at Cambridge","The Asian Age",FALSE,"New Delhi: The Delhi government is sending 60 principals of its schools to the prestigious Cambridge University in England for a training programme.

Announcing the decision on Monday, deputy chief minister Manish Sisodia said the principals would be sent in two batches of 30 each for the Inspiring Leadership Improving Performance.

""The Delhi government has increased it teachers-training budget more than 11 times from Rs 9 crore to Rs102 crore. After the improvement in infrastructure in government schools, the next target is that the teachers should be trained at the best level,"" Mr Sisodia said while addressing a gathering of principals here.

While the first batch will be at Cambridge between October 8-17, the training for the next batch will be from October 19-28.

So far, around 119 Delhi government school principals have attended the 10-day programme at Cambridge.

""Teachers should have the first-hand experience of the best education practices of the world and it is with this perspective that our government stresses on teachers' training at best institutes of the world,"" the education minister said."
"160","958850444","2018-10-01","https://www.business-standard.com/article/pti-stories/delhi-govt-school-principals-to-get-training-at-cambridge-118100100819_1.html","Delhi govt-school principals to get training at Cambridge","Business Standard",FALSE,"HC directs authorities to ensure no defacement of prop during DUSU polls

The Delhi government is sending as many as 60 principals of its government schools to the prestigious Cambridge University in England for a training programme.

Announcing the decision on Monday, Deputy Chief Minister Manish Sisodia said the principals would be sent in two batches of 30 each for the Inspiring Leadership Improving Performance. While the first batch will be at Cambridge between October 8 -17, the training for the next batch will be from October 19-28.

""The Delhi government has increased it teachers-training budget more than 11 times from Rs 9 crore to Rs 102 crore. After the improvement in infrastructure in government schools, the next target is that the teachers should be trained at the best level,"" Sisodia said, while addressing a gathering of principals here.

""Teachers should have first-hand experience of the best education practices of the world and it is with this perspective that our government stresses on teachers' training at best institutes of the world,"" the education minister said.

He appealed to the principals not to confine themselves to merely training-seekers at Cambridge, but as education administrators. ""My suggestion is go with prior preparation and be completely focused during your training tenure.""

""All of you are being sent on tax payers' money... Therefore, in return, I expect you to be the harbingers of change in making Delhi government schools' education world class. This will be a great service,"" he added.

So far, around 119 Delhi government school principals have attended the 10-day programme at Cambridge."
"161","958850722","2018-10-01","https://www.business-standard.com/article/news-ians/60-delhi-govt-school-principals-to-go-to-cambridge-118100100862_1.html"," 60 Delhi govt school principals to go to Cambridge ","Business Standard",FALSE,"Delhi government will send 60 principals of government schools to UK's Cambridge University for a leadership training programme this month, Deputy Chief Minister and Education Minister Manish Sisodia said on Monday.

The principals will be sent in two batches of 30 each, he said.

""The first batch will be at Cambridge between October 8 and 17. The training for the next batch will start from October 19 to 28,"" he said.

Addressing the principals, Sisodia said Delhi government has increased it teachers' training budget more than 11 times from Rs 9 crore to Rs 102 crore.

""After improvement in infrastructure in Delhi government schools, people feel that children studying in government schools should get world-class education. An important step in that direction is that teachers should be trained at the best level.

""Teachers should have first-hand experience of best education practices of the world. It is with this perspective that our government stresses teachers' training at best institutes of the world,"" Sisodia said.

He appealed to the principals not to confine themselves to merely training seekers at Cambridge, but as education administrators.

""My suggestion is go with preparation, and be completely focused during your training tenure,"" the Deputy Chief Minister said.

""All of you are being sent on tax payers' money, therefore in return, I expect you to be harbingers of change in making Delhi government schools' education world class. This will be a great service,"" Sisodia said.

He also told the principals that they would get a chance to visit schools there and they should form an understanding about the autonomy and accountability of schools.

""I am in favour of schools getting complete autonomy, which comes with accountability. I would like to know your views about autonomy and accountability there,"" Sisodia said.

Mentioning about the School Management Committees (SMCs), Sisodia asked the principals to learn about the concept, role and decision-making abilities of such committees in the United Kingdom.

He also encouraged the teachers and principals to be active on social media platforms.

""Please share your Cambridge experiences on Facebook and Twitter. This will help your colleagues and other teachers across the country to pick up best education practices across the world,"" he said.

During the last three-and-a-half years, Delhi government has been sending teachers and principals to the best institutes of the world.

So far, 119 Delhi government school principals have attended the 10-day Inspiring Leadership Improving Performance at Cambridge."
"162","955813605","2018-09-27","https://www.abplive.in/india-news/bihar-govt-school-students-made-to-sleep-on-streets-outside-patna-zoo-during-excursion-trip-760336","Bihar: Govt school students made to sleep on streets outside Patna zoo during excursion trip","ABP Live",FALSE,"Bihar: In an outrageous incident, students of a government school of Champaran were made to sleep on the streets on Tuesday night while they were out for an excursion trip in Patna. As per sources, the students of were on the trip as a part of Mukhyamantri Bihar Darshan Yojna and were made to sleep outside Patna zoo.

Clearly no hotel was booked for the students and their safety and security was placed around with.

Related

The highly shocking incident was captured by someone, where the students can be seen sleeping on the ground on the street, and a school bus is parked next to the pavement where the students can be seen sleeping, without shelter.

No statement has come from school authorities so far, nor has any action come from Chief Minsiter Nitish Kumar government against the school authorities.

For INDIA News Follow us on Facebook, Twitter, Google+ and for news updates download our News App.

Tags: bihar CHAMPARAN Mukhyamantri Bihar Darshan Yojna nitish kumar patna patna zoo"
"163","955241035","2018-09-26","https://www.ibtimes.co.in/75-govt-school-students-compelled-sleep-pavement-patna-781574","75 govt school students compelled to sleep on pavement in Patna","International Business Times, India Edition",FALSE,"An inquiry has been ordered into the matter, said RK Mahajan, the Principal Secretary in the Education Department.

Around 75 students of a government school on an educational trip to Patna were forced to spend the night on a pavement after their vehicle developed a fault, officials said on Wednesday.

An inquiry has been ordered into the matter, said RK Mahajan, the Principal Secretary in the Education Department.

The students of the government middle school in a village in East Champaran district arrived in Patna to visit the Sanjay Gandhi Zoological Park and other places.

""After the trip was over, their bus driver told their teachers that the vehicle had developed a problem and expressed his inability to drive it on Tuesday night.

With no other option, the students were asked to sleep on the pavement,"" an official said.

The students then forced spent the night under the open skies on a pavement off Bailley Road."
"164","954852507","2018-09-26","http://www.newindianexpress.com/cities/chennai/2018/sep/26/govt-school-karate-champs-seek-funds-for-intnl-tourney-1877086.html","Govt school karate champs seek funds for intn'l tourney","The New Indian Express",FALSE,"CHENNAI: Over 10 medals of victory weigh down the tender neck of nine-year-old AM Siddesh Hariharan. He carries with him a fat folder full of certificates he won at various Karate tournaments in the State. Siddhesh, who studies at a small government municipal school in Zameen Pallavaram has exceeded his teachers' expectations by winning almost every tournament he's been to. Four other students from his school -- M Aaris, I Hari Govind Gokul Raj, M Manoj Kutty and T Bharath Kumar -- and he have the opportunity to contest in an international tournament in Sri Lanka, but don't have the funds to travel.

This school is a little different from others. The school has a strength of over 600 students and is extremely sought after in the neighbourhood as it provides a holistic education to children by offering karate, carrom, chess and Bharatanatyam classes after school hours.

All the extra-curricular activities are funded by teachers, parents and well-wishers of the school and not by the government. ""Nearly 40 students learn karate, 60 learn Bharatanatyam, 35 students learn chess and most students play carrom,"" said N Karthikeyan, head master of the school.

The students are trained by Sensei RS Srinivasan at '100 a month. A team of teachers from school headed by teacher A Geetha, collected funds, to pay for the classes. She finds patrons every time a student upgrades to the next belt in karate.

The school management has chosen five students to contest at an international tournament in Sri Lanka. For every student, it will cost up to '50,000 for flight, transport, stay (for four days), food and accommodation, explained Srinivasan.

However, no parent has the money to send their kids abroad for a tournament. ""This tournament will be life-changing for them, as they will get tremendous exposure through international tournaments. And to go to such large stages from a government school, it will be an inspiration for all students who cannot afford private schools,"" said Srinivasan, the Karate master. To provide funds, contact: 9543197917, 9003134677

Wins

When the karate students were recently taken for a South-Indian Karate Tournament in Pudukottai, they won 15 gold medals, two silver medals and 9 bronze medals. Siddesh alone won four gold medals in the competitions he participated in."
"165","954586882","2018-09-25","https://www.business-standard.com/article/pti-stories/govt-school-principal-held-taking-rs-4-500-bribe-118092501170_1.html","Govt school principal held taking Rs 4,500 bribe","Business Standard",FALSE,"The accused Ved Prakash, principal of the government senior secondary school, Raisinghnagar, had demanded the bribe from a private school's principal for submitting a favourable school inspection report under Right to Education (RTE).

After verification of the complaint, the accused was caught red-handed taking the bribe, Additional SP of Anti-corruption Bureau Rajendra Dhidharia said.

Prakash was arrested under the Prevention of Corruption Act."
