"","ID","date","url","title","source","duplicate","body"
"217","1014414716","2018-12-09","https://indianexpress.com/article/cities/delhi/in-push-for-sports-five-clay-tennis-courts-at-delhi-govt-school-5485727/","In push for sports, five clay tennis courts at Delhi govt school","The Indian Express",FALSE,"These courts are part of the Delhi government's initiative to involve various academies, clubs and trainers in the training of student sportspersons in government schools.

Bringing tennis to Delhi government schools, five clay courts were inaugurated by Education Minister Manish Sisodia at Sarvodaya Kanya Vidyalaya No 2 in Punjabi Bagh Sunday. According to officials, the courts can be used by both private and government school students. Coaching, meanwhile, will be provided by Puneet Rawat, who runs tennis academy 'Tennis O Holic'. However, officials said, rackets and kits will be provided free of charge only to government school students.

""It is a core intervention in sports, where students from government schools can get the best coaching. Most of our schools are idle after hours, so this is the optimum utilisation of resources... Students from private schools can also avail the opportunity,"" said Sisodia.

Enrollment for coaching began two weeks ago. Around 180 students are from government schools, of which 140 are from Sarvodaya Kanya Vidyalaya No. 2, and 13 are from private schools nearby. The children are aged between 8 and 12 years.

These courts are part of the Delhi government's initiative to involve various academies, clubs and trainers in the training of student sportspersons in government schools. Under the initiative, private academies can use the premises of government schools for commercial use. But they cannot charge fees from government school students, who must make up half the total number of children enrolled for training at the premises.

Advertising

Apart from tennis, the private trainer-government school initiative has been extended to other sports such as volleyball, taekwondo, basketball, football, cricket, softball, boxing, kabbaddi, judo, hockey, and athletics among others.

The government is also starting its initiative, ""Play and Progress"", to provide financial assistance to ""upcoming school sportspersons"".

Eligible students -- who have lived in Delhi for the last three years or are regular students of any Delhi school for three years -- will receive financial support for nutrition, equipment, medical insurance and travel within the country, with a ceiling of Rs 2 lakh for students up to the age of 14 and Rs 3 lakh for those up to 17 years. Those selected will have to represent Delhi in all tournaments they choose to participate."
"218","1014397730","2018-12-09","https://www.thehindu.com/news/cities/Delhi/tennis-academy-opened-at-govt-school/article25706412.ece","Tennis academy opened at govt school","The Hindu",FALSE,"Policy allows private academies to use premises of govt-run schools

Deputy Chief Minister Manish Sisodia on Sunday inaugurated five tennis courts and a tennis academy at Sarvodaya Kanya Vidyalaya No. 2 in Punjabi Bagh as part of the Delhi government's policy that allows private academies to use the premises of schools run by the government.

These academies are given land for free and can use it commercially on two conditions -- half of all enrolments should be from Delhi government schools and that these students are not charged a fee.

Mr. Sisodia said the policy has received very enthusiastic response from organisations with expertise in sports training, and imparting art and cultural activities to children.

Stating that there should not be any difference in the quality of training, the Education Minister instructed the academy to ensure there is no segregation between students from surrounding areas and those from Delhi government schools.

He also asked the MLA and the school principal to explore the possibility of organising inter-school tournaments once the students are trained.

The Delhi government has also rolled out a 'Play and Progress' scheme to help talented sportspersons at the school-level hone their skills. Under the scheme, sportspersons under the age of 14 years are eligible to receive a quantum of assistance of ₹2 lakh per annum and ₹3 lakh for students in 14-17 years age bracket. The quantum of assistance can be enhanced by 20% in some cases.

Specialised training for these sportspersons is organised at 18 places, including Chhatrasal Stadium, Thyagaraj Sports Complex, East Vinod Nagar Sports Complex and Najafgarh Stadium.

Another scheme rolled out for established young sportspersons, called 'Mission Excellence', aims to see 100 top-level sportspersons of Delhi receive training and coaching sponsored by the government to prepare for international tournaments and championships.

Mr. Sisodia said that the problem with sports administration was that decision-making powers are held by those who have had no link with sports in their lives. ""The Delhi government has formed a special panel of experts with sportspersons to pick talented students, coaches and coaching techniques."""
"219","1012789763","2018-12-07","https://www.latestly.com/india/education/govt-school-in-meerut-is-better-than-any-private-institution-in-town-students-thrive-to-get-admission-527032.html","Govt School in Meerut Is Better Than Any Private Institution in Town; Students Thrive to Get Admission | LatestLY","Latestly",FALSE,"Parents are always concerned about their children getting a quality education. In a bid to that, many of us choose private over the government schools because of undeniable reasons. But not everyone can admit their child to the private institutions due to its high annual fee charges. Hence, they end up in government schools. Sadly, time and again even after the government's constant effort, the govt-run schools have disappointed the educators with its lack of facilities. This is not the case with Meerut. Reportedly, a government school in the town is more preferred among parents and students than any other private institution. Mount Carmel School in Delhi Loses Recognition Over Fee Hike.

Primary School-1 in Phaphunda is appearing in the headlines for its ""money-back policy."" A 2016 recipient Vidyalaya Puraskaar, this school returns the money if they are not satisfied with the performance of their wards. According to TOI, the Primary School-1 ask the parents to send their kids studying in private institutions to their school for three months. And if they find no improvement in their child, they pay back the fees. The Principal Kausar Jahan reported that she visits every home personally to convince the parents to send their kids to the school and also announce schemes on the public address system.

The block education officer of Meerut, Charan Singh was quoted in the same report, ""The school has been doing very well since last few years. During his visit to the school last week, the district magistrate gave an appreciation letter, saying he was happy to interact with the kids. In other schools, we have to try hard to engage with the students. But the situation is completely different here. The quality of education here is the best in the district."" Gujarat GSHSEB Class 10 & 12 Board Exam 2019 Timetable Announced.

With their unique approach and quality education, the school which had 190 students in 2014, has seen a massive improvement. In the last four years, the principal reported that the number of students has doubled. Talking about the interior, the school has an activity room with a projector, a laptop, a printer and colourful flex board with cartoons. Besides, the parents have also seen progress in their child and even recommends other families to shift their children from the private school. Today, where quality education has only become expensive, we need more institutions like Primary School-1 across for the betterment of our future generation."
"220","1011513325","2018-12-05","http://www.dailyexcelsior.com/safety-compromised-as-govt-school-sans-boundary-wall/","Safety compromised as Govt school sans boundary wall","Jammu Kashmir Latest News | Tourism | Breaking News J&K",FALSE,"UDHAMPUR, Dec 5: Government High School Jhakhar is without boundary wall thus compromising with the safety of students studying there.

Despite repeated pleas to the concerned higher authorities highlighting the risks involved due to no boundary wall of the school, nothing positive has been done with the result that students continue to face threat to their lives.

Click here to watch video

According to the students and the locals, the school is situated in the close vicinity of a forest and wild animals venture into the school premises very often. Further, they added, there is an open well near the school and in absence of boundary wall, mishap can happen any time.

The situation can be gauged from the fact that the school misses extra-curricular activities to avoid any mishap because of no boundary wall and even during the recess time, the students are asked to take extra caution by remaining confined to safer area.

The School Headmistress told the Excelsior that the students could not concentrate on their studies as their attention gets diverted to happenings outside the school premises. ""We repeatedly apprised the CEO Udhampur about all this but nothing was done except assurances to construct the boundary wall,"" she added and urged the Governor to issue necessary instructions for construction of boundary wall for safety of the students."
"221","1010321135","2018-12-04","https://www.latestly.com/india/news/odisha-govt-school-headmaster-peon-beaten-up-for-harassing-tribal-girl-student-watch-video-521792.html","Odisha: Govt School Headmaster, Peon Beaten up For Sexual Misconduct, Watch Video | LatestLY","Latestly",FALSE,"Mayurbhanj, December 4: A headmaster and peon of a government-run school were beaten up by locals on Monday for sexual misconduct. Locals also locked the duo who were later rescued by the police. The incident took place Hatipatuka residential high school in Odisha's Mayurbhanj district. Peon was then booked on the basis of the complaint lodged by the girl's mother.

The girl had complained against the school peon, identified as Rabindra Sahu, to her parents that he was harassing her since the last few days. On Monday, enraged locals of Panchupalli, Khirpada, Hatipatuka and nearby villages stormed the school and detained the headmaster and peon. Although, the headmaster tried to calm the mob, they did not relent and started beating Sahu. SRM University Students Stage Protest on Campus Alleging Inaction on Sexual Harassment Complaint.

When the headmaster intervened, he too was assaulted. Locals then locked the duo inside a room. On being informed, the police reached the school and rescued the headmaster and the accused. Locals accused the headmaster and the peon of forcing students to do their personal works. They also alleged that students who refused to do their personal chores were tortured.

""The duo also forced the girls to clean their clothes and bedroom. Some students have also accused the headmaster of touching them inappropriately,"" locals told a leading daily. Students alleged they had complained about the substandard quality of food being served in the school but the headmaster didn't pay heed.

After assaulting the headmaster and the accused, locals also blocked the road between Manitri and Baisinga demanding action. The blockade was withdrawn after police assured to look into the matter. An investigation was underway against the peon."
"222","1009845313","2018-12-04","https://www.hindustantimes.com/education/44-k-delhi-govt-school-students-yet-to-receive-uniform-subsidy-due-to-defunct-bank-accounts/story-iF8wniQn16JJH0Z0HSEjZM.html","44 K Delhi govt school students yet to receive uniform subsidy due to 'defunct' bank accounts","Hindustan Times",FALSE,"Nine months into the academic session, as many as 44,191 government school students are yet to receive subsidy for uniforms from the directorate of education (DoE) as their bank accounts are ""non functional"". The DoE transfers the subsidy directly to students' bank accounts.

According to the circular issued by DoE's consultant (planning) NT Krishna to the heads of all government schools in Delhi last week, the department has transferred the subsidy to 14,20,191 students. ""The directorate of education is unable to disburse the money to 44,191 students as their bank accounts have not been submitted/entered online on the directorate website or their accounts are non-functional,"" the circular said.

The highest number of complaints about bank accounts -- 9,692 -- was reported from schools in north-east district of Delhi, followed by those in the south-east at 6,629, and 5,810 from east Delhi schools.

""The head of schools are advised to act fast and enter details of these students latest by December 10,"" Krishna said.

As per the Right to Education (RTE) Act, students of government schools are entitled to receive free books, stationery items and uniforms up to class 8. The Delhi government distributes books to these students and transfer subsidy for uniforms and stationery directly into their bank accounts once a year.

Sanjay Goel, director DoE, said, ""These students are either irregular or took late admissions. There are cases wherein students had enrolled in schools but never turned up. In such cases, it is very difficult to trace them. We have asked our district education officers to personally monitor such cases,"" he said.

Officials at a government boys' school in east Delhi said there are cases wherein students have taken admissions in more than one school. ""There are so many cases wherein students have enrolled in more than one school and their names have appeared at two or three places,"" a head of one such East Delhi school said.

Several parents said they had bought summer uniforms on their own and are now expecting to receive the money at least for winter uniforms.

""The winter uniforms are comparatively expensive. My son is of a growing age and can't wear his last year's sweater. I hope the money comes soon,"" Sheela Devi, a domestic help and mother of a class 6 student, said.

Experts said the cash transfer mechanism is ""highly defective"". ""When the Delhi high court held in 2014 that cash subsidy is not acceptable and the elected government of Delhi decided to provide entitlements on or before April 1 of every year, then where is the question of cash transfer? The right of children cannot be taken away for the sake of not having bank accounts,"" Khagesh Jha, a lawyer representing parents in several such cases before the Delhi high court, said."
"223","998662463","2018-11-20","https://timesofindia.indiatimes.com/city/chennai/boy-adopts-govt-school-in-tn-village/articleshow/66696381.cms","Boy adopts govt school in TN village - Times of India","The Times of India",FALSE,"TIRUVANNAMALAI: In an effort well worthy of emulation, a 17-year-old boy from Sengunam in Tiruvannmalai has founded an NGO to improve the quality of education at government schools and cleanliness in villages.

As a first step, Mukundh Balajee, a Class XII student at National Public school in Koramangala, Bengaluru, has adopted a government higher secondary school at a village in his native Tiruvannamalai. The NGO has set up a well-equipped library in the school and plans to set up smart classrooms in Sengunam Government Higher Secondary School in Polur town panchayat.

Mukundh founded the NGO 'Gramin Shiksha' with the help of his parents in June 2017. His father Balajee Subramaniyan whose family owns the Essae Group of Companies had assured to back his son's move.

Mukundh told TOI, ""The aim of opening the organisation was to help rural schools in Karnataka where we are settled. But a TOI article in September 'Fund crunch may force TN government to close down 3,000 schools' shocked me. After that, I held a discussion with my family and decided to adopt the school.""

School headmaster R Karunanithi said the school has 285 students -- including 133 boys and 152 girls.

Through Gramin Shiksha, Mukundh opted to contribute and setup a smart class room at a cost of 1.5 lakhs.

Mukund also contributed study materials for students to prepare for competitive and entrance examinations including NEET, UPSC and TNPSC. He assured to donate 4-5 used computers and improve the infrastructure of the school by renovating the old toilets and paint the school to develop the premise.

While works are underway to transform the Sengunam government school on a par with international standard private schools, students and parents of the school had expressed their gratitude to Mukundh and his family members."
"224","998269385","2018-11-19","https://www.business-standard.com/article/pti-stories/principal-dies-as-boundary-of-govt-school-collapses-on-her-118111900999_1.html","Principal dies as boundary of govt school collapses on her","Business Standard",FALSE,"The principal of a government primary school here was killed Monday after the boundary wall on the premises collapse on her, police said.

Sharda Singh (55), the principal of government primary school Kasarwal in Sahjanwa block, was killed when the boundary wall near her collapsed, they said.

She was rushed to hospital where she died during treatment.

""The principal died during treatment in BRD Medical college and prima facie, the reason behind her death is school boundary collapse,"" Sahjanwa SHO Satya Prakash Singh said.

He said no one had made any complaint regarding the incident till then and the post-mortem report was awaited.

(This story has not been edited by Business Standard staff and is auto-generated from a syndicated feed.)"
"225","997557420","2018-11-18","https://www.abplive.in/videos/world-toilet-day-delhis-govt-school-exposed-ground-report-from-green-park-781484","World Toilet Day: Delhi's govt school exposed, ground report from Green Park | ABP News Videos","ABP Live",FALSE,"World Toilet Day is an official United Nations international observance day on 19 November to inspire action to tackle the global sanitation crisis. Worldwide, 4.5 billion people live without ""safely managed sanitation"" and around 892 million people practise open defecation. Sustainable Development Goal 6 aims to achieve sanitation for all and end open defecation. World Toilet Day exists to inform, engage and inspire people to take action toward achieving this goal.

World Toilet Day was established by the World Toilet Organization in 2001. Twelve years later, the UN General Assembly declared World Toilet Day an official UN day in 2013."
"226","996981434","2018-11-17","https://www.thehindu.com/news/cities/Coimbatore/govt-school-to-introduce-exclusive-reading-hours-for-students/article25528096.ece","Govt. school to introduce exclusive reading hours for students","The Hindu",FALSE,"Read and Rise initiative inaugurated at Idigarai Govt. School

The reading habit not only enhances imagination and creativity but also builds up confidence levels to face the challenges in life, speakers told students during the inauguration of the Read and Rise initiative of The Hindu in association with CRI Pumps at Idigarai Government Higher Secondary School.

S. Raja, Head - Corporate Social Responsibility of CRI Pumps, launched the initiative in the presence of I.C. Govindasamy, former President, Idigarai Students' Association, S. Bagath Singh, headmaster. Pradeep Yuvaraj, Managing Director of Prezantim, took part.

As a part of the activity, the students would be provided with 200 copies of The Hindu every day by CRI pumps throughout the year. Exclusive reading hours will be introduced with the support of teachers, to inculcate the reading habits and to improve their English language skills.

Mr Raja said that CRI Pumps have been taking up efforts in contributing to society through their CSR efforts. Across the country, CRI Pumps have adopted around 100 government and rural schools, including nine in Coimbatore district. He expressed that this novel initiative aimed at improving the knowledge and skills of the rural students would be extended to all the other adopted schools, gradually. During the event, Mr. Pradeep Yuvaraj gave a pep talk on why reading is crucial. The students also presented some cultural events."
"227","996357146","2018-11-16","https://timesofindia.indiatimes.com/city/coimbatore/60-govt-school-students-to-visit-space-centre-at-bluru/articleshow/66660590.cms","60 govt school students to visit space centre at B'luru - Times of India","The Times of India",FALSE,"Coimbatore: Sixty class IX students from government schools in the district will get a chance to visit the prestigious ISRO Satellite Centre (ISAC) in Bengaluru this month.

It is a part of the exposure visits conducted by the Samagra Shiksha Abhiyan (SSA), an official said. ""It will encourage the students to take more interest in science and mathematics and spur their creativity. It will familiarise them with places of educational importance and the country's diverse culture."" he said.

Students, who are interested in Science and Mathematics and those who have attended exhibitions will be selected for the visit. ""We will select a student from each school. The Indian Railway Catering and Tourism Corporation (IRCTC) will organize the trip. A teacher will guide groups of 20 students during the two-day trip,"" the official told TOI.

Apart from the space centre, the students will also be taken to science centres and higher education institutions including the Indian Institute of Science (IIS) and Visvesvaraya Industrial and Technological Museum. ""They will also be taken to tourist and historical places. The trip will make learning a joyful and meaningful activity. The Central government has allotted Rs 1.20lakh per district for the visit.""TNN"
"228","994902348","2018-11-15","https://kashmirobserver.net/2018/city-news/model-kg-centre-opened-allochibagh-govt-school-37855","Model KG Centre Opened At Allochibagh Govt School","Kashmir Observer",FALSE,"SRINAGAR -- A model KG Centre was opened government middle school Allochibagh here on Wednesday.

The Centre was jointly inaugurated by Director Meteorological department, Sonam Lotus and Chief Education Officer Srinagar Mudasir Kaleem Fazili.

Sonam Lotus and Mudasir Kaleem Fazili after inaugurating the Centre also participated in the enrolment drive on Children's Day at the school. During the inaugural function, almost 40 students were enrolled on the spot.

While interacting with the parents, Sonam Lotus advised them to take full advantage of these kinds of initiatives.

Mudasir Kaleem while talking to the parents ensured them of modern facilities of Education to their kids. CEO said that the Department of School Education is committed to ""providing latest educational facilities in the schools and this is evident by the establishment of these types of modern Kindergarten schools.""

Referring to the free facilities being provided as these centres, Kaleem appealed the parents to enrol their children in these centres and take full advantage of these facilities provided by the department.

During the function, National Best Teacher Awardee of 2018 and DEPO Srinagar, Ghulam Rasool Mir threw light on many aspects of the facilities being provided at these KG Centres. Zonal Education Officer, Batamaloo Nusrat Jahan formally thanked the guests on the occasion. The function was also attended by HoD DIET Moomina Qadir and many other officers of the Department.

Rehana Kaunsar, a Master from the Department School Education has been plaing a key role to open the centres."
"229","994590935","2018-11-14","https://www.thehindu.com/news/cities/chennai/govt-school-students-to-go-on-study-trips-abroad/article25500100.ece","Govt. school students to go on study trips abroad","The Hindu",FALSE,"School Education Minister K.A. Sengottaiyan said that students from government schools in the State would be selected and taken on study trips abroad in December.

Speaking on the sidelines of Children's Day celebrations organised by the School Education Department at M.C.C. Higher Secondary School, he said students -- in groups of 25 -- would be taken to Finland, Singapore and Malaysia, among other places.

""This will give them an opportunity to learn and observe the development and culture of those places. A hundred students will be selected and they will go on trips from December,"" the Minister said. A cultural programme with dance and music performances was put up by students from schools across the city.

At the event, the Minister said that in the coming academic year, all school uniforms would be changed and new colours would be introduced.

D. Jayakumar, Minister for Fisheries, was present at the event.

When asked about the allegations of irregularities in the appointment of art teachers, Mr. Sengottaiyan said the department had initiated a re-verification of certificates for teachers who had been recruited.

""The department will also begin English language training for nearly 5,000 teachers,"" he added.

Prizes were distributed to students who had won competitions conducted ahead of Children's Day. The department also presented awards to librarians of district libraries."
