"","ID","date","url","title","source","duplicate","body"
"1","1029036739","2018-12-29","https://www.thehindu.com/news/cities/chennai/iit-m-students-donate-notebooks-to-govt-school/article25862154.ece","IIT-M students donate notebooks to govt. school","The Hindu",FALSE,"This year, the students of Indian Institute of Technology-Madras have chosen education as the theme for their cultural festival -- Saarang.

Ahead of the event, they have launched LEAP- learning and education accessibility project, a campaign for reaching out to government school students.

As part of the campaign, IIT-M students have distributed 1,600 notebooks made from recycled paper to students of a government school in Korattur.

Donation boxes are placed in schools across the city and student teams have been interacting with students in these schools. Book donation campaigns will be organised as part of the initiative on the IIT-M campus and in select places across the city. It will also include a drive to collect recyclable paper.

Aniket Kamthe, core of sponsorship and PR, Saarang 2019, said students had organised guest lectures by activists, scholars and social entrepreneurs to create awareness about the cause. NGOs roped in for the initiative will organise creative, learning-oriented activities for schoolchildren."
"2","1026774837","2018-12-26","https://www.latestly.com/india/news/up-over-800-cows-shut-inside-govt-school-health-centre-by-aligarh-farmers-to-protect-crops-559009.html","UP: Over 800 Cows Shut Inside Govt School, Health Centre by Aligarh Farmers to Protect Crops | LatestLY","Latestly",FALSE,"Lucknow, December 26: Aggrieved by the inaction of civic authorities, farmers in Aligarh district locked over 800 cows inside a government school and a primary healthcare centre on Tuesday. The bovines were later freed by the police personnel, who carried them in trucks to the nearest gaushala.

Farmers in Gorai and Tamautiya villages of Aligarh were forced to lock up the cows as several acres of farmlands have been destroyed by the bovines, left stray by their owners after they no longer yielded milk. Cow Slaughter, Banned by UP CM Yogi Adityanath, Creates Bovine Menace in State.

Speaking to reporters, the local farmers in Tamautiya said they are forced to remain awake throughout the nights in their fields to prevent the stray cattle from eating the the near-ready to harvest crops.

The number of bovines have multiplied exponentially over the past couple of years, since the Yogi Adityanath-led BJP was elected to power. The state government has rigorously enforced a ban on the slaughter of cows and cow progeny.

Apart from the government-enforced ban, vigilantes affiliated to some right-wing groups have been involved in attacks on cattle traders -- which has forced many of them to abandon their animals.

The incident on Tuesday in Aligarh led to a brief law and order violation as well, as the police team which arrived to free the cattle and take them to the nearest gaushala faced protests, including stone-pelting. The demonstrators were mobilised through a WhatsApp rumour claiming that the cows are being sent for slaughter.

The situation was brought under control, said said senior police officer Ajay Kumar Sahni, adding that four miscreants have been arrested."
"3","1025618359","2018-12-24","https://www.hindustantimes.com/india-news/no-furniture-students-in-this-dehradun-govt-school-sit-on-the-floor/story-pTjoQK6MfaGzUNWckX22fJ.html","No furniture, students in this Dehradun govt school sit on the floor","Hindustan Times",FALSE,"It is biting cold on a winter morning. Children are trickling in to a government primary school in Raipur, in sub-urban Dehradun, and jostling for space on jute mats spread inside the classrooms as well as outside the classes on the school premises.

The school has 144 students but does not have a single piece of furniture or boundary wall on one side, posing a security threat.

The administrative work of the school is managed by a teacher as it doesn't have a principal. The former principal passed away in 2017 and no appointment was made since then.

This is one among several schools in the state that are struggling without basic necessities.

State education minister Arvind Pandey has been pushing for better facilities for students in government schools, but they are still a distant dream for many schools in the state.

According to the education department data for 2017-2018, out of 1,412 schools in Dehradun, 649 schools do not have a playground, 329 schools do not have ramp facilities or boundary walls, and fencing is missing in 117 schools.

Sunita Rawat, the teacher in charge of the primary school in Raipur, said: ""We got ~50,000 from the department this month and we will use it to repair the floors and toilets. We never had furniture in the school and students have been sitting on mats only.""

She also added that even the neighbouring schools don't have such facilities and they ""never asked the department especially for furniture"".

Another teacher said on condition of anonymity: ""We requested the department to release funds for repairing the boundary wall many times as it is a worry if any child sneaks out through the broken part of the wall.""

SB Joshi, chief education officer of Dehradun, said: ""There are over 1,000 schools in the district and we are trying to provide furniture to all. Till then, jute mats and carpets are provided for students to sit on.""

The department of school education sanctioned Rs 10 crore in November to all 13 districts for buying furniture for government schools.

""We received money from the government and have disbursed it to different districts but issuing of tender and other such procedures may take time,"" said VS Rawat, additional director, elementary education."
"4","1025296134","2018-12-23","https://timesofindia.indiatimes.com/city/coimbatore/alumni-pitch-in-to-renovate-five-decade-old-govt-school/articleshow/67222776.cms","Alumni pitch in to renovate five-decade-old govt school - Times of India","The Times of India",FALSE,"Tirupur: A group of alumni and many villagers have helped to revive a five-decade-old government school in Perumanallur in the district. After it was 'abandoned' a decade ago, the school had become a den for anti-social elements to play cards, booze and indulge in prostitution.

The state government has recently passed an order to start a government girls' high school in the building, which was inaugurated last week by the state school education minister K A Sengottaiyan.

The school was started in 1957 in a tile-roof building at Perumanallur. It was upgraded as government higher secondary school. When the strength increased, lack of infrastructure in the school became an issue. So, the students were shifted to a higher secondary school functioning on Kanakkampalayam Road, around 10 years ago. But the old school building was 'abandoned'.

""Especially women would fear to go near the school building because of the anti-social elements. Apart from the prostitution activities, many college students would camp in the dilapidated classrooms and involve in gambling. Despite continuous complaints, numerous incidents were happening in the school building. A few months ago, a class VIII girl was allegedly molested,"" said P Mouleeswaran, secretary, alumni association of the school.

""After our continuous requests to restart the school, the school education minister Sengottaiyan visited the abandoned school building. Quickly, the government passed an order to divide Perumanallur government higher secondary school, among four other government schools in the state, and separate the girl students from the school. Now, Perumanallur government girls' high school was started in the abandoned building,"" he said.

""A group of alumni of the school has come forward and helped to restore the buildings and established a smart classroom. With 10 classrooms, a well-furnished toilet facility, equipped with sanitary napkin incinerator. The alumni have, so far, spent, more than Rs 40 lakh,"" said Mouleeswaran, the 1981-batch student.

""It is commendable that the alumni were putting their hearts out in reviving the school. The government has ordered to transfer 249 girls, between class VI and class X, from Perumanallur government higher secondary school to this school, which is now Perumanallur government girls' high school. After completion of half-yearly exam holidays, the school will start functioning on January 2,"" M Dhanabaggiam, headmistress of the new school told TOI.

Mouleeswaran said, ""The school education department will soon avail loan of Rs 1.36 crore from the National Bank for Agriculture and Rural Development (NABARD), for the revived school. More classrooms will be constructed soon. The government has also promised to upgrade the school as higher secondary school soon."""
"5","1024794686","2018-12-22","http://www.asianage.com/metros/mumbai/231218/regularise-widows-job-in-govt-school-hc-to-state-govt.html","Regularise widow's job in govt. school: HC to state govt","The Asian Age",FALSE,"Mumbai: The Bombay high court has directed the state government to regularise the job of a widow in a government school who was given a job on compassionate grounds by the school management.

The state government refused to regularise her job as there was a stay on approvals as per the 2012 state decision. But the court held that jobs given on compassionate grounds were not fresh jobs and hence, not in want of approval by the state.

A division bench of Justices S.C. Dharmadhikari and Bharati Dangre was hearing the petition filed by Samita Desai seeking directions to the state to regularise her post. The petition also sought directions to the state to pay her the dues accrued to her while working as a peon in the school.

According to the plea, Desai's husband, Sameer, worked as a peon in the school and his post was an approved one with his salary being paid by the government. However, he died on November 2, 2011 and Samita was left with two minor children. On March 26, 2012, the school management decided to appoint her in place of her husband on compassionate grounds.

The school sent an application on August 7, 2012 to the education department to regularise Samita's job, which was refused on grounds that there was a ban on approving new staff since May 2, 2012. Thereafter, Samitai and the school approached the court.

Public prosecutor, Shruti Vyas, argued that there was a ban on approvals and the post had not been sanctioned as per the 2013-14 staffing pattern for the school.

The court, however, rejected the contentions and stated that Samita's appointment was done as per a December 2, 2002 state order which superseded the 2012 ban."
"6","1024410128","2018-12-22","https://citytoday.news/throw-ball-harohalli-govt-school-boys-gbs-girls-emerge-champs/","Throw ball: Harohalli govt school boys, GBS girls emerge champs - Mysuru Today","Mysuru Today",FALSE,"Mysuru: The two-day district-level inter-school sub-junior throw ball tournament championship for under-14 boys and girls was held on December 18 and 19. The tournament was organised by Citizen Convent, Udayagiri and Mysore district amateur throw ball association. From Mysore district, nearly 18 teams in boys' category and 16 teams in girls category took part in the tournament.

The tournament was inaugurated at Citizen Convent and the event was started by Shafi Ahmed, Deputy Mayor, Ayub Khan, ex-mayor and, Jayseem, international throw ball player and. Maha Jabeen, founder secretary and headmistress, Citizen Convent.

In the boys' section, Harohalli Government School emerged winners, while Citizen Convent emerged runners-up. Scores: Harohalli Government School vs. Citizen Convent: 20:25, 25:18, 26:27.

Best player of the tournament was awarded to Yaseen Ansari of Citizen Convent.

In the girls' section, Gaeta Bhatia School in Siddhartha Layout emerged winners and Citizen Convent settled for second place. Scores: Gaeta Bhatia School vs. Citizen Convent: 25:17, 25:22.

Best player of the tournament was awarded to Chithra H S of Gaeta Bhatia School.

The prize distribution ceremony was held on the concluding day at the school premises. Shafi Ahmed was honoured on the occasion.

N.S Subbramanya Director Refries Board, Karnataka Throw Ball Association, Siddaraju, taluq physical education officer, Suhail Baig, ex- corporator and Maha Jabeen were present.

Shafi Ahmed appreciated the school management for conducting the district-level throw ball tournament and asked the students to involve in sports activities and improve their health and physical standards.

Siddaraju appreciated all the schools for participating in this event and he congratulated the organisers of the tournament for conducting the tournament. (MR)."
"7","1023830351","2018-12-21","https://timesofindia.indiatimes.com/city/chennai/iit-madras-students-make-desks-for-govt-school-kids-using-discarded-cardboard-boxes/articleshow/67193780.cms","IIT-Madras students make desks for govt school kids, using discarded cardboard boxes - Times of India","The Times of India",FALSE,"CHENNAI: Students in Indian Institute of Technology Madras (IIT-M) collected discarded cardboard boxes from shops and made desks for over 400 school students studying in government schools.

This initiative -- called 'ReACH' -- is aimed at improving the conditions of rural schools in an eco-friendly manner. ReACH is part of Shaastra, an annual technical fest scheduled in the first week of January.

IIT-M student Sawni Gupta said during their visits to some schools, they had seen children sitting on the floor with their back hunched.

""So we decided to create desks with cheap and sustainable material. We collected discarded cardboard boxes from nearby stores and used them to make desks,"" she said.

""We designed them in such a way that students can use them to keep their books on them and read. Tapes were used for providing a smooth finishing at edges. After testing the strength, we distributed them to students in eight government schools,"" she added.

Puducherry lt governor Kiran Bedi, former Indian cricketer Anil Kumble, first Indian to travel in space Rakesh Sharma and others were impressed by the idea and extended their support to the campaign, said an official release.

Though Shaastra started as a tech-fest, it broadened out into taking up a social initiative each year to create a positive impact in society.

The previous campaigns included producing liquid handwash bottles out of recycled soap, building toilets with used water bottles and pledge-a-book campaign aimed at distributing books to underprivileged children, the release added."
"8","1023246367","2018-12-20","https://www.thehindu.com/news/national/karnataka/teachers-in-this-govt-school-go-the-extra-mile/article25791759.ece","Teachers in this govt. school go the extra mile","The Hindu",FALSE,"Govt. school in Hassan taluk has raised the bar for SSLC students this time

The Government High School at Attavara in Hassan taluk gives a tough fight to private schools nearby by securing good results in SSLC, besides organising some unique activities to improve the learning ability of students. Unlike many schools in rural areas, the school registered 100% results in SSLC this year. Of the 29 students who took the exams, 27 secured first-class marks.

""This time our target is 100% results will all first class,"" said K.P. Narayana, headmaster. Last year, we had 98% results and constant efforts by teachers helped improve the results this year. ""There is a notion among the public that rural students do not study hard. We want to prove that wrong. We, teachers, maintain a good rapport with students and their parents and monitor their studies regularly,"" he said. Interestingly, teachers take out their personal time to visit their students late in the evening. Sometimes students are surprised to see their teachers on their doorstep. ""We go to their place and speak to their parents. The exercise helps us develop a contact with the parents and also see if students set aside enough time for studies at home,"" he said.

Recently, the school conducted a rangoli competition for students. It was unique because the students were told to draw the diagrams they study as part of their science syllabus. A student drew an image of the brain, nervous system, and respiratory system using colours provided by the teachers.

After school hours, students of classes 8, 9, and 10 have to take part in group studies. With the help of villagers, the school has got special benches on the campus for evening classes. All 98 students attend the classes, before leaving for home. H.L. Nagaraj, Assistant Commissioner of Hassan sub-division, has taken a special interest in improving basic amenities in the school. He visits the school regularly and motivates teachers and students for improving results.

The school has a rainwater harvesting system. Making use of the available water, students grow vegetables on the campus as part of their co-curricular activities. The vegetables grown are used for midday meals."
"9","1023191071","2018-12-20","https://www.business-standard.com/article/pti-stories/caste-religion-segregation-in-bihar-govt-school-inquiry-ordered-118122001008_1.html","Caste, religion segregation in Bihar govt school, inquiry ordered","Business Standard",FALSE,"A state-run school in Bihar's Vaishali district has been found allegedly segregating students along caste and religious lines, prompting the government to order an inquiry, an official said Thursday.

The district administration has also asked the Bihar education department to take ""exemplary action"" against the school's principal as the ""allegations have been found to be, prima facie, true"".

District Magistrate Rajiv Raushan said the inquiry was ordered following media reports claiming that students belonging to different castes and religious communities were made to sit separately at the G A Higher Secondary School in the district's Lalganj block.

He said they have also written to higher authorities in the education department to take ""exemplary action against the school's principal in order to deter others from adopting such practices"".

Students from scheduled castes, scheduled tribes, other backward classes and upper castes, as well as from the Hindu and Muslim communities, were assigned separate sections in their respective classrooms, according to the reports.

The reports had also claimed that separate attendance registers were, therefore, being maintained for students belonging to different social segments even though the children freely intermingled outside the school.

""The allegations have been found to be, prima facie, true in the inquiry. This is a very serious and sensitive matter,"" the district magistrate said.

Orders have been issued to immediately do away with the discriminatory system prevailing at the school, he said.

(This story has not been edited by Business Standard staff and is auto-generated from a syndicated feed.)"
"10","2018-12-1022935080","2018-12-20","https://www.deccanchronicle.com/nation/current-affairs/201218/bihar-govt-school-dividing-students-on-basis-of-caste-and-religion.html","Bihar: Govt school dividing students on basis of caste and religion","Deccan Chronicle",FALSE,"Vaishali: Following reports of caste and religion based discrimination in a school in Vaishali, a team constituted to investigate the matter has concluded that such system was indeed prevailing in the school and held the Principal responsible for it.

The District Education Officer-led-team in its written recommendation to the education department has asked for the stern action against the Principal, Meena Kumari.

""From many years, the system of division of classroom on the basis of caste and religion is existing in the GA Higher Secondary School at Lalganj in Vaishali district. Separate classrooms were allotted for the students belonging to the upper castes, OBCs and Dalits. Similarly, There are also separate sections and rooms for students belonging to Hindu and Muslim communities at the school,"" confirmed Vaishali District Magistrate, Rajeev Roshan.

After the matter came into light, the officials constituted a team to investigate further.

""Strict action would be taken against the Principal and she would be suspended from her service,"" Roshan added.

Even after the report proved the allegation, Meena Kumari, in her defence, rejected such claims and said, ""Students of every caste and religions sit together, there is no such division."""
"13","1021258434","2018-12-18","https://www.indiatimes.com/trending/human-interest/nri-boy-uses-rs-2-lakh-prize-money-to-transform-grandpa-s-dilapidated-govt-school-in-tamil-nadu-358826.html","NRI Boy Uses Rs 2 Lakh Prize Money To Transform Grandpa's Dilapidated Govt School In Tamil Nadu","indiatimes.com",FALSE,"Krithik Ramesh, a 16-year-old boy of Indian origin who lives in Denver, decided to do something a little offbeat on his vacation to India. He came with the sole aim to pay a visit to the government school at Deviyakuruchi near Attur in Tamil Nadu, where his grandfather had completed school.

But when he got there, what he saw shocked him. The school was utterly dilapidated and Ramesh couldn't bear to see it in that condition.

Together with his father M Ramesh Babu and grandfather V Muthuraman, Krithik decided to start Empowering Rural India Foundation, a non-profit organisation, with the aim of uplifting government schools across the country.

But soon, Krithik realised that he did not have enough funds to take his vision forward. His folks suggested he look for sponsors.

Once he had the funds ready, Krithik approached the school management. Upon enquiring about the needs of the school, he was told that it faced occasional power outages, and the headmaster suggested that installation of solar panels would be of great help.

The family approached many solar service providers before finally zeroing in on a company, that two weeks ago, successfully managed to provide the school with the necessary infrastructure. With the installation of solar panels, the school can now easily save up to Rs 15,000 that otherwise was spent on electricity bills once in two months.

Interestingly, the solar panels can produce about 2kW of power, which is more than what the school needs. So, Krithik suggested that the school sell the excess power to the state electricity board.

His father, Ramesh, stated that they intend to put in place sustainable and renewable energy systems that will serve schools across India for a long time and will pave the way for improved academic success through self-sustaining solutions."
"14","1018463739","2018-12-14","https://www.hindustantimes.com/india-news/govt-school-teacher-held-in-rs-150-crore-ponzi-scheme-in-cyberabad/story-rrBHyCNb29ByS19LrL0aOO.html","Govt school teacher held in Rs 150 crore ponzi scheme in Cyberabad","Hindustan Times",FALSE,"The Economic Offences Wing of the Cyberabad police in Hyderabad on Friday arrested a government school teacher, the alleged kingpin of a Rs 150 crore ponzi scheme.

Cyberabad police commissioner V C Sajjanar said the police had arrested Methuku Ravinder, chief executive officer of Sun Pariwar Group of companies, and frozen Rs 14 crore deposited by his company in various banks.

Ravinder had been working as a government school teacher at Upper Primary School in Revalli village of Siddipet district. Unsatisfied with his meagre income, he applied for long leave from his job and floated his own company Sun Pariwar Group at Sangareddy in 2015.

""Since he was still a government employee, he started as many as eight different business outfits such as Sun Mutually Aided Thrift and Credit Cooperative Society Ltd, Methuku Chit Funds, Methuku Ventures etc. under the umbrella of Sun Pariwar Group, in the name of his close associates and relatives,"" the commissioner said.

Ravinder used to attract customers with a slogan of 'Kalisthe Gelustham (together we win)' and collected huge amounts to the extent of Rs 150 crore from gullible investors. His modus operandi was to collect Rs one lakh in the form of deposit in the company, for which the depositor would be returned Rs 6,000 per month as interest for a period of 25 months. In the 26th month, the depositor would be returned the principal amount of Rs 1 lakh.

""Ravinder also offered attractive incentives to the agents who would mobilise deposits -- a commission of 3% for a period of nine months if the deposit is Rs 5 lakh and 4% commission, if the deposit is more than Rs 5 lakh. Even if a member admits another member, he, too, would get a commission of 3%. He also used to take agents on holiday trips to Goa, Shimla, Bangkok and Dubai if they achieved their targets,"" Sajjannar said.

Thus, Ravinder collected huge amount of deposits running up to Rs 150 crore from gullible people who were attracted by high interest rates and commissions. Subsequently, he started avoiding payments of interests and principals to the depositors.

Following a complaint from a depositor, D Durgadas, the Shamirpet police of Cyberabad registered a case which was later transferred to the Economic Offences Wing. After a thorough investigation, the police cracked the case and arrested the accused.

""A cheating case was registered against Ravinder under section 420 of the IPC besides Section 5 of Andhra Pradesh Protection of Depositors of Financial Establishments Act, 1999. The other directors of the company are absconding,"" the police commissioner said."
