"","ID","date","url","title","source","duplicate","body"
"30","868264336","2018-05-15","https://timesofindia.indiatimes.com/city/bengaluru/right-to-education-applications-can-be-modified-till-tomorrow/articleshow/64167087.cms","Right to Education applications can be modified till tomorrow - Times of India","The Times of India",FALSE,"BENGALURU: The department of public instruction (DPI) on Monday extended the deadline for modification of Right to Education (RTE) applications to 10am Wednesday, prior to the beginning of the second round of allotment.

This modification process allows parents to change their school preferences and include those schools that may still have empty seats.

Over the weekend, parents of children awaiting allotment of seats under RTE had complained of not receiving the one-time password (OTP), despite having submitted their application number and mobile phone number.

With the earlier deadline ending on 1pm Monday, they were worried about missing out due to technical issues.

Pvt schools demanding money for books, uniforms: Parents

Parents of RTE students have alleged that they are being charged extra money by private schools, ostensibly for books and uniforms. While the education department has made it clear that schools cannot ask money from RTE students, many parents had to shell out cash, fearing their children's seats would be revoked.

""My daughter got admission for LKG in a private school in Thanisandra, and I, along with other parents, was asked to pay Rs 4,360. My son, who also got admission under RTE, is in Class 5 and we had to pay Rs 6,640 for his books and uniform. This amount doubled over the past one year -- we paid Rs 3,000 last time. There's a monthly fee of Rs 200-300 too,"" said a parent.

""The schools are demanding money mainly because the department hasn't issued a circular to them making its stand clear. I've written to the principal secretary, department of primary and secondary education, highlighting this issue,"" said B N Yogananda, general secretary, RTE Students and Parents' Association."
"31","862310802","2018-05-04","http://www.business-standard.com/article/current-affairs/right-to-education-for-ews-children-what-lies-ahead-after-the-age-of-14-118050401240_1.html","Right to Education for 'EWS' children: What lies ahead after the age of 14","Business Standard",FALSE,"It is a significant moment for the Right To Education, exposing its vulnerabilities while also shedding light on its positive impact

Going to school in cosmopolitan Delhi can be a lesson in national integration. Parents find notes from school requesting that their child dress up in colours of the national flag for Independence Day, in traditional Indian wear for Diwali or as little Christmas trees on December 25.

This is not the only evidence of schools being a microcosm of a larger social reality. Social biases -- especially those related to class and economic strata -- are burdens that students carry along with their heavy backpacks. These disparities have perhaps become more striking in the past nine ..."
"32","861638472","2018-05-03","http://www.thehindu.com/news/cities/Hyderabad/right-to-education-of-nearly-100-children-at-risk/article23763352.ece","Right to education of nearly 100 children at risk","The Hindu",FALSE,"Youth for Better India approaches State Human Rights Commission

Youth for Better India, an NGO, has approached the State Human Rights Commission (SHRC) for restoration of right to education to about 100 children from underprivileged sections, whose school inside a park site has been given eviction notices by GHMC authorities.

The Commission has reportedly issued notices to the Hyderabad district administration and GHMC Commissioner seeking their reports by July 31.

According to the details that were published by The Hindu on April 3 this year, the 'Alpha School', a philanthropic initiative by a woman, has been functioning since 1999, imparting education to children from poor background living in surrounding areas.

Initially located in a slum near road no. 22 at Jubilee Hills, the school was evicted along with other slum dwellers as the site was earmarked for a park. Later, the school was shifted to a footpath outside the park and the children continued attending the classes.

Security concerns

In 2015, the school faced eviction from the footpath too, owing to security concerns involving the passage of the convoy of Andhra Pradesh Chief Minister N. Chandrababu Naidu.

New school

When protests were conducted against the eviction, the then State Commission for Protection of Child Rights intervened and asked the district administration and the School Education Department to provide alternative schooling facility for the children, by admitting them in the nearest government school and providing them transportation facilities.

It also suggested to the State government to construct a new school with the necessary infrastructure in a nearest available land.

The orders were never implemented, and the school yet again occupied a spot inside the site allotted for the park. The GHMC officials recently asked the woman, G. Shobha, who runs the school, to vacate the premises so that the site can be used for the purpose it was meant for.

Youth for Better India, which is a collective of professionals from different platforms, visited the site and took the issue to the notice of the SHRC, claiming that the right to education of about 100 children is being violated."
"33","854042088","2018-04-23","https://timesofindia.indiatimes.com/city/bengaluru/no-right-to-education-seats-in-716-schools/articleshow/63853249.cms","No Right To Education seats in 716 schools - Times of India","The Times of India",FALSE,"BENGALURU: Under the RTE quota, 716 schools (393 aided and 323 unaided) in the state did not receive seat applications. The reason: lack of proper infrastructure and not many teachers, said an official from the department of public instruction (DPI).

On Friday, over 1 lakh seats were allotted to private aided/unaided schools during the first round of the online lottery system. Officials said 2.3 lakh applicants were scrutinised for 1.52 lakh seats, but since many parents didn't opt for seats in some schools, only 111,548 were finally allotted."
"34","847777456","2018-04-11","http://www.freepressjournal.in/mumbai/bombay-high-court-directs-maharashtra-government-to-implement-right-to-education-effectively/1254826","Bombay High Court directs Maharashtra government to implement Right To Education effectively | Free Press Journal","Free Press Journal",FALSE,"Mumbai: The Bombay High Court on Tuesday directed the Maharashtra government to ensure the Right To Education (RTE) Act is implemented in its true sense. The HC said the government must ensure the enactment which mandates primary education for children up to the year of 14 years, must be implemented step-by-step.

A division bench of Justice Bhushan Gavai and Justice Bharati Dangre rapped the government after learning that the government made a mistake in interpreting the orders passed by the Nagpur bench of the Bombay HC. The judges were informed that the government has followed the orders of the Nagpur bench and during all this, it failed to allow admissions to nearly 2 lakh students under the reserved quota of 25 per cent. Irked over the submissions, the bench said, ""This is certainly not a manner in which you are expected to interpret orders of this Court. You must ensure that provisions of the RTE Act are implemented in letter and spirit and in its true sense.""

The judges were hearing a writ petition filed by Dadar-based Balmohan Vidyamandir, contending that several schools were forced by the government to grant admissions to students in violation of the provisions of the RTE Act. The school claimed the government compelled thousands of schools to admit students who live beyond the stipulated distance. The petition sought an effective implementation of the provision which mandates a school to reserve 25 per cent of its seats for the poor children and also to prioritise the admission for students living nearby the school. Having heard the submissions, the judges directed the government to file a fresh affidavit spelling out the steps undertaken to implement the RTE Act, within two weeks."
"35","847679677","2018-04-10","http://indianexpress.com/article/cities/delhi/right-to-education-ews-students-must-get-books-uniforms-says-doe-5132250/","Right to Education: EWS students must get books, uniforms, says DoE","The Indian Express",FALSE,"By: Express News Service | New Delhi | Published: April 11, 2018 3:32:03 am The schools have now been told to provide the books and uniforms, and the amount spent will be reimbursed by the DoE.

The Directorate of Education has directed private schools to provide free books and uniform to children studying under the economically weaker section/disadvantaged (EWS/DG) category at their schools.

On Tuesday, The Indian Express had reported how two private schools were allegedly not giving books and uniform to children under the category, and asking parents to buy it themselves.

The schools have now been told to provide the books and uniforms, and the amount spent will be reimbursed by the DoE, as per expenditure incurred on per-child basis or the actual amount charged from the child -- whichever is less.

In a circular issued on Tuesday, the DoE also cited a High Court order of 2014, and said it was obligatory for them to do so.

""In 2014, directions were again issued to all private unaided recognised schools of Delhi to comply with the provisions of Rule 8 of Delhi Right to Education (DRTE) Rules, 2011...,"" stated the circular. The schools have been told not to misread the order as the court has not exempted private schools from providing books and uniform.

Share your thoughts"
"36","843602257","2018-04-04","http://www.freepressjournal.in/mumbai/mumbai-private-schools-to-initiate-voucher-system-for-right-to-education-admissions/1249957","Mumbai: Private schools to initiate voucher system for Right to Education admissions | Free Press Journal","Free Press Journal",FALSE,"Mumbai: Private unaided schools of the state have suggested initiating a voucher system for admissions through Right to Education (RTE). This move has come to tackle the reimbursement burden of fee from the state government. Private unaided schools under Federation of Schools Association of Maharashtra (FSAM) have suggested a voucher system for applying for RTE admissions. This system would solve problem of waiting for reimbursement for RTE admissions.

Schools stated they do not want to wait for reimbursement given by state government. Bharat Malik, a senior member of private schools said, ""The reimbursement amount is Rs 1,200 crore since 2012 where the government has not paid the funds for education of students of Class 1 to Class 8. This is elementary education and students cannot be denied of this right.""

Students claimed they need to get education for free under RTE in private schools. Malik added, ""We want to introduce voucher system so that children are given specified amount in their account and they can use it anytime. Parents should use it wisely so that they do not have to wait for the reimbursement amount.""

Private unaided schools have initiated a movement which would facilitate facilitate of funds for education of students. Malik said, ""We cannot be denied of the fact that reimbursement is given to us. We cannot let any students suffer due to the carelessness of the state government. We need to use these funds to help students fund their education.""

Schools stated they cannot adhere it as any amount given to them in advance. Radha Sen, a parent said, ""Parents and students may misuse of the funds and use it for students. We cannot award students a certain amount of fund which may be misused. The funds should be used for admissions through RTE admissions help future if students. Our teachers help students to secure admissions which is used for children of economically weak sections of society."""
"37","843519394","2018-04-03","http://indianexpress.com/article/education/protest-over-provisions-of-rte-act-in-delhi-5122407/","Protest over provisions of Right To Education Act","The Indian Express",FALSE,"By: Express News Service | New Delhi | Updated: April 4, 2018 2:52:37 am The protest is being spearheaded by people associated with low-budget private schools across the country. (Expres photo by Gurpreet Singh) Collecting old books for those who cannot afford new onesGujarat govt to increase income limit for 25 per cent EWS admissions under RTEMumbai: Citing dues, schools refuse RTE admission

The National Independent Schools Alliance (NISA) has called for a demonstration at the Ramlila Maidan on April 7. The alliance is protesting against the provisions of the Right To Education (RTE) Act 2009, which says that unrecognised schools should be shut.

The protest is being spearheaded by people associated with low-budget private schools across the country. Kulbhushan Sharma, president of NISA, said, ""We have been serving the public for many years while maintaining the quality of education with limited resources. These schools have fee from Rs 200-1,000. But since the RTE law came, a problem has cropped up. This rally is to save the education sector.""

They also criticised the Delhi government for not holding any meeting of the committee formed to make rules flexible for recognition of non-recognised schools. The committee was set-up on June 16, 2017.

Share your thoughts"
"38","842394658","2018-04-02","http://ahmedabadmirror.indiatimes.com/ahmedabad/cover-story/gujarat-right-to-education-yes-financial-assistance-no-as-800-parents-borrow-money-to-buy-books-uniforms/articleshow/63571937.cms","Gujarat: Right to Education, yes. Financial assistance, no as 800 parents borrow money to buy books, uniforms - Ahmedabad Mirror","Ahmedabad Mirror",FALSE,"Education Minister Bhupendrasinh Chudasama said he had not come across such cases but will check againMore than 800 economically backward parents have come to realise that Right to Education (RTE) may provide their wards admission to private schools but that does not necessarily mean they will get financial assistance of Rs 3,000 from the state government. Many of them have not received a single rupee even after three years and are forced to borrow money to sustain education of their sons and daughters.

A DEO official claimed there's not enough grant to give assistance to every parent while an NGO warned that government apathy can lead to rise in drop out of kids studying under RTE. State Education Minister Bhupendrasinh Chudasama maintained, ""Issues pertaining to RTE were discussed twice in the Vidhan Sabha. But we have not come across any case of parents not receiving assistance.

However, I will get the details and see if there are such cases. Also, we will immediately address the matter if parents write to us."" Provisions under RTE Under RTE, the state government facilitates admission in private schools and provides assistance of Rs 3,000 to parents per child per year for buying books, uniform, schoolbag etc. However, there are many who have not received assistance even once since 2015-16 when the state government started to give it.

When Rs 3,000 makes a huge difference

Yasmin Ajmeri, whose daughter studies in Class 4 at Model English School, Juhapura, said, ""We had opened a bank account where the government assistance could be deposited directly. However, due to zero balance the account has been closed. I have not received Rs 3,000 even once. After our daughter got admission under RTE three years ago, we were happy that she would be provided free education.

But not anymore. While education is free, I have been borrowing money to purchase books and uniform."" Till now Ajmeri has borrowed around Rs 6,000 to make sure that her daughter's education does not suffer. Krutika Sutariya, a parent whose son studies under RTE at DAV International School, said, ""My son is in class 2 and we have checked our bank account several times eagerly awaiting deposit of the amount but are yet to receive it. We were informed that the money is deposited two months after the school starts. Maybe it's our fault for not checking with the government officials.""

Jitendra Parmar, whose daughter studies in an Ambawadi school and will now come in class 3, said, ""I have not received any incentive. While the school says they have already sent the report to the DEO office, officials there claim they have not received it. I have visited the DEO office number of times but there's no solution yet. For a middle class family Rs 3,000 means a lot.

Government should look into the matter."" Sahana Begum's case is unique. Her daughter was admitted to a Navrangpura school three years ago under RTE. But she's yet to receive Rs 3,000 assistance even once. Recounting her plight, she said: ""It's difficult for us to make two ends meet. We are thankful for free education but for people like us Rs 3,000 is a huge amount. What is the point of free education when the government fails to provide assistance on time?""

'Drop out cases may rise'

Sanjida Shaikh, who coordinates with RTE parents and works for NGO SAATH, said, ""In the first place, it's difficult to convince parents to admit their children under RTE. We bring them around by telling them that besides free education, the government takes care of other needs like uniform, books by providing financial aid. But when the assistance fails to reach such parents, many of them may discontinue their child's education because they can't afford it.""

DEO office gets 10 cases per day

An official working in the DEO office, on condition of anonymity, said, ""On an average 10 parents visit the DEO office daily with the query as to when will they get their Rs 3,000. But the problem is that the government does not have enough grant to disburse the amount to all. There must be more than 800 such parents in Ahmedabad."" Mujahid Nafees, an RTE activist, said, ""Cases of parents not receiving financial aid are few. I believe they might not be getting it due to technical error. However, fact remains that it's government's responsibility to ensure aid is given to parents on time so that no child is forced to go without education."""
"40","836806849","2018-03-23","https://timesofindia.indiatimes.com/city/mumbai/schools-turn-away-right-to-education-seat-students/articleshow/63422106.cms","Schools turn away 'Right to Education' seat students - Times of India","The Times of India",FALSE,"MUMBAI: Even as the first round of admissions under the Right to Education Act is expected to conclude on Saturday, several parents are being turned away by schools over their fight with the government over non-payment of dues. The schools on Thursday wrote to the Prime Minister and chief minister, informing that they are firm on their decision to not admit students until dues are cleared.

In the letter to the chief minister, SC Kedia, secretary, Unaided Schools Forum, Mumbai wrote, ""We have been cooperating with education department but the stage has come that we have no option except to resort to agitation for our legitimate rights as education department has no respect for private schools. We request you to kindly advice the education department to release all our outstanding amount towards reimbursement of fees for RTE students...""

School education secretary, Nandkumar said, ""We have responded to the letter. Schools will have to admit students within 15 days."""
