"","ID","date","url","title","source","duplicate","body"
"17","906434728","2018-07-16","http://www.koimoi.com/bollywood-news/filmmaker-shadab-khan-delhi-47-km-speaks-about-right-to-education/","Filmmaker Shadab Khan: Delhi 47 KM Speaks About 'Right To Education'","Koimoi",FALSE,"Written and directed by Khan, and presented by CineCloud Films and Asma Ali Shaikh, ""Delhi 47 KM"" will hit theatres on July 20.

Filmmaker Shadab Khan says he has tried to convey the importance of right to education through his upcoming film ""Delhi 47 KM"".

""'Delhi 47 KM' has many layers and one of them is 'right to education'. In the film, we have shown that how a child named Mintoo is deprived off his education and forced into trading of arms by his father because the father is convinced that education will not do any good to him.

""Through my film, I want to tell the audience that it is really important to stop the abuse and they should stand for their rights at the right time as it can save them from falling further,"" Khan said in an interview here.

On the need to provide equal opportunities to common citizen of the country, he said: ""I think 'Be equal to all and privilege to none' -- that should be the idea to take the country forward. We as a society have not been completely successful to give education to the poor class.

""If authorities can't give equal facilities to everyone, then at least they should provide proper education to every single child in India and that should be our top agenda.""

""Delhi 47 KM"" is a story about a region which is merely 47 km away from the Indian capital and in that region, there are dealing of drugs, illegal weapons, exploitation of children and prostitution.

The film is produced by Khan, along with Jigar Rawal, Sachin Saxena and Rajneesh Dubey.

Written and directed by Khan, and presented by CineCloud Films and Asma Ali Shaikh, ""Delhi 47 KM"" will hit theatres on July 20."
"19","906386180","2018-07-16","https://www.business-standard.com/article/news-ians/shadab-khan-speaks-for-right-to-education-through-delhi-47-km-118071600396_1.html"," Shadab Khan speaks for 'right to education' through 'Delhi 47 KM' ","Business Standard",FALSE,"""'Delhi 47 KM' has many layers and one of them is 'right to education'. In the film, we have shown that how a child named Mintoo is deprived off his education and forced into trading of arms by his father because the father is convinced that education will not do any good to him.

""Through my film, I want to tell the audience that it is really important to stop the abuse and they should stand for their rights at the right time as it can save them from falling further,"" Khan said in an interview here.

On the need to provide equal opportunities to common citizen of the country, he said: ""I think 'Be equal to all and privilege to none' -- that should be the idea to take the country forward. We as a society have not been completely successful to give education to the poor class.

""If authorities can't give equal facilities to everyone, then at least they should provide proper education to every single child in India and that should be our top agenda.""

""Delhi 47 KM"" is a story about a region which is merely 47 km away from the Indian capital and in that region, there are dealing of drugs, illegal weapons, exploitation of children and prostitution.

The film is produced by Khan, along with Jigar Rawal, Sachin Saxena and Rajneesh Dubey.

Written and directed by Khan, and presented by CineCloud Films and Asma Ali Shaikh, ""Delhi 47 KM"" will hit theatres on July 20."
"20","906373784","2018-07-16","https://in.news.yahoo.com/shadab-khan-speaks-education-delhi-47-km-080403177.html","Shadab Khan speaks for 'right to education' through 'Delhi 47 KM'","Yahoo News India",FALSE,"Mumbai, July 16 (IANS) Filmmaker Shadab Khan says he has tried to convey the importance of right to education through his upcoming film ""Delhi 47 KM"".

""'Delhi 47 KM' has many layers and one of them is 'right to education'. In the film, we have shown that how a child named Mintoo is deprived off his education and forced into trading of arms by his father because the father is convinced that education will not do any good to him.

""Through my film, I want to tell the audience that it is really important to stop the abuse and they should stand for their rights at the right time as it can save them from falling further,"" Khan said in an interview here.

On the need to provide equal opportunities to common citizen of the country, he said: ""I think 'Be equal to all and privilege to none' -- that should be the idea to take the country forward. We as a society have not been completely successful to give education to the poor class.

""If authorities can't give equal facilities to everyone, then at least they should provide proper education to every single child in India and that should be our top agenda.""

""Delhi 47 KM"" is a story about a region which is merely 47 km away from the Indian capital and in that region, there are dealing of drugs, illegal weapons, exploitation of children and prostitution.

The film is produced by Khan, along with Jigar Rawal, Sachin Saxena and Rajneesh Dubey.

Written and directed by Khan, and presented by CineCloud Films and Asma Ali Shaikh, ""Delhi 47 KM"" will hit theatres on July 20.

--IANS

iv/rb/vm"
"21","901499385","2018-07-08","https://ahmedabadmirror.indiatimes.com/ahmedabad/cover-story/how-the-right-to-education-is-wronged/articleshow/64890859.cms","HOW THE RIGHT TO EDUCATION IS WRONGED - Ahmedabad Mirror","Ahmedabad Mirror",FALSE,"Data of 687 schools in Ahmedabad district reveals that there are 374 schools which have been allotted RTE students only in single digits; PIC: ANCELA JAMINDARGovt apathy or connivance?

Activists allege govt, schools and education officials are trying to scuttle right to education of poor; city DEO data says RTE allotment in 107 schools less than 30% against intake capacity raising questions over the RTE admission process

Delay in resuming second round of RTE admissions raises a stink. While parents of 56,589 students eagerly wait for it, the State government has expressed inability to start second round saying more than 300 schools -- claiming to be minority institutes -- have obtained stay from the court.

Even as various stakeholders continue to fight it out in the court, Ahmedabad District Education Officer (DEO) data of 687 schools reveals that there are 374 schools which have been allotted RTE students only in single digits. There are 107 schools where less than 30% RTE seats have been allotted against the intake strength. The situation in some of the top schools of Ahmedabad is striking (See table below).

Delhi Public School, Bopal, has a quota (intake) of 100 RTE students but has been allotted only nine students this year. Similarly, Asia English School has been allotted only 24 students against quota of 50. It had no RTE student last year. Another reputed school, Udgam School for Children, was allotted only 15 students last year against quota of 83. This year, it has been allotted 53 students.

There are 1,25,784 approved seats for RTE in the state and only 72,294 students have been allotted schools in the first round of which 3,097 applications have been rejected. In all, 56,589 applicants that are eligible for RTE admissions are yet to be allotted schools.

What activists say

RTE activists allege that certain school managements and government are hand-in-glove to scuttle the right of poor to quality education.

RTE activist Mujahid Nafees said, ""The government is just giving an excuse that minority schools have obtained stay on the proceedings. The government can always start RTE admission in schools other than the 300 odd schools claiming minority status. We have been fighting the opaque RTE admission process for years.""

He alleged, ""The government has succumbed to pressure from private schools to allot them less RTE students"".

Another RTE activist Sandip Munjyasara said: ""The government can keep aside RTE admissions in the 300 schools that are claiming minority status. However, nothing should stop it from going ahead with RTE admissions in rest of the schools.""

What educationists say

Schools put the blame on the 'bad lot' among them. A principal wishing to stay anonymous said, ""Certain schools enter into an 'arrangement' with the DEO so that they have to absorb lesser number of RTE students. In fact, there are schools that have not been allotted even a single RTE student. How is it possible? For every RTE admission, the state government pays the school only Rs 10,000 even if the fee for regular student is more than Rs 1 lakh. The schools then pass the fee burden on parents of regular students.""

Raja Pathak, Director of Sattva Vikas School, said, ""Several seats go vacant in some schools as there are not enough RTE applications in the locality where they are situated. We have intake of only 6 seats as we have only one division with 24 students.""

Lamiya Shums, Director of Anand Niketan School, Shilaj, said, ""Density of population and demography determine the allocation of RTE seats besides the personal choice of parents. If 5 schools near their residence are shown in the Google map, obvious choice of parents would be to select the one that is near their residence.""

Manan Choksi, Executive Director of Ugdam School, said, ""We have admitted students under RTE allotted to us and we have also asked for more students in the remaining quota.""

For Zebar School, Choksi added, ""We have 10 seats vacant in Class 1 after accommodating RTE students. Also, we are not getting regular admission applications as the academic year has started. If RTE quota is not filled up, it will be a double whammy for us as we will neither get fee reimbursement from the government nor fee from normal admissions. This is a criminal wastage of seats.""

What education officials say

The DEO and District Primary Education Officer (DPEO) justify the large number of vacant seats to ""choice-based allocation"". Mahesh Mehta, DPEO, said, ""The allocation depends on choice of parents and geography. There's nothing more to it."" Navneet Mehta, DEO (City), said, ""Parents usually go for schools that have a reputation. For example, in Paldi area which has allotment capacity of only 30 students we received 1,800 applications. The key issue is selection made by parents and not whether less or more students are allotted admission in certain schools.""

Read Also:

IS AUTOMATED PARKING AT KALUPUR RLY STATION FACING DERAILMENT?"
"22","897457656","2018-07-01","http://www.easternmirrornagaland.com/right-to-education/","Right to Education","Eastern Mirror",FALSE,"Starting from Right to Education to the latest proposal of replacing the University Grants Commission (UGC) - in recent years, many changes have been made to our education system. But without being too critical it can be safely said that all these changes have so far not been able to improve the standard of education in our country. Rather, the changes have created an air of uncertainty among the students. Students are virtually clueless about their future. They do not know what changes will come next and what will happen to their career plan? For example, students of various central universities are still agitating over the reduction of seats for M. Phil and PhD. As usual, students of Delhi's Jahwarlal Nehru University (JNU) were at the forefront of this agitation. So, it was easy for the authorities to claim that those students were not at all interested in their studies and that they were only interested in occupying the seats to pursue their political careers. But the explanation did not answer the moot question. What will happen to those students who are eligible to continue their studies further after obtaining Master degrees but would not be able do so because the universities have suddenly reduced the intake of students? Are there any alternatives for them? The authorities have no answer.

The authorities will not be able to answer these questions as these decisions were taken more to satisfy their own egos rather than keeping the need of our education system in mind. As a matter of fact the authorities have failed to realise that education system in our country needs a total overhauling from primary to the highest level. Effecting changes in one segment ignoring the problems of other sectors will further weaken the system. There should be comprehensive policy to make education meaningful. Adequate number of teachers and a common syllabus for students all over the country are the need of the day. Further, it is time to think whether education should be on the concurrent list or not as this is creating more problems than solutions. For example, recently the Centre has announced that history of emergency will become part of the curriculum soon. But the Centre was not the only one to do so. Few years ago the West Bengal government included Singur Movement in curriculum. Many other state governments have also burdened the students by including their favourite topics in the syllabus taking advantage of education being in the concurrent list. As there is common syllabus, when a student enters into national level, on most occasions, he or she will have to start afresh as the syllabus he or she followed was completely different.

In such a scenario, steps should be taken to remove the flaws prevailing in our education system. Cosmetic measures such as replacing UGC by another body will serve no purpose. At the same time disparities between in Central and state universities should be removed. It should be ensured that quality teachers are available in all the educational institutions. Only then Right to Education will become meaningful."
"23","896706109","2018-06-30","https://timesofindia.indiatimes.com/videos/city/delhi/daily-wagers-son-gets-prosthetic-arm-from-delhi-govt-by-invoking-right-to-education-act/videoshow/64798993.cms","Daily wager's son gets prosthetic arm from Delhi govt by invoking Right to Education Act | City- Times of India Videos ","The Times of India",FALSE,"Ritik, the son of a daily wage earner, became the first person in the country to get a prosthetic limb from the government by invoking the Right to Education Act. He was born with a congenital deficiency, bilateral elbow disarticulation, which means that both his arms were not fully formed at birth. Despite that, the 16 year old has won several state-level drawing and painting awards using his feet and toes. The Class 12 student is happy that he can now use his artificial arm to write and draw. He can now play cricket, draw and paint freely. He wants to pursue higher education and aims at becoming an artist."
"24","880608625","2018-06-04","https://www.firstpost.com/india/pil-moved-in-delhi-high-court-seeks-proper-execution-of-right-to-education-act-4495221.html","PIL moved in Delhi High Court seeks proper execution of Right to Education Act - Firstpost","Firstpost",FALSE,"New Delhi: A plea has been moved in the Delhi High Court seeking proper implementation of the Right to Education Act, alleging that authorities concerned have taken no action to ensure education, health and nutrition of children up to the age of 14 years.

Representational image. AFP

The PIL has sought framing of a policy to ensure education, health and nutrition as well as the development of children up to the age of 14 years, as guaranteed under the Constitution.

The petition has sought directions to the Aam Aadmi Party government and the municipal corporations, which run schools in the national capital, to carry out a house to house survey in their respective areas to find out if there are any children between the ages of 6-14 years who are not going to schools.

The petitioner, Salek Chand Jain, has also urged the court to direct authorities to take steps to curb the drop out rate in government and corporation-run schools.

A bench of Acting Chief Justice Gita Mittal and Justice C Hari Shankar is likely to hear the matter on 11 July.

Updated Date: Jun 04, 2018 16:44 PM"
"25","880571365","2018-06-04","https://www.business-standard.com/article/pti-stories/pil-in-hc-for-proper-implementation-of-right-to-education-act-118060400483_1.html","PIL in HC for proper implementation of Right to Education Act","Business Standard",FALSE,"PIL in HC for free education up to class 12 for poor students in private schools

A plea has been moved in the Delhi High Court seeking proper implementation of the Right to Education Act, alleging that authorities concerned have taken no action to ensure education, health and nutrition of children up to the age of 14 years.

The PIL has sought framing of a policy to ensure education, health and nutrition as well as development of children up to the age of 14 years, as guaranteed under the Constitution.

The petition has sought directions to the AAP government and the municipal corporations, which run schools in the national capital, to carry out house to house survey in their respective areas to find out if there are any children between the ages of 6-14 years who are not going to schools.

The petitioner, Salek Chand Jain, has also urged the court to direct authorities to take steps to curb the drop out rate in government and corporation-run schools.

A bench of Acting Chief Justice Gita Mittal and Justice C Hari Shankar is likely to hear the matter on July 11."
"26","876404319","2018-05-28","http://www.newindianexpress.com/states/tamil-nadu/2018/may/29/tamil-nadu-schools-pick-right-to-education-act-lots-without-displaying-list-of-applicants-1820721.html","Tamil Nadu: Schools pick Right to Education Act lots without displaying list of applicants","The New Indian Express",FALSE,"CHENNAI: Schools across the State on Monday picked lots from the list of applicants who applied under the Right to Education Act (RTE). However, many schools have picked these students without displaying the list of all applicants on the notice board on Friday last, as mandated by the government.Over 1.28 lakh children have applied for admissions for 2018-19 under the Right to Education Act.

According to TN RTE rules, 25 per cent of the total seats in private schools are reserved for students belonging to economically weaker sections (families with an annual income of less than '2 lakh) and disadvantaged groups (SC/ST/BC/MBC). The students will be admitted in entry-level grades, namely, LKG or class 1.

The schools in which the students are applying for RTE admissions should be within one km from their residence. The list of applications accepted and rejected should be mentioned with reasons on the notice boards of the schools concerned before 5 pm on May 25 . However, when Express visited 10 schools in Chennai, none had displayed the list of applicants on Friday. ""We didn't expect such large numbers of applications. Sorting took much longer than expected,"" said the principal of a popular school in the heart of the city.

But many of these schools picked the list of applicants that would get admitted through the RTE Act on Monday. By not displaying the list of all eligible applicants before lot-picking, the schools eliminate a fair chance at the admission.D Manoharan, Chief Education Officer, Chennai, told Express on Monday that lot-picking of applicants went smoothly all over the city. ""Education officers were deployed to all schools to ensure that the process was fair,"" he said.

No fair chance

By not displaying the list Of all eligible applicants before lot-picking, the schools eliminate a fair chance at the admission."
"27","873724733","2018-05-24","http://indianexpress.com/article/education/right-to-education-admissions-in-surat-cases-to-be-filed-against-2252-parents-over-bogus-income-proof-5189045/","Right To Education Admissions in Surat: Cases to be filed against 2,252 parents over bogus income proof","The Indian Express",FALSE,"By: Express News Service | Surat | Published: May 24, 2018 5:59:26 am According to sources in the DEO office, a total of 9,410 applications were received at different centres in the city. Allow students of Economically Weaker Sections to complete studies in private schools: PIL'English Medium' in Sanjay CampWhere are schools for students with autism: SC questions UP

The Surat District Education Officer (DEO) has started the process of registering an offence against 2,252 parents who procured bogus income proof certificates for admissions of their children under the Right To Education (RTE) Act.

According to sources in the DEO office, a total of 9,410 applications were received at different centres in the city for obtaining admissions under RTE in the schools in Surat city.

After month-long investigation, city prant officials found that out of 9,410 applications, a total of 2,252 applications had submitted fake income proof documents with the stamp of mamlatdar.

Surat City prant officer B S Patel said, ""In our investigation, we have found that out of 2,252 fake income proof documents, over 1,000 such documents had come from Puna area in Surat city. We have personally investigated and found that some touts are involved in this racket.""

Surat DEO UN Rathod said, ""We will act as per the orders of district Collector and register an offence against the parents.""

Share your thoughts"
"28","871364358","2018-05-19","http://www.newindianexpress.com/states/tamil-nadu/2018/may/20/over-128-lakh-children-from-tamil-nadu-apply-for-admissions-under-right-to-education-act-1816959.html","Over 1.28 lakh children from Tamil Nadu apply for admissions under Right to Education Act","The New Indian Express",FALSE,"CHENNAI: Over 1.28 lakh children have applied for admissions under the Right to Education (RTE) Act 2018-19, according to figures released by the Directorate of Matriculation Education on Saturday. Last year 1.17 lakh applications were admitted. According to Tamil Nadu RTE rules, 25 per cent of the total seats in private schools are reserved for students belonging to economically weaker sections (families with an annual income of less than Rs 2 lakh) and disadvantaged groups (SC/ST/BC/MBC).

Students will be admitted at entry level grade, that is LKG or class one. Schools in which students are applying for RTE admissions should be within one kilometre from their residence. If a school does not get enough students to fill the admissions under RTE, then it could fill the vacancies by selecting students from nearby areas.

The list of applications which are accepted and applications rejected should be put up with reasons on notice boards of the schools concerned before 5 pm on May 22. If more number of students have applied for RTE admissions than the number of seats in the schools, then the admissions should be made through a lot system in the presence of officials of School Education Department.

Orphaned children, children of HIV-infected parents, transgender children and the ones living with disabilities should be given preference. The circular also says all students who are selected for admission under the RTE Act should be admitted in the schools on May 29 and officials from School Education Department should ensure that no fee is collected from these students.

What the rules say

Orphaned children, children of HIV-infected parents, transgender children and the ones living with disabilities should be given preference. The circular also says all students who are selected for admission under the RTE Act should be admitted in the schools on May 29"
"29","871013961","2018-05-19","http://www.dnaindia.com/mumbai/report-hiv-affected-obcs-included-in-25-quota-under-right-to-education-act-maharashtra-government-2616647","HIV affected, OBCs included in 25% quota under Right to Education Act: Maharashtra government","Daily News and Analysis (DNA) India",FALSE,"The Brihanmumbai Municipal Corporation's education department has decided to open its website portal for the admissions under the 25 per cent quota of the Right to Education Act. After the state government revised the procedure of online admission under the RTE quota, parents who missed out filling the online admission forms this year will be able to fill out the forms by next week.

The state government, on Thursday, issued a resolution on the online admission process under the 25 per cent RTE quota which included children with the human immunodeficiency virus (HIV) within the socially and economically weaker sections (EWS) reserved category. Additionally, Vimukt Jaati nomadic tribes(VJNT), other backward classes (OBC) and special backward classes (SBC) have also been included in the RTE online admission process.

Earlier only schedule dcaste (SC), scheduled tribe (ST), handicapped and economically weaker section children were allowed to obtain admission under the 25 per cent quota under the RTE act.

Mahesh Palkar, BMC's education officer, said, ""We are waiting for the directions to come from the director of primary education in Pune. It is expected by Monday or Tuesday. The website will be opened for all parents again who missed the chance of filing form this year and also for newly added sections of society."""
