"","ID","date","url","title","source","duplicate","body"
"1","997638366","2018-11-18","https://www.thehindu.com/news/cities/Delhi/sdmc-schools-to-get-cctv-cameras/article25533711.ece","SDMC schools to get CCTV cameras","The Hindu",FALSE,"South Delhi Municipal Corporation Education committee chairperson Nadnini Sharma said the body was all set to install CCTV cameras in its schools which will allow parents to watch live on the mobiles the activities of their wards in the school. She made the announcement at a 'Bal Divas' event at Ambedkar Stadium on November 17.

The project of installing about 4,348 CCTV cameras in 344 of its primary schools which have up to 2.5 lakh students enrolled was given the nod by the Standing Committee of the corporation in June. The project was expected to cost about ₹5 crore. A senior official said that it is expected to be completed by year-end.

At the event, other announcements were also made including the launching of a ""Bal Sansad"" or parliament to inform students of the democratic process, as well the commencement of an annual ""Shikshak Rattan"" award for one teacher and one principal in SDMC schools. The Mayor also announced a holiday for SDMC schools on Monday."
"2","985868826","2018-11-04","https://www.freepressjournal.in/mumbai/navi-mumbai-municipal-schools-to-get-cctv-cameras/1389819","Navi Mumbai municipal schools to get CCTV cameras","Free Press Journal",FALSE,"Mumbai: Amid increasing reports of minors being subjected to sexual assault on school premises in Navi Mumbai, the the Navi Mumbai Municipal Corporation (NMMC) will soon instal Closed Circuit Television (CCTV) cameras at all 70 of its civic schools. The move is on the heels of a police recommendation that schools be under CCTV surveillance as a precautionary measure.

The importance of this security measure on school premises was brought home by the alleged rape of a nine-year-old girl inside the toilet of her school in Vashi in September. The victim confided to her mother about the incident. She said, an unidentified person took her to a toilet after covering her mouth with a handkerchief and raped her. The incident took place as she was entering school. Since there were no CCTV cameras installed in the school, the accused was never identified.

Meanwhile, police will send notices to schools to take precautions to ensure the safety of students on the premises. Sudhakar Pathare, Deputy Commissioner of Police (Zone 1), said, ""Apart from requesting schools to instal CCTV cameras, we have also asked schools to hire guards from certified security agencies, who can keep a record of people entering and leaving the school.""

DCP Pathare added, school management and staff should also ensure the CCTV footage be retained for at least a week, and not just for 24 hours, as is usually the practice. NMMC Commissioner N Ramaswamy said this proposal was tabled in the committee in March and the project is underway. ""At this juncture, the project is at tendering stage. All civic schools in the city will be under CCTV surveillance by the end of this financial year. Each school will be installed with CCTV cameras after thorough individual survey. The results of the survey will determine the number of cameras required per school.""

Explaining how installation of CCTV surveillance costs as low as Rs 14 per student, parents will not mind paying a minimal amount to ensure the safety and security of their children. Lopes Diago, Principal of St Xavier's School in Nerul said, ""Our schools are well-equipped with CCTV surveillance. Lack of funds cannot be an excuse for not having one. We have installed cameras everywhere and a student has to pay just Rs 14 more for the security.""Parents will breathe a sigh of relief over the decision, as it will mean improved alertness and security, said an educational activist."
"3","946300856","2018-09-14","https://www.apherald.com/Politics/ViewArticle/319835/3000-Karnataka-Govt-Schools-to-get-CCTV-Cameras/","3000 Karnataka Govt Schools to get CCTV Cameras","APHerald [Andhra Pradesh Herald]",FALSE,"According to sources as per report from the current academic year, over 3,000 government primary and high schools in Karnataka will be brought under CCTV camera surveillance. Meanwhile when following instructions from Chief Minister HD Kumaraswamy, it was stated that the CCTV cameras will be installed in a phased manner by the state department of primary and secondary education. In the first step, the Department of Education (DoE) has released Rs 10 crore for installation of the cameras at over 3,000 government schools across the state.

Recently while priority is being accorded to schools with greater number of girl students, each school will get four CCTV cameras. Furthermore the spots where the CCTC cameras are to be installed will be decided by officials at the local level and the school heads depending on strategic locations and their sensitivity. Accordingly one camera will be installed at the entrance of the school, one will be in the playground and another in the teachers' lobby and school authorities will be able to monitor the footage using a computer."
"4","942434309","2018-09-09","https://www.hindustantimes.com/mumbai-news/all-navi-mumbai-civic-schools-to-get-cctv-cameras-in-this-financial-year-nmmc/story-k6nCaOmyoxrQVS2BETHJ3M.html","All Navi Mumbai civic schools to get CCTV cameras in this financial year: NMMC","Hindustan Times",FALSE,"Civic school in Navi Mumbai do not have CCTV cameras on their premises.(HT FILE)

After the alleged rape of a nine-year-old girl inside the toilet of her school in Vashi last week, the Navi Mumbai Municipal Corporation (NMMC) has decided to install CCTV cameras at all civic schools run by them. The task will be finished by end of this financial year, a senior officer said.

Installation of CCTV cameras in school premises was the topic of discussion in the satellite city last after the alleged rape of a minor girl came to light.

The girl said that an unidentified person took her to a toilet by covering her mouth with a handkerchief when she was entering her school and raped her inside it.

The private school had no CCTV camera and hence the police have not been able collect concrete evidences against anyone.

After the incident, parents had also staged a protest and asked the school authorities to install CCTV cameras on the premises.

Ramaswamy N, commissioner of NMMC, said, ""At beginning of this financial year, we had decided to install CCTV cameras on the premises of our schools. The project is in tendering process. We can say that all civic schools in the city will be under CCTV surveillance by end of this financial year.""

NMMC runs a total of 70 schools of which 53 are primary and 17 are secondary schools.

When asked about the number of cameras each school will get, Ramaswamy said, ""Individual surveys will be conducted at each school and the number of required cameras will be decided based on that. We will ensure the entire premises is covered.""

Meanwhile, the city police are sending notices to private schools to take precautionary measures to ensure safety of students on the premises.

Installation of CCTV cameras was one of the measures mentioned in the notice.

Sudhakar Pathare, deputy commissioner of police (zone 1), said, ""Apart from installing such cameras, we have asked the schools to hire guards from certified security agencies. They should also keep record of people who enter their compound.""

""Likewise, the school authorities should preserve the CCTV feed for a longer time as it may help in investigations,"" he said.

When asked if the police would take action if schools do not follow the guidelines, Pathare said, ""We cannot take any action under Indian Penal Code, Code of Criminal Procedure or the Mumbai Police Act. The education department of NMMC will have to the action.""

Activists and parents of civic school students are happy with the civic body's decision.

Parshuram Rumale, 42, a parent of a child who studies in the Vashi school where the minor was raped, said, ""When a school has CCTV cameras, miscreants normally get scared to enter its compound. Every school should install such cameras.""

Ramesh Bhagat, 39, a parent of a child who studies in a Nerul school, said, ""Apart from cases like sexual assault, parents allege that kids are beaten up by teachers . If every classroom has CCTV cameras, there will never be such confusion.""

Sudhir Dani, 50, an education activist, said children's safety is more important than analysis of the existing rules.

""If something goes wrong inside the school, it's bad for the school too. Therefore, the schools should take it as their moral responsibility to install CCTV cameras,"" said Dani.

Father S Almeida, principal of Father Agnel Multipurpose School and Junior College, Vashi, said, ""We have installed CCTV cameras on the entire premises. They are monitored from the principal's room. It's not easy for a student to go out of the premises during school hours.""

""We also keep conducting workshops for our staff and ask them to treat the students with right manners. Thus, within our parameter, we have taken all precautionary measures. However it's tough to say that nothing can happen,"" he said.

An official from St Xavier's School in Nerul said, ""Lack of fund cannot be an excuse for not having CCTV surveillance. We have installed cameras everywhere and a student has to pay just Rs14 more for the security."""
"6","879765155","2018-06-02","https://www.business-standard.com/article/pti-stories/safety-norms-for-schools-cctv-on-premises-character-118060200765_1.html","Safety norms for schools: CCTV on premises, character","Business Standard",FALSE,"Maha moving towards permitting cluster universities: Tawde

The Maharashtra School Education department today issued guidelines for schools and junior colleges, mandating certain safety measures in students' interest.

A circular issued by the department said that every school and junior college should install CCTV cameras.

Attendance should be marked thrice a day, and if a student is found missing, parents should be informed immediately through a text message, the circular said.

No student should be punished in such a way that he or she would suffer a mental or physical trauma, it said.

The guidelines also restrict entry of unidentified persons on the school premises.

Character certificate from police would be mandatory for recruitment as teachers or other staff at educational institutions.

Washrooms for boys and girls should be separate and at a suitable distance from each other, and there should be a woman attendant at the girls' washroom, the guidelines say.

The woman attendant on school bus should not leave the bus until the last girl is dropped, the guidelines add.

The guidelines will apply to state board schools as well as those affiliated to CBSE, ICSE and international boards.

They would come into effect from the coming academic year.

Education minister Vinod Tawde said while the state government can not interfere in the curriculum of international boards, students' safety comes under the state's purview.

""Students are from Maharashtra, so all these schools should also follow these norms. If any school fails, the education department will lodge a police case,"" he said."
