"","ID","date","url","title","source","duplicate","body"
"48","923012051","2018-08-10","http://www.asianage.com/metros/delhi/110818/hc-ask-centre-govt-to-decide-on-dilapidated-school-building.html","HC ask Centre, govt to decide on 'dilapidated' school building","The Asian Age",FALSE,"New Delhi: The Delhi high court on Friday left it to the Centre and the Delhi government to demolish and re-construct a government school's 99-year-old building which is ""dilapidated and unsafe"" for children.

A bench of Chief Justice Rajendra Menon and Justice C. Hari Shankar expressed satisfaction over a report filed by the Delhi government's directorate of education (DoE) in which it proposed that the ministry of defence (MoD) should construct a new building on the land to run an aided school or it may hand over the complete possession of the land to the department for construction of a new school building.

The court directed the MoD and DoE to workout the issue between themselves and submit a status report, and listed the matter for October 26.

The affidavit was filed through the Delhi government's additional standing counsel Sanjoy Ghose in a pending petition by NGO Social Jurist in which it was alleged that Rajputana Rifles Heroes Memorial Senior Secondary School in Delhi Cantonment, taken over by the Delhi government since 1975 and getting 100 per cent aid from the state government, was in a horrible condition.

""Since the building is dilapidated and unsafe for the children, as a measure of abundant caution, the students of the school may be shifted or adjusted to nearby schools with the consent of the parents,"" it said."
"49","922849279","2018-08-10","https://www.business-standard.com/article/pti-stories/hc-ask-centre-and-delhi-govt-to-decide-on-unsafe-condition-of-99-yr-old-school-building-118081001163_1.html","HC ask Centre and Delhi govt to decide on unsafe condition of 99-yr-old school building","Business Standard",FALSE,"HC seeks Centre, civic bodies' reply over lack of baby feeding rooms

The Delhi High Court today left it to the Centre and the Delhi government to demolish and re-construct a government school's 99-year-old building which is ""dilapidated and unsafe"" for children.

A bench of Chief Justice Rajendra Menon and Justice C Hari Shankar expressed satisfaction over a report filed by the Delhi government's Directorate of Education (DoE) in which it proposed that the Ministry of Defence (MoD) should construct a new building on the land to run an aided school or it may hand over the complete possession of the land to the department for construction of a new school building.

The court directed the MoD and DoE to workout the issue between themselves and submit a status report, and listed the matter for October 26.

The affidavit was filed through the Delhi government's additional standing counsel Sanjoy Ghose in a pending petition by NGO Social Jurist in which it was alleged that Rajputana Rifles Heroes Memorial Senior Secondary School in Delhi Cantonment, taken over by the Delhi government since 1975 and getting 100 per cent aid from the state government, was in a horrible condition.

""Since the building is dilapidated and unsafe for the children, as a measure of abundant caution, the students of the school may be shifted or adjusted to nearby schools with the consent of the parents,"" it said.

The DoE said that in pursuance to the court's July 13 direction, joint inspections were carried out by the senior officials of Ministry of Defence, DoE and others on July 23 and 25.

It said that after the inspections, garrison engineer of MoD highlighted that the school building was constructed in 1919 and it has outlived its useful life and is unsuitable for habitation.

Due to the condition of the building, no major repair or alteration is recommended to the building owing to safety issue. Even the building is not compliant with latest codal provisions laid down for school, architecturally and structurally, by the Bureau of Indian Standards. Hence, functioning of the school from the current building is not recommended, it said.

The DoE said the military engineer services takes the rent for the school building including the water and electricity charges from it for running the school.

Advocate Ashok Agarwal, appearing for the NGO, had earlier said around 450 students are studying in the school and they have been unjustly deprived of adequate physical infrastructure and academic faculty to educate them.

The plea has said though the school is open for all, it mainly caters to the children of servants of military officials who are not in a position to educate their kids in private school.

It has alleged that the school lacks basic amenities, including potable drinking water, functional toilets, science and computer labs, clean classrooms and proper boundary wall and several posts of teaching staff are lying vacant.

The petition has sought direction that the existing building of the school be demolished and rebuilt as a state of art school."
"50","922745604","2018-08-10","https://www.indiatimes.com/news/india/class-2-student-raped-inside-delhi-school-building-after-classes-by-non-teaching-staff-member-350999.html","Class 2 Student Raped Inside Delhi School Building After Classes By Non-Teaching Staff Member","indiatimes.com",FALSE,"Parents send their children to schools on the belief that they will be safe there with teachers and other saff. But an incident which has been reported from the national capital has raised some serious questions on the safety of children in schools.

A class two student of a New Delhi Municipal Council (NDMC) school in Gole Market area was allegedly raped by an electrician inside the institute's premises.

The incident came to light when the girl narrated her ordeal to her parents after returning from school on Thursday, a police official said.

The accused, identified as Ram Asre has been working in the school for around a month and is a permanent electrician employed with the NDMC.

""During the initial probe, it was found that Asre after school hours took the victim to a pump house where he sexually assaulted her. He also threatened her not to tell about the incident to anyone,"" Deputy Commissioner of Police Madhur Verma said.

He has been arrested and a case has been registered against him under the relevant section of the IPC and under the Protection of Children from Sexual Offences (POCSO) Act.

Following the incident, the Delhi Commission for Women on Friday issued a notice to police and school authorities."
"52","922208040","2018-08-09","http://www.newindianexpress.com/cities/delhi/2018/aug/09/delhi-government-admits-in-high-court-99-year-old-school-building-dilapidated-unsafe-for-kids-1855580.html","Delhi government admits in High Court, 99-year-old school building dilapidated, unsafe for kids","The New Indian Express",FALSE,"NEW DELHI: The Delhi government has admitted before the Delhi High Court that the 99-year-old building of a government school on the land belonging to the Ministry of Defence in Delhi Cantonment was dilapidated and unsafe for children.

The Delhi government's Directorate of Education (DoE), in an affidavit, proposed that the Ministry of Defence (MoD) should construct a new building on the land to run an aided school or it may hand over the complete possession of the land to the department for construction of a new school building.

The affidavit was filed in a pending petition by NGO Social Jurist in which it was alleged that Rajputana Rifles Heroes Memorial Senior Secondary School in Delhi Cantonment, taken over by the Delhi government since 1975 and getting 100 per cent aid from the state government, was in a horrible condition.

""Since the building is dilapidated and unsafe for the children, as a measure of abundant caution, the students of the school may be shifted or adjusted to nearby schools with the consent of the parents,"" it said.

The matter is scheduled to come up for hearing tomorrow before a bench of Chief Justice Rajendra Menon.

The DoE said that in pursuance to the court's July 13 direction, joint inspections were carried out by the senior officials of Ministry of Defence, DoE and others on July 23 and 25.

It said that after the joint inspections, Garrison engineer of MoD highlighted that the school building was constructed in 1919 and it has outlived its useful life and is unsuitable for habitation from the next on completion of 100 years.

Due to the condition of the building, no major repair or alteration is recommended to the building owing to the safety issue.

Even the building is not compliant with latest codal provisions laid down for school, architecturally and structurally, by the Bureau of Indian Standards.

Hence, the functioning of the school from the current building is not recommended, it said.

The DoE said the military engineer services takes the rent for the school building including the water and electricity charges from it for running the school.

Advocate Ashok Agarwal, appearing for the NGO, had earlier said around 450 students are studying in the school and they have been unjustly deprived of adequate physical infrastructure and academic faculty to educate them.

The plea has said though the school is open for all, it mainly caters to the children of servants of military officials who are not in a position to educate their kids in private school.

It has alleged that the school lacks basic amenities, including potable drinking water, functional toilets, science and computer labs, clean classrooms and proper boundary wall and several posts of teaching staff are lying vacant.

The petition has sought direction that the existing building of the school is demolished and rebuilt as a state of art school."
"53","922170996","2018-08-09","https://www.business-standard.com/article/pti-stories/delhi-govt-admits-in-hc-99-yr-old-school-building-dilapidated-unsafe-for-kids-118080901503_1.html","Delhi govt admits in HC 99-yr-old school building dilapidated, unsafe for kids","Business Standard",FALSE,"The Delhi government's Directorate of Education (DoE), in an affidavit, proposed that the Ministry of Defence (MoD) should construct a new building on the land to run an aided school or it may hand over the complete possession of the land to the department for construction of a new school building.

The affidavit was filed in a pending petition by NGO Social Jurist in which it was alleged that Rajputana Rifles Heroes Memorial Senior Secondary School in Delhi Cantonment, taken over by the Delhi government since 1975 and getting 100 per cent aid from the state government, was in a horrible condition.

""Since the building is dilapidated and unsafe for the children, as a measure of abundant caution, the students of the school may be shifted or adjusted to nearby schools with the consent of the parents,"" it said.

The matter is scheduled to come up for hearing tomorrow before a bench of Chief Justice Rajendra Menon.

The DoE said that in pursuance to the court's July 13 direction, joint inspections were carried out by the senior officials of Ministry of Defence, DoE and others on July 23 and 25.

It said that after the joint inspections, Garrison engineer of MoD highlighted that the school building was constructed in 1919 and it has outlived its useful life and is unsuitable for habitation from the next on completion of 100 years.

Due to the condition of the building, no major repair or alteration is recommended to the building owing to safety issue. Even the building is not compliant with latest codal provisions laid down for school, architecturally and structurally, by the Bureau of Indian Standards. Hence, functioning of the school from the current building is no recommended, it said.

The DoE said the military engineer services takes the rent for the school building including the water and electricity charges from it for running the school.

Advocate Ashok Agarwal, appearing for the NGO, had earlier said around 450 students are studying in the school and they have been unjustly deprived of adequate physical infrastructure and academic faculty to educate them.

The plea has said though the school is open for all, it mainly caters to the children of servants of military officials who are not in a position to educate their kids in private school.

It has alleged that the school lacks basic amenities, including potable drinking water, functional toilets, science and computer labs, clean classrooms and proper boundary wall and several posts of teaching staff are lying vacant.

The petition has sought direction that the existing building of the school be demolished and rebuilt as a state of art school."
"54","916605348","2018-07-31","https://www.thehindu.com/news/cities/kozhikode/school-building-collapses-in-rain/article24566986.ece","School building collapses in rain","The Hindu",FALSE,"A meeting will be convened at Raroth Government High School, Parappanpoyil, near Thamarassery, at 12 p.m. on Wednesday to discuss the future course of action after a portion of the school building collapsed on Tuesday.

According to sources, the incident occurred around 4.30 p.m.

The wall of the old building housing upper primary classes collapsed and the tiled-roof too came crashing down.

As the Deputy Director of Education had directed the school authorities to declare a day off after the heavy rain in the morning, major casualties were averted. Around 100 students are studying in the building housing Classes 4, 5,and 6. District Collector U.V. Jose would be present at the meeting, said a release."
"55","914768663","2018-07-28","https://indianexpress.com/article/india/no-action-yet-on-crumbling-school-building-despite-four-letters-by-head/","No action yet on crumbling school building despite four letters by head","The Indian Express",FALSE,"Written by Divya Goyal | Ludhiana | Published: July 29, 2018 2:01:07 am The government primary school at Jahangirpur village of Ludhiana. Express Photo

Water seeping through cracked ceilings and walls during rain, broken window panes and roots of old trees peeping out of damaged walls -- this is the scenario inside the government primary school at Jahangirpur village of Ludhiana. However, the education department and Public Works Department (PWD) is unmoved, despite the probability that the school building can collapse anytime, putting lives of around 200 children at risk. It is yet to declare the building unsafe as heavy rainfall has made the condition worse and students have to adjust in four classrooms. The walls, windows and ceiling of the entire building have become very weak.

Since the departments do not have any alternative, they are not declaring classrooms unsafe, putting the lives of more than 200 children at stake, said Manmohan Singh, head teacher of the school, who has written at least four letters in the past week, stating that due to heavy rain, the school building, which is already in a very bad shape, can collapse anytime. So, it should be declared unsafe at the earliest so that they can move kids out, but there has been no action till Saturday.

Singh, who has written to the block primary education officer, local MLA Sanjay Talwar and local PWD officials, said the school has more than 200 kids. ""There are four classrooms and all of them are unsafe. Despite our several letters to various departments, the PWD is not declaring the building unsafe and lives of children are being put at stake,"" he said.

Kuldeep Saini, Deputy District Education Officer, said a report from the PWD engineers is awaited to declare the building unsafe. ""We are looking for some other arrangement, till a new building is constructed. Meanwhile, teachers can hold classes in the local gurdwara,"" he said.

Unofficially, the head teacher has been asked to look for space and even contact local gurdwara.

""They (government) have no other space and we have been told to move to nearby gurdwara, but through unofficial verbal orders. A major tragedy is awaiting. Even roots of old trees have entered deep inside walls. We get scared when any child moves closer to any wall,"" said Singh."
"56","914419146","2018-07-28","https://www.oneindia.com/india/sorry-state-education-no-school-building-so-chhattisgarh-s-2744292.html","Sorry state of education: No school building, so Chhattisgarh students study under a tree","Oneindia",FALSE,"Raipur, July 28: Just imagine the plight of small children who are being forced to study under a tree, no matter if it rains or the sun shines bright.

The students of a government school in Chhattisgarh's Jagima village are studying under a tree in an open field as they have no school building. The construction of the building has been stopped as the state government and some villagers are fighting over the land on which the school was supposed to come up, stated a report by news agency ANI.

Since the authorities have failed to resolve the land dispute, children have no school building and their classes are taking place under a tree.

The ANI report added that if it rains heavily then the students of the school either go to a nearby Anganwadi to take shelter or their classes get cancelled. This way the students lose a lot of their study hours in the school as most often weather plays a spoilsport.

""Balrampur: Students of a government school in Jagima village study under a tree due to dispute between the govt & some villagers over the land allotted for the school's construction. Classes get stalled or are conducted in nearby Anganwadi during rainfall. #Chhattisgarh,"" tweeted ANI.

Balrampur: Students of a government school in Jagima village study under a tree due to dispute between the govt & some villagers over the land allotted for the school's construction. Classes get stalled or are conducted in nearby Anganwadi during rainfall. #Chhattisgarh pic.twitter.com/cfCFkUNNhz

-- ANI (@ANI) July 27, 2018

On Friday, OneIndia wrote about leaking roofs of a Madhya Pradesh school. In fact, tired by the lackadaisical attitude of the authorities to fix the leaking roofs of their school building, students of the government school in Dindori, Madhya Pradesh on Thursday submitted a memorandum to the district council. Their memorandum was addressed to President Ramnath Kovind.

""During monsoon, water drips from the roof in every classroom. There are no washrooms and it has been like this for many years, please help us,"" stated the memorandum addressed to the President.

Be it Chhattisgarh or Madhya Pradesh, school education, mostly in rural areas, is in shambles. It seems the government is not at all serious about improving the school education system in the country, but the ruling Bharatiya Janata Party at the Centre talks about giving institute of excellence status to a select few varsities."
"57","913801357","2018-07-27","https://timesofindia.indiatimes.com/city/bhubaneswar/unsafe-school-building-forces-kids-to-study-in-make-shift-classrooms/articleshow/65160091.cms","Unsafe school building forces kids to study in make-shift classrooms - Times of India","The Times of India",FALSE,"BHAWANIPATNA: Administrative lapse seems to be playing with the future of 161 students of Latkabahali upgraded primary school in Kalahandi's Kesinga block. In the absence of a permanent school building for the past three years, these students and their three teachers have to make do with rooms provided by individuals.

In 2015, owing to the dilapidated condition of the government-run school building, officers from the education department closed it down keeping in mind students' safety. But in three years they could not start work on a new building. Since then, students were forced to attend classes in rooms provided by the villagers, one of whom got his house built under Indira Awas Yojana.

Jajati Kesari Suna, president of the school management committee said, ""We requested the house owner to allow us to use his room, but how long could we keep him waiting.""

So, after two years, the owner told them to vacate his home. ""We approached the officials requesting them to help us construct a new building, but all their assurances came to nought,"" Suna said.

Disappointed, the school management decided to shift to another house which had been newly constructed. But after holding classes there for a year, the owner has now asked them to vacate the place within the next two months.

""Where will these students study?"" asked Hara Prasad Shah, the school headmaster. ""Due to shortage of rooms, we shifted students from Classes VI to VIII to another school, which is four km away. Only students from I-V are studying here,"" Shah added.

Kalahandi district collector Anjan Kumar Manik said fund had been allocated for construction of a new school building two years back. ""I have instructed the officials to start the construction as soon as possible,"" Manik said.

Nila Madhab Panda, the block education officer of Kesinga, said Rs 6 lakh was allocated for the school but it could not be utilised in time because getting suitable land was a problem. ""A piece of land near the existing building has been acquired around six months back. The process of allocating fresh grant is on. As soon as it happens, we will start the building's construction,"" Panda said."
"58","909528233","2018-07-20","http://www.newindianexpress.com/nation/2018/jul/20/allahabad-hc-directs-restoration-of-school-building-in-front-of-bjp-mps-house-1846243.html","Allahabad HC directs restoration of school building in front of BJP MP's house ","The New Indian Express",FALSE,"LUCKNOW: The Allahabad High Court today took note of the demolition of a government primary school building in front of the bungalow of BJP MP Brij Bhushan Sharan Singh in Gonda, and directed the authorities to restore the building and do the needful by August 21.

The Lucknow bench of the high court said it was prima facie satisfied that the building was demolished for ulterior motives.

The court directed that the building be restored at the same place after it was informed that funds were demanded from State Project Director of Sarva Siksha Abhiyan for reconstruction of the school building.

A bench of Justices Vikram Nath and Rajesh Singh Chauhan passed the order on a PIL moved by one Rana Pratap Singh.

The petitioner alleged that the school was demolished to provide a large space to the parliamentarian in front of his house, in collusion with education authorities and the village pradhan.

The claim that the school building was demolished because it was dilapidated is not correct, the petitioner said.

A new building for the school has been constructed over a private land, he claimed.

The Gonda district magistrate had on May 23 constituted a committee comprising district basic education officer, district collector and executive engineer of public works department, to probe the case.

Subsequently, the inquiry report found the officials of the education department and village pradhan in the wrong.

Accordingly, the Gonda DM instituted departmental inquiry against the erring officials and the village pradhan.

""The anxiety of the court is that the school building should be restored back at the same place where it was existing as prima facie, the court is of the view that this building was illegally demolished for ulterior motives,"" the court said after the inquiry report was submitted before it."
"59","909505564","2018-07-20","https://www.business-standard.com/article/pti-stories/hc-directs-restoration-of-school-building-in-front-of-bjp-mp-s-house-118072001291_1.html","HC directs restoration of school building in front of BJP MP's house","Business Standard",FALSE,"WFI chief Brij Bhushan officially named as India's Chef de Mission for Asian Games

The Allahabad High Court today took note of the demolition of a government primary school building in front of the bungalow of BJP MP Brij Bhushan Sharan Singh in Gonda, and directed the authorities to restore the building and do the needful by August 21.

The Lucknow bench of the high court said it was prima facie satisfied that the building was demolished for ulterior motives.

The court directed that the building be restored at the same place after it was informed that funds were demanded from State Project Director of Sarva Siksha Abhiyan for reconstruction of the school building.

A bench of Justices Vikram Nath and Rajesh Singh Chauhanpassed the order on a PIL moved by one Rana Pratap Singh.

The petitioner alleged that the school was demolished to provide a large space to the parliamentarian in front of his house, in collusion with education authorities and the village pradhan.

The claim that the school building was demolished because it was dilapidated is not correct, the petitioner said.

A new building for the school has been constructed over a private land, he claimed.

The Gonda district magistrate had on May 23 constituted a committee comprising district basic education officer, district collector and executive engineer of public works department, to probe the case. Subsequently, the inquiry report found the officials of the education department and village pradhan in the wrong.

Accordingly, the Gonda DM instituted departmental inquiry against the erring officials and the village pradhan.

The anxiety of the court is that the school building should be restored back at the same place where it was existing as prima facie, the court is of the view that this building was illegally demolished for ulterior motives,"" the court said after the inquiry report was submitted before it."
