"","ID","date","url","title","source","duplicate","body"
"13","788761777","2018-01-05","https://timesofindia.indiatimes.com/city/noida/noida-dm-orders-school-closure-till-january-10-schools-yet-to-receive-order/articleshow/62385582.cms","Noida: DM orders school closure till January 10, schools yet to receive order - Times of India","The Times of India",FALSE,"NOIDA: For the third time this winter, the district administration has extended the school-closure for classes nursery to 8th owing to ""prevailing cold conditions.""

A few schools which had re-opened on Friday after their winter-break had however opened as the order did not reach on time.

""Due to cold wave and extreme fog prevailing in the district, the district magistrate BN Singh has ordered that the schools will remain closed from classes nursery to VIII. This order will apply on all the government schools, non-affiliated, affiliated, CBSE and ICSE schools,"" a statement from the DM office said.

Earlier on January 1, the DM had ordered the schools to remain closed till January 4. However, the order hardly had any impact as most private schools had already closed for winter vacations.

While most private schools are set to open next week, some schools had re-opened on Friday while a few had opened on January 1. The government schools which did not have winter vacations, had observed a holiday owing to the Guru Gobind Singh Jayanti. They were supposed to open on Saturday but have decided to observe closure for classes nursery to class VIII after the order was issued.

In Noida, some schools were open for all classes on Friday while some students went to give preparatory tests in a private school in Greater Noida.

The Assisi Convent School, Sector 33 had reopened on Friday and was working on Friday.

""We have not received any order about closing operations from the DM Office so far. We had opened the school on Friday after the winter vacation that started on December 22. We will close the school in case such an order is received,"" Sister Sheeba, Principal of the school told TOI.

DSM Public school in Noida's Bahlolpur village was also open. Marigold Public School, Sector 27 was also open for all classes on Friday.

An official in the school administration said that they have not received the order so far. ""We had to re-open school for all classes on January 2 but had to shut operations since the DM had ordered school earlier on January 1. We had opened today and will open on Monday. In case, we get the order, we will abide by the same. The DM's order usually comes late,"" the official said.

""The school was closed on Friday owing to the Guru Gobind Singh Jayanti. We will now close classes nursery to VIIIth,"" Hemlata, Principal, Government Government Kanya Inter College, Hoshiarpur told TOI. Most private schools open on 11th or 15th.

When contacted, DM BN Singh said that the administration expects that the schools which get the information should remain closed.

The administration had ordered school closure in November when the air quality index deteriorated to dangerous levels."
